id,city_id,city_name,country_name,name,description,short_description,latitude,longitude,location,type,created_at
622,77,Kotor,Montenegro,Hotel Boka,"{'Location': ['Located in Kotor, 2 km from Tivat Airport.'], 'Services and Facilities': ['Free Wi-Fi, bar, 24-hour front desk, concierge service, tour arrangements.'], 'Rooms': ['Air-conditioned rooms with flat-screen TV, satellite channels, safe, and private bathroom with towels and linens.'], 'Nearby Attractions': ['Kotor Clock Tower (6.7 km), Sea Gate (6.7 km), St. Sava Cathedral (7.7 km), Tivat Clock Tower (7.9 km).']}","Modern hotel with comfortable rooms, offering bike rentals and a central location for exploring Kotor.",42.3783983,18.6749447,https://maps.app.goo.gl/EGMd1FWcm2HgHh7H6,hotel,2025-02-19T19:39:48.000000Z
621,75,Borjomi,Georgia,Hotel Tsemi Plaza,"{'Location': ['The hotel is located in the heart of Burgumi, allowing guests easy access to major tourist attractions such as Burgumi Central Park and Burgumi Museum.'], 'Facilities and services:': ['Free Wi -Fi: available throughout the hotel to meet the communication needs for guests.', 'Free parking: special parking for guests, which allows them to rest in the event of a car.', 'Garden and Terrace: To experience relaxation in nature, where guests can enjoy picturesque mountain views.', '24 hours reception: to meet all the needs of the guests at any time.', 'Cleaning services: This includes room cleaning service on a daily basis.'], 'Rooms:': ['Double rooms with balcony: provide stunning views of the surrounding mountains.', 'Family rooms with balcony: designed to provide comfort for families, with additional space.', 'Family rooms with mountain views: Panoramic views are available on mountain landscapes.'], 'Near tourist places:': ['Burgumi Park', 'Burgumi-Kafali Reserve', 'The summit of Jabal Kharfali', 'Burgumi Castle', 'Lake Tsimnisi']}","Tsemi Plaza is located in Borjomi, Georgia, and offers a comfortable stay near nature and tourist attractions.",41.7982818,43.4572029,https://maps.app.goo.gl/sgh188J8bh3FgAY16,hotel,2025-02-19T19:37:53.000000Z
620,77,Kotor,Montenegro,Hyatt Regency Kotor Bay Resort,"{'Location': ['Located on Kotor Bay, 15 km from Tivat Airport.'], 'Services and Facilities': ['Spa & wellness center, beach, private marina with 3 docks, in-house restaurants (Blue, Lighthouse), Piano lounge & coffee bar, airport shuttle service.'], 'Rooms': ['Rooms and suites with views of Kotor Bay, flat-screen TV, walk-in shower, luxury toiletries.'], 'Nearby Attractions': ['Kotor Old Town is approximately 7 km away.']}","Luxury resort with a private marina, wellness facilities, and stunning bay views.",42.4652423,18.7310601,https://maps.app.goo.gl/bzvekb3ALe3ph9jJA,hotel,2025-02-19T19:32:57.000000Z
619,77,Kotor,Montenegro,HUMA Hotel and Villas,"{'Location': ['Located on the waterfront, 3.6 km from Old Town Kotor.'], 'Services and Facilities': ['Private beach area, outdoor pool, free Wi-Fi, restaurant, bar, beach club with occasional live music.'], 'Rooms': ['Air-conditioned rooms with flat-screen TV, cable channels, kettle, private bathroom with shower and hairdryer, some rooms offer a balcony with sea views.'], 'Nearby Attractions': ['26 km to Budva, 88 km to Podgorica, 11 km to Tivat Airport.']}","Modern hotel with private beach, outdoor pool, and great sea views.",42.4479913,18.7631383,https://maps.app.goo.gl/fBXudhetuNH5ws2t9,hotel,2025-02-19T19:25:21.000000Z
618,75,Borjomi,Georgia,Golden Borjomi,"{'Location': ['The hotel is located on Zakaria Ballasfili Street No. 16, Borjomi, Georgia, near the famous Borjomi Central Park.'], 'Facilities and services:': ['Restaurants and bars: The hotel includes a restaurant that offers a variety of local and international dishes, as well as a bar that offers various drinks in a comfortable atmosphere.', 'Recreational facilities: The hotel has a fitness center equipped with the latest equipment, in addition to a spa center that offers relaxation and renewal services.', 'Other services: The hotel provides free Wi -Fi throughout the building, in addition to the airport transportation service on request.'], 'Rooms:': ['The hotel offers a variety of rooms and suites designed with a high taste, equipped with the latest amenities to ensure a comfortable stay for guests.'], 'Near tourist places:': ['Borjomi Central Park', 'Borjomi Museum', 'Mineral water resort', 'Palace of the King of Borjomi', 'Mount Karajali']}","The Golden Borjomi Hotel is located in the heart of the city, near Borjomi Park, Burgumi Museum and tourist attractions.",41.8424764,43.3595351,https://maps.app.goo.gl/Q5EaFyh6zgw3phFH8,hotel,2025-02-19T19:14:31.000000Z
323,77,Kotor,Montenegro,Restaurant MojaKafanica,"{'Info': [""Moja Kafanica is a gastro pub located in the heart of Kotor's Old Town, Montenegro."", 'Established in 2015 within the historic ""Palata Beskuća,"" it offers a unique blend of traditional local cuisine and modern culinary creations. The ambiance is warm and inviting, reflecting a fusion of historical charm and'], 'Restaurant Features': ['Cuisine: Authentic local dishes alongside innovative culinary creations.', 'Atmosphere: Cozy and friendly, suitable for both quick lunches and relaxed dinners.', 'Services: Indoor and outdoor seating, live music events, and a selection of local wines and craft beers.'], 'Main Dishes': ['Blackbeard Burger: A hearty burger featuring double homemade sauce, lettuce, tomato, bacon, red onion, beef patty, cheddar cheese, and served with roasted potatoes.', 'Posna Pizza: A vegan-friendly pizza topped with plant-based cheese, vegetables, arugula, cherry tomatoes, olives, and oregano.'], 'Working Hours': ['Open until 1:00 AM.']}",Gastro pub in Kotor's Old Town blending traditional and modern cuisine in a historic setting.,42.4245273,18.767672,https://maps.app.goo.gl/UTWgTUUViptZuk5r8,restaurant,2025-02-19T19:06:06.000000Z
617,75,Borjomi,Georgia,Holiday Borjomi,"{'Location': ['The hotel is located on Faithlovani Street No. 6, Borjomi, Georgia, 3.1 km from the city center.'], 'Facilities and services:': ['A beautiful garden features picturesque views of the surrounding mountain nature.', 'A terrace where guests can relax and enjoy landscapes.', '24 -hour front desk.', 'Room service: Provides guests comfort in the room.', 'Luggage storage service to help store things before or after logging in.', 'Ki clothing service to help take care of clothes.', 'Transport service to the airport or station (at an additional cost).', 'Free Wi -Fi is available throughout the hotel.', 'Restaurant: Continental Breakfast offers a variety of food and breakfast buffet that offers various options every morning.'], 'Rooms:': ['The rooms have a flat -screen TV.', 'Work office.', 'Luggage wardrobe.', 'A private bathroom with all hygiene supplies.', 'A balcony with beautiful looks on the garden or mountains.', 'Fans in the rooms instead of air conditioning.'], 'Near tourist places:': ['Burgumi Park', 'Burgumi Resort for Mineral Springs', 'Romanov Palace', 'Burgumi National Park', 'Deir Saber']}",The Holiday Borjomi Hotel is a 3 -star comfortable hotel with mountain views and excellent services in Borjomi.,41.8523054,43.4084952,https://maps.app.goo.gl/4tbqmd99NgwG2nND7,hotel,2025-02-19T19:04:55.000000Z
322,77,Kotor,Montenegro,Galion restaurant,"{'Info': ['Restaurant Galion is a renowned dining establishment located in Kotor, Montenegro, offering a blend of modern Mediterranean and local cuisine.', ""Situated on the waterfront, just a few minutes' walk from the Old Town, it provides diners with stunning views of Kotor's marina and the historic city walls.""], 'Restaurant Features': ['Ambiance: The restaurant boasts a sophisticated interior with floor-to-ceiling glass walls, allowing guests to enjoy panoramic vistas of the bay and Old Town. The terrace, perched above the sea, offers an intimate setting, especially enchanting during sunset.', 'Services: Galion offers both indoor and outdoor seating, free Wi-Fi, and is pet-friendly. The establishment is also equipped to host private events and special occasions, with a total capacity of 70 seats divided into four distinct areas.'], 'Main Dishes': ['Seafood Specialties: Freshly caught fish, grilled octopus, and sea bass are among the highlights, prepared with a touch of local flavors.', 'Meat Dishes: Beef fillet with green pepper sauce and other international meat selections are available for those preferring land-based options.', ""Pasta Varieties: Dishes such as mushroom soup with truffle oil and risotto with avocado and spices showcase the restaurant's innovative approach to traditional recipes.""], 'Working Hours': ['Daily: 12:00 PM – 10:00 PM.']}",Waterfront Kotor restaurant offering modern Mediterranean and local dishes with panoramic marina views.,42.4227595,18.766819,https://maps.app.goo.gl/GQUxyy2K66g8WH65A,restaurant,2025-02-19T18:56:32.000000Z
321,77,Kotor,Montenegro,Restaurant PRŽUN,"{'Info': [""Restaurant PRŽUN is a culinary gem nestled in the heart of Kotor's Old Town, Montenegro."", 'Known for its blend of traditional and modern Mediterranean cuisine, the restaurant offers a diverse menu that caters to various palates.'], 'Restaurant Features': ['Ambiance: Set within the historic walls of Kotor, PRŽUN provides a cozy and inviting atmosphere with rustic décor that reflects the rich history of the area.', 'Services: The restaurant offers both indoor and outdoor seating, allowing guests to enjoy their meals in a charming setting. Free Wi-Fi is available, and the staff is known for their warm hospitality.'], 'Main Dishes': ['Seafood Specialties: Fresh catches from the Adriatic Sea, including grilled octopus and king prawns wrapped in bacon.', 'Meat Dishes: Beef fillet with green pepper sauce and various barbecue options.', 'Varieties Pasta: Spaghetti alla whore and penne to the norm.'], 'Working Hours': ['Daily: 9:00 AM – 11:30 PM.']}",Charming Old Town Kotor restaurant offering a blend of traditional and modern Mediterranean cuisine.,42.4248786,18.7695207,https://maps.app.goo.gl/JbozKYwAjSTSA61t8,restaurant,2025-02-19T18:48:26.000000Z
616,75,Borjomi,Georgia,Mountain Resort Galadiadi,"{'Location': ['The Gantiadi Mountain Resort is located in the village of Tsemi, Borjomi, 1208, Georgia.'], 'Facilities and services:': ['Residence: The resort offers a set of rooms and suites fully equipped to ensure the comfort of guests.', 'Restaurants: The resort provides restaurants serving a variety of local and international dishes.', 'Entertainment activities: The resort offers various entertainment activities such as swimming, water sports, and mountainous activities.', 'Spa and wellness: The resort contains spa facilities, wellness for relaxation and renewal.'], 'Rooms:': ['Double Rooms: contains a double bed or two single beds, suitable for husbands or individuals.', 'Triple rooms: it contains three beds, ideal for families or small groups.', 'Wings: It includes more space with a separate seating area, suitable for families or guests looking for more comfort.'], 'Near tourist attractions:': ['Gantaidy National Park: It is located near the resort, and is considered one of the most prominent natural landmarks in the region.', 'Lake Gantaidy: A beautiful mountain lake is an ideal destination for picnics and water activities.']}",The Gantiadi Hotel in Tsimi offers comfortable rooms with integrated services in the mountainous Borjomi area.,41.799107,43.4485102,https://maps.app.goo.gl/G87JtYb2AkNxxkfU9,hotel,2025-02-19T18:36:47.000000Z
320,77,Kotor,Montenegro,Ombra Restaurant,"{'Info': [""Ombra Restaurant is a charming eatery nestled in the heart of Kotor's Old Town, Montenegro."", 'Established in 2013, it offers a delightful blend of Mediterranean and international cuisines, with a strong emphasis on organic and locally sourced ingredients. The restaurant caters to a variety of dietary preferences, including vegan and vegetarian options.'], 'Restaurant Features': ['Ambiance: Set within the historic Kotor Fortress, Ombra provides a unique dining experience under the shade of a grand old tree, creating a cozy and inviting atmosphere.', 'Services: The restaurant offers outdoor seating, live entertainment, and is wheelchair accessible. Free Wi-Fi is available for guests, and reservations are recommended, especially during peak hours.'], 'Main Dishes': [""Seafood Specialties: Freshly caught fish dishes that highlight the region's rich maritime heritage."", 'Vegan and vegetarian options: vegan pizza with vegan cheese, angry penne, and spaghetti garlic and oil.', 'Turkish-Inspired Dishes: A selection of dishes inspired by Turkish cuisine, reflecting the diverse culinary influences of the region.'], 'Working Hours': ['Daily: 8:00 AM – 12:00 AM.']}",Cozy Old Town Kotor restaurant offering organic Mediterranean and international dishes under a historic tree canopy.,45.1080261,-8.364058,https://maps.app.goo.gl/dvcLq2EeNNU7xXjS8,restaurant,2025-02-19T18:34:43.000000Z
319,77,Kotor,Montenegro,Atrium Restaurant,"{'Info': [""Restoran Atrium is a charming restaurant located in the heart of Kotor's Old Town, Montenegro."", 'Known for its delightful ambiance and diverse menu, it offers a unique dining experience that combines traditional Montenegrin flavors with international cuisine.'], 'Restaurant Features': ['Ambiance: Nestled in a serene corner of Old Town, Restoran Atrium boasts a cozy interior adorned with lush indoor plants and a skylight roof, creating a greenhouse-like atmosphere. The decor includes velvet couches and candlelight, enhancing its romantic and inviting setting.', 'Services: The restaurant offers free Wi-Fi, air conditioning, and is pet-friendly. It also features an outdoor seating area in a picturesque garden setting, making it ideal for both intimate dinners and larger gatherings.'], 'Main Dishes': ['Seafood Specialties: Fresh tuna, prawns, and seafood risotto are among the popular choices.', 'Signature Dishes: Beef and tuna tartare, veal medallions, and pasta dishes, including spaghetti and carbonara.', 'Desserts: A selection of cakes and pastries to conclude your meal on a sweet note.'], 'Working Hours': ['Daily: 11:00 AM – 11:00 PM.']}","Cozy Old Town Kotor restaurant offering diverse international and Montenegrin dishes in a lush, plant-filled setting.",42.4228771,18.7670816,https://maps.app.goo.gl/YGkLPvuJwewv6MKZ6,restaurant,2025-02-19T18:26:09.000000Z
318,77,Kotor,Montenegro,Cesarica Restaurant Restaurant,"{'Info': [""Restoran Cesarica is a family-run establishment located in the heart of Kotor's Old Town, Montenegro."", 'Known for its cozy, traditional interior, the restaurant offers an authentic taste of local cuisine, emphasizing fresh seafood sourced daily from the bay by the owner, a skilled local fisherman.'], 'Restaurant Features': ['Ambiance: Situated down a quiet cobbled lane, Cesarica provides a quaint and rustic atmosphere with a cave-like brick interior, offering a peaceful retreat from the bustling town.', 'Services: The restaurant offers both indoor and outdoor seating, accommodating various dining preferences.'], 'Main Dishes': ['Seafood Specialties: The menu features a variety of fresh seafood dishes, including mussels, squid, grilled sea bass, and traditional fish and chips, all prepared with care by family chefs.'], 'Working Hours': ['Daily: Open until 11:00 PM.']}","Family-run restaurant in Kotor's Old Town, serving fresh seafood in a cozy, traditional setting.",42.4253612,18.7683099,https://maps.app.goo.gl/X5Hu5wBdkRnBeZbu7,restaurant,2025-02-19T18:16:21.000000Z
615,75,Borjomi,Georgia,Wine Inn Borjomi Hotel,"{'Location': ['Wine Inn Borjomi Hotel is located on Greygul Robakidza Street No. 2, Burgumi, Georgia and is characterized by its central location, which is easy to reach the main city landmarks.'], 'Facilities and services:': ['Internet and Communications: The hotel provides free Wi -Fi throughout the building.', 'Parking: A free parking is available for guests.', 'Other facilities: Each apartment contains a fully equipped kitchen, allowing guests to prepare their own meals.'], 'Rooms:': ['Each apartment has a fully equipped kitchen with a dining table, allowing guests to prepare their own meals.', 'The rooms feature a comfortable design and modern facilities including a flat -screen satellite TV.', 'Private bathrooms have free shower and bathtubs.'], 'Near tourist attractions:': ['Borjomi Central Park: It is located 1 km from the hotel and is one of the most prominent landmarks of the city.', 'Borjomi Train Station: It is 300 meters away, which facilitates access to other areas.', 'Borjomi National Park: It is about 21.2 km and is considered one of the distinctive tourist destinations.']}","Wine Inn Borjomi provides comfortable apartments with self -services in the heart of the city of Borjomi, Georgia.",41.8411189,43.381568,https://maps.app.goo.gl/yah9bgk56NBABaPa9,hotel,2025-02-19T18:11:49.000000Z
317,77,Kotor,Montenegro,Bokun Restaurant,"{'Info': [""Bokun is a charming restaurant and wine bar nestled in the heart of Kotor's Old Town, Montenegro."", 'Known for its authentic Montenegrin and Mediterranean cuisine, Bokun offers a cozy atmosphere complemented by live music performances, making it a favorite spot for both locals and tourists.'], 'Restaurant Features': ['Ambiance: Cozy interior with tasteful decor, creating an inviting space for intimate dinners and larger gatherings.', 'Services: Free Wi-Fi, air conditioning, live music, pet-friendly environment, and outdoor seating in a beautiful garden setting.'], 'Main Dishes': ['Local Specialties: Fresh seafood dishes, traditional Montenegrin prosciutto, and a variety of pasta options, including Spaghetti Napolitan.', 'Beverages: An extensive selection of fine wines and craft cocktails.'], 'Working Hours': ['Summer: Daily from 8:00 AM to 1:00 AM.', 'Winter: Daily from 9:00 AM to 11:00 PM.']}",Cozy Old Town Kotor restaurant offering authentic Montenegrin cuisine with live music.,42.4259335,18.7665786,https://maps.app.goo.gl/zPoFRMBaXi5mz2k66,restaurant,2025-02-19T18:06:23.000000Z
316,77,Kotor,Montenegro,Konoba Scala Santa Restaurant,"{'Info': [""Konoba Scala Santa is a historic restaurant located in the heart of Kotor's Old Town, Montenegro."", 'Established in 1931, it is renowned as the oldest restaurant in Kotor, offering a charming and authentic dining experience with its traditional wooden beams and cozy atmosphere.'], 'Restaurant Features': [""Ambiance: Situated in a tranquil corner of Old Town, the restaurant provides both indoor seating with a cozy alpine feel and a spacious outdoor terrace, making it an ideal spot to escape the city's hustle and bustle."", 'Services: Free Wi-Fi, air conditioning, and facilities accommodating families and groups.'], 'Main Dishes': ['Seafood Specialties: Freshly grilled sea bass, red snapper, and sea bream.', 'Signature Dishes: Fish soup, fish stew, tuna steak, shrimp truffle gnocchi, and shrimp sautéed with white wine.'], 'Working Hours': ['Daily: 11:30 AM – 10:00 PM.']}","Historic Kotor restaurant offering Mediterranean seafood in a cozy, traditional setting.",42.423745,18.7689195,https://maps.app.goo.gl/qJxbLZn4WRpNPTw46,restaurant,2025-02-19T17:59:56.000000Z
614,75,Borjomi,Georgia,Terrace Borjomi Hotel,"{'Location': ['The Terras Borjomi Hotel is located on Ericley 1 Street, Burgumi 1200, Georgia. This hotel is a special choice for travelers wishing to explore the city of Burgumi and enjoy its facilities.'], 'Facilities and services:': ['Terrace: The hotel has an external terrace where guests can enjoy great panoramic views of the mountains and the surrounding nature.', 'Al Bar: The hotel provides a bar that allows guests to relax and enjoy various drinks.', 'Relax Hall: There is a place for relaxation with a calm and elegant atmosphere.', 'Free Wi -Fi: Wi -Fi is available throughout the hotel for free to keep guests in constant contact.', 'Daily room cleaning service: The rooms are cleaned on a daily basis to ensure comfort and hygiene.', 'Ski storage and rental services: Since Burgumi is a famous ski city, the hotel provides ski storage services and rental services to help guests who want skiing.', 'Parking: The hotel provides free parking for guests, making it easy to move for those who reach their own cars.', 'Facilities for people with special needs: The hotel provides comfortable facilities for people with special needs.'], 'Rooms:': ['Double Rooms: contains a double bed with all basic amenities.', 'Luxury wings: provide more space and luxury with beautiful looks.', ""Family rooms: suitable for families and has an additional bed to suit children's needs.""], 'Near tourist places:': ['Burgumi Park', 'Burgumi Castle', 'Amirani Park', 'Pakoriani skiing resort', 'Mineral Water Park area']}",The Terras Borjomi Hotel provides comfortable rooms and distinctive facilities with a central site close to Borgomi's tourist attractions.,41.8317469,43.3595597,https://maps.app.goo.gl/cvDmASfzPX8gb8kn9,hotel,2025-02-19T17:20:15.000000Z
612,75,Borjomi,Georgia,Borjomi Palace Hotel & SPA,"{'Location': ['Borjomi Palace and Spa Resort is a 4 -star hotel located in Borjomi, Georgia and is located near Burgumi National Park.'], 'Facilities and services:': ['Internet: The hotel provides free Wi -Fi throughout the facility.', 'Parking: A free parking is available for guests.', 'Public facilities: The hotel includes an external swimming pool, a sports club, and a health resort that provides massage services and cosmetic treatments.', 'Restaurants and drinks: The hotel has a restaurant that offers Georgian and European dishes, as well as a bar that serves drinks and kariocy.', 'Other services: Facilities are available for meetings, room service, and 24 -hour reception.'], 'Rooms:': ['The rooms feature a comfortable design and modern facilities and contain air conditioning, flat -screen TV, minibar and daily cleaning service.'], 'Near tourist attractions:': ['Burgumi National Park: It is about 5 minutes on foot.', 'Burgumi Museum: Located 1.5 km.', 'Cloud castles: It is 10 km away.']}","Borjomi Palace Hotel and Spa offers comfortable rooms, swimming pools, spa and entertainment facilities near Borjomi Park.",41.8391667,43.3610673,https://maps.app.goo.gl/vYrLNqCbPvWYZazL6,hotel,2025-02-19T16:31:51.000000Z
611,75,Borjomi,Georgia,Polifonia Inn Borjomi,"{'Location': ['It is a guest house located on Ilia Chavchavadze Street 4, Borjomi, Georgia and is about 237 meters from the city center.'], 'Facilities and services:': ['Internet: Provides free Wi -Fi.', 'Parking: A free parking is available for guests.', 'Public facilities: It includes a garden and a relaxing garden.', 'Internal facilities: a fully equipped shared kitchen.', 'Services: Washing service is available.', 'Pets: Pets are allowed.'], 'Rooms: The rooms feature a comfortable design and modern facilities, and contain:': ['Facilities: air conditioning and heating.', 'Equipment: minibar and flat -screen TV.', 'Services: Daily Cleaning Service.'], 'Near tourist attractions:': ['Burgumi Central Park: About 1 km.', 'Pakurini ski area: It is 17.2 km away.', 'Davleti skiing area: It is 17.3 km away.']}","Borjomi Hotel offers comfortable rooms, free Wi -Fi, free parking, and a common kitchen near the center.",41.8391186,43.3811106,https://maps.app.goo.gl/Hpuag2RghN4ELrVN8,hotel,2025-02-19T16:07:48.000000Z
610,75,Borjomi,Georgia,Hotel Borjomi Verde,"{'Location': ['Borjomi Verdi Hotel is located on Grigol Robakidzi Street, No. 32, Burgumi 1200, Georgia.'], 'Facilities and services:': ['Internet: The hotel provides free Wi -Fi throughout the hotel.', 'Parking: A free parking is available for guests.', 'Public facilities: The hotel includes a garden and a relaxing garden.', 'Services: Washing service is available.', 'Food and drinks: The hotel provides an outdoor dining area.', 'Entertainment activities: guests can enjoy horse riding.'], 'Rooms: The rooms at Burgumi Verde Hotel feature a warm wooden design, and contain:': ['Facilities: a kitchen mininity and a private bathroom.', 'Equipment: a wide balcony with a beautiful swing overlooking the mountain.', 'Services: Free Wi -Fi is available.'], 'Near tourist places:': ['Burgumi National Park', 'Mineral water resort', 'Hot water gardens', 'Burgumi Museum', 'Lake Burgumi', 'Buka Bridge', 'Burgumi-Kafali Reserve']}","Borjomi Verdi Hotel is located near Burgumi Park, hot springs, clouds and lake castles.",41.834214,43.3771202,https://maps.app.goo.gl/ixC9cKHEFQngoXbF8,hotel,2025-02-19T15:51:50.000000Z
403,77,Kotor,Montenegro,Clock Tower,"{'Info': ['A historic clock tower located in the main square of Kotor’s Old Town.', 'Built in 1602 during Venetian rule, it has been a central landmark for centuries.'], 'Main Features': ['Stone façade, two clock faces, and a leaning structure due to past earthquakes.'], 'Working Hours': ['Open 24 hours.']}",A historic leaning clock tower symbolizing Kotor’s Venetian past.,42.4258323,18.7483431,https://maps.app.goo.gl/1dwJvU2xS8Ldgc3n6,tourist place,2025-02-19T15:32:46.000000Z
402,77,Kotor,Montenegro,Maritime Museum,"{'Info': ['A museum dedicated to Kotor’s rich maritime history, located in the Old Town.', 'Showcases Montenegro’s naval heritage, dating back to the Venetian and Ottoman eras.'], 'Main Features': ['Ship models, naval artifacts, old maps, and exhibits on seafaring traditions.'], 'Working Hours': ['Monday–Saturday: 9:00 AM – 6:00 PM; Closed on Sundays.', 'Perfect for history enthusiasts; check for guided tours to learn more details.']}",A fascinating museum displaying Kotor’s seafaring and naval legacy.,42.4257727,18.7483431,https://maps.app.goo.gl/abZw7Lpf5wqsEGV17,tourist place,2025-02-19T15:29:22.000000Z
