id,city_id,city_name,country_name,name,description,short_description,latitude,longitude,location,type,created_at
219,64,Bangkok,Thailand,Sanam Luang,"{'Information': ['Sanam Luang is a large open field located near the Grand Palace in Bangkok, serving as a historic public gathering space and site for royal ceremonies.', 'Historically, it has been used for royal processions, ceremonial events, and important national celebrations. It has also hosted the royal cremation ceremonies of past monarchs.'], 'Key Features': ['Cultural Site: Hosts royal ceremonies and public events, including the annual King’s Birthday celebrations.', 'Open Space: A vast green field surrounded by significant landmarks like the Grand Palace and Wat Phra Kaew.', 'Nearby Attractions: Located close to important cultural sites, making it a convenient stop for tourists.'], 'Visiting Tips': ['Best Time to Visit: Early mornings or late afternoons to avoid the heat and crowds.', 'Opening Hours: Open daily, but ceremonies and events may alter accessibility.']}","Sanam Luang is a historic public field in Bangkok, used for royal ceremonies and events, located near the Grand Palace.",13.7558745,100.4907055,https://maps.app.goo.gl/1rmQow4xzwMspzSm8,tourist place,2025-02-03T20:08:42.000000Z
217,64,Bangkok,Thailand,Wat Benchamabophit,"{'Information': ['Wat Benchamabophit, also known as the Marble Temple, is a Buddhist temple in Bangkok renowned for its stunning marble architecture and serene atmosphere.', 'Built during the reign of King Chulalongkorn (Rama V) in the early 20th century, it is one of the most revered temples in Thailand and a prime example of Thai architectural style.'], 'Key Features': ['Marble Architecture: The temple is constructed from exquisite white Carrara marble, giving it a distinct and elegant appearance.', 'Ubosot (Ordination Hall): The main hall houses a large golden Buddha statue and intricate artwork.', 'Surrounding Cloisters: Beautiful galleries with rows of Buddha statues, offering a peaceful atmosphere for reflection.', 'Landscaped Gardens: The temple grounds are surrounded by well-kept gardens and ponds.'], 'Visiting Tips': ['Opening Hours: Daily from 8:00 AM to 5:00 PM.', 'Dress Code: Modest clothing required.']}","Wat Benchamabophit, or the Marble Temple, is a beautiful Buddhist temple in Bangkok known for its stunning white marble architecture.",13.7665675,100.5115642,https://maps.app.goo.gl/nXdNAXdeyoD2NcEV8,tourist place,2025-02-03T19:58:43.000000Z
216,64,Bangkok,Thailand,Wat Saket Ratchawora Mahawihan,"{'Information': ['Wat Saket, also known as the Golden Mount, is a Buddhist temple located on a hill in the heart of Bangkok. It is famous for its large golden chedi (stupa) that offers panoramic views of the city.', 'The temple dates back to the Ayutthaya period and was later renovated during the reign of King Rama III. The Golden Mount itself was constructed by King Rama V.'], 'Key Features': ['Golden Chedi: The golden stupa at the summit is a major attraction and a symbol of enlightenment.', 'Scenic Views: The hilltop provides stunning views of Bangkok’s skyline.', 'Temple Grounds: Beautifully landscaped gardens and peaceful walkways surround the temple.', 'Religious Significance: A popular place for Buddhist ceremonies and festivals.'], 'Visiting Tips': ['Best Time to Visit: Early morning or late afternoon for cooler weather and fewer crowds.', 'Opening Hours: Daily from 7:30 AM to 5:30 PM.', 'Dress Code: Modest attire is required.']}","Wat Saket, or the Golden Mount, is a Buddhist temple in Bangkok, known for its golden stupa and panoramic city views.",13.7538689,100.503971,https://maps.app.goo.gl/4wWQ2oKHNhG865Ds5,tourist place,2025-02-03T19:32:57.000000Z
74,64,Bangkok,Thailand,MBK CENTER,"{'Information': ['MBK Center is a popular shopping mall in Bangkok, known for its wide range of affordable products, including electronics, clothing, and souvenirs.'], 'Key Features': ['Shopping: Offers a variety of stores selling fashion, accessories, electronics, and Thai handicrafts.', 'Dining: Numerous food courts and restaurants serving Thai and international cuisine.', 'Entertainment: Includes a cinema, arcade, and karaoke.', 'Affordable Prices: Known for budget-friendly shopping, especially electronics and mobile accessories.'], 'Main Shops': ['Fashion & Apparel : Levi’s, Uniqlo ,H&M, Guess ,Nike.', 'Beauty & Cosmetics : The Body Shop, Watsons, Scentio.'], 'Visiting Tips': ['Best Time to Visit: Weekdays are ideal to avoid crowds.', 'Opening Hours: Open daily from 10:00 AM to 10:00 PM.']}","MBK Center is a popular Bangkok mall offering affordable shopping for fashion, electronics, souvenirs, and dining options.",13.7446343,100.5275835,https://maps.app.goo.gl/wPweNW37pnecS3Lv7,shop,2025-02-03T19:18:51.000000Z
215,64,Bangkok,Thailand,Chatuchak Park,"{'Information': ['Chatuchak Park is a large urban park in Bangkok, offering a peaceful escape with lush greenery, walking paths, and a central lake.'], 'Key Features': ['Green Spaces: Enjoy shaded areas, gardens, and picnic spots.', 'Walking & Jogging Paths: Ideal for outdoor exercise and relaxation.', 'Lake & Boat Rental: A central lake where visitors can rent boats.', 'Flora & Fauna: Home to diverse plant life, trees, and birds.'], 'Visiting Tips': ['Best Time to Visit: Early morning or late afternoon for a cooler atmosphere.', 'Opening Hours: Open daily from 5:00 AM to 9:00 PM.']}","Chatuchak Park is a spacious urban park in Bangkok, featuring gardens, a lake, walking paths, and peaceful green spaces.",13.8074892,100.5528449,https://maps.app.goo.gl/p5wDzzE5SVcgKEK56,tourist place,2025-02-03T17:58:45.000000Z
214,64,Bangkok,Thailand,Madame Tussauds museum,"{'Information': ['Madame Tussauds Bangkok is a world-famous wax museum featuring lifelike statues of celebrities, historical figures, and cultural icons from around the globe.'], 'Key Features': ['Celebrity Figures: Meet wax figures of stars like Hollywood actors, sports legends, and musicians.', 'Interactive Exhibits: Pose with figures and participate in themed areas such as the ""World Leaders"" and ""Sports Zone.""', 'Cultural Icons: See figures of Thai kings, cultural figures, and Asian celebrities.', 'Virtual Reality: Experience interactive VR attractions for a unique experience.'], 'Visiting Tips': ['Best Time to Visit: Weekdays are ideal for fewer crowds.', 'Opening Hours: Daily from 10:00 AM to 8:00 PM.']}","Madame Tussauds Bangkok is a wax museum with lifelike figures of celebrities, historical icons, and interactive exhibits.",13.7464232,100.5290961,https://maps.app.goo.gl/1Y9aseRNXJxnFxw59,tourist place,2025-02-03T17:49:53.000000Z
213,64,Bangkok,Thailand,Khaosan Road,"{'Information': ['Khaosan Road is Bangkok’s famous backpacker street, known for its vibrant nightlife, street food, budget hotels, and cultural mix.'], 'Key Features': ['Nightlife: Lively bars, clubs, and street performances.', 'Street Food: Offers Thai snacks, Pad Thai, and exotic dishes.', 'Shopping: Markets selling clothes, souvenirs, and handmade items.', 'Massage & Spa: Affordable Thai massages and wellness centers.'], 'Visiting Tips': ['Best Time to Visit: Evening for the best nightlife experience.', 'Opening Hours: Open 24/7, with peak activity at night.']}","Khaosan Road is Bangkok’s lively backpacker hub, famous for nightlife, street food, shopping, and budget stays.",13.7589258,100.4946829,https://maps.app.goo.gl/QWwqwrRdYSbHZnrKA,tourist place,2025-02-03T17:29:19.000000Z
212,64,Bangkok,Thailand,Wat Trai Mit,"{'Information': ['Wat Traimit, also known as the Temple of the Golden Buddha, is famous for housing the world’s largest solid gold Buddha statue.', 'The Golden Buddha, dating back to the 13th-15th century, was discovered hidden under plaster in the 1950s, revealing its true gold form.'], 'Key Features': ['Museum: Showcases the history of the statue and Chinatown’s heritage.', 'Golden Buddha: A 5.5-ton solid gold Buddha statue, symbolizing prosperity.', 'Temple Architecture: Features traditional Thai design with intricate details.'], 'Visiting Tips': ['Best Time to Visit: Early morning or late afternoon to avoid crowds.', 'Opening Hours: Daily from 8:00 AM to 5:00 PM.', 'Dress Code: Modest attire required.']}","Wat Traimit is home to the world’s largest solid gold Buddha, a symbol of prosperity, located in Bangkok’s Chinatown.",13.7377127,100.5108796,https://maps.app.goo.gl/fum5aTUPgz3PnvNYA,tourist place,2025-02-03T17:20:57.000000Z
73,64,Bangkok,Thailand,Siam Paragon,"{'Information': ['Siam Paragon is one of Bangkok’s most luxurious shopping malls, featuring high-end brands, gourmet dining, entertainment, and SEA LIFE Bangkok Ocean World.'], 'Key Features': ['Luxury Shopping: Home to brands like Louis Vuitton, Gucci, and Chanel.', 'Dining & Cafés: Offers a variety of Thai and international restaurants.', 'Entertainment: Includes a cinema, SEA LIFE aquarium, and a bowling alley.', 'Automobile Showroom: Displays luxury cars like Ferrari and Lamborghini.'], ' Main Shops': ['Luxury & High-End Fashion : Louis Vuitton ,Gucci, Chanel ,Dior ,Prada ,Hermès.', 'Fashion & Apparel : Zara ,H&M ,Uniqlo ,Mango ,Adidas ,Nike.', 'Luxury Car : Showrooms , Ferrari ,Lamborghini, Maserati.'], 'Main Shops': ['Luxury & High-End Fashion : Louis Vuitton ,Gucci, Chanel ,Dior ,Prada ,Hermès.', 'Fashion & Apparel : Zara ,H&M ,Uniqlo ,Mango ,Adidas ,Nike.', 'Luxury Car : Showrooms , Ferrari ,Lamborghini, Maserati.'], 'Visiting Tips': ['Best Time to Visit: Weekdays are less crowded.', 'Opening Hours: Open daily from 10:00 AM to 10:00 PM.']}","Siam Paragon is a luxury mall in Bangkok, featuring high-end brands, fine dining, entertainment, and SEA LIFE aquarium.",13.7464317,100.5322802,https://maps.app.goo.gl/txspmVuzKRfTxoXX8,shop,2025-02-03T17:08:09.000000Z
208,64,Bangkok,Thailand,Siam Amazing Park,"{'Location': ['Siam Amazing Park is Thailand’s largest amusement and water park, offering thrilling rides, water attractions, and family-friendly entertainment. It is a top destination for adventure seekers and families.'], 'Key Features': ['Water Park: Home to one of the world’s largest wave pools and exciting water slides.', 'Adventure Zone: Features roller coasters, a giant drop, and other thrilling rides.', 'Cultural Exhibits: Showcases Thai-themed attractions and performances.'], 'Visiting Tips': ['Best Time to Visit: Weekdays are less crowded, and mornings offer cooler weather.', 'Opening Hours: Open daily from 10:00 AM to 6:00 PM.', 'Various ticket options available, including combo passes for rides and water park access.']}","Siam Amazing Park is Bangkok’s largest amusement and water park, featuring thrilling rides, a giant wave pool, and family attractions.",13.806583,100.6889458,https://maps.app.goo.gl/FyMyLbcDJ6UgZBab9,tourist place,2025-02-03T16:47:08.000000Z
207,64,Bangkok,Thailand,National Museum Bangkok,"{'Information': ['The National Museum Bangkok is the largest museum in Thailand, showcasing the country’s rich cultural heritage and history. It houses an extensive collection of artifacts, ranging from ancient Thai art to historical relics.', 'Founded in 1782, the museum is located near the Grand Palace and serves as a repository for royal collections and historical objects.', 'It was established during the reign of King Rama V to preserve and promote Thai culture.'], 'Key Features': ['Ancient Artifacts: The museum displays items dating back to prehistoric times, including sculptures, pottery, and tools.', 'Royal Collections: It features items related to the Thai monarchy, including royal artifacts, costumes, and weaponry.', 'Buddhist Art: The museum showcases a significant collection of Buddhist sculptures, murals, and religious relics.', ""Thai History Exhibits: The museum provides insights into Thailand's history, from ancient kingdoms to modern times.""], 'Visiting Tips': ['Best Time to Visit: Visit early in the day to avoid crowds, especially on weekends.', 'Opening Hours: The museum is open Wednesday to Sunday, from 9:00 AM to 4:00 PM. Closed on Mondays and Tuesdays.']}","The National Museum Bangkok showcases Thailand’s cultural heritage, with exhibits on art, history, and royal collections.",13.7576223,100.4899418,https://maps.app.goo.gl/7KUrbmSkvRU22wxu6,tourist place,2025-02-03T15:37:34.000000Z
206,64,Bangkok,Thailand,Jim Thompson House Museum,"{'Information': ['The Jim Thompson House Museum is the former home of American businessman and silk entrepreneur Jim Thompson, located in central Bangkok.', 'The house is now a museum showcasing traditional Thai architecture and art, along with Thompson’s collection of Southeast Asian art.  Historical Significance', 'Jim Thompson is credited with revitalizing the Thai silk industry in the 1950s and 1960s. In 1967, Thompson mysteriously disappeared while traveling in Malaysia. His home was converted into a museum to honor his legacy.'], 'Key Features': ['Traditional Thai Architecture: The house is a complex of six traditional teakwood houses that were combined and renovated by Thompson. It represents classical Thai architecture with modern touches.', 'Southeast Asian Art Collection: The museum houses a collection of Thai, Burmese, Cambodian, and Laotian art, including sculptures, paintings, and textiles.', 'Beautiful Gardens: The museum is set amidst lush gardens, offering a peaceful escape in the heart of Bangkok.', 'Guided Tours: Visitors can learn about Jim Thompson’s life and the history of Thai silk through informative guided tours.'], 'Visiting Tips': ['Best Time to Visit: It is best to visit in the morning or late afternoon to avoid crowds.', 'Opening Hours: The museum is open daily from 9:00 AM to 6:00 PM.', 'Dress Code: Visitors are asked to dress modestly.']}","Jim Thompson House is a museum showcasing traditional Thai architecture, art, and Jim Thompson's legacy in silk.",13.7492543,100.5257341,https://maps.app.goo.gl/dULNuBgTrAEW86m78,tourist place,2025-02-03T15:26:05.000000Z
72,64,Bangkok,Thailand,CentralWorld,"{'Information': ['CentralWorld is one of the largest shopping malls in Bangkok, offering a wide variety of retail stores, dining options, and entertainment facilities.', 'It’s located in the heart of the city and is a popular destination for both locals and tourists.'], 'Key Features': ['Shopping: The mall features both high-end international brands and local shops, offering fashion, electronics, home goods, and more.', 'Dining: A diverse range of restaurants, from fast food to fine dining, serving both Thai and international cuisines.', ""Entertainment: CentralWorld has an ice skating rink, a cinema, and an interactive kids' zone."", 'Events: The mall hosts various events throughout the year, including concerts, fashion shows, and seasonal festivals.'], 'Main Shops': ['Fashion & Apparel : Zara ,H&M ,Uniqlo ,Gucci ,Louis Vuitton ,Chanel ,The North Face.', 'Electronics & Technology : Apple Store ,Samsung ,PowerBuy, Sony.', 'Jewelry & Accessories:  Pandora, Tiffany & Co., Cartier.']}","CentralWorld is a large shopping mall in Bangkok, featuring international brands, dining options, entertainment, and events.",13.7465389,100.5365739,https://maps.app.goo.gl/dCE2FHX5vbYdhEAo7,shop,2025-02-03T15:15:35.000000Z
205,64,Bangkok,Thailand,The Temple of the Emerald Buddha,"{'Information': [""The Temple of the Emerald Buddha, located within the Grand Palace complex in Bangkok, is Thailand's most sacred Buddhist temple."", 'It houses the Emerald Buddha, a revered statue believed to bring prosperity to the country.', 'The temple was established in 1782 by King Rama I, and the Emerald Buddha itself dates back to the 14th century. It is an important religious and cultural symbol of Thailand.'], 'Key Features': ['Emerald Buddha: The centerpiece of the temple, this small but highly revered Buddha statue is made of jade and is adorned with gold clothing.', 'Golden Chedi: The temple features a golden chedi (stupa) that is a prominent part of the architecture, symbolizing the Buddha’s teachings.', 'Wall Murals: The temple’s walls are adorned with stunning murals depicting the life of the Buddha and scenes from Thai history.', 'Royal Chapel: The temple is also the royal chapel where important ceremonies and prayers for the royal family are held.'], 'Visiting Tips': ['Dress Code: Visitors must dress modestly, covering shoulders and knees, and avoid wearing hats or shorts.', 'Best Time to Visit: It is best to visit early in the morning to avoid crowds and the heat.', 'Opening Hours: The temple is open daily from 8:30 AM to 3:30 PM.']}","The Temple of the Emerald Buddha, located in the Grand Palace, houses the revered Emerald Buddha and is Thailand's most sacred temple.",13.7515019,100.4900936,https://maps.app.goo.gl/ZFSRvvYR8A7heLWp8,tourist place,2025-02-03T15:02:36.000000Z
204,64,Bangkok,Thailand,Safari World Marine Park,"{'Information': ['Safari World Marine Park is a section of Safari World in Bangkok, dedicated to marine animals and featuring a variety of shows and interactive exhibits. It is known for its wide range of animal performances and wildlife displays.'], 'Key Features': [""Dolphin Show: The park's famous dolphin show showcases playful and talented dolphins performing tricks."", 'Bird Show: A variety of exotic birds perform acrobatic feats and tricks, including parrots and cockatoos.', 'Orangutan Show: Visitors can watch orangutans in entertaining performances.', 'Wildlife Exhibits: The park features animals such as sea lions, tigers, and other exotic creatures in naturalistic settings.', 'Marine Life: The park includes aquariums and tanks featuring marine species like fish, turtles, and sharks.'], 'Visiting Tips': ['Best Time to Visit: Arrive early to enjoy the shows and avoid the midday crowds.', 'Admission Fee: Tickets can be purchased for the Marine Park separately or combined with the Safari Park ticket.', 'Opening Hours: The Marine Park is open daily from 9:00 AM to 5:00 PM.']}","Safari World Marine Park in Bangkok features dolphin shows, bird performances, and wildlife exhibits with marine life and exotic animals.",13.8654951,100.6981391,https://maps.app.goo.gl/scBfMj91kkHScLWL8,tourist place,2025-02-03T14:54:35.000000Z
203,64,Bangkok,Thailand,Safari World Safari Park,"{'Information': ['Safari World Bangkok is a large open zoo and safari park located just outside central Bangkok. It is divided into two main sections: the Safari Park and the Marine Park, offering a variety of wildlife experiences and entertainment.', 'Opened in 1988, Safari World Bangkok was designed to provide a unique and interactive wildlife experience.', 'The park aims to promote animal conservation and offers educational opportunities about wildlife and natural habitats.'], 'Key Features': ['Safari Park: Visitors can drive through the Safari Park in their own vehicle or in a guided tour to see animals like tigers, lions, giraffes, and zebras in an open, naturalistic setting.', 'Cultural Experiences: The park also offers cultural exhibits and performances, including Thai and African-themed shows.', 'Marine Park: The Marine Park features a wide variety of animals, including dolphins, orangutans, and exotic birds, with daily shows and performances.'], 'Visiting Tips': ['Best Time to Visit: It’s recommended to visit early in the day to avoid the midday heat and large crowds. The animal shows tend to be less crowded early on.', 'Admission Fee: Tickets are sold for the Safari Park, Marine Park, or a combination of both.', 'Opening Hours: The park is open daily from 9:00 AM to 5:00 PM.']}","Safari World Bangkok is an open zoo with a safari park, marine park, animal shows, and cultural performances.",13.8654951,100.7004351,https://maps.app.goo.gl/Epgv6RgAcLdJqUbc7,tourist place,2025-02-03T14:44:49.000000Z
200,64,Bangkok,Thailand,SEA LIFE Bangkok Ocean World,"{'Information': ['SEA LIFE Bangkok Ocean World is one of the largest aquariums in Southeast Asia, located beneath the Siam Paragon Mall in the heart of Bangkok.', 'It offers visitors the chance to explore marine life through impressive exhibits and interactive experiences.'], 'Historical Significance': ['Opened in 2005, SEA LIFE Bangkok Ocean World was designed to be a leading marine education and conservation center in the region.', 'It features diverse aquatic environments and promotes awareness about ocean conservation.'], 'Key Features': ['Ocean Tunnel: The highlight of the aquarium, the 270-degree glass tunnel allows visitors to walk through and experience being surrounded by sea creatures like sharks, rays, and schools of fish.', 'Exhibits: Various themed zones, such as the Rainforest, Deep Reef, and Rock Pool, showcase different marine environments, including freshwater species, coral reefs, and exotic sea life.', 'Interactive Experiences: Visitors can participate in feeding shows, touch pools, and even dive with sharks or rays.', '3D Cinema: The aquarium features an immersive 3D cinema that offers educational films about marine life.'], 'Visiting Tips': [""Best Time to Visit: It's best to visit during weekdays to avoid weekend crowds. Early morning or late afternoon visits are ideal for fewer people.Best Time to Visit: It's best to visit during weekdays to avoid weekend crowds. Early morning or late afternoon visits are ideal for fewer people."", 'Admission Fee: Tickets are available online or at the entrance, with discounts for children and groups.', 'Opening Hours: SEA LIFE Bangkok is open daily from 10:00 AM to 8:00 PM.']}","SEA LIFE Bangkok Ocean World is a large aquarium in Siam Paragon, featuring marine life exhibits, an ocean tunnel, and interactive experiences.",13.7468017,100.5337196,https://maps.app.goo.gl/AGye9EowCQfm74wU6,tourist place,2025-02-03T14:32:31.000000Z
199,64,Bangkok,Thailand,Chatuchak Weekend Market,"{'Information': ['Chatuchak Weekend Market is one of the largest and most popular markets in Bangkok, offering a wide variety of goods, from clothing and accessories to antiques and local foods.'], 'Historical Significance': [""The market was established in 1942 and has since grown into one of the world's largest outdoor markets. It started as a flea market and gradually expanded to become a major retail hub.""], 'Key Features': ['Over 8,000 Stalls: The market is divided into sections, with vendors selling everything from clothing, accessories, and home décor to pets, plants, and antiques.', 'Street Food: Chatuchak is famous for its variety of street food stalls offering local Thai snacks, fresh juices, and international dishes.', 'Handmade Goods: You’ll find plenty of unique, handcrafted items, making it an excellent place to pick up souvenirs.', 'Art and Crafts: Local artisans showcase traditional Thai arts, crafts, and artwork, providing a glimpse into Thai creativity.'], 'Best Time to Visit': ['The market is open only on weekends (Saturday and Sunday), from 9:00 AM to 6:00 PM. It’s best to go early to avoid the crowds.']}","Chatuchak Weekend Market is a bustling market in Bangkok, offering diverse goods, street food, and handmade items across 8,000+ stalls.",13.7997862,100.5478496,https://maps.app.goo.gl/dATuZdsDTXYCWnaV9,tourist place,2025-02-03T14:21:03.000000Z
198,64,Bangkok,Thailand,Lumpini Park,"{'Information': [""Lumpini Park is a large public park in the heart of Bangkok, offering a peaceful escape from the city's bustling streets."", 'It is a popular destination for both locals and tourists, known for its lush green spaces, serene lakes, and recreational activities.'], 'Historical Significance': ['Opened in 1920, Lumpini Park was designed by the city’s planners to provide green space for relaxation and recreation.', 'It was named after Lumbini, the birthplace of the Buddha in Nepal. The park holds historical importance as a place for public events and community gatherings.'], 'Key Features': ['Lumpini Lake: A large lake in the center of the park where visitors can enjoy paddle boating and relax by the water.', 'Walking and Running Tracks: The park offers wide pathways perfect for jogging, walking, and cycling.', 'Outdoor Fitness Equipment: Various exercise stations are spread across the park, making it a popular spot for fitness enthusiasts.', 'Wildlife: Despite its urban location, the park is home to a variety of birds, turtles, and even monitor lizards.'], 'Best Time to Visit': ['Early mornings and late afternoons are ideal for visiting to enjoy the cooler weather and avoid the crowds.']}","Lumpini Park is a tranquil green space in central Bangkok, featuring a lake, walking tracks, and outdoor fitness equipment.",13.7314333,100.5391235,https://maps.app.goo.gl/xkdSvR59cHFgn79M7,tourist place,2025-02-03T14:12:40.000000Z
