id,city_id,city_name,country_name,name,description,short_description,latitude,longitude,location,type,created_at
1257,134,Andijan,Uzbekistan,PREMIER HOTEL,"{'Location': ['PREMIER HOTEL is located in Andijan, Uzbekistan, a wonderful place to stay and explore.'], 'Services & Facilities': ['Free Wi-Fi', 'Free breakfast.'], 'Rooms': ['Comfortable rooms.', 'Air conditioning.', 'Cozy atmosphere.'], 'Nearby Attractions': ['Andijan international hotel', 'TM HOTEL', 'Sultan Boutique Hotel']}",Premier Hotel Bukhara is a stylish 4-star hotel located in the heart of Bukhara’s Old City.,40.762975499999996,72.35402189999999,https://www.google.com/maps?q=PREMIER%20HOTEL&ftid=0x38bcedfc6337bff3:0xcdf0299bfb41650c,hotel,2025-07-03T08:54:19.000000Z
990,132,Tashkent,Uzbekistan,Alisher Navoi Monument,"{'Location': ['Alisher Navoi Monument is in Tashkent, Uzbekistan and is a must-visit landmark with a rating of 4.6, known for its rich history dating back to the royal era in Uzbekistan.'], 'Activities and Facilities': ['The Alisher Navoi Monument offers a glimpse into the royal history of Uzbekistan, providing visitors with a cultural and historical experience. The monument is surrounded by other attractions like Chorsu Bazaar, Tashkent Chimes, and the Memorial to the Victims of Repression, making it a hub of historical significance and architectural beauty.'], 'Opening Hours and Entry Fees': ['Open 24 hours daily.'], 'Nearby Areas': ['Close to the Alisher Navoi Monument, visitors can explore attractions such as Chorsu Bazaar, Tashkent Chimes, and the Memorial to the Victims of Repression. The area also features various dining options serving authentic Uzbek cuisine.']}","The Alisher Navoi Monument is a tribute statue to the famous Uzbek poet and thinker Alisher Navoi, embodying his great contributions to literature and culture, and is considered one of the prominent landmarks in Tashkent.",41.3037669,69.2411506,https://www.google.com/maps?q=Alisher%20Navoi%20Monument&ftid=0x38ae8b00ba2e95b9:0xcfb50229894202c5,tourist place,2025-07-03T08:51:20.000000Z
1256,134,Andijan,Uzbekistan,Vella Elegant,"{'Location': ['Vella Elegant is located in Andijan, Uzbekistan, a charming place to stay and explore.'], 'Services & Facilities': ['Free Wi-Fi', 'Free breakfast.', 'Parking available.'], 'Rooms': ['Comfortable rooms.', 'Air-conditioned rooms', 'Cozy atmosphere.'], 'Nearby Attractions': ['Andijan International Hotel', 'TM Hotel', 'Sultan Boutique Hotel']}","Refined hotel with an indoor pool. Stylish rooms in a sophisticated hotel with a spa, an indoor pool, a restaurant & an outdoor cafe.",40.7607335,72.351446,https://www.google.com/maps?q=Vella%20Elegant&ftid=0x38bcecc244588c45:0x89c23efc90772215,hotel,2025-07-03T08:50:38.000000Z
1255,134,Andijan,Uzbekistan,"Hotel ""Bog'ishamol""","{'Location': ['Hotel ""Bog\'ishamol"" is located in Andijan, Uzbekistan, a charming destination for travelers seeking comfort and relaxation.'], 'Services & Facilities': ['Guests at Hotel ""Bog\'ishamol"" can enjoy amenities like Free Wi-Fi and Free breakfast, ensuring a convenient and pleasant stay.'], 'Rooms': ['The rooms at Hotel ""Bog\'ishamol"" offer a comfortable and cozy atmosphere, perfect for unwinding after a day of exploring the city.'], 'Nearby Attractions': ['Close to the hotel are several tourist attractions in Andijan, offering guests the opportunity to immerse themselves in the local culture and history.']}","Refined hotel with an indoor pool. Stylish rooms in a sophisticated hotel with a spa, an indoor pool, a restaurant & an outdoor cafe.",40.7664974,72.35742309999999,https://www.google.com/maps?q=Hotel%20%22Bog%27ishamol%22&ftid=0x38bceceae4a55669:0x33b719eaf7f92108,hotel,2025-07-03T08:48:57.000000Z
989,132,Tashkent,Uzbekistan,Amir Temur Square,"{'Location': ['Amir Temur Square is in Tashkent, Uzbekistan and is a must-visit destination in the heart of the city, offering a glimpse into the rich history and culture of the region.'], 'Activities and Facilities': ['Explore the iconic Chorsu Bazaar for a vibrant shopping experience.', 'Visit the Memorial to the Victims of Repression for a somber yet important historical perspective.', 'Enjoy a leisurely walk around the beautiful Minor Mosque.'], 'Opening Hours and Entry Fees': ['Open daily from morning to evening.'], 'Nearby Areas': ['Amir Temur Square is surrounded by the bustling Tashkent City Walking Tour, where visitors can enjoy a leisurely stroll and explore the nearby Independence Square for more historical insights.']}","Amir Temur Square is a famous historical square in Tashkent dedicated to Amir Temur (Tamerlane), one of the most prominent leaders in the history of Uzbekistan, and contains a huge equestrian statue of him, a symbol of national pride and Uzbek history. If you mean something else, send me a simple clarification and I'll help you right away.",41.3109548,69.2792661,https://www.google.com/maps?q=Amir%20Temur%20Square&ftid=0x38ae8b00071a9c97:0xdda4dc279e8f70e1,tourist place,2025-07-03T08:48:54.000000Z
988,132,Tashkent,Uzbekistan,Minor Mosque,"{'Location': ['Minor Mosque is in Tashkent, Uzbekistan and is a significant landmark with a rating of 4.8, known for its rich history dating back to the royal era in Uzbekistan. It is a must-visit destination for history enthusiasts and those seeking architectural beauty.'], 'Activities and Facilities': ['Explore the stunning architecture of the mosque.', 'Learn about the history of the mosque and its cultural significance.', 'Enjoy peaceful moments in the serene surroundings.'], 'Opening Hours and Entry Fees': ['Open 24 hours daily.'], 'Nearby Areas': ['Close to the mosque are attractions like Chorsu Bazaar, Tashkent Chimes, and Memorial to the Victims of Repression in Tashkent. Visitors can also find various dining options nearby to experience local cuisine.']}","Marble mosque with a striking blue dome. Huge modern mosque with traditional marble features, towering minarets & a turquoise dome.",41.335310199999995,69.275035,https://www.google.com/maps?q=Minor%20Mosque&ftid=0x38ae8b454cf51035:0xc1f97becd64cf681,tourist place,2025-07-03T08:45:54.000000Z
1254,133,Bukhara,Uzbekistan,Minzifa Boutique Hotel,"{'Location': [""Amulet Hotel is located in Bukhara, Uzbekistan, a charming place to relax and unwind after exploring the city's rich history and culture.""], 'Services & Facilities': ['Free Wi-Fi', 'Free breakfast'], 'Rooms': ['Comfortable rooms.', 'Air conditioning', 'Cozy atmosphere.'], 'Nearby Attractions': ['Bukhara Old Town', 'Lyab-i Hauz Complex', 'Kalon Mosque']}","Casual hotel with free breakfast. Modest rooms in a laid-back hotel offering free breakfast & parking, plus a covered terrace.",39.7734703,64.4249634,https://www.google.com/maps?q=Amulet%20Hotel&ftid=0x3f5771a87b6f51cd:0xafecdd64ae285246,hotel,2025-07-03T08:44:25.000000Z
987,132,Tashkent,Uzbekistan,Memorial to the Victims of Repression in Tashkent,"{'Location': ['Memorial to the Victims of Repression in Tashkent is in Tashkent, Uzbekistan, a significant landmark with a rating of 4.7, commemorating the victims of historical repression in a solemn and respectful setting.'], 'Activities and Facilities': ['The memorial offers a serene space for reflection and remembrance, with activities like picnics and hiking available for visitors to enjoy.'], 'Opening Hours and Entry Fees': ['Open daily from 9:00 AM to 5:00 PM, except Mondays when it is closed. Entry is free for all visitors.'], 'Nearby Areas': ['Close to the memorial, visitors can explore attractions like Chorsu Bazaar, Tashkent Chimes, Minor Mosque, and Amir Temur Square. The area also features a variety of dining options serving local delicacies and international cuisine.']}","Memorial to the Victims of Repression A peaceful park and museum in Tashkent honoring those who suffered under Soviet political repressions, featuring a domed monument, symbolic sculptures, and historical exhibits.",41.3478267,69.28811139999999,https://www.google.com/maps?q=Memorial%20to%20the%20Victims%20of%20Repression%20in%20Tashkent&ftid=0x38aef4aa99d8a0e9:0x3364c0222bd37e8b,tourist place,2025-07-03T08:43:50.000000Z
986,132,Tashkent,Uzbekistan,Tashkent Chimes,"{'Location': ['Tashkent Chimes is in Tashkent, Uzbekistan and is a must-visit spot in the city known for its historical significance and architectural beauty.'], 'Activities and Facilities': ['Tashkent Chimes offers a variety of activities and facilities including exploring Chorsu Bazaar, visiting the Memorial to the Victims of Repression, admiring the Minor Mosque, and taking a walk at Amir Temur Square and Monument Square.'], 'Opening Hours and Entry Fees': ['Tashkent Chimes is open 24 hours a day, allowing visitors to enjoy its beauty at any time.'], 'Nearby Areas': ['Close to Tashkent Chimes, you can explore the vibrant Independence Square and enjoy a leisurely walk at Tashkent City Walking Tour. The area also offers various dining options to indulge in local cuisine.']}","Tashkent Chimes A famous Soviet-era clock tower in the heart of Tashkent, known for its melodic hourly chimes and historical architecture. It’s a popular photo spot and a symbol of the city’s modern history.",41.309632799999996,69.2797894,https://www.google.com/maps?q=Tashkent%20Chimes&ftid=0x38ae8b29af54f155:0x5292984a88da5ff6,tourist place,2025-07-03T08:41:12.000000Z
1253,133,Bukhara,Uzbekistan,Garden Plaza Bukhara,"{'Location': ['Minzifa Boutique Hotel is located in Bukhara, Uzbekistan, a charming destination rich in history and culture, making it a perfect place to stay for travelers seeking an authentic experience.'], 'Services & Facilities': ['The hotel offers amenities such as free Wi-Fi and complimentary breakfast, ensuring a comfortable and convenient stay for guests. Additionally, guests can enjoy services like parking and spa facilities during their visit.'], 'Rooms': ['The rooms at Minzifa Boutique Hotel are designed to provide a cozy and relaxing atmosphere for guests. Each room is equipped with modern amenities, ensuring a comfortable stay. Guests can enjoy features like air conditioning and a peaceful ambiance.'], 'Nearby Attractions': ['Close to the hotel, visitors can explore attractions like Mercure Bukhara Old Town and Grand Ark Bukhara, adding to the cultural experience. The surrounding area also boasts a variety of restaurants and cafes where guests can indulge in delicious local cuisine.']}","Refined property with dining & a terrace. Plush, individually styled rooms in a polished family-run hotel offering a restaurant & a terrace.",39.770547799999996,64.4208531,https://www.google.com/maps?q=Minzifa%20Boutique%20Hotel&ftid=0x3f5006054ebe5b0f:0xcf70e02232f2ff24,hotel,2025-07-03T08:40:46.000000Z
1252,133,Bukhara,Uzbekistan,Asia Bukhara,"{'Location': ['Garden Plaza Bukhara is located in Bukhara, Uzbekistan, offering a luxurious stay in the heart of the historic city.'], 'Services & Facilities': ['The hotel provides amenities like free Wi-Fi and complimentary breakfast, ensuring a comfortable and convenient stay for guests.'], 'Rooms': ['The rooms at Garden Plaza Bukhara are designed to be cozy and well-equipped, featuring amenities such as free Wi-Fi and breakfast to enhance the guest experience.'], 'Nearby Attractions': ['Close to the hotel are several tourist attractions in Bukhara, allowing guests to explore the rich history and culture of the city. The surrounding area also offers a variety of dining options for guests to enjoy.']}","Warm hotel with a pool & free Wi-Fi. Cozy hotel set in the old town offering free Wi-Fi & parking, plus an outdoor pool & a restaurant.",39.768083,64.45557699999999,https://www.google.com/maps?q=Garden%20Plaza%20Bukhara&ftid=0x3f5005955555554b:0xf701457b9cb11d87,hotel,2025-07-03T08:38:51.000000Z
985,132,Tashkent,Uzbekistan,Chorsu Bazaar,"{'Location': ['Chorsu Bazaar is in Tashkent, Uzbekistan, a vibrant market known for its historical significance and bustling atmosphere.'], 'Activities and Facilities': ['Exploring traditional Uzbek crafts and spices at the market stalls.', 'Visiting the Tashkent Chimes for a peaceful moment.', 'Paying respects at the Memorial to the Victims of Repression.', 'Admiring the architecture of the Minor Mosque.', 'Taking a leisurely walk at Amir Temur Square.', 'Viewing the Alisher Navoi Monument and Memorial Square.', 'Joining the Tashkent City Walking Tour for a guided experience.', 'Seeing the Taras Shevchenko Monument and Monument of Courage.', 'Enjoying family time at Tashkentland with various amenities.', 'Exploring the historic Independence Square.'], 'Opening Hours and Entry Fees': ['Open daily from early morning to late evening.', 'Specific opening hours for each attraction within the area.'], 'Nearby Areas': ['Close to Chorsu Bazaar, visitors can explore the vibrant streets of Tashkent, sample local cuisine at nearby restaurants and cafes, and enjoy the cultural richness of the city.'], 'The site.': ['Chorsu Bazaar is located in Tashkent, Uzbekistan, and is a vibrant market known for its historical significance and bustling atmosphere.']}","Historic market with local goods & gifts. Large, enduring market with stalls selling local foods & souvenirs, plus clothing & household items.",41.3267357,69.2350318,https://www.google.com/maps?q=Chorsu%20Bazaar&ftid=0x38ae8b9cdd04953d:0xf8109d550917a88e,tourist place,2025-07-03T08:38:42.000000Z
1251,133,Bukhara,Uzbekistan,Hotel Malika-Bukhara,"{'Location': ['Asia Bukhara is located in Bukhara, Uzbekistan, a charming city known for its rich history and stunning architecture. Situated at Mehtar Ambar St 55, 200118, Asia Bukhara offers a warm and welcoming stay for travelers looking to explore the beauty of Bukhara.'], 'Services & Facilities': ['Guests staying at Asia Bukhara can enjoy a range of amenities including free Wi-Fi, complimentary breakfast, and cozy accommodations. The hotel also provides a relaxing atmosphere, perfect for unwinding after a day of sightseeing.'], 'Rooms': ['The rooms at Asia Bukhara are equipped with modern amenities to ensure a comfortable stay for guests. From air conditioning to spacious interiors, each room offers a cozy retreat for travelers.'], 'Nearby Attractions': ['Close to Asia Bukhara, visitors can explore the historic sites of Bukhara such as the Ark Fortress and Po-i-Kalyan Complex. Additionally, the area around the hotel boasts a variety of restaurants and cafes where guests can indulge in delicious local cuisine.']}","Genteel lodging with breakfast. Polished rooms in an upscale hotel offering Wi-Fi & breakfast, plus a chic restaurant & a bar.",39.7736474,64.4184038,https://www.google.com/maps?q=Asia%20Bukhara&ftid=0x3f5771a87b6f51cd:0xa266eb84f7254be8,hotel,2025-07-03T08:36:14.000000Z
1250,133,Bukhara,Uzbekistan,Sahid Zarafshon,"{'Location': ['Hotel Malika-Bukhara is located in Bukhara, Uzbekistan, a charming city known for its rich history and stunning architecture. It is situated on Gavkushon Road 25, offering guests a convenient and picturesque setting to explore the city.'], 'Services & Facilities': ['The hotel offers a range of amenities including free Wi-Fi, complimentary breakfast, and a cozy atmosphere for guests to relax and unwind during their stay.'], 'Rooms': ['The rooms at Hotel Malika-Bukhara are equipped with modern conveniences, ensuring a comfortable and enjoyable stay for visitors. Guests can expect air conditioning, a relaxing ambiance, and all the necessary amenities for a pleasant experience.'], 'Nearby Attractions': ['Close to the hotel, guests can explore the historic sites of Bukhara such as the Ark Fortress, Lyab-i Hauz Complex, and Po-i-Kalyan Complex. The surrounding area also boasts a variety of restaurants and cafes where visitors can savor delicious local cuisine.']}","Genteel lodging with breakfast. Polished rooms in an upscale hotel offering Wi-Fi & breakfast, plus a chic restaurant & a bar.",39.772605999999996,64.417332,https://www.google.com/maps?q=Hotel%20Malika-Bukhara&ftid=0x3f50061b769d6cab:0x90fccfbbe1bb1113,hotel,2025-07-03T08:33:42.000000Z
1249,133,Bukhara,Uzbekistan,Wyndham Bukhara,"{'Location': ['Sahid Zarafshon is located in Bukhara, Uzbekistan, a charming place to stay and explore.'], 'Services & Facilities': ['Free Wi-Fi', 'Free breakfast'], 'Rooms': ['Comfortable rooms.', 'Air conditioning.', 'Cozy atmosphere.'], 'Nearby Attractions': ['Historic sites in Bukhara', 'Local restaurants and cafes.', 'Shopping areas in the city.']}","Wyndham Bukhara is a modern 4-star hotel in central Bukhara, Uzbekistan, offering stylish rooms.",39.7620377,64.42676999999999,https://www.google.com/maps?q=Sahid%20Zarafshon&ftid=0x3f5007535c10e183:0x67d2ba146074ce05,hotel,2025-07-03T08:31:03.000000Z
1248,133,Bukhara,Uzbekistan,Grand Ark Bukhara,"{'Location': [""Wyndham Bukhara is located in Bukhara, Uzbekistan, a charming city known for its rich history and stunning architecture. It's a perfect place to stay during your visit to experience the beauty of the region.""], 'Services & Facilities': ['Guests at Wyndham Bukhara can enjoy a range of amenities including free Wi-Fi, complimentary breakfast, and a cozy atmosphere. The hotel also offers convenient services to make your stay comfortable and memorable.'], 'Rooms': [""The rooms at Wyndham Bukhara are well-equipped with modern facilities to ensure a relaxing stay. Guests can enjoy comfortable bedding, air conditioning, and a cozy ambiance for a restful night's sleep.""], 'Nearby Attractions': [""Close to Wyndham Bukhara, you'll find a variety of tourist attractions to explore, such as historic sites, bustling markets, and cultural landmarks. The area also boasts numerous restaurants and cafes where you can savor delicious local cuisine.""]}","Wyndham Bukhara is a modern 4-star hotel in central Bukhara, Uzbekistan, offering stylish rooms.",39.7650436,64.4215548,https://www.google.com/maps?q=Wyndham%20Bukhara&ftid=0x3f50075ab4ce6869:0xbd63acef53761e6b,hotel,2025-07-03T08:28:44.000000Z
1247,133,Bukhara,Uzbekistan,Mercure Bukhara Old Town,"{'Location': ['Grand Ark Bukhara is located in Bukhara, Uzbekistan, a charming city known for its rich history and stunning architecture. Nestled in the heart of Bukhara Region, this hotel offers a perfect blend of traditional charm and modern comfort, making it a top choice for travelers.'], 'Services & Facilities': ['The hotel provides a range of amenities including free Wi-Fi, ensuring guests stay connected throughout their stay. Additionally, guests can enjoy comfortable rooms, on-site dining options, and convenient services to make their stay memorable.'], 'Rooms': ['The rooms at Grand Ark Bukhara are designed to offer a cozy and relaxing atmosphere for guests. With modern amenities and a touch of elegance, each room provides a comfortable retreat after a day of exploring the city.'], 'Nearby Attractions': [""Close to the hotel, guests can explore the vibrant streets of Bukhara, home to historical sites like the Ark Fortress and Kalon Minaret. The area also boasts a variety of dining options where visitors can savor delicious local cuisine and immerse themselves in the city's culinary scene.""]}",Mercure Bukhara Old Town is a stylish 4-star hotel located in the heart of Bukhara’s historic center.,39.774995,64.4428545,https://www.google.com/maps?q=Grand%20Ark%20Bukhara&ftid=0x3f500590260462dd:0x78202cc77d95d93c,hotel,2025-07-03T08:25:37.000000Z
1246,133,Bukhara,Uzbekistan,Mercure Bukhara Old Town,"{'Location': ['Mercure Bukhara Old Town is located in Bukhara, Uzbekistan, a charming place to stay and explore.'], 'Services & Facilities': ['Free Wi-Fi available throughout the hotel.', 'Cozy rooms with modern amenities.', 'Complimentary breakfast for guests.'], 'Rooms': ['Comfortable and well-equipped rooms.', 'Air-conditioned for a pleasant stay.', 'Spa services available for relaxation.'], 'Nearby Attractions': ['Explore the historic Samarkand Str.', 'Visit the vibrant Bukhara Region.', 'Discover the beauty of Uzbekistan.']}",Mercure Bukhara Old Town is a stylish 4-star hotel located in the heart of Bukhara’s historic center.,39.781732399999996,64.4211981,https://www.google.com/maps?q=Mercure%20Bukhara%20Old%20Town&ftid=0x3f5009b28c9a0121:0xad5a49b99ede8f45,hotel,2025-07-03T08:23:09.000000Z
1245,132,Tashkent,Uzbekistan,"Radisson Blu Hotel, Tashkent","{'Location': ['Radisson Blu Hotel, Tashkent is located in Tashkent, Uzbekistan, a luxurious and welcoming place to stay in the heart of the city.'], 'Services & Facilities': ['Guests at Radisson Blu Hotel, Tashkent can enjoy amenities such as free Wi-Fi, comfortable rooms, and a relaxing spa for a truly indulgent experience.'], 'Rooms': ['The rooms at Radisson Blu Hotel, Tashkent are designed to provide a cozy and air-conditioned environment, ensuring a comfortable stay for all guests.'], 'Nearby Attractions': ['Close to the hotel are several tourist attractions in Tashkent, offering guests the opportunity to explore the vibrant city. The area surrounding the hotel also boasts a variety of restaurants and cafes, perfect for sampling delicious local cuisine.']}","Simple lodging with 2 restaurants. Straightforward hotel featuring 2 dining options & an indoor pool, plus a coffee shop/bakery.",41.3346769,69.28501829999999,https://www.google.com/maps?q=Radisson%20Blu%20Hotel%2C%20Tashkent&ftid=0x38ae8b4d019155f7:0x2061e34e2368666e,hotel,2025-07-03T05:37:04.000000Z
1244,132,Tashkent,Uzbekistan,Ramada by Wyndham Tashkent,"{'Location': ['Ramada by Wyndham Tashkent is located in Tashkent, Uzbekistan, a vibrant city known for its rich history and cultural attractions. It is a welcoming place for travelers seeking comfort and convenience during their stay.'], 'Services & Facilities': ['Guests staying at Ramada by Wyndham Tashkent can enjoy a range of amenities including free Wi-Fi and complimentary breakfast. The hotel also offers extensions for additional services to enhance the guest experience.'], 'Rooms': ['The rooms at Ramada by Wyndham Tashkent are designed to provide a comfortable and cozy environment for guests. Amenities such as air conditioning and other features ensure a relaxing stay for visitors.'], 'Nearby Attractions': ['Close to the hotel are several tourist attractions in Tashkent waiting to be explored. The area surrounding the hotel is bustling with a variety of restaurants and cafes offering delicious local cuisine, making it a convenient choice for travelers.']}","Informal hotel with dining & 2 pools. Casual hotel offering warmly decorated rooms & suites, plus dining, a hammam & 2 pools.",41.3246829,69.2639122,https://www.google.com/maps?q=Ramada%20by%20Wyndham%20Tashkent&ftid=0x38ae8b6a9acde4e7:0x891b6a3591f2ae50,hotel,2025-07-03T05:25:03.000000Z
1243,132,Tashkent,Uzbekistan,Wyndham Tashkent,"{'Location': ['Wyndham Tashkent is located in Tashkent, Uzbekistan, a welcoming destination for travelers seeking comfort and convenience in the heart of the city.'], 'Services & Facilities': ['Free Wi-Fi', 'Free breakfast'], 'Rooms': ['Cozy and comfortable rooms.', 'Air conditioning in all rooms.', 'Modern amenities for a pleasant stay.'], 'Nearby Attractions': ['Explore the vibrant city center of Tashkent.', 'Visit the historic Amir Temur Square.', 'Indulge in local cuisine at nearby cafes and restaurants.']}","Informal hotel with dining & 2 pools. Casual hotel offering warmly decorated rooms & suites, plus dining, a hammam & 2 pools.",41.3174171,69.2800445,https://www.google.com/maps?q=Wyndham%20Tashkent&ftid=0x38ae8b520dbbc613:0x79f2d03d0917abe6,hotel,2025-07-03T05:19:01.000000Z
1242,132,Tashkent,Uzbekistan,Hampton by Hilton Tashkent,"{'Location': ['Hampton by Hilton Tashkent is located in Tashkent, Uzbekistan, a vibrant city known for its rich history and beautiful architecture. It is situated at Istiqbol 17, 100047, offering a convenient and comfortable stay for travelers.'], 'Services & Facilities': ['Guests staying at Hampton by Hilton Tashkent can enjoy a range of amenities including free Wi-Fi, complimentary breakfast, and other extensions to make their stay relaxing and enjoyable. The hotel also offers convenient services like parking, a swimming pool, and a spa for ultimate comfort.'], 'Rooms': ['The rooms at Hampton by Hilton Tashkent are designed to provide a cozy and welcoming atmosphere for guests. With amenities like air conditioning, comfortable bedding, and modern furnishings, guests can unwind and relax after a day of exploring the city.'], 'Nearby Attractions': ['Close to Hampton by Hilton Tashkent are several tourist attractions in Tashkent waiting to be explored. Guests can visit historical sites, museums, and vibrant markets to immerse themselves in the culture of the city. The area surrounding the hotel also boasts a variety of restaurants and cafes offering delicious local and international cuisine.']}","High-end hotel with dining & a spa. Upmarket rooms & suites in a sophisticated hotel featuring a restaurant, a fitness center & a spa.",41.3074428,69.28387579999999,https://www.google.com/maps?q=Hampton%20by%20Hilton%20Tashkent&ftid=0x38ae8b2a739c360f:0xd9cadbb811dfcb5c,hotel,2025-07-03T05:13:06.000000Z
1241,132,Tashkent,Uzbekistan,InterContinental Tashkent by IHG,"{'Location': ['InterContinental Tashkent by IHG is located in Tashkent, Uzbekistan, a luxurious place to stay in the heart of the city.'], 'Services & Facilities': ['Free Wi-Fi', 'Free breakfast.'], 'Rooms': ['Comfortable rooms.', 'Air conditioning.', 'Cozy ambiance.'], 'Nearby Attractions': ['Palace of Prince Romanov', 'Chorsu Bazaar', 'Amir Timur Museum']}","Laid-back business hotel with dining. Relaxed business hotel featuring 3 restaurants & an indoor pool, plus 2,128 sq m of meeting space.",41.315114699999995,69.28262819999999,https://www.google.com/maps?q=InterContinental%20Tashkent%20by%20IHG&ftid=0x38ae8b2dc3bf3f79:0xe1d61daec41f268f,hotel,2025-07-03T05:10:22.000000Z
