id,city_id,city_name,country_name,name,description,short_description,latitude,longitude,location,type,created_at
596,96,Gyumri,Armenia,Cobweb Art Gallery & Museum,"{'Information': ['The Cobweb Art Gallery & Museum is a unique cultural space in Gyumri, showcasing intricate artworks made from cobwebs. It is a one-of-a-kind museum that highlights an extraordinary artistic technique.'], 'Historical Importance': ['The museum preserves and promotes this rare art form, which has been practiced by Armenian artists. It serves as a testament to Gyumri’s rich artistic traditions and innovative craftsmanship.'], 'Key Features': ['Cobweb Artworks: Delicate paintings and designs crafted using real cobwebs.', 'Exhibitions: Features permanent collections and temporary displays of Armenian artists.', 'Cultural Experience: Provides insight into an unusual and intricate form of artistic expression.'], 'Working Hours': ['Typically open from morning to evening; check locally for exact timings.']}","A unique museum in Gyumri showcasing delicate artworks made from real cobwebs, reflecting rare craftsmanship.",40.792742,43.834976,https://maps.app.goo.gl/YiMJVerDBJYZn7qF6,tourist place,2025-03-11T00:59:03.000000Z
917,94,Khujand,Tajikistan,Guest House Sharq 21,"{'Location:': ['Hostel Sharq 21 is located in the historical district of Khujand, near the Panjshanbe Market and the Sheikh Muslihiddin Mosque.'], 'Facilities and Services': ['Garden and shared lounge.', 'Concierge service.', 'Sun deck.', 'Free Wi-Fi.', 'Free parking.', 'Shared kitchen.', '24-hour front desk'], 'Rooms:': ['A joint bedroom with eight beds with a private bathroom.', 'Quad room with a private bathroom and an independent entrance.', 'Double room with a private bathroom.'], 'Near tourist places:': ['Bangshansbi Market', 'Jame Mosque', 'Khajand Castle', 'Khajand Historical Regional Museum', 'Khajand Art Center']}","Sharq 21 Hostel is located in Khujand, Tajikistan, and offers comfortable accommodation with basic amenities and free Wi-Fi.",40.2785437,69.6339685,https://maps.app.goo.gl/y25Z2YoD6vH3Vams6,hotel,2025-03-11T00:49:23.000000Z
595,96,Gyumri,Armenia,Mher Mkrtchyan Museum,"{'Information': ['The museum honors Mher Mkrtchyan, one of Armenia’s most famous actors, known for his roles in Soviet Armenian cinema and theater. It displays his personal items, film memorabilia, and career highlights.'], 'Historical Importance': [""Established in his birthplace, the museum celebrates Mkrtchyan's impact on Armenian and Soviet cinema. His comedic and dramatic performances remain iconic in Armenian culture.""], 'Key Features': ['Film Memorabilia: Costumes, scripts, and personal belongings from his acting career.', 'Photographs & Posters: Showcasing his life and famous film roles.', 'Traditional Gyumri House: The museum is located in a historic building reflecting local architecture.'], 'Working Hours': ['Typically open from morning to evening; check locally for exact timings.']}","A museum in Gyumri dedicated to legendary Armenian actor Mher Mkrtchyan, featuring his film memorabilia.",40.7887837,43.8401448,https://maps.app.goo.gl/iSzWZBYHaxMrH9zs6,tourist place,2025-03-11T00:43:39.000000Z
916,94,Khujand,Tajikistan,Parliament Palace Hotel,"{'Location:': ['Parliament Palace Hotel is located at 28 Sir Darya Street, Khujand 735700, Tajikistan.'], 'Facilities and services': ['Restaurant: Offers a variety of cuisines, including local and international dishes.', 'Spa and Fitness Center: Includes sauna, Turkish bath, and various massage sessions.', 'Recreational facilities: such as table tennis, billiards, karaoke, and fishing.', 'Additional services: Free Wi-Fi, parking, and airport shuttle service.'], 'Rooms:': ['Single and double rooms: suitable for individuals and couples.', 'Wings: For those seeking extra space and luxury.', 'Apartments: Fully equipped for long stays.'], 'Nearby tourist attractions:': ['Panjshanbe Bazaar: One of the oldest markets in Central Asia, offering a unique shopping experience for local products.', 'Khujand Fortress: A historical landmark dating back to the 17th century, reflecting traditional architecture.', 'Khujand Historical Museum: Displays the history and culture of the city.', 'Ismail Samani Monument: A memorial honoring the founder of the Samanid state.', 'Kamoli Khujandi Park: A perfect place to relax and take a walk.', 'Syr Darya River Bridge: Offers stunning views of the river and the surrounding landscape.']}","Parliament Palace Hotel in Khujand, Tajikistan, offers comfortable accommodation with modern facilities, including a restaurant, spa, and fitness center.",40.2949864,69.6253502,https://maps.app.goo.gl/SLxnpsCY23PiRiJW8,hotel,2025-03-11T00:38:10.000000Z
594,96,Gyumri,Armenia,Hovhannes Shiraz House-Museum,"{'Information': ['The museum is dedicated to Hovhannes Shiraz, one of Armenia’s most beloved poets. It preserves his personal belongings, manuscripts, and literary works, offering insight into his life and contributions to Armenian poetry.'], 'Historical Importance': [""Established in the poet's birthplace, the museum highlights his role in Armenian literature. Shiraz's poetry, known for its emotional depth and patriotic themes, remains a cornerstone of Armenian cultural heritage.""], 'Key Features': [""Personal Artifacts: Includes Shiraz's handwritten poems, letters, and personal items."", 'Exhibitions: Displays his literary legacy and influence on Armenian poetry.', 'Building: A traditional Gyumri-style house, reflecting 19th-century Armenian architecture.'], 'Working Hours': ['Usually open from morning to evening; check locally for exact timings.']}","A museum in Gyumri dedicated to poet Hovhannes Shiraz, showcasing his personal items and literary heritage.",40.7876734,43.8405114,https://maps.app.goo.gl/P53pW9UmVvTdB2hh6,tourist place,2025-03-11T00:29:24.000000Z
915,94,Khujand,Tajikistan,Sugdiyon Hotel,"{'Location:': ['It is located in Khujand, the second-largest city in Tajikistan.', 'Close to the city center, making it convenient to access local markets, the river, and historical landmarks.'], 'Services and Facilities': ['Reception: 24 hours reception.', 'Restaurants and cafes: A main restaurant serves local and international dishes.', 'Physical fitness and recreation: Gym (GYM) equipped.', 'Free Wi -Fi throughout the hotel.', 'Free parking.', '24-hour room service.', 'Daily room cleaning service.', 'Washing and ironing service.', 'Transportation service to and from the airport upon request.', 'Conference halls and meetings equipped with display and sound devices.', 'Treasury in rooms or reception.', 'Watch and security cameras around the clock.'], 'Rooms:': ['Furnished rooms with comfortable furniture.', 'Air conditioning.', 'Flat-screen TV with satellite channels.', 'Mini bar and mini fridge.', 'Private bathroom with free toiletries.', 'Balconies in some rooms offer views of the Syr Darya River or the city.'], 'Nearby tourist attractions:': ['Bangshanbei Market', 'Khujand Fortress', 'Khujand Historical Museum', 'Ismail Samani Monument', 'Kamoli Khujand Park', 'Syr Darya Bridge']}","The SugdiyonHotel in Khujand, Tajikistan, provides comfortable stay with modern facilities, including a pool, gym, and restaurant.",40.2878634,69.61637,https://maps.app.goo.gl/AFxCVv7aw3RZv1Xf7,hotel,2025-03-11T00:21:12.000000Z
593,96,Gyumri,Armenia,The Gallery of Mariam and Eranuhi Aslamazyan Sisters,"{'Information': ['The gallery is dedicated to the works of Mariam and Eranuhi Aslamazyan, two renowned Armenian artists. It showcases their paintings, graphic art, and ceramics, reflecting Armenian culture and daily life.'], 'Historical Importance': ['Established in 1987, it is the only museum in Armenia dedicated to female artists. The Aslamazyan sisters played a key role in shaping modern Armenian art, blending traditional themes with innovative techniques.'], 'Key Features': ['Art Collection: Includes paintings, graphics, and ceramics with vibrant colors and national motifs.', 'Building: Housed in a historic 19th-century building in Gyumri, adding to its cultural charm.', 'Exhibitions: Features both permanent collections and temporary exhibitions.'], 'Working Hours': ['Typically open from morning to evening, but hours may vary. Check locally for updates.']}","A unique gallery in Gyumri showcasing the artistic legacy of the Aslamazyan sisters, housed in a historic building.",40.7863862,43.8381706,https://maps.app.goo.gl/ppNKzQEPki5DmCMK6,tourist place,2025-03-11T00:18:03.000000Z
591,96,Gyumri,Armenia,Vardanants Square,"{'Information': ['Vardanants Square is a central public square in Gyumri, Armenia, known for its historical significance and vibrant atmosphere. The square is a popular gathering place for locals and visitors alike.'], 'Historical Importance': ['The square is named after Vardan Mamikonian, an Armenian military leader and hero who led the Armenians in the Battle of Vartanants in 451 AD. The square honors his legacy and has been a focal point for various historical events in the city.'], 'Key Features': ['Monument: A monument to Vardan Mamikonian stands in the square, commemorating his role in Armenian history.', 'Location: The square is surrounded by beautiful architecture, with several historical buildings nearby, offering visitors a picturesque view.', 'Events: Vardanants Square is often used for public events, concerts, and festivals, making it a lively area of Gyumri.'], 'Working Hours': ['As a public square, it is open at all times. However, the surrounding facilities and businesses might have their own working hours.']}","A historic square in Gyumri, featuring a monument to Vardan Mamikonian and surrounded by beautiful architecture.",40.7841001,43.8386454,https://maps.app.goo.gl/Sqx6TCpgwPPp1ZyJ7,tourist place,2025-03-11T00:10:10.000000Z
590,96,Gyumri,Armenia,St. All Saints,"{'Information': [""St. All Saviors Church, also known as Surb Sargis, is an Armenian Apostolic Church located in Gyumri, Armenia. It is one of the city's historical landmarks, offering a glimpse into the architectural style of the region.""], 'Historical Importance': ['The church dates back to the 19th century, and although it has suffered damage over the years, it remains a significant symbol of faith and Armenian culture in Gyumri. The church has been carefully restored after the 1988 earthquake.'], 'Key Features': ['Architecture: The church combines traditional Armenian architectural elements with some unique local touches, including a distinctive bell tower.', 'Location: Situated in a central area of Gyumri, offering a peaceful and spiritual atmosphere.'], 'Working Hours': ['The church is generally open for visitors during the day. It is best to check for any special hours for religious services.']}","A historic Armenian Apostolic church in Gyumri, showcasing traditional architecture and religious significance.",40.784092,43.8386454,https://maps.app.goo.gl/AgZzKvCDET8fkQyD7,tourist place,2025-03-11T00:00:07.000000Z
914,94,Khujand,Tajikistan,Firuz Hotel,"{'Location:': ['The Fayruz Hotel is located in Khujand, Sughd Province, Tajikistan.', 'Address: near the city center, which facilitates access to the main markets and attractions.'], 'Facilities and Services': ['A restaurant serving local and international cuisine.', '24-hour front desk', 'Free Wi-Fi throughout the hotel.', 'Free private parking.', 'Laundry and dry cleaning service.', 'Small meeting room.', 'On-demand airport transfer service.'], 'Rooms:': ['Clean and comfortable single and double rooms.', 'Suites equipped with spacious areas and family facilities.', 'Every room has air conditioning, a TV, a mini-bar, and a private bathroom with toiletries.', 'Room service is available 24 hours a day.'], 'Nearby tourist attractions:': ['Khujand Fortress (10-minute drive).', 'Sughd Regional Museum.', 'Bangshanbi Folk Market.', 'Khujand Central Mosque', 'Kamal Khujandi Statue.', 'Syr Darya River for picnics and walking.']}",Firuz Hotel offers comfortable accommodation and good services near Khujand's tourist attractions.,40.2636263,69.654184,https://maps.app.goo.gl/Sr3nX6EfNbJqdc1W6,hotel,2025-03-10T23:56:19.000000Z
589,96,Gyumri,Armenia,Museum of National Architecture and Urban Life,"{'Information': [""The Museum of National Architecture and Urban Life, also known as the Dzitoghtsyan House-Museum, is situated in Gyumri, Armenia. Housed in a 19th-century mansion, it offers insights into the city's historical and cultural heritage.""], 'Historical Importance': [""Established in 1984, the museum is located in a building constructed in 1872 by Petros Dzitoghtsyan, a wealthy merchant from Alexandropol. The mansion survived the devastating 1988 earthquake, standing as a testament to Gyumri's resilience and architectural legacy.""], 'Key Features': [""Architectural Design: The mansion is built from the region's distinctive red tuff stone, reflecting traditional Armenian architectural styles."", 'Exhibitions: Displays include traditional trades and crafts such as woodworking, embroidery, tinwork, and silversmithing, providing a glimpse into the daily life of 19th and early 20th-century Gyumri.', ""Historical Models: A 1910s model of Alexandropol showcases the city's layout, featuring notable streets, buildings, and seven churches.""], 'Working Hours': ['Tuesday to Thursday: 11:00 AM – 5:00 PM.', 'Friday to Sunday: 11:00 AM – 6:00 PM.', 'Monday: Closed.']}",A 19th-century mansion showcasing Gyumri's rich architectural heritage and urban life through diverse exhibits.,40.781451,43.8429735,https://maps.app.goo.gl/TdVdRKxjA5Y4zgWp6,tourist place,2025-03-10T23:53:00.000000Z
588,96,Gyumri,Armenia,Black Fortress (Sev Berd),"{'Information': ['The Black Fortress, locally known as Sev Berd, is a historic fortress located in Gyumri, Armenia. It was built between 1834 and 1847 by the Russian Empire and is notable for its circular design made from black stone, which gives it its name.'], 'Historical Importance': ['The fortress was constructed after the Russo-Turkish War (1828–1829) to strengthen Russian defenses against the Ottoman Empire. It never faced siege but played a strategic role in subsequent conflicts until 1878. In the 20th century, the site was repurposed for military purposes.'], 'Key Features': ['Architectural Design: A circular structure made from black stone.', 'Location: Located on a hill offering panoramic views of Gyumri.', 'Strategic Significance: Situated 8 kilometers from the Turkish border, adding to its defensive importance.'], 'Visiting Tips': ['There are no specific working hours listed for the fortress. It is best to contact the local tourism office or information center for up-to-date details before your visit.', ""Guided Tours: It's recommended to join a guided tour to better understand the fortress's rich history.""]}",A 19th-century circular fortress offering a glimpse into Armenia's military and architectural heritage.,40.7824753,43.8227487,https://maps.app.goo.gl/mtmbf2MBRzw9RTnX6,tourist place,2025-03-10T23:44:54.000000Z
177,95,Goris,Armenia,Shane Supermarket & Food Court,"{'Location': ['36 Mashtots Street, Goris, Armenia.'], 'Main Features': ['Wide selection of groceries, including fresh produce, dairy, and international products.', 'In-house food court offering various dining options.', 'Online shopping and delivery services available.'], 'Product Range': ['Grocery section with local and imported goods.', 'Bakery offering fresh bread and pastries.', 'Butchery with a range of meats.', 'Food court with multiple fast-food and local cuisine outlets.'], 'Working Hours': ['Monday to Sunday: 8:30 AM – 12:00 AM.', 'Delivery service: 10:00 AM – 10:00 PM.']}","A comprehensive supermarket and food court in Goris, offering a variety of products and dining options.",39.5087308,46.3379462,https://maps.app.goo.gl/muiD9265n6fRGCR8A,shop,2025-03-10T23:16:55.000000Z
176,95,Goris,Armenia,ANTONYAN'S MARKET,"{'Location': ['5 Arzumanyan Street, Goris, Armenia'], 'Main Features': ['Offers a wide selection of groceries, including fresh produce, local and international products.', 'Specializes in Armenian delicacies and artisanal goods.', 'Provides an easy and comfortable shopping experience with organized aisles.'], 'Product Range': ['Fresh fruits and vegetables.', 'Local cheeses and breads.', 'International food brands.'], 'Working Hours': ['Monday to Sunday: 8:30 AM – 12:00 AM.']}",A well-stocked supermarket offering a variety of local and international goods.,39.5201258,46.3388018,https://maps.app.goo.gl/EcbRsWXVe2fu1Z729,shop,2025-03-10T23:03:40.000000Z
175,95,Goris,Armenia,Ararat Supermarket,"{'Location': ['Goris, Armenia.'], 'Main Features': ['Offers a wide selection of groceries, including fresh produce, local and international products.', 'Specializes in Armenian delicacies and artisanal goods.', 'Provides an easy and comfortable shopping experience with organized aisles.'], 'Product Range': ['Fresh fruits and vegetables.', 'Local cheeses and breads.', 'International food brands.', 'Household items.'], 'Working Hours': ['Monday to Sunday: 8:30 AM – 12:00 AM.']}",A well-stocked supermarket offering a variety of local and international goods in Goris.,39.5070029,46.3373913,https://maps.app.goo.gl/dU1oQWYyZGaeMKEZ8,shop,2025-03-10T22:50:07.000000Z
981,94,Khujand,Tajikistan,Khujand Deluxe Hotel,"{'Location:': ['Khujand Deluxe Hotel is located in the heart of Khujand, Sughd Province, Tajikistan.', 'Address: Mira Street 63A, Khujand, Tajikistan'], 'Facilities and Services': ['A restaurant serving local and international dishes.', '24-hour front desk', 'Fitness center (gym).', 'Free Wi-Fi throughout the hotel.', 'Free private parking.', 'Laundry and dry cleaning services.', 'Conference and meeting hall.', 'On-demand airport transfer service.', 'Spa and sauna.'], 'Rooms:': ['Individual and double rooms equipped with modern furniture.', 'Luxury wings with a view of the city or the river.', 'Each room contains air conditioning, flat -screen TV, minibar, and personal warehouse.', 'Special bathrooms equipped with free baths and hair dryers.', '24 -hour room service.'], 'Nearby tourist attractions:': ['Bangshanbi Traditional Market (5 minutes walk).', 'Khujand Historical Fortress (10-minute drive).', 'Kamal Khujandi Statue.', 'Sughd Regional Museum.', 'Khujand Central Mosque', 'Arbub Palace (20-minute drive).', 'Syr Darya River (accessible by foot).']}",The Khujand Deluxe Hotel provides comfortable accommodation with distinguished services in the historic city of Khujand.,40.2991239,69.6269891,https://maps.app.goo.gl/iLVfrWYdYUTLwQaA8,hotel,2025-03-10T22:43:28.000000Z
586,94,Khujand,Tajikistan,Arbob Palace,"{'Information:': ['Arbob Palace is a luxurious historical building that served as the residence of the wealthy agricultural leader Said Mir Arbob in the early 20th century. The palace is distinguished by its architectural style, which combines European and traditional Tajik influences.'], 'Historical significance:': ['The palace served as an administrative headquarters and a venue for official meetings during the Soviet era.', ""The palace witnessed the first session of the Tajik parliament after Tajikistan's independence in 1992."", ""The palace reflects the history of Tajikistan's social and political development during the Soviet era and beyond.""], 'Key Features:': ['Distinctive architecture that blends European ornamentation with traditional Islamic art.', 'Vast gardens surround the palace, adorned with fountains and flowers.', 'Luxurious halls adorned with chandeliers and wall decorations.', 'A museum showcasing the history of the palace and the prominent figures who lived in or visited it.'], 'Working hours:': ['Daily from 9:00 AM to 5:00 PM.', 'Closed on public holidays.']}",Arbob Palace is a historical landmark reflecting European and Tajik architectural styles in northern Tajikistan.,40.269594,69.6918114,https://maps.app.goo.gl/9ysXbU3KsEFTk1jM8,tourist place,2025-03-10T21:55:46.000000Z
585,94,Khujand,Tajikistan,Khujand Fortress,"{'Information:': ['Khujand Fortress is an ancient historical fort located in the city of Khujand, northern Tajikistan. It is considered one of the oldest fortresses in Central Asia.'], 'Historical significance:': ['The fortress was a strategic center for protecting the city of Khujand, located on the ancient Silk Road.', 'The castle witnessed many historical invasions, including the armies of Alexander the Great and the Mongols.', ""It reflects the history of wars and defenses in the region, making it a symbol of the city's resilience throughout the centuries.""], 'Key Features:': ['A robust defensive design with high walls and watchtowers.', 'Inside the fortress is the Sughd Regional Museum, which displays artifacts and historical relics of the region.', 'A prime location overlooking the Syr Darya River, offering panoramic views of the old city.', 'A vast square around the castle hosts cultural events and historical performances.'], 'Working hours:': ['Open for visits daily from 9:00 AM to 5:00 PM.']}","Khujand Fortress is a historical fort dating back more than 2500 years, located on the Silk Road in northern Tajikistan.",40.2858654,69.6140417,https://maps.app.goo.gl/wxn22M7hCkg85Xc67,tourist place,2025-03-10T21:47:02.000000Z
512,95,Goris,Armenia,Old Goris Restaurant,"{'Info': ['Old Goris Restaurant is a traditional Armenian eatery located in Goris, Armenia, offering authentic local cuisine in a cozy and family-friendly environment.'], 'Restaurant Features': ['Traditional Armenian decor.', 'Cozy, family-friendly atmosphere.', 'High-quality service.'], 'Main Dishes': ['Traditional Armenian dishes.', 'Delicious local specialties.'], 'Working Hours': [""Specific working hours are not readily available; it's advisable to contact the restaurant directly for current hours.""]}",A unique place in Goris offering delicious Armenian cuisine in a friendly and family-oriented setting.,39.5092723,46.3392911,https://maps.app.goo.gl/3CYCwpnVbAAMbjMP7,restaurant,2025-03-10T21:37:33.000000Z
511,95,Goris,Armenia,Nation Art Restaurant,"{'Info': ['Nation Art Restaurant is located in Goris, Armenia, offering authentic Armenian cuisine in a cozy and artistic atmosphere.'], 'Restaurant Features': ['Traditional Armenian decor.', 'Cozy and artistic ambiance.', 'Friendly and welcoming staff.'], 'Main Dishes': ['Veal kebab.', 'Fresh salads.', 'Homemade French fries.'], 'Working Hours': ['Information on working hours is not readily available. It is advisable to contact the restaurant directly for current hours.']}",A cozy restaurant in Goris offering authentic Armenian dishes in an artistic setting.,39.5173037,46.3351539,https://maps.app.goo.gl/pE8ktUTqxaS7GHdh7,restaurant,2025-03-10T20:24:27.000000Z
510,95,Goris,Armenia,Cafe Tour Market,"{'Info': ['Turbaza Cafe is a beautiful garden cafe located in Goris, Armenia, offering traditional Armenian cuisine in a serene outdoor setting.'], 'Restaurant Features': ['Outdoor seating in a garden ambiance.', 'Scenic views of the famous Needles.', 'Traditional Armenian decor.', 'Family-friendly environment. Family-friendly environment.'], 'Main Dishes': ['Family-friendly environment.', 'Lavash (Armenian flatbread).', 'Various local stews and grilled meats.', 'Fresh salads with local ingredients.'], 'Working Hours': ['Monday to Sunday: 11:00 AM – 11:00 PM.']}",A garden café in Goris offering traditional Armenian dishes with scenic views of the needle rocks.,39.5059532,46.3450651,https://maps.app.goo.gl/h5F7hu77wVJ8WDet8,restaurant,2025-03-10T20:17:08.000000Z
509,95,Goris,Armenia,Tavern Hndzan,"{'Info': ['Tavern Hndzan is a family-friendly restaurant located in Shinuhayr, near Goris, Armenia. It offers authentic Armenian cuisine in a cozy atmosphere.'], 'Restaurant Features': ['Traditional Armenian decor.', 'Family-friendly environment.', 'Spacious seating arrangements.', 'On-site shop offering homemade products.'], 'Main Dishes': ['Succulent kebabs.', 'Rich stews.', 'Homemade pastries.'], 'Working Hours': ['Monday to Sunday: 11:00 AM – 11:00 PM.']}",A cozy Armenian tavern offering traditional dishes and a family-friendly atmosphere.,39.4287699,46.307478,https://maps.app.goo.gl/EDKqpjNmV5vh9DYW6,restaurant,2025-03-10T19:55:28.000000Z
584,95,Goris,Armenia,Old Khndzoresk,"{'Information': ['Old Khndzoresk is an ancient cave village located near Goris, Armenia. It was once a thriving settlement where people lived in caves carved into the cliffs. Today, it serves as an open-air historical site showcasing Armenia’s unique past.'], 'Historical Importance': ['The village was inhabited for centuries and played a key role in the region’s history. It was a stronghold during conflicts and a center of traditional Armenian life. The caves were used as homes, churches, and storage spaces until the 1950s when residents relocated to New Khndzoresk.'], 'Key Features': ['Hundreds of man-made cave dwellings carved into cliffs.', 'Ancient churches and chapels, including St. Hripsime Church.', 'Stunning views of the Khndzoresk Gorge.', 'The famous Khndzoresk Swinging Bridge, connecting Old and New Khndzoresk.', 'Hiking trails leading through historical and natural landscapes.'], 'Visiting Tips': ['Cross the swinging bridge for the best views of the caves.', 'Visit early in the morning or late afternoon for cooler temperatures.']}","An ancient cave village with historic dwellings and churches, offering breathtaking views of Khndzoresk Gorge.",39.5100373,46.4196289,https://maps.app.goo.gl/m8YicWjTKk1JqWRX6,tourist place,2025-03-10T19:23:09.000000Z
