id,city_id,city_name,country_name,name,description,short_description,latitude,longitude,location,type,created_at
45,36,Dahab,Egypt,Ecotel Dahab Bay View Resort,"{'information': ['Ecotel Dahab Bay View Resort is located in Dahab, Egypt, about 8 kilometers from the city center, making it an ideal destination for nature lovers and those seeking tranquility.'], 'Rooms and Suites:': ['Rooms: The rooms feature a modern design with air conditioning, satellite TV, and private balconies or terraces overlooking the sea or desert.', 'Facilities: The hotel has an outdoor pool, tennis court, fitness center, and 5 bars and a disco.'], 'Location and Nearby Attractions:': ['Location: The hotel is situated in Wadi El-Qowain, Dahab, Egypt.', 'Nearby Attractions: The hotel is just a short distance from Dahab Bay, allowing guests to enjoy beach activities and diving.', 'Activities: The hotel offers a variety of recreational activities including diving, boat trips, and beach activities.']}","Ecotel Dahab Bay View: A luxury resort with sea views, exciting water activities and exceptional services.",28.4584588,34.4665413,https://maps.app.goo.gl/ZtKihE5xVktLheGr5,hotel,2025-01-05T23:15:40.000000Z
44,36,Dahab,Egypt,Tropitel Dahab Oasis Hotel,"{'information': ['Tropitel Dahab Oasis is located in Dahab, Egypt, on the coast of the Gulf of Aqaba, and is a great choice for accommodation in the area.'], 'Rooms and Suites:': ['Rooms: The rooms feature modern designs, air conditioning, satellite TV, and balconies with views of the Gulf or the desert.', 'Facilities: The hotel offers a private beach, a heated outdoor pool during winter, a diving center, a fitness club, sauna, steam room, and massage services.'], 'Location and Nearby Attractions:': ['Location: The hotel is located 8 km from the city center of Dahab and is a 70-minute drive from Sharm El Sheikh International Airport.', 'Nearby Attractions: The hotel is within walking distance of the famous Blue Hole dive site.', 'Activities: The hotel offers a variety of activities, including diving, boat trips, and beach activities.']}","Tropitel Dahab Oasis Hotel: luxurious accommodation with stunning views, a private beach and fun water activities.",28.551616,34.5147089,https://maps.app.goo.gl/bHDRb4km4Wmh882N8,hotel,2025-01-05T22:58:52.000000Z
43,40,Giza,Egypt,soul pyramids view hotel,"{'information': ['Soul Pyramids View Hotel is a great choice for accommodation in the Giza area, located on Nazlet El-Samman, just 2.21 km from the Giza Pyramids, 13 km from Qasr El Nil Bridge, and 29 km from Cairo International Airport.'], 'Rooms and Suites:': ['Rooms: The rooms feature a modern design that blends tradition and contemporary style, offering breathtaking panoramic views of the pyramids.', 'Facilities: The hotel offers a variety of services and amenities, including a restaurant serving delicious Egyptian and international cuisine, an outdoor pool to enjoy the scenic views, and a peaceful garden for relaxation.'], 'Location and Nearby Attractions:': ['Location and Nearby Attractions: The hotel is located in Nazlet El-Samman, providing easy access to famous tourist sites such as the Giza Pyramids, the Egyptian Museum, and is close to Cairo International Airport.']}",Sol Pyramids View Hotel: Magnificent views of the pyramids with luxurious facilities and exceptional services.,29.9764093,31.1372102,https://maps.app.goo.gl/JSYyBNCersQU9bVq5,hotel,2025-01-05T22:44:50.000000Z
42,40,Giza,Egypt,The Muse Pyramids Inn Hotel,"{'information': ['The Muse Pyramids Inn is a great choice for accommodation in the Giza area, located on Abu Al-Hol Street, just 2.2 km from the Giza Pyramids, 13 km from the Egyptian Museum, and 29 km from Cairo International Airport.'], 'Rooms and Suites:': ['Rooms: The rooms feature elegant design and décor inspired by Egyptian culture, creating a tranquil and relaxing atmosphere.', 'Facilities: The hotel offers a wide range of services and amenities, including a restaurant serving delicious Egyptian and international cuisine, a fitness center, and a luxurious spa for rejuvenation and vitality.'], 'Location and Nearby Attractions:': ['The hotel is situated in the Abu Al-Hol tourist area, allowing guests easy access to famous landmarks like the Giza Pyramids and the Egyptian Museum.'], 'Additional Services:': ['The hotel offers airport transfer services and organizes camel rides and excursions.']}","The Muse Pyramids Inn Hotel: Amazing views of the pyramids, distinguished services and a luxurious cultural experience.",29.9897186,31.1334698,https://maps.app.goo.gl/cqD7vcHNRaAEuR5AA,hotel,2025-01-05T22:31:35.000000Z
41,31,Cairo,Egypt,Four Seasons Hotel Cairo at First Residence,"{'information': ['Four Seasons Hotel Cairo at The First Residence is located in the Giza area and is one of Cairo’s premier luxury hotels. The hotel boasts a strategic location near the Nile River, offering stunning views of the city and surrounding landmarks.'], 'Rooms and Suites:': ['The hotel features 269 elegantly designed rooms, equipped with all modern comforts, including free Wi-Fi, flat-screen TVs, and a minibar. The rooms feature luxurious décor with panoramic views of the city or the Nile River.'], 'Restaurants and Facilities:': ['Aura Restaurant: Serves traditional Syrian and Lebanese cuisine by the pool.', 'La Gourmandise Restaurant: A modern brasserie located in the heart of First Mall.', 'Outdoor Pool: Provides great views of the city.', 'Full Spa: Offers a variety of health and beauty treatments.', 'Casino: Offers a unique entertainment experience for guests.'], 'Location and Nearby Attractions:': ['The hotel is just 100 meters from the Nile River and close to the Cairo Zoo and the historical botanical gardens. It is also 26 km from Cairo International Airport.'], 'Additional Services:': ['The hotel offers 24-hour room service, car rentals, and limousine airport transfers.']}",Four Seasons Hotel at First Residence: exceptional luxury with Nile River views and luxurious amenities.,30.0242925,31.2142121,https://maps.app.goo.gl/VxyiyEbfwmBpV69v7,hotel,2025-01-05T22:14:05.000000Z
40,31,Cairo,Egypt,"Kempinski Nile Hotel, Cairo","{'information': [""Kempinski Nile Hotel Cairo is located in the upscale Garden City area of Cairo and is one of the city's premier five-star hotels. The hotel boasts a strategic location along the Nile River, offering breathtaking views of the river and the surrounding landmarks.""], 'Rooms and Suites:': ['The hotel features 137 rooms and 54 suites, all designed with elegance and offering modern amenities, including free Wi-Fi, high-quality LCD TVs with satellite channels, and a free mini-bar with Coca-Cola soft drinks. The rooms feature contemporary décor and stunning views of the city or the Nile River.'], 'Restaurants and Facilities:': ['Osmanly Restaurant: Serves traditional Ottoman cuisine in a luxurious setting.', 'The Blue Restaurant: Offers Italian cuisine in a stylish environment.', 'Jazz Bar: Located on the 10th floor, providing a lively atmosphere with jazz music.', 'Rooftop Pool: Offers panoramic views of Cairo, allowing guests to enjoy a unique atmosphere.', 'Fitness Center and Spa: Equipped with the latest fitness equipment, along with relaxation facilities such as a sauna and steam rooms.'], 'Location and Nearby Attractions:': ['The hotel is located just a 5-minute walk from downtown Cairo and the Egyptian Museum. It is 25 km from Cairo International Airport and 20 minutes by car to the Pyramids of Giza and the Citadel of Saladin.'], 'Additional Services:': ['The hotel offers personal butler services, concierge, and a pillow menu to ensure guests’ comfort.']}","Kempinski Nile Hotel: luxury overlooking the Nile, offering a distinguished experience with luxurious restaurants and facilities.",30.0386996,31.2283065,https://maps.app.goo.gl/b1EHxWek6ycF6XgB7,hotel,2025-01-05T21:57:00.000000Z
39,31,Cairo,Egypt,"Radisson Blu Hotel, Cairo Heliopolis","{'information': [""Radisson Blu Hotel Cairo Heliopolis is located in the upscale Heliopolis area and is one of the city's most luxurious hotels. The hotel is strategically positioned near Cairo International Airport, making it an ideal destination for both business and leisure travelers.""], 'Rooms and Suites:': ['The hotel offers elegantly designed rooms and suites equipped with all modern amenities, including free Wi-Fi, flat-screen TVs, and mini-bars. The rooms feature contemporary decor and stunning city views.'], 'Restaurants and Facilities:': ['Restaurant: Serves a variety of international and local dishes in an elegant and comfortable atmosphere.', 'Lobby Bar: A perfect place to relax and enjoy a variety of beverages.', 'Rooftop Pool: Offers panoramic views of Cairo, allowing guests to enjoy a unique atmosphere.', 'Fitness Center: Equipped with the latest fitness equipment to ensure a complete workout experience.'], 'Location and Nearby Attractions:': ['The hotel is approximately 3 kilometers from Cairo International Airport, making it easily accessible for travelers. It is also close to major tourist attractions like the Giza Pyramids, with tours that can be arranged through the hotel’s tour desk.', 'The hotel provides airport shuttle services, as well as meeting and event facilities equipped with the latest technologies to meet business needs.']}","Radisson Blu Hotel, Cairo Heliopolis: A luxury hotel close to the airport, offering distinguished services and modern facilities.",30.1065101,31.3726776,https://maps.app.goo.gl/TeL2KZyPpirXcBSu5,hotel,2025-01-05T21:39:46.000000Z
38,31,Cairo,Egypt,Baron Hotel Cairo,"{'information': ['The Baron Hotel Cairo is located in the Heliopolis area and is one of the four-star hotels that combines luxury and comfort. The hotel is strategically situated opposite the famous Baron Empain Palace, offering stunning views of this historic landmark.'], 'Rooms and Suites:': ['The hotel features 117 rooms and suites, all equipped with air conditioning, flat-screen TVs with satellite channels, mini-bars, and free Wi-Fi. The rooms are designed with modern decor and offer beautiful city views.'], 'Restaurants and Facilities:': ['Baron Restaurant: Offers a wide variety of international dishes in a comfortable and elegant atmosphere.', 'Lobby Bar: An ideal place to relax and enjoy a variety of beverages.', 'Additionally, the hotel provides a fully equipped fitness center for its guests.'], 'Location and Nearby Attractions:': ['The Baron Hotel Cairo is located 12 km from Cairo International Airport, making it convenient for travelers. It is also close to major attractions such as the Baron Empain Palace and shopping areas in Heliopolis.']}","Baron Hotel Cairo: A distinctive location in Heliopolis with a view of the Baron Palace, combining luxury and comfort.",30.0861115,31.3290921,https://maps.app.goo.gl/HUntuLDSr48nJRJv5,hotel,2025-01-05T21:25:47.000000Z
37,31,Cairo,Egypt,Cairo Marriott Hotel and Omar Khayyam Casino,"{'Information': ['The Cairo Marriott Hotel & Omar Khayyam Casino is located in the Zamalek area and is considered one of the most luxurious hotels in the city. The hotel is distinguished by its lavish architectural design and strategic location, offering stunning views of the Nile River and the surrounding gardens.'], 'Rooms and Suites': ['The photos show the 19-story hotel building, featuring 1,064 rooms and suites with an architectural design that combines luxury and modernity.', 'The photos highlight spacious rooms equipped with the latest amenities, with balconies overlooking the Nile River or the gardens.'], 'Dining and Facilities': ['The hotel offers a variety of restaurants and bars serving international cuisines, in addition to the Omar Khayyam Casino, which provides a unique entertainment experience.'], 'Location and Access': ['The hotel is located near important tourist attractions, such as the Modern Egyptian Art Museum, and is approximately 25 kilometers from Cairo International Airport.']}","Cairo Marriott Hotel: luxury with amazing views of the Nile, beautiful gardens, and the Omar Khayyam Casino.",30.0570666,31.2219381,https://maps.app.goo.gl/JguuZYa9YGJ8zHiMA,hotel,2025-01-05T00:02:46.000000Z
36,31,Cairo,Egypt,Steigenberger Hotel Tahrir Cairo,"{'Information': ['The Steigenberger Hotel Tahrir is located in the heart of Cairo, in Tahrir Square, and is considered one of the most luxurious hotels in the city. The hotel is distinguished by its modern design and strategic location, offering stunning views of the Egyptian Museum and the Nile River.'], 'Rooms and Suites': ['The photos show the hotel building consisting of 10 floors, featuring 295 rooms and suites with an architectural design that combines modernity and elegance.', 'The photos highlight spacious rooms equipped with the latest amenities, offering various views of the city and the Nile River.'], 'Dining and Facilities': ['The hotel provides a variety of restaurants serving international cuisines, as well as recreational facilities like the rooftop swimming pool, which offers a panoramic view of Cairo.'], 'Location and Access': ['The hotel is located near key attractions such as the Egyptian Museum and is approximately 17 kilometers from Cairo International Airport.']}","Steigenberger Tahrir Hotel: modern luxury in the heart of Cairo, with distinctive views of the Nile and the Egyptian Museum.",30.0467331,31.2303881,https://maps.app.goo.gl/WKXd8UqkzrKwz9Jz6,hotel,2025-01-04T23:46:07.000000Z
