id,city_id,city_name,country_name,name,description,short_description,latitude,longitude,location,type,created_at
18,15,Tirana,Albania,The first war shelter,"{'Introduction': [""BUNK'ART 1 is a historical and cultural site in the heart of Tirana, Albania, reflecting part of Albania's history during the Cold War era. Originally, this place served as a shelter for protection against nuclear attacks during the communist regime and was built in the 1970s under the supervision of Enver Hoxha's regime.""], 'History and Significance:': [""Currently, BUNK'ART 1 has become a museum that offers visitors an in-depth look at Albania's communist history and the Cold War through exhibits featuring photos, documents, and documentaries. BUNK'ART 1 was originally built to serve as a fortified shelter in case of a nuclear attack or foreign invasion."", ""BUNK'ART 1 was originally built to serve as a fortified shelter in case of a nuclear attack or foreign invasion.""], 'Exhibits and Experience:': ['The Historical Experience: The museum showcases daily life under the communist regime in Albania, illustrating the impact of this system on individuals and society. Many exhibits focus on political, military, and cultural activities during that period.', ""Exhibit Content: Visitors can view historical photos, documents, and diagrams that explain the details of the shelter's construction and its use during the Cold War era. The museum features a dark and intriguing atmosphere that reflects the sense of isolation and threat experienced by Albanians during that time.""], ""Why Visit BUNK'ART 1?"": [""Learning about Albanian History: BUNK'ART 1 is an ideal destination for those interested in understanding modern Albanian history and the impacts of communism."", 'A Unique Experience: A visit to this site will transport you to a world of mystery and historical drama that shaped the lives of people in Albania during that era.', 'Unique Architecture: Visitors can explore the massive and complex architectural structures that were built to protect the government and important figures.'], 'Conclusion:': [""If you are a history enthusiast or interested in understanding the aspects and impacts of the Cold War, visiting BUNK'ART 1 in Tirana is an experience not to be missed. This museum offers a unique opportunity to learn about a part of Albanian history that significantly shaped the country's past in the 20th century.""]}",This museum provides a unique opportunity to learn about part of the Albanian past,41.349879,19.8603982,https://maps.app.goo.gl/t8GK8ihGD7Z7Ytx37,tourist place,2024-12-15T15:42:19.000000Z
17,15,Tirana,Albania,Tanners Bridge,"{'Introduction': [""Tanners' Bridge (Ura e Tabakëve) is one of the most important historical landmarks in the Albanian capital, Tirana. It reflects the Ottoman architectural heritage dating back to the 18th century. This bridge was used as part of the main trade route, connecting the city with the surrounding agricultural areas and allowing the passage of traders and animals between different regions.""], 'Location:': ['The bridge is located in a central area in Tirana, close to many other landmarks, making it easily accessible for visitors.'], 'Historical Significance:': ['The bridge was built during the Ottoman era to serve artisans and traders, especially the leather tanners, who used the bridge to transport their goods.', 'It is one of the few landmarks that have been preserved to bear witness to the old Ottoman design and sturdy engineering structure.'], 'Architecture and Design:': ['Made of stone, it features beautiful and simple arches designed to support heavy loads.', 'It stands as a great example of traditional Ottoman engineering, which focused on durability and functionality.'], 'Why Visit It?': ['Rich History: The bridge reminds visitors of the Ottoman era and its economic and social importance to Tirana.', 'Architectural Beauty: Its simple design reflects ancient engineering traditions, making it an ideal spot for photography enthusiasts.', 'Cultural Resting Place: The bridge is surrounded by areas where visitors can relax or enjoy a historical tour.'], 'Other Information and Conclusion': ['The bridge is currently designated for pedestrians only and is a historical site carefully preserved. It is easily accessible from central areas of Tirana and is located near cafes and restaurants.', ""In conclusion, Tanners' Bridge is a destination that combines cultural heritage and simple beauty, making it an essential stop when visiting Tirana.""]}",This place combines cultural heritage and simple beauty,41.3264431,19.8260531,https://maps.app.goo.gl/ZDv7VRVibuQyUTQy8,tourist place,2024-12-15T15:11:12.000000Z
16,15,Tirana,Albania,Zoo in Tirana,"{'Introduction': ['Tirana Zoo is a unique destination for visitors, offering an opportunity to explore the biodiversity and wildlife of Albania and the surrounding region. The zoo is located in a natural area next to the Grand Park of Tirana, making it an ideal family destination for relaxation and learning.'], 'Location of the Park:': ['The zoo is located close to the famous Grand Park Lake, making it easily accessible. You can also use the maps available here to pinpoint the exact location.'], 'What Does the Park Offer?': ['The zoo is located near the famous Grand Park Lake, making it easily accessible. You can also use the maps available here to pinpoint the exact location.'], 'Features of the Zoo:': ['Local and International Animals: The zoo features a diverse range of local animals such as wolves and bears, as well as other species like birds of prey and antelopes.', 'Educational Experience: The park offers educational information about the animals, making it an enjoyable experience for both children and adults.', 'Recreational Facilities: Dedicated family areas, children’s play zones, and relaxation spaces.', 'Proximity to Nature: The zoo is surrounded by trees and green spaces, adding a calm and appealing atmosphere to the place.'], 'Why Visit the Tirana Zoo?': ['The zoo is an excellent choice for a fun family day that combines entertainment and education, offering the chance to learn about various animal species and enjoy the surrounding nature.']}",A place that combines entertainment and education,41.3124918,19.8280692,https://maps.app.goo.gl/HitpLhMAe4ngsQik7,tourist place,2024-12-15T14:53:29.000000Z
15,15,Tirana,Albania,Mount Daiti cable car,"{'Introduction': [""Dajti Mountain Cable Car, known as Dajti Ekspres, is one of the most popular tourist destinations in the Albanian capital, Tirana. It offers a unique experience for the city's visitors, combining the enjoyment of breathtaking nature with the exploration of the beauty of the Albanian countryside from a high altitude.""], 'Daiti Mountain Logation:': ['Departure: From the outskirts of Tirana, about 15 minutes by car from the city center.', 'Arrival: The cable car takes visitors to the top of Dajti Mountain, known as the ""Balcony of Tirana,"" where the final station is located at an altitude of over 1,600 meters.'], 'Activities at Daiti Mountain': ['Panoramic Views: During the 15-20 minute ride, visitors can enjoy breathtaking views of the city and surrounding mountains.', 'Dining: The dining experience at Ballkoni i Dajti restaurant, famous for its enchanting views and both local and international dishes.', 'Outdoor Activities: Hiking on the natural trails around the mountain, as well as seasonal activities such as horseback riding or skiing in the winter.', 'Photography: The mountain offers perfect backdrops for photography enthusiasts who love nature and tranquility.'], 'Facilities at Daiti Mountain': ['Comfortable cabins that can accommodate up to 6 people, designed to provide a full panoramic view.', ""Family-oriented services and facilities, such as children's play areas and relaxation spaces.""], 'Working Hours and Cost:': ['Working Hours: From 10:00 AM to 7:00 PM (in winter), and until 10:00 PM (in summer).', 'Ticket Price: The prices are reasonable, with discounts for groups and children.'], 'Why Visit Daiti Mountain Cable': ['This cable car is an ideal choice for those looking to escape the hustle and bustle of the city, enjoy a peaceful natural atmosphere, with unforgettable views and unparalleled experiences. It is a perfect destination for families, couples, and nature adventure enthusiasts.']}",Your window to nature in Tirana,41.3683954,19.9055504,https://maps.app.goo.gl/3G5o6fotDjFBNRxo9,tourist place,2024-12-15T14:25:07.000000Z
13,15,Tirana,Albania,Renia Park,"{'Introduction': ['Rinia Park in Tirana is one of the greenest and most peaceful places in the Albanian capital. Located in the heart of the city, it is an ideal destination to escape the hustle and bustle of urban life and enjoy nature.'], 'Importance of the Park:': ['Rinia Park was established as a place for relaxation and enjoyment of green spaces, making it an environmental hub in the city.', 'The park is characterized by its dense trees and diverse plants, making it a natural retreat in the heart of the city.'], 'Location:': ['The park is located in the center of Tirana, near many tourist attractions such as Skanderbeg Square. It is easily accessible from most points in the city and is a favorite destination for both residents and tourists.'], 'Activities:': ['Walking and enjoying the fresh air are among the main activities in the park.', 'Visitors can take a stroll along the designated paths or sit in the shaded areas.', 'The park also features designated areas for children, making it family-friendly. It is a perfect place to relax, read a book, or enjoy a cup of coffee at one of the surrounding cafés.'], 'Facilities and Services:': ['The park offers sports facilities to keep visitors active, as well as a playground for children.', 'It has areas where visitors can sit and relax on the grass, with comfortable views and a peaceful atmosphere.'], 'Tourist Attractions:': ['Rinia Park is an ideal place to enjoy scenic views and take photos.', 'It is also one of the best spots for tourists to experience local life, where city residents can be seen enjoying their daily activities.']}",One of the most green and quiet places in the Albanian capital.,41.3248984,19.8183262,https://maps.app.goo.gl/Qdbtpxdqcm8AbjiN7,tourist place,2024-12-15T10:27:07.000000Z
11,15,Tirana,Albania,The new mosque,"{'Introduction': ['The New Mosque in Tirana (""New Mosque"") is one of the significant religious landmarks in the Albanian capital, Tirana. This mosque is considered one of the most prominent religious places reflecting the Islamic heritage of the city, and it contributes to highlighting the cultural and religious diversity in Albania.'], 'Historical and Religious Significance': [""The New Mosque was built in the last decade to be added to the city's landmarks, which feature a blend of cultural and historical influences."", 'This mosque is considered a spiritual destination for Muslims in Tirana, with continuous visits from local worshippers as well as visitors who wish to learn about religious life in Albania'], 'Location': ['The mosque is located in the heart of Tirana, near many cultural and historical landmarks, making it a center of religious and social activity.'], 'Architecture': ['The mosque features a modern design that blends traditional Islamic elements with contemporary architectural touches, making it one of the prominent landmarks that attract both local and international tourists.'], 'Activities and Services': ['In addition to performing prayers, the mosque also offers religious and cultural activities, including Quran lessons and religious lectures, which contribute to enhancing religious knowledge within the community.'], 'In the end': [""The New Mosque is one of the must-visit destinations in Tirana, whether you are visiting to enjoy its architecture or to explore the spiritual and cultural side of the city. If you're interested, just get in touch with us. We organize guided tours with experienced local guides.""]}",One of the unmissable destinations in Tirana,41.3257338,19.9068407,https://maps.app.goo.gl/7WWGo3sa6NzpeBAj8,tourist place,2024-12-15T10:00:27.000000Z
10,15,Tirana,Albania,Skanderbek Square,"{'Introduction': ['Skanderbeg Square is the main square in Tirana, the capital of Albania, and is considered one of the most prominent tourist and historical landmarks in the city. The square represents a starting point for exploring the heart of Tirana. It is named after Skanderbeg, the famous Albanian national leader who led the Albanian resistance against the Ottoman Empire in the 15th century.'], 'Location and Historical Importance:': [""It is located in the center of Tirana, a vital point at the heart of the city's most important streets and landmarks."", 'The square holds great historical significance as it features a statue of Skanderbeg himself, who is considered a symbol of national freedom and independence.'], 'Nearby Landmarks:': ['National History Museum: Located next to the square, it showcases the history and culture of Albania.', 'The Palace of Culture: A cultural center near the square, hosting many events and art performances.', 'The Great Church: A recently built landmark, one of the prominent religious sites in the city.'], 'Tourist Activities:': ['The square is an ideal place for strolling and enjoying the surrounding landmarks.', 'Visitors can enjoy cafes and restaurants offering traditional Albanian cuisine.'], 'Why Visit It?': ['If you are in Tirana, visiting Skanderbeg Square is a key step in exploring the city.', 'The square offers a blend of history and modern life, making it an ideal destination for all visitors.'], 'Why Is It Named That?': ['Skanderbeg Square in Tirana is named after George Kastrioti, known by the title Skanderbeg, the famous Albanian military leader who led the Albanian resistance against the Ottoman Empire in the 15th century. Skanderbeg is considered a symbol of freedom and national independence in Albania, as he led numerous important battles against the Ottomans after commanding an army of Albanian forces and posed a significant challenge to the Ottoman Empire. The square was named in his honor and in recognition of his heroic legacy.'], 'Finally': [""Skanderbeg Square represents the essence of Tirana city and its cultural features. It is a vibrant place that attracts both local and international visitors. If you're interested in visiting, we are here to help! We organize tours with professional guides so you can gain in-depth knowledge of the area. If you'd like to visit, don't hesitate to get in touch with us.""]}",This square is a mixture of history and modern life,41.3278211,19.8185708,https://maps.app.goo.gl/SNzBs3hgiAhUSMD8A,tourist place,2024-12-15T09:44:40.000000Z
