id,city_id,city_name,country_name,name,description,short_description,latitude,longitude,location,type,created_at
602,70,Kutaisi,Georgia,Hotel Rustaveli,"{'Location': ['The Rostafili Hotel in Kutaisi is a 3 -star hotel located in the heart of the city, which allows easy access to the main tourist attractions.', 'The hotel is located in the center of Kutaisi, near the famous White Bridge, which facilitates access to tourist attractions such as the Baghrati Cathedral and the Kolchis fountain.'], 'Facilities and services:': ['Restaurant: offers a variety of local and international dishes, where guests can enjoy a delicious dining experience.', 'A common hall: space for relaxation and comfort with the ability to communicate with other guests.', 'Meeting facilities: The hotel offers meeting halls equipped for travelers for the purpose of work.', 'Parking: Free parking for the hotel guests.', '24 hours reception service', 'Conservative service', 'Daily room cleaning service:', 'Airport transport service', 'Washing and ironing service on request.'], 'Rooms:': ['Comfortable and air -conditioned rooms with modern decor.', 'Flat screen TV with satellite channels.', 'Free Wi -Fi throughout the hotel.', 'A private bathroom equipped with free bathing facilities.', 'Family rooms are available to families who want to stay together.'], 'Near tourist attractions:': ['White Bridge: It is located near the hotel, and it is one of the famous landmarks in Kotesi.', 'Pagagrati Cathedral: A short car.', 'Colchis Fountain: Also very close, making the hotel an ideal starting point for exploring tourist attractions.']}","The Rostafelli Hotel in Kutaisi offers comfortable rooms, restaurants, and excellent services near tourist attractions.",42.2666724,41.4721496,https://maps.app.goo.gl/hF4MjuC5uSdWJG9e8,hotel,2025-02-19T01:23:51.000000Z
601,70,Kutaisi,Georgia,Boutique Hotel Argo,"{'Location': ['The Argo Boutique Hotel is a 4 -star hotel located in the heart of Kutaisi, Georgia, near major tourist attractions.', ""The hotel is located in the old and beautiful part of the city, a walk away from the famous White Bridge, the King's area, and the Colchis fountain.""], 'Facilities and services:': ['Restaurant: offers a variety of local and international dishes.', 'A common hall: a place to relax and interact with the rest of the guests.', 'Garden or terrace: to relax outdoors.', 'Providing tourism services (local tours reservations).', '24 -hour reception service.', 'Room cleaning service.', 'Conserge service: to help arrange tours and activities.', 'Free parking.', 'Transport services: Providing transportation services to and from the airport on request.'], 'Rooms:': ['Air -conditioned rooms with modern decor.', 'Flat screen TV with satellite channels.', 'Free Wi -Fi.', 'A private bathroom equipped with personal care supplies.'], 'Near tourist attractions:': ['White Bridge: It is located at a distance from the hotel.', 'King District: It is located near the hotel.', 'Colchis Fountain: It is located at a distance of a walk from the hotel.']}",The Argo Boutique Hotel in Kutaisi offers comfortable rooms and various services near the famous tourist attractions.,42.265478,42.6962328,https://maps.app.goo.gl/13PcRE3UvKWAbr8eA,hotel,2025-02-19T01:13:23.000000Z
600,70,Kutaisi,Georgia,Nugo Villa,"{'Location': ['Nugo Villa is a 3 -star hospitality house located in Kutaisi, Georgia, in the Kviteri area.'], 'Facilities and services:': ['Public facilities: The guest house includes a solar terrace, garden, and barbecue facilities.', 'Services: The guest house provides 24 -hour front service, free parking, and room cleaning service.'], 'Rooms:': ['The rooms feature a modern and comfortable design, equipped with air conditioning, a flat -screen TV with satellite channels, and free Wi -Fi.'], 'Near tourist attractions:': ['White Bridge: It is located 5.6 km from the guesthouse.', 'Pagagrati Cathedral: It is 6.3 km from the guest house.', 'Colchis Fountain: It is located 6.5 km from the guest house.']}",Nugo Villa in Kutaisi provides comfortable rooms and various facilities near tourist attractions such as the Baghrati Cathedral.,42.2463778,42.6380704,https://maps.app.goo.gl/JLRxnm8LyN7GWwwB6,hotel,2025-02-19T01:02:39.000000Z
599,70,Kutaisi,Georgia,Garden,"{'Location': ['Garden Hotel in Kotesi is a 2 -star hotel located about 15 minutes drive from White Bridge.', 'The hotel is located 15 km from Kutisi International Airport, 3.1 km from the David Kakapadzi Fine Arts Show.'], 'Facilities and services:': ['Public facilities: The hotel includes a seasonal external swimming pool, free parking, and a shared relaxation hall.', 'Services: The hotel provides 24 -hour reception, room cleaning service, and concierge service.'], 'Rooms:': ['The rooms feature a modern and comfortable design, equipped with air conditioning, a flat -screen TV with satellite channels, and free Wi -Fi.'], 'Near tourist attractions:': [""White Bridge: It is 15 minutes' drive from the hotel."", 'Pagagrati Cathedral: Located 15 minutes by car.']}","Garden Hotel in Kutaisi provides comfortable rooms and various facilities near tourist attractions,",42.2437683,42.6334466,https://maps.app.goo.gl/78i7VXeswyV55KB48,hotel,2025-02-19T00:52:58.000000Z
598,70,Kutaisi,Georgia,Hotel Tskhumi,"{'Location': ['Located in the heart of Kutisi, the Teskomi Hotel is located in the heart of Kotesi, which allows easy access to many major tourist attractions in the city.'], 'Facilities and services:': ['Public facilities: The hotel includes a restaurant that offers a variety of meals, as well as a shared relaxation hall.', 'Services: The hotel provides 24 -hour reception, room cleaning service, and concierge service.'], 'Rooms:': ['The rooms feature a modern and comfortable design, equipped with air conditioning, flat -screen TV, and free Wi -Fi.'], 'Near tourist attractions:': ['Pagagrati Cathedral: It is short of a car, and it is one of the most prominent historical monuments in Kotesi.', 'Colchis Fountain: It is located near the hotel, and is considered a famous tourist attraction.', 'White Bridge: It is located a short distance by car, and is considered one of the distinctive features in the city.']}",Tskhumi Hotel in Kutaisi provides comfortable rooms and various facilities near the famous tourist attractions.,42.2742767,42.6979125,https://maps.app.goo.gl/PE9Dpi5rme4Lj8F68,hotel,2025-02-19T00:43:39.000000Z
