id,city_id,city_name,country_name,name,description,short_description,latitude,longitude,location,type,created_at
55,19,Vlore,Albania,Zverneci Island,"{'Zverneci Island': ['Zverneci Island, also known as Ishulli i Zvernecit, is one of the most beautiful natural and tourist attractions in Albania. Located in the Narta Lagoon near the city of Vlora, the island is a popular destination for those seeking tranquility and natural beauty.'], 'Features of the Island:': ['Natural Beauty: Surrounded by the calm waters of Narta Lagoon, the island boasts stunning scenery with dense trees and lush greenery.', 'Historical Landmark: The island is home to the Monastery of Zverneci, a historic site from the medieval period and a significant cultural and religious symbol in the region.', 'Peaceful Atmosphere: The secluded and serene environment makes it perfect for relaxation away from city noise.', 'Accessibility: The island is connected to the mainland by a narrow wooden bridge, which itself is a unique experience.'], 'Tourist Activities:': ['Exploring the surrounding nature and photography.', 'Visiting the Monastery of Zverneci and enjoying its spiritual ambiance.', 'Walking on the wooden bridge and birdwatching.'], 'Additional Information:': ['Best Time to Visit: Spring and summer when the weather is ideal for outdoor activities.', 'Location: The island is about 15 kilometers away from Vlora.']}",The most beautiful natural and tourist attractions in Albania,40.5175755,19.4011259,https://maps.app.goo.gl/EZnNuDhZRRCEXtyv7,tourist place,2024-12-18T13:48:57.000000Z
54,18,Pogradec,Albania,Gulek Bridge,"{'Goliku Bridge': [""Goliku Bridge is one of Albania's historical landmarks, located in a picturesque mountainous area that offers stunning natural views. The bridge reflects traditional Albanian architecture and serves as a popular tourist destination for those interested in exploring history and nature.""], 'Features of the Bridge:': ['Traditional Architecture: Built using local stones, the bridge is characterized by its sturdy and elegant design.', 'Geographic Location: The bridge is situated in a scenic area surrounded by hills and rivers, making it an ideal spot for hiking.', ""Historical Significance: It is believed to have been constructed during the Ottoman era and stands as a testament to the region's history."", 'Tourist Activities: Visitors come to enjoy walking and taking photos amidst nature.'], 'Additional Information:': ['Best Time to Visit: Spring and summer when nature is at its best.', 'Accessibility: The bridge is easily accessible via local roads.', 'Visitor Tips: Wear comfortable shoes to explore the surrounding areas.']}",One of the landmarks that reflects the traditional architecture in Albania,41.170613,20.26209,https://maps.app.goo.gl/ErgFnUabHrScALELA,tourist place,2024-12-18T13:35:06.000000Z
53,18,Pogradec,Albania,Lake Ohrid,"{'Lake Ohrid': ['Lake Ohrid is one of the oldest and deepest lakes in the world, and it is a prominent natural landmark in Albania. The lake is located on the border between Albania and North Macedonia, known for its clear waters and stunning natural surroundings, making it a unique tourist destination.'], 'Features of the Lake:': ['Natural Beauty: The lake boasts crystal-clear blue waters and is surrounded by green mountains.', 'Tourist Activities: Visitors can enjoy swimming, boating, and fishing.', 'Ecological Diversity: The lake hosts rare species of flora and fauna, earning it a place on the UNESCO World Heritage List.', 'Culture and History: The surrounding area is rich with archaeological sites and historical churches, reflecting deep cultural heritage.'], 'Additional Information:': ['Best Time to Visit: Summer, when the weather is warm and ideal for outdoor activities.', 'How to Reach: The lake can be accessed from Pogradec in Albania or Ohrid in North Macedonia.', 'Restaurants and Services: The area offers numerous restaurants and hotels with stunning views of the lake.']}",The surroundings of the lake are full of archaeological sites and historical churches that reflect the depth of history and civilization.,41.040541,20.718971,https://maps.app.goo.gl/hFBhaERtrdgSUtD5A,tourist place,2024-12-18T13:27:53.000000Z
52,18,Pogradec,Albania,Drilon National Park - Drilon Park,"{'Drilon National Park': [""Drilon National Park, also known as Drilon Park, is located in the Pogradec area and is one of the most stunning natural destinations in Albania. The park is renowned for its serene beauty, combining clear lakes, dense trees, and expansive green spaces. It is the perfect spot for relaxation and tranquility away from the city's hustle and bustle.""], 'Features of the Park:': ['Beautiful Lakes: The park features small, clear lakes where visitors can enjoy boat rides and admire the natural scenery.', 'Exceptional Restaurant: There is a delightful restaurant in the park that serves delicious local dishes with breathtaking views of the lake and surrounding area.', 'Enchanting Nature: The park boasts diverse flora and fauna, making it a favorite destination for photography and relaxation enthusiasts.', 'Various Activities: Visitors can enjoy walking in nature, cycling, and fishing.'], 'Additional Information:': ['Best Time to Visit: Spring and summer, when nature is at its peak beauty with mild temperatures.', 'How to Get There: The park is about 5 kilometers from the center of Pogradec and is easily accessible by car.', 'Available Facilities: The park is equipped with seating areas, picnic spots, and playgrounds for children.']}",One of the most beautiful natural destinations in Albania,40.8995919,20.7131695,https://maps.app.goo.gl/cBHJMV17wXzhxWVq7,tourist place,2024-12-18T13:19:36.000000Z
4,16,Durres,Albania,Old Market - Kruja Bazaar,"{'The Old Bazaar of Kruja (Kruja Bazaar)': ['The Old Bazaar of Kruja (Kruja Bazaar), also known as the Kruja Market, is one of the most famous historical sites in Albania. Located in the city of Kruja, part of the Durres region, this bazaar is a perfect destination for those who love shopping and culture. Dating back to the 17th century, it is one of the oldest traditional markets in the country.'], 'Bazaar Highlights:': ['Historic Atmosphere: The bazaar is characterized by its traditional vibe, with shops lining the narrow cobblestone streets, giving visitors a sense of stepping back in time.', 'Traditional Products: It offers a wide variety of traditional items such as handmade carpets, wooden crafts, copper tools, and Albanian national clothing.', 'Souvenirs: The bazaar is an ideal spot to purchase unique souvenirs that represent Albanian culture.'], 'Tourist Experience:': ['Visitors can enjoy watching local artisans work on their traditional crafts.', 'The market provides an opportunity to taste local delicacies or purchase organic products like olive oil and honey.', 'A visit to the bazaar is often combined with a tour of the Kruja Castle and the National Museum of ""Skanderbeg"" due to their proximity.'], 'Opening Hours:': ['The bazaar is open daily and is usually busiest in the morning and early afternoon. Visiting during these times is recommended to enjoy the full experience.'], 'How to Get There:': ['The bazaar is located about 30 kilometers from the capital, Tirana, and is easily accessible by car or public transportation.']}","This market dates back to the 17th century, making it one of the oldest traditional markets in the country.",41.511637,19.7803407,https://maps.app.goo.gl/zWgnib4qD4pSKWaLA,shop,2024-12-18T12:17:11.000000Z
8,17,Shkoder,Albania,Velipoja Grand Resort,"{'Velipoja Grand Europa Resort, Affiliated by Meliá': ['Velipoja Grand Europa Resort, Affiliated by Meliá is a luxurious resort located in the Velipoja area on the Albanian coastline. This resort is the perfect destination for tourists seeking a relaxing and luxurious experience in a stunning natural setting. The resort is part of the renowned Meliá hotel group, ensuring a high level of service and comfort for its guests.', 'Location: The resort is situated in Velipoja, known for its golden beaches and clear waters, making it an ideal destination for relaxation and water sports enthusiasts. Thanks to its strategic location, visitors can enjoy beautiful sea views and easily access various local attractions.'], 'Services and Facilities:': ['Luxurious Rooms and Suites: The resort offers spacious and stylish rooms with breathtaking views of the sea or gardens. All rooms are equipped with modern amenities such as air conditioning, modern TVs, and comfortable furniture.', 'Diverse Restaurants: The resort features a variety of restaurants offering delicious local and international dishes, allowing guests to savor exquisite cuisine in a refined setting.', 'Recreational Facilities: The resort includes a range of facilities such as an outdoor pool, a fitness center, and a spa offering massage treatments and relaxation therapies.', 'Water Sports: Guests can enjoy water activities like snorkeling, kayaking, and surfing, as well as other beach activities.'], 'Activities:': ['Beach Relaxation: The resort is located close to the beach, allowing guests to enjoy a full day of relaxation on the golden sands.', 'Water Sports: With water sports equipment available, guests can indulge in snorkeling, boating, and surfing.', 'Local Exploration: Guests can visit nearby attractions like natural lakes, traditional villages, and cultural landmarks famous in the region.'], 'Travel Tips:': ['It is recommended to book accommodation in advance, especially during the summer season when the resort sees high demand.', ""Guests can take advantage of the resort's tours to explore the beautiful natural surroundings of Albania.""]}",Ideal for tourists looking for a comfortable and luxurious experience in a stunning natural environment,41.8613112,19.3939498,https://maps.app.goo.gl/yiEk5FaNhrxweYu96,hotel,2024-12-17T23:39:52.000000Z
7,17,Shkoder,Albania,Fishta Hotel,"{'What is the Fishta Hotel? And where is its location': ['Fishta Hotel is a comfortable hotel located in the city of Shkodër, Albania. It is an ideal place for travelers looking for comfort and tranquility amidst beautiful natural scenery. The hotel enjoys a strategic location close to many famous landmarks in the city and surrounding area.', ""Location: Fishta Hotel is located in a quiet area, providing guests with a peaceful environment suitable for relaxation after a long day of exploring Shkodër's attractions. Guests can easily access the famous Shkoder Lake, Mesi Bridge, and the area's castles.""], 'Services and Amenities:': ['Comfortable Rooms: The hotel features comfortable rooms equipped with all modern amenities, such as air conditioning, free Wi-Fi, and modern TV sets.', 'Restaurant: The hotel has a restaurant offering delicious local and international dishes, providing guests with the opportunity to taste traditional Albanian cuisine.', 'Additional Facilities: The hotel also provides services such as free parking, room service, and arranging sightseeing tours.'], 'Activities:': ['Exploring Shkodër Attractions: The hotel offers guests the chance to explore nearby attractions like Shkoder Lake, Shkoder Castle, and other amazing landmarks.', 'Relaxing at the Hotel: The hotel provides a peaceful environment to relax away from the hustle and bustle of the city, allowing guests to enjoy comfort and rejuvenation.'], 'Travel Tips:': ['It is recommended to book rooms in advance, especially during peak tourism seasons, as reservations may be difficult during busy periods.', 'Guests can take advantage of local transport services to easily reach surrounding tourist attractions.']}",A quiet environment to relax away from the hustle and bustle of the city,41.8616047,19.4243804,https://maps.app.goo.gl/3mDqFwLrAM6G3DoNA,hotel,2024-12-17T23:29:58.000000Z
48,17,Shkoder,Albania,Lizhi Castle,"{'Lezhë Castle': ['is one of the most important historical landmarks in Albania, located in the city of Lezhë in the northern part of the country. The castle is a place that combines history and natural beauty, offering a stunning view of the city and the surrounding area.'], 'History of the Castle: ': ['Lezhë Castle was built during the medieval period and is one of the oldest castles in Albania. Over the centuries, the castle has witnessed numerous wars and conflicts and played a major role in resisting invaders from various empires. The most famous historical event related to the castle is the death of Skanderbeg (Gjergj Kastrioti), the national hero of Albania, who died in this castle in 1468.'], 'Location:': ['The castle is situated atop a hill, providing visitors with breathtaking views of the city of Lezhë and its surrounding region. The castle is easily accessible, making it a popular tourist destination for visitors from all over the world.'], 'Historical Site:': ['Visitors can tour the castle and explore its ancient walls and towers, which hold a long history.'], 'Stunning Views:': ['The castle offers magnificent views of the surrounding city and the natural beauty of the mountains and plains.', 'Museums: Inside the castle, there is a museum that explains the history of the castle and the significance of Skanderbeg in Albanian history.'], 'Travel Tips:': ['It is recommended to visit the castle in the spring or fall to avoid the intense summer heat and enjoy the scenic views.', 'Be sure to wear comfortable shoes, as some of the pathways inside the castle can be rough.']}",One of the places that combines history and natural beauty,41.7884459,19.642539,https://maps.app.goo.gl/iRAG1nCJkjAY48Qi7,tourist place,2024-12-17T23:18:45.000000Z
6,17,Shkoder,Albania,RAFAELO RESORT,"{'first': [""RAFAELO Resort is one of the most prominent tourist resorts in Albania, located in a beautiful and peaceful coastal area near the sea. It is an ideal destination for relaxation and comfort, featuring stunning natural views and high-end facilities that cater to all visitors' needs. The RAFAELO Resort is strategically positioned, making it close to many other tourist sites in Albania, allowing visitors to explore the beauty of the region during their stay.""], 'Facilities and Services:': ['Luxury Accommodation: The resort offers rooms and suites equipped with the latest amenities and modern design, ensuring comfort and luxury for visitors.', 'Entertainment Activities: The resort features a range of water activities like swimming and boating, as well as other sports like tennis and cycling.', 'Restaurants: The resort offers a variety of restaurants serving delicious local and international cuisines, making dining an exceptional experience.', 'Spa: The resort has a wellness center offering massage and relaxation treatments, allowing guests to recharge and enjoy a comforting experience.'], 'Travel Tips:': ['It is recommended to visit the resort during the summer months from June to September to enjoy the warm beaches and clear waters.', 'Don’t forget to visit nearby attractions like beautiful beaches and natural parks.']}",One of the most prominent tourist resorts in Albania,41.8083442,19.5977722,https://maps.app.goo.gl/pvUzXekLqGzknsqG6,hotel,2024-12-17T22:49:32.000000Z
47,17,Shkoder,Albania,Valbona Valley,"{'First': ['Valbona Valley National Park is one of the most beautiful and famous natural destinations in Albania, located in the northern part of the country within the Albanian Alps region. This valley is renowned for its stunning landscapes and picturesque nature, where dense forests meet rivers and waterfalls. Valbona Valley is home to many rare plant and animal species that are found nowhere else, making it an ideal destination for nature lovers and adventure enthusiasts.'], 'Main Attractions:': ['Scenic Views: The valley is known for its breathtaking mountain views, with high peaks surrounding the valley and deep ravines.', 'Hiking and Adventure Sports: Valbona Valley offers various hiking and climbing trails, attracting adventure enthusiasts with activities like climbing, mountain biking, and horseback riding.', ""Rivers and Waterfalls: The Valbona River flows through the valley, featuring several beautiful waterfalls that reflect the region's beauty."", 'Wildlife: Valbona Valley is home to many wild animals such as wolves, bears, and deer, as well as rare bird species.'], 'Travel Tips:': ['The best time to visit the valley is during the summer months from June to September to enjoy the beautiful nature.', 'Be sure to wear suitable mountain hiking shoes, as some trails can be challenging in certain areas.', 'You can enjoy staying in rural cottages or small hotels scattered throughout the region.']}",Here is where dense forests meet rivers and waterfalls to form a stunning nature,42.425865,19.925868,https://maps.app.goo.gl/HRz8LLmNptWyE3yZ8,tourist place,2024-12-17T22:36:41.000000Z
46,17,Shkoder,Albania,Shenzhen beach,"{'the first': ['Shëngjin Beach is a popular coastal destination in Albania, located along the Adriatic Sea. It is considered one of the most beautiful beaches in the country, featuring crystal-clear waters and golden sands that offer the perfect environment for relaxation and swimming. The beach is surrounded by a variety of restaurants and cafes offering both local and international cuisine, attracting tourists to enjoy a memorable experience. The beach is also close to the town of Lezhë, making it easy for visitors to explore the surrounding area.'], 'Main Attractions:': ['Shëngjin Beach: Known for its golden sands and clear waters, it is an ideal spot for swimming and relaxation.', 'Restaurants and Cafes: Offering a unique tasting experience with traditional Albanian cuisine and seafood dishes.', 'Activities: The coast is popular for activities like boat riding, surfing, and swimming in the blue waters.', 'Proximity to Historical Sites: Shëngjin is a great starting point for visiting historical landmarks in the area, such as the Lezhë Castle and the ancient site of Butrint.'], 'Travel Tips:': ['The best time to visit Shëngjin Beach is during the summer months from June to September.', 'Visitors can find many hotels and resorts near the beach for a comfortable stay.', 'It is recommended to use sunscreen and avoid swimming during high waves.']}","This coast is distinguished by its golden sandy beaches, clear blue waters, and integrated tourism services",41.811819,19.5917559,https://maps.app.goo.gl/8DVp5Vrk5396w5556,tourist place,2024-12-17T22:28:48.000000Z
44,17,Shkoder,Albania,Lake Komani,"{'Introduction:': [""Koman Lake is one of Albania's most breathtaking natural attractions and a top destination for nature enthusiasts. Known for its turquoise waters and stunning landscapes, the lake has often been compared to the famous Norwegian fjords.""], 'Location:': ['Koman Lake is located in northern Albania, in the Shkodra County. It was created in the 1970s as a result of the construction of the Koman Dam on the Drin River. The lake stretches for approximately 34 kilometers, winding between dramatic mountain ranges.'], 'Description:': ['The lake is surrounded by towering mountains and deep valleys, creating a picturesque and serene environment.', 'Its clear turquoise waters add to the charm, making it one of the most scenic waterways in Europe.', 'A boat journey through Koman Lake is a magical experience, with narrow passages and rocky cliffs that amaze visitors.'], 'Activities at Koman Lake:': ['Boat Tours: Visitors can enjoy boat rides or ferries that take around two hours. This scenic journey offers spectacular views of the surrounding mountains and waterways.', 'Photography: The lake’s vivid turquoise waters combined with lush greenery provide stunning opportunities for photography.', 'Hiking and Walking: Several hiking trails around the lake allow visitors to explore its natural beauty up close.', 'Exploring Local Villages: Small villages such as Berisha are located along the lake’s shores, offering a glimpse into local life and traditions.', 'Camping: The lake’s peaceful shores make it an ideal spot for camping and enjoying nights under the stars.'], 'How to Reach Koman Lake:': ['Travelers usually start their journey from Shkodra City and take a bus or car to the village of Koman. From there, boat trips begin at the dam and provide an unforgettable experience.'], 'Best Time to Visit:': ['The best time to visit Koman Lake is during spring and summer, when the weather is perfect for boat trips and outdoor activities.'], 'Significance of Koman Lake:': ['The lake plays a significant role in Albania’s hydroelectric power production.', ""It promotes eco-tourism and highlights Albania's natural beauty."", 'Koman Lake offers a peaceful retreat, ideal for relaxation and exploration.']}",A major tourist destination for lovers of nature and stunning views.,42.105449,19.827256,https://maps.app.goo.gl/KbaM9e1EkPxNwJYD9,tourist place,2024-12-17T20:45:50.000000Z
43,17,Shkoder,Albania,Shala River,"{'Introduction:': ['The Shala River is one of the most stunning natural wonders in Albania, often referred to as the “Thailand of Europe” due to its crystal-clear turquoise waters and breathtaking surroundings. It is a must-visit destination for nature lovers and adventure seekers.'], 'Location:': ['The Shala River originates in the Albanian Alps and flows through the beautiful Koman Lake area. It is nestled within a valley surrounded by towering mountains, offering a serene escape into nature.'], 'Description: ': ['The Shala River is known for its pristine, turquoise waters that remain refreshingly cold throughout the year.', 'The surrounding landscape features dense forests, rocky cliffs, and peaceful valleys, making it an idyllic retreat.', 'Its remote location and unspoiled beauty make it a popular choice for those seeking tranquility and a connection with nature.'], 'How to Reach the Shala River:': ['Visitors must first travel to Koman Lake, where they can board small boats or ferries for a scenic ride across the lake. The boat journey to the Shala River takes approximately 45 minutes to an hour and is a highlight in itself.'], 'Activities at the Shala River:': ['Boat Trips: Explore the river by boat and take in the stunning scenery along the way.', 'Swimming: The river’s clear and cool waters are perfect for swimming, especially during the summer months.', 'Camping: Set up tents along the riverbanks and enjoy peaceful nights under the stars.', 'Hiking and Climbing: The surrounding mountains and trails provide excellent opportunities for hiking and exploration.', 'Photography:With its vibrant colors and natural beauty, the Shala River is a paradise for photographers.'], 'Best Time to Visit:': ['The best time to visit the Shala River is during spring and summer when the weather is pleasant and the river is most inviting for outdoor activities.'], 'Significance of the Shala River:': ['The river is a top tourist attraction in Albania, drawing visitors from around the world.', 'It promotes eco-tourism and provides an opportunity to experience unspoiled natural beauty.', 'The Shala River serves as a perfect getaway for relaxation, recreation, and adventure.']}",An ideal destination for photography lovers thanks to its bright colors and natural scenery,42.27784,19.7948863,https://maps.app.goo.gl/kxPmi1NtzuudrSpo7,tourist place,2024-12-17T20:35:01.000000Z
42,17,Shkoder,Albania,Theth Waterfall (Grunas Waterfall),"{'Introduction:': ['The Grunas Waterfall, located in the village of Theth in the Albanian Alps, is one of the most breathtaking natural attractions in northern Albania. Known for its stunning beauty, the waterfall is a favorite destination for hikers, nature lovers, and photographers.'], 'Location:': ['Grunas Waterfall is situated in Theth Village, part of the Albanian Alps. It is easily accessible and located a short walking distance from the village center, making it a popular spot for day trips and nature walks.'], 'Description:': ['The waterfall stands approximately 30 meters high, cascading down rugged cliffs and creating a mesmerizing scene.', 'It is surrounded by dense greenery, towering rocks, and crystal-clear waters flowing through the valley.', 'The water is cold, fresh, and pure, originating from the peaks of the Albanian Alps, adding to its charm and refreshing appeal.'], 'How to Reach the Waterfall:': ['Visitors can reach Grunas Waterfall via a hiking trail starting from Theth Village. The hike takes around 45 minutes to 1 hour, making it an ideal adventure for trekking enthusiasts.'], 'Activities at the Waterfall:': ['Hiking and Exploring: The trail leading to the waterfall offers a scenic walk through the picturesque landscapes.', 'Photography: Grunas Waterfall is a perfect spot for photographers, with its dramatic flow of water and stunning mountain backdrop.', 'Relaxation: Visitors can relax by the waterfall, enjoying the peaceful sounds of flowing water and the serene surroundings.', 'Swimming: Although the water is cold, some visitors enjoy swimming in the natural pool at the base of the waterfall, especially in summer.'], 'Best Time to Visit:': ['The best time to visit Grunas Waterfall is during the spring and summer seasons when the weather is pleasant and the waterfall is at its peak flow.'], 'Significance:': ['Grunas Waterfall is a highlight of the natural beauty found in the Albanian Alps.', 'It promotes eco-tourism in Theth and attracts visitors seeking a peaceful retreat.', 'The site offers a perfect escape into nature, away from the hustle and bustle of urban life.']}",One of the most prominent natural landmarks in the Theth region,42.3758536,19.7995026,https://maps.app.goo.gl/5A1R4aJu4rX3u1U46,tourist place,2024-12-17T20:16:53.000000Z
