id,city_id,city_name,country_name,name,description,short_description,latitude,longitude,location,type,created_at
1240,132,Tashkent,Uzbekistan,INTERNATIONAL HOTEL TASHKENT,"{'Location': ['INTERNATIONAL HOTEL TASHKENT is located in Tashkent in Uzbekistan, a vibrant city with a rich history and culture. The hotel stands out as a welcoming retreat in the heart of the city, offering a perfect blend of comfort and convenience for travelers.'], 'Services & Facilities': ['Free Wi-Fi', 'Free breakfast.'], 'Rooms': ['Comfortable rooms with modern amenities.', 'Air-conditioned rooms for a pleasant stay.', 'Cozy ambiance for a relaxing experience.'], 'Nearby Attractions': ['Close to the hotel are several tourist attractions in Tashkent waiting to be explored.', 'The area surrounding the hotel hosts a variety of restaurants and cafes offering delicious local and international cuisines.', 'Within a short distance, guests can find shopping centers and entertainment venues to enjoy.']}","Upscale hotel with fine dining & a pool. Upmarket hotel offering 2 elegant restaurants & a piano bar, plus an outdoor pool, a gym & a sauna.",41.337528,69.2835456,https://www.google.com/maps?q=INTERNATIONAL%20HOTEL%20TASHKENT&ftid=0x38ae8b52199f91c5:0x7dccc1f963dd9dd8,hotel,2025-07-03T05:08:21.000000Z
1239,132,Tashkent,Uzbekistan,Lotte City Hotel Tashkent Palace,"{'Location': ['Lotte City Hotel Tashkent Palace is located in Tashkent, Uzbekistan, a vibrant city known for its rich history and vibrant culture. It is situated on Buyuk Turon Street, offering guests a convenient and central location to explore the city.'], 'Services & Facilities': ['Guests staying at Lotte City Hotel Tashkent Palace can enjoy a range of amenities including free Wi-Fi, complimentary breakfast, and other extensions to make their stay comfortable and convenient. The hotel also offers services like parking, a spa, and a pool for relaxation and leisure.'], 'Rooms': ['The rooms at Lotte City Hotel Tashkent Palace are designed to provide a cozy and comfortable stay for guests. They are equipped with modern amenities, air conditioning, and other offerings to ensure a pleasant experience during the stay.'], 'Nearby Attractions': ['Close to Lotte City Hotel Tashkent Palace, guests can explore popular tourist attractions in Tashkent such as {Attraction 1}, {Attraction 2}, and {Attraction 3}. The surrounding area also boasts a variety of restaurants and cafes where visitors can indulge in delicious local cuisine and international dishes.']}","Sleek hotel with a pool & dining. High-end hotel offering 2 restaurants, a bar & an indoor pool, plus a hot tub & a spa.",41.3096895,69.2685937,https://www.google.com/maps?q=Lotte%20City%20Hotel%20Tashkent%20Palace&ftid=0x38ae8b23e75461ab:0x5ea6c174e07c850e,hotel,2025-07-03T05:05:14.000000Z
1238,132,Tashkent,Uzbekistan,Hilton Tashkent City,"{'Location': ['Hilton Tashkent City is located in Tashkent, Uzbekistan, a luxurious and welcoming place to stay in the heart of the city.'], 'Services & Facilities': ['Free Wi-Fi', 'Free breakfast.'], 'Rooms': ['Comfortable and cozy rooms.', 'Air conditioned', 'Modern amenities.'], 'Nearby Attractions': ['Explore the historic sites of Tashkent.', 'Enjoy the vibrant local markets.', 'Indulge in the diverse cuisine of the city.']}","Relaxed hotel with 2 restaurants. Unassuming rooms & suites in an informal hotel with 2 restaurants, a 24-hour cafe & breakfast.",41.314169299999996,69.24886459999999,https://www.google.com/maps?q=Hilton%20Tashkent%20City&ftid=0x38ae8b685b689e13:0xaf4cdf526e02f5e7,hotel,2025-07-03T05:00:56.000000Z
1237,132,Tashkent,Uzbekistan,Hotel Uzbekistan,"{'Location': ['Hotel Uzbekistan is located in Tashkent, Uzbekistan, offering a warm and welcoming stay in the heart of the city.'], 'Services & Facilities': ['Guests at Hotel Uzbekistan can enjoy amenities such as free Wi-Fi and complimentary breakfast, ensuring a comfortable and convenient stay.'], 'Rooms': ['The rooms at Hotel Uzbekistan are designed to provide a cozy and relaxing atmosphere, with features like air conditioning for a pleasant stay.'], 'Nearby Attractions': ['Close to Hotel Uzbekistan, visitors can explore attractions in Tashkent such as museums, parks, and historical sites, as well as nearby restaurants and cafes offering delicious local cuisine.']}","Relaxed hotel with 2 restaurants. Unassuming rooms & suites in an informal hotel with 2 restaurants, a 24-hour cafe & breakfast.",41.3113642,69.28267819999999,https://www.google.com/maps?q=Hotel%20Uzbekistan&ftid=0x38ae8b2bec875291:0x22b5bc120c7e164,hotel,2025-07-03T04:58:04.000000Z
984,128,Samsun,Turkey,Veterans Museum,"{'Location': ['Veterans Museum is in Samsun, Turkey and is a significant landmark with a rating of 4.6, offering a glimpse into the rich history of the royal era in the country.'], 'Activities and Facilities': ['Explore the Tütün İskelesi and Onur Anıtı, enjoy the panoramic views from Amisos Hill, relax at Atatürk Parkı, discover the exhibits at Samsun Kent Müzesi, have a leisurely time at Samsun sahil, enjoy nature at SAMSUN BATI PARK, picnic at Bayrak Tepe Tabiat Parkı, visit Bandırma ferry, and explore the historical displays at Veterans Museum.'], 'Opening Hours and Entry Fees': ['Open daily from 8:30 AM to 4:30 PM, Veterans Museum welcomes visitors to explore its exhibits showcasing the history of veterans and the country.'], 'Nearby Areas': ['Close to the Veterans Museum are attractions like Tütün İskelesi, Onur Anıtı, Amisos Hill, Atatürk Parkı, Samsun Kent Müzesi, Samsun sahil, SAMSUN BATI PARK, Bayrak Tepe Tabiat Parkı, Bandırma ferry, and Central Great Mosque. The area also offers various dining options serving delicious local cuisine.']}",Museum dedicated to Turkey's founder. 20th-century house known for hosting Atatürk for a week in the late 1920s & showing his effects.,41.2901649,36.3324242,https://www.google.com/maps?q=Veterans%20Museum&ftid=0x408877b88fff68c1:0x82e7bb3ad397c025,tourist place,2025-07-02T20:37:43.000000Z
983,128,Samsun,Turkey,Atakum Beach,"{'Location': ['Atakum Beach is in Samsun, Turkey, and is a must-visit destination with a remarkable rating of 4.8, offering a blend of history and natural beauty.'], 'Activities and Facilities': ['Atakum Beach is home to various attractions like Tütün İskelesi, Onur Anıtı, Amisos Hill, Atatürk Parkı, Samsun Kent Müzesi, Samsun sahil, SAMSUN BATI PARK, Bayrak Tepe Tabiat Parkı, Bandırma ferry, Veterans Museum, and Central Great Mosque, each providing unique experiences and facilities for visitors.'], 'Opening Hours and Entry Fees': ['Atakum Beach is accessible 24 hours a day, providing visitors with the flexibility to enjoy its offerings at any time.'], 'Nearby Areas': ['Close to Atakum Beach, visitors can explore the vibrant atmosphere of Samsun with its diverse dining options and charming cafes, making it a perfect spot for a leisurely day out.']}","Atakum Beach is a long sandy beach along the Black Sea in Samsun, featuring a modern promenade with cafés, bike paths, and leisure facilities—ideal for sunbathing, strolling, and seaside relaxation.",41.3423795,36.2637864,https://www.google.com/maps?q=Atakum%20Sahili&ftid=0x4088790035b019e5:0x92fc0d0260e3bdad,tourist place,2025-07-02T20:32:45.000000Z
982,128,Samsun,Turkey,Bayrak Tepe Nature Park,"{'Location': ['Bayrak Tepe Tabiat Parkı is in Samsun, Türkiye and is a breathtaking natural park offering stunning views of the surrounding area. It is a must-visit destination for nature lovers and outdoor enthusiasts.'], 'Activities and Facilities': ['Exploring the Tütün İskelesi for panoramic views.', 'Visiting the Onur Anıtı for historical insights.', 'Hiking at Amisos Hill for a scenic workout.', 'Enjoying a leisurely stroll at Atatürk Park.', 'Exploring the exhibits at Samsun Kent Müzesi.', 'Relaxing by the seaside at Samsun Coast.', 'Having a picnic and hiking at SAMSUN BATI PARK.', 'Exploring the beauty of Bayrak Tepe Nature Park.', 'Visiting the Bandırma Ferry for a historical experience.', 'Exploring the exhibits at Veterans Museum.', 'Visiting the Central Great Mosque for a cultural experience.'], 'Opening Hours and Entry Fees': ['Open daily from 9 AM to 10 PM at Amisos Hill.', 'Open 24 hours at Bayrak Tepe Nature Park'], 'Nearby Areas': ['Close to the park are the Central Great Mosque, Samsun Kent Museum, and Atatürk Park which offer a mix of cultural and recreational experiences.']}","Bayrak Tepe Nature Park is a scenic nature park just outside Samsun, featuring forests, picnic spots, playgrounds, walking trails, and ancient castle ruins—perfect for family outings and outdoor adventures.",41.2358639,36.3851657,https://www.google.com/maps?q=Bayrak%20Tepe%20Tabiat%20Park%C4%B1&ftid=0x4087df69810579e3:0xa3e8a0e41561a45e,tourist place,2025-07-02T20:28:32.000000Z
981,128,Samsun,Turkey,SAMSUN WEST PARK,"{'Location': ['SAMSUN BATI PARK is in Samsun Turkey, a stunning park offering a blend of natural beauty and recreational activities for visitors of all ages.'], 'Activities and Facilities': ['SAMSUN BATI PARK is a perfect spot for picnics, hiking, and enjoying the great outdoors with features like a barbecue grill, basketball court, picnic tables, swings, and slides. It also includes a dog park, making it a family-friendly destination.'], 'Opening Hours and Entry Fees': ['Open daily from morning till evening, providing ample time for visitors to explore and enjoy the park.'], 'Nearby Areas': ['Close to SAMSUN BATI PARK, visitors can explore attractions like Tütün İskelesi, Onur Anıtı, Amisos Hill, Atatürk Parkı, Samsun Kent Müzesi, Bayrak Tepe Tabiat Parkı, Bandırma ferry, Veterans Museum, and Central Great Mosque. The area also offers various dining options serving delicious local cuisine.']}","Samsun Sahili is the city's scenic coastline along the Black Sea, featuring a modern promenade, parks, cafés, bike paths, and sandy beaches—perfect for strolls, relaxation, and sea views.",41.3236299,36.3199678,https://www.google.com/maps?q=SAMSUN%20BATI%20PARK&ftid=0x408879da9744b1c7:0xd55496f508ce693c,tourist place,2025-07-02T20:24:09.000000Z
980,128,Samsun,Turkey,Samsun coast,"{'Location': ['Samsun Sahil is in Samsun, Turkey and is a must-visit destination along the coast of the Black Sea, offering breathtaking views and a rich historical background.'], 'Activities and Facilities': ['Samsun Coast provides a variety of activities and facilities such as Tütün İskelesi, Onur Anıtı, Amisos Hill, Atatürk Parkı, Samsun Kent Müzesi, SAMSUN BATI PARK, Bayrak Tepe Tabiat Parkı, Bandırma Ferry, Veterans Museum, and Central Great Mosque. Visitors can enjoy picnics, hiking, and explore historical sites and museums.'], 'Opening Hours and Entry Fees': ['Samsun Sahil is open 24 hours a day, offering visitors the flexibility to enjoy the stunning views and attractions at any time.'], 'Nearby Areas': ['Close to Samsun Sahil, visitors can explore the vibrant city of Samsun, indulge in delicious seafood at local restaurants and cafes, and enjoy the beauty of the Black Sea coast.']}","Samsun Sahili is the city's scenic coastline along the Black Sea, featuring a modern promenade, parks, cafés, bike paths, and sandy beaches—perfect for strolls, relaxation, and sea views.",41.3303486,36.295708,https://www.google.com/maps?q=Samsun%20sahil&ftid=0x40887905bc174a23:0x9e43d1459de0f67d,tourist place,2025-07-02T20:19:23.000000Z
979,128,Samsun,Turkey,Samsun City Museum,"{'Location': ['Samsun City Museum is in Samsun, Türkiye and is easily accessible via public or private transportation. Parking facilities and comfortable amenities are available, accommodating visitors of all ages.'], 'Activities and Facilities': ['Samsun City Museum is a must-visit landmark with a rich history dating back to the royal era in Turkey. Visitors can explore Tütün İskelesi, Onur Anıtı, Amisos Hill, Atatürk Parkı, and more. The museum offers insights into the cultural heritage and traditions of the region.'], 'Opening Hours and Entry Fees': ['Open daily from 8:30 AM to 4:45 PM, except on Mondays when it opens from 12 PM. Entry is free for all visitors.'], 'Nearby Areas': ['Close to the museum are attractions like Samsun sahil, SAMSUN BATI PARK, Bayrak Tepe Tabiat Parkı, and Bandırma ferry. Visitors can also explore Atakum Sahili, Veterans Museum, and Central Great Mosque in the vicinity.']}","Exhibits on Turkey's ""founding father"". Military leader & statesman Kamal Atatürk once stayed at this 1902 hotel, now a museum in his honor.",41.2863456,36.340025499999996,https://www.google.com/maps?q=Samsun%20Kent%20M%C3%BCzesi&ftid=0x408877b61deece9d:0xf22ff7f915d6323,tourist place,2025-07-02T20:15:15.000000Z
978,128,Samsun,Turkey,Atatürk Park,"{'Location': ['Atatürk Park is in Samsun, Turkey and is a must-visit destination for nature lovers and history enthusiasts alike.'], 'Activities and Facilities': ['Atatürk Park offers a range of activities including hiking, picnics, and a playground for children. Visitors can enjoy the beautiful natural surroundings and explore historical landmarks within the park.'], 'Opening Hours and Entry Fees': ['Open daily from 8:30 AM to 4:45 PM, Atatürk Parkı provides ample time for visitors to immerse themselves in its beauty and history.'], 'Nearby Areas': ['Close to Atatürk Parkı, visitors can explore Tütün İskelesi, Onur Anıtı, and Amisos Hill. The park is also surrounded by various dining options serving delicious local cuisine.']}","Atatürk Park (Samsun) is a historic and scenic urban park located in the İlkadım district along the Black Sea coast. It features beautifully landscaped gardens, playgrounds, walking paths, and the landmark Statue of Honor (Onur Anıtı) commemorating Atatürk’s landing in Samsun. Open 24/7, it’s a beloved gathering place for families, locals, and visitors alike .",41.289496899999996,36.336038099999996,https://www.google.com/maps?q=Atat%C3%BCrk%20Park%C4%B1&ftid=0x408877b83ae4d1dd:0x9585443ae08829,tourist place,2025-07-02T20:11:48.000000Z
977,128,Samsun,Turkey,Honor Monument,"{'Location': ['The Honor Monument is in Samsun, Turkey, a significant landmark with a rating of 4.8, offering a glimpse into the royal history of the country.'], 'Activities and Facilities': ['Visitors can explore Tütün İskelesi, Amisos Hill, Atatürk Parkı, Samsun Kent Müzesi, Samsun sahil, SAMSUN BATI PARK, Bayrak Tepe Tabiat Parkı, Atakum Sahili, Bandırma ferry, Veterans Museum, and Central Great Mosque, all offering unique experiences and facilities.'], 'Opening Hours and Entry Fees': ['Open daily from morning till night, providing ample time for visitors to explore and enjoy the attractions.'], 'Nearby Areas': ['Close to Onur Anıtı, tourists can find a variety of attractions such as Tütün İskelesi, Amisos Hill, and Atatürk Parkı. Additionally, the area boasts numerous restaurants and cafes serving delicious local cuisine and seafood.']}","Large statue to honor independence hero. Imposing bronze sculpture honoring Mustafa Kemal Atatürk, father of the Turkish War of Independence.",41.2890668,36.336451,https://www.google.com/maps?q=Onur%20An%C4%B1t%C4%B1&ftid=0x408877b83ac955bb:0xb6a8c2486f31011a,tourist place,2025-07-02T20:07:25.000000Z
976,129,Bodrum,Turkey,Red Heart White Bodrum,"{'Location': ['Red&White is in Bodrum, Turkey and is a must-visit destination for history enthusiasts and families alike.'], 'Activities and Facilities': ['Explore the rich history of Bodrum at Red&White, where you can visit iconic landmarks such as Bodrum Museum Of Underwater Archaeology, Mausoleum at Halicarnassus, Bodrum Castle, and Zeki Muren Arts Museum. Enjoy stunning views from Myndos Gate and Deniz Feneri, and immerse yourself in the local culture at Historic Bodrum House and Karia Princess Museum.'], 'Opening Hours and Entry Fees': ['Open daily from morning till evening, Red&White offers visitors the chance to explore historical sites at their own pace.'], 'Nearby Areas': ['Close to Red&White, visitors can explore the charming streets of Bodrum and enjoy delicious seafood at nearby restaurants and cafes.']}",Red Coraz White Bodrum appears to be a scenic area in Bodrum featuring charming white sunbeds with red cushions along the waterfront. It likely offers a relaxed seaside atmosphere ideal for sunbathing and enjoying coastal views.,37.032842599999995,27.430752199999997,https://www.google.com/maps?q=Red%26White&ftid=0x14be6d512b9e989f:0xfed43ddb5862add6,tourist place,2025-07-02T19:26:11.000000Z
975,129,Bodrum,Turkey,Bodrum Municipality Umurça Park,"{'Location': ['Bodrum Belediyesi Umurça Parkı is in Bodrum, Turkey, a charming park known for its rich history and beautiful surroundings.'], 'Activities and Facilities': ['Exploring the Bodrum Museum Of Underwater Archaeology', 'Visiting the Mausoleum at Halicarnassus', 'Touring the Bodrum Castle.', 'Discovering the Zeki Muren Arts Museum.', 'Taking in the views from Myndos Gate.', 'Enjoying the historic Bodrum House.', 'Exploring the Karia Princess Museum.'], 'Opening Hours and Entry Fees': ['Open daily from 7 AM to 11 PM.'], 'Nearby Areas': ['Close to Bodrum Belediyesi Umurça Parkı are attractions like the Bodrum Museum Of Underwater Archaeology, Mausoleum at Halicarnassus, Bodrum Castle, and Zeki Muren Arts Museum. The area also offers a variety of dining options serving delicious seafood.']}","Umurça Park is a large public park in Bodrum with playgrounds, sports areas, walking paths, a café, and an educational Archeopark. It’s a relaxing green space for families and visitors of all ages.",37.0380429,27.443735,https://www.google.com/maps?q=Bodrum%20Belediyesi%20Umur%C3%A7a%20Park%C4%B1&ftid=0x14be6d793420499f:0x96e78146bd8878f2,tourist place,2025-07-02T19:22:09.000000Z
974,129,Bodrum,Turkey,Kızılhisarlı Mustafa Paşa Mosque,"{'Location': ['Kızılhisarlı Mustafa Paşa Mosque is in Bodrum, Turkey and is a historical landmark known for its rich history and cultural significance.'], 'Activities and Facilities': [""Explore the Bodrum Museum Of Underwater Archaeology showcasing ancient artifacts, visit the Mausoleum at Halicarnassus, and enjoy live performances at Bodrum Castle. Don't miss the Zeki Muren Arts Museum and the Myndos Gate for a glimpse into the past. Additionally, experience the breathtaking sunset views from the view point overlooking the castle.""], 'Opening Hours and Entry Fees': ['Open daily from morning till evening. Specific opening hours vary for different attractions nearby.'], 'Nearby Areas': ['Close to Kızılhisarlı Mustafa Paşa Camii, you can find the Bodrum Belediyesi Umurça Parkı offering activities like hiking, basketball, and picnicking. Also, enjoy delicious seafood at nearby restaurants and cafes.']}","**Kızılhisarlı Mustafa Paşa Mosque** is one of the oldest mosques in Bodrum, built in the early 18th century near Bodrum Castle. It features traditional Ottoman architecture with a single minaret and stone structure.",37.032921,27.429682,https://www.google.com/maps?q=K%C4%B1z%C4%B1lhisarl%C4%B1%20Mustafa%20Pa%C5%9Fa%20Camii&ftid=0x14be6c4180b4d6cd:0x9664319f17eee806,tourist place,2025-07-02T19:17:46.000000Z
973,129,Bodrum,Turkey,Karia Princess Museum,"{'Location': ['Karia Princess Museum is in Bodrum, Turkey and is a fascinating historical site worth visiting.'], 'Activities and Facilities': ['Explore the rich history of the royal era in Turkey.', 'Admire the unique architecture and artifacts on display.', 'Enjoy the beautiful views of Bodrum from the museum.'], 'Opening Hours and Entry Fees': ['Open daily from morning till evening.'], 'Nearby Areas': ['Close to Karia Princess Museum are attractions like Bodrum Museum Of Underwater Archaeology, Mausoleum at Halicarnassus, and Bodrum Castle. Visitors can also find a variety of restaurants and cafes offering delicious Turkish cuisine.']}","Deniz Feneri (Bodrum Lighthouse) is a historic lighthouse at the entrance of Bodrum Harbor, built in 1880 by French architect Marius Michel Paşa. The small white tower (5 m high on an 8 m base) guides ships up to 8 nautical miles away. It’s a charming landmark with scenic coastal views, especially magical at sunset as its red beacon lights up .",37.0317757,27.429211799999997,https://www.google.com/maps?q=Karia%20Princess%20Museum&ftid=0x14be6c43cac71adf:0xff2b213af746827b,tourist place,2025-07-02T19:13:07.000000Z
972,129,Bodrum,Turkey,Lighthouse,"{'Location': ['Deniz Feneri is in Bodrum, Turkey and is a historic lighthouse offering stunning views of the surrounding area.'], 'Activities and Facilities': ['Explore the Bodrum Museum Of Underwater Archaeology, Mausoleum at Halicarnassus, Bodrum Castle, Zeki Muren Arts Museum, Myndos Gate, and more nearby attractions.'], 'Opening Hours and Entry Fees': ['Open daily from 10:00 AM to 10:00 PM.'], 'Nearby Areas': ['Close to Deniz Feneri are the Bodrum Museum Of Underwater Archaeology, Mausoleum at Halicarnassus, Bodrum Castle, and many other historical sites and parks.']}","Deniz Feneri (Bodrum Lighthouse) is a historic lighthouse at the entrance of Bodrum Harbor, built in 1880 by French architect Marius Michel Paşa. The small white tower (5 m high on an 8 m base) guides ships up to 8 nautical miles away. It’s a charming landmark with scenic coastal views, especially magical at sunset as its red beacon lights up .",37.032347,27.4247899,https://www.google.com/maps?q=Deniz%20Feneri&ftid=0x14be6c44427edbfb:0xeeb326bc188427b1,tourist place,2025-07-02T19:09:04.000000Z
971,129,Bodrum,Turkey,English Tower,"{'Location': ['English Tower is in Bodrum, Türkiye and is a must-visit historical landmark with a rating of 4.2. It offers a glimpse into the royal era of Türkiye.'], 'Activities and Facilities': ['Visitors can explore Bodrum Museum Of Underwater Archaeology, Mausoleum at Halicarnassus, Bodrum Castle, Zeki Muren Arts Museum, Deniz Feneri, and more nearby attractions showcasing the rich history and culture of the region.'], 'Opening Hours and Entry Fees': ['English Tower is open 24 hours daily, allowing visitors to enjoy its beauty at any time.'], 'Nearby Areas': ['Close to the English Tower, tourists can explore the vibrant Bodrum city center with its charming cafes, restaurants, and shops offering a variety of local delights.']}","**İngiliz Kulesi** (English Tower) is one of the historic towers of Bodrum Castle, built in the 15th century. Also known as the ""Lion Tower,"" it now features exhibits from the Museum of Underwater Archaeology, showcasing medieval themes.",37.030964,27.429871,https://www.google.com/maps?q=%C4%B0ngiliz%20Kulesi&ftid=0x14be6c424fe9500f:0x218ea597d2741aea,tourist place,2025-07-02T19:05:04.000000Z
970,129,Bodrum,Turkey,Viewpoint to watch the castle at sunset.,"{'Location': ['View point to watch the castle at sunset is in Bodrum, Turkey and offers a breathtaking view of the castle at sunset, making it a must-visit spot for tourists.'], 'Activities and Facilities': ['Enjoy a panoramic view of Bodrum Castle and the surrounding area, ideal for photography enthusiasts.', 'Experience the magical sunset over the castle, creating a picturesque setting for romantic evenings.', 'Explore nearby attractions such as Bodrum Museum Of Underwater Archaeology and Mausoleum at Halicarnassus.'], 'Opening Hours and Entry Fees': ['Open 24 hours, allowing visitors to witness the stunning sunset at any time of the day.'], 'Nearby Areas': ['Located in Kumbahçe, the viewpoint is surrounded by historic landmarks like Bodrum Castle and offers easy access to restaurants and cafes serving delicious Turkish cuisine.']}","A scenic viewpoint in Bodrum offering stunning sunset views over Bodrum Castle and the Aegean Sea. It’s easily accessible, ideal for photography enthusiasts and couples, and provides a peaceful spot to watch the castle light up as dusk settles over the harbor.",37.0312011,27.4384046,https://www.google.com/maps?q=View%20point%20to%20watch%20the%20castle%20at%20sunset&ftid=0x14be6dfc47d470df:0x14d19015f1695d56,tourist place,2025-07-02T19:01:23.000000Z
969,129,Bodrum,Turkey,Myndos Gate,"{'Location': ['Myndos Gate is in Bodrum, Türkiye and stands as a significant historical landmark with a rating of 4.1, offering a glimpse into the royal era of the country.'], 'Activities and Facilities': ['Exploring the ancient ruins and historical artifacts.', 'Enjoying panoramic views of Bodrum and the sea.', 'Taking leisurely walks around the well-preserved gate.'], 'Opening Hours and Entry Fees': ['Open 24 hours daily.'], 'Nearby Areas': ['Close to Myndos Gate, visitors can explore the Bodrum Museum Of Underwater Archaeology, Mausoleum at Halicarnassus, and Bodrum Castle. The area also features a variety of restaurants and cafes serving delicious seafood dishes.']}","Myndos Gate is an ancient city gate in Bodrum, once part of the old city walls of Halicarnassus. Built in the 4th century BCE, it played a key role during Alexander the Great’s siege. Today, it's a free-to-visit historic site.",37.0377363,27.4133796,https://www.google.com/maps?q=Myndos%20Gate&ftid=0x14be6d758a0bbe6b:0xbcf931ce3c6e3606,tourist place,2025-07-02T18:57:40.000000Z
