id,city_id,city_name,country_name,name,description,short_description,latitude,longitude,location,type,created_at
474,84,Mitrovica,Kosovo,Isa Beg Mosque,"{'Info': ['A historic Ottoman-era mosque in Mitrovica, known for its traditional Islamic architecture.', 'Built during the Ottoman rule, it stands as one of the oldest mosques in the region.'], 'Key Features': ['Elegant minaret, intricate Islamic calligraphy, and a peaceful courtyard.'], 'Visiting Tips': ['Respect prayer times, dress modestly, and visit during daylight hours.']}",A historic Ottoman mosque reflecting Islamic heritage in Mitrovica.,42.895508,20.8420633,https://maps.app.goo.gl/GnGKkqSQrtgnLVNu9,tourist place,2025-02-27T20:07:02.000000Z
473,76,Gudauri,Georgia,"Gudauri Gondola ""Ghandi""","{'Information:': ['Gudauri Gondola ""Ghandi"" is a modern cable car offering stunning panoramic views and easy access to the Caucasus peaks.'], 'Historical importance:': ['Gandul ""Gandhi"" is one of the most important means of transportation in the Judauri resort, as it was created to facilitate the access of visitors and skiers to high peaks, which enhances the experience of skiing and enjoying stunning views.'], 'The most prominent landmarks:': ['A modern cable car provides a comfortable trip to the top of the mountain with amazing panoramic looks.', 'An ideal starting point for skiers and hikers to explore the Caucasus Mountains.', 'A great experience for photographing and enjoying the snow scene from high altitudes.'], 'working hours:': ['It works daily during the ski season from 10:00 am to 5:00 pm (times may vary depending on weather conditions).']}","Gudauri Gondola ""Ghandi"" offers a stunning cable car experience with breathtaking views of the Caucasus Mountains and ski trails.",42.4708504,44.489302,https://maps.app.goo.gl/YF5LbtbCNmp93Mab7,tourist place,2025-02-27T20:02:24.000000Z
472,76,Gudauri,Georgia,Go Gudauri spa,"{'Information:': ['Go Gudauri Spa is a luxurious relaxation center in Judaore and provides massage sessions, sauna and vapor bathrooms with a wonderful mountainous view.'], 'Historical importance:': ['It is one of the latest spa centers in Godauri, where it combines traditional treatments and modern technologies, making it an ideal destination for relaxation after a day of skiing.'], 'The most prominent landmarks:': ['Professional massage sessions using natural oils.', 'Sauna and steam bath to enhance relaxation and renew the activity.', 'Warm water baths with great looks on the Caucasus Mountains.', 'Skin and body care services using natural products.'], 'working hours:': ['It opens daily from 10:00 am to 10:00 pm (times may vary depending on the season).']}","Go Gudauri Spa is an ideal relaxing destination, including a sauna, massage and vapor bathrooms with a great view of the Caucasus Mountains.",42.4720041,44.4912537,https://maps.app.goo.gl/d8HNd7tSkHA1G2NZ9,tourist place,2025-02-27T19:48:41.000000Z
471,84,Mitrovica,Kosovo,Church of Saint Demetrius in Mitrovica,"{'Info': ['A Serbian Orthodox church built on a hill overlooking North Mitrovica.', 'Constructed in 2005 as a replacement for an older church in South Mitrovica, reflecting post-war ethnic divisions.'], 'Key Features': ['Traditional Serbian Orthodox architecture, a prominent bell tower, and religious frescoes.'], 'Visiting Tips': ['Respect religious customs; best visited during daylight hours for scenic views of the city.']}",A Serbian Orthodox church symbolizing faith and resilience in Mitrovica.,42.8954153,20.860088,https://maps.app.goo.gl/u9Ntn7mwjLDDuuDG6,tourist place,2025-02-27T18:35:41.000000Z
470,84,Mitrovica,Kosovo,Mitrovica Bridge,"{'Info': ['A significant bridge over the Ibar River, symbolizing the division between North and South Mitrovica.', 'Represents ethnic and political tensions between Kosovo Albanians and Serbs since the Kosovo War.'], 'Key Features': ['Concrete structure, often monitored by peacekeeping forces, and a key crossing point in the city.']}",A historic bridge symbolizing division and reconciliation efforts in Mitrovica.,42.8912599,20.8634274,https://maps.app.goo.gl/S1qzqqhsa65WD8pp7,tourist place,2025-02-27T18:23:42.000000Z
469,76,Gudauri,Georgia,Gudai ski Georgia,"{'Information:': ['The Gudauri Resort is an ideal destination for winter sports lovers as it provides a soft, perfect snow for free skiing, with picturesque views of the Caucasus Mountains, making it one of the best skiing destinations in Eastern Europe.'], 'Historical importance:': ['Judauri is one of the most famous ski resorts in Georgia, located at an altitude of 2,200 meters above sea level and began to develop it in the Soviet era, but it flourished after independence to become a global destination for winter sports lovers.'], 'The most prominent landmarks:': ['Ski tracks suitable for all levels, from beginners to professionals.', 'Various activities such as ice skiing, cable car ride, and umbrella jumping over the mountains covered with snow.', 'Charming views of the Caucasus Mountains.', 'Luxurious hotels and resorts provide a distinctive accommodation experience.'], 'working hours:': ['The resort opens its doors throughout the week during the winter season (December - April) from 10:00 am to 5:00 pm (working hours may vary according to weather conditions).']}","Judauri, a famous ski resort in Georgia, features wide paths, perfect snow, and great views of the Caucasus.",42.4755433,44.477892,https://maps.app.goo.gl/UykWHVxJKBG7jKjL7,tourist place,2025-02-27T18:20:28.000000Z
468,76,Gudauri,Georgia,Tsar Bani,"{'Information:': ['(TSAR Bani) is a luxurious spa complex located in the Judauri mountain resort in Georgia and is considered one of the highest traditional Russian baths in the world and the complex provides a unique relaxation experience that combines Russian traditions with Georgian hospitality with picturesque views of the Caucasus Mountains.'], 'Historical importance:': ['Tsar Bani was opened in 2014 and soon gained fame as one of the most prominent tourist destinations in Godauri and in 2015 and was honored as one of the best accommodations according to Booking.com, which reflects the level of service and excellence it provides.'], 'The most prominent landmarks:': ['Traditional Russian baths: The complex offers traditional steam baths with massage sessions using tree branches (Phoenic), which enhances the experience of relaxation and renewal.', 'Comfortable accommodation: Tsar Bani provides luxury rooms with panoramic views of the surrounding mountains with all modern amenities.', 'Integrated spa services: In addition to the bathrooms, the complex offers various massage sessions and cosmetic treatments using local natural products.'], 'working hours:': ['Tsar Bani works daily from 10:00 am until 10:00 pm, and it is advised to pre -book to ensure the availability of service, especially during the tourist peak season.']}","Tzar Bani in Judauri, Georgia, a luxury spa that offers traditional Russian baths with picturesque views of the Caucasus Mountains.",42.4695778,44.4801162,https://maps.app.goo.gl/RdQGqYY6srJW48Gg7,tourist place,2025-02-27T17:57:30.000000Z
467,76,Gudauri,Georgia,White Rabbit Snow Park,"{'Information:': ['White Rabit Snow Park is an ideal destination for winter sports fans and snow adventures as it provides spaces for skiing and skating amid picturesque landscapes.'], 'Historical importance:': ['It is one of the latest snow parks in the region as it was developed to enhance winter tourism and provide a unique experience for visitors.'], 'The most prominent landmarks:': ['Various skiing tracks suitable for all levels.', 'Skin areas for free skiing and ice skating.', ""A suitable environment for families with children's play areas.""], 'working hours:': ['Daily from 9:00 am to 6:00 pm.']}",White Rabit Snow Park is an ideal destination for ski lovers and provides various paths and a great winter atmosphere in Gudauri.,42.4926329,44.4931557,https://maps.app.goo.gl/Va2dPeygiRStmPA7A,tourist place,2025-02-27T16:18:33.000000Z
745,73,LONDON,United Kingdom,Pinto Tower Apartments,"{'Location': ['Pinto Tower Apartments, located in the heart of London, offering convenient access to key attractions and transport links.'], 'Services & Facilities': ['Spacious apartments with fully-equipped kitchens, modern furniture, en-suite bathrooms, and living areas.'], 'Nearby Attractions': ['Westminster Abbey', 'Hyde Park', 'Oxford Street', 'Covent Garden', 'The British Museum']}","Pinto Tower Apartments provide modern, self-catering accommodations with a central location, ideal for both short and extended stays.",51.4803195,-0.1287688,https://maps.app.goo.gl/DTxFb2S2vNS2epeYA,hotel,2025-02-27T15:14:38.000000Z
422,73,LONDON,United Kingdom,The Queen of Sheba Restaurant,"{'Info': ['An Ethiopian restaurant offering a wide range of traditional Ethiopian dishes in a welcoming environment.'], 'Restaurant Features': ['Cozy setting with a traditional Ethiopian ambiance and communal dining style.'], 'Main Dishes': ['Injera, Doro Wat (spicy chicken stew), Tibs, Kitfo, Vegetarian combinations, and traditional Ethiopian coffee.'], 'Working Hours': ['Monday - Sunday: 12:00 PM - 10:00 PM.']}","The Queen of Sheba offers authentic Ethiopian cuisine with a warm, communal dining experience.",51.5522629,-0.1408331,https://maps.app.goo.gl/AJgeXv6697AdwmNt6,restaurant,2025-02-27T15:08:10.000000Z
466,76,Gudauri,Georgia,Gudauri View Point,"{'Information:': ['Gudauri View Point is a high altitude, providing a picturesque panoramic view of the Caucasus Mountains.'], 'Historical importance:': ['It is a special location on the old silk road and is located near the Russian Georgian friendship built in 1983.'], 'The most prominent landmarks:': ['A charming view of the vicinity covered with snow and mountain peaks.', 'The memorial of friendship between Georgia and Russia with its unique design.', 'An ideal place to take pictures and enjoy snowy adventures.'], 'working hours:': ['Open 24 hours, it can be visited at any time.']}",Gudauri View Point provides a great panoramic view on the Caucasus Mountains and includes the Russian Georgian Monument.,42.4921171,44.4167581,https://maps.app.goo.gl/8yfBsZWibVLwAyj46,tourist place,2025-02-27T14:54:48.000000Z
420,73,LONDON,United Kingdom,AlMASKOOF ALIRAQI RESTAURANT,"{'Info': ['A restaurant offering authentic Iraqi cuisine, known for its flavorful grilled meats and traditional dishes.'], 'Restaurant Features': ['Cozy atmosphere with a focus on Iraqi decor and a casual dining experience.'], 'Main Dishes': ['Masgouf (grilled fish), Kebab, Tabbouleh, Samak Masgouf, Hummus, and Iraqi-style rice dishes.'], 'Working Hours': ['Monday - Sunday: 12:00 PM - 10:00 PM.']}","Al Maskoof Al Iraqui serves a variety of traditional Iraqi dishes, with a special focus on grilled fish and meats.",51.5150664,-0.1653157,https://maps.app.goo.gl/EMRabP2xMvWauoBM8,restaurant,2025-02-27T14:44:27.000000Z
419,73,LONDON,United Kingdom,Freej Swaileh Kuwaiti Food,"{'Info': ['A popular restaurant offering authentic Kuwaiti cuisine with a warm and inviting atmosphere.'], 'Restaurant Features': ['Traditional Kuwaiti decor, casual and family-friendly setting.'], 'Main Dishes': ['Machboos, hares, margooga, shawarma, kuwaiti-style Grilled meats, and desserts like baklava.'], 'Working Hours': ['Monday - Sunday: 12:00 PM - 11:00 PM.']}","Freej Swaileh serves traditional Kuwaiti dishes, known for their rich flavors and authentic taste.",51.4997363,-0.1638196,https://maps.app.goo.gl/huNwSKRxz2KP4o9NA,restaurant,2025-02-27T14:37:18.000000Z
418,73,LONDON,United Kingdom,Jacuzzi,"{'Info': ['An Italian fine-dining restaurant offering classic Italian cuisine in a sophisticated setting.'], 'Restaurant Features': ['Elegant and stylish decor with an upscale ambiance.'], 'Main Dishes': ['Pasta dishes (such as Carbonara, Bolognese), Pizza, Risotto, Tiramisu.'], 'Working Hours': ['Monday - Sunday: 12:00 PM - 10:00 PM.']}",Jacuzzi offers a premium Italian dining experience with a wide selection of authentic dishes and an elegant atmosphere.,51.5016858,-0.1920064,https://maps.app.goo.gl/5ZKS9aoptaxrAkv77,restaurant,2025-02-27T14:17:59.000000Z
417,73,LONDON,United Kingdom,Maroush Reastaurant,"{'Info': ['A popular Lebanese restaurant chain known for authentic flavors and traditional dishes.'], 'Restaurant Features': ['Stylish decor with a blend of modern and traditional Lebanese elements.'], 'Main Dishes': ['Shawarma, Hummus, Tabouleh, Grilled Lamb, Kebabs, Baklava.'], 'Working Hours': ['Monday - Sunday: 12:00 PM - 11:00 PM.']}",Maroush offers a vibrant Lebanese dining experience with a wide variety of flavorful dishes.,51.4934203,-0.1944427,https://maps.app.goo.gl/irRsXgry9jfmB9KU8,restaurant,2025-02-27T14:09:31.000000Z
416,73,LONDON,United Kingdom,Yasmin Restaurant,"{'Info': ['A charming Middle Eastern restaurant offering classic dishes and a warm ambiance.'], 'Restaurant Features': ['Cozy setting with traditional Middle Eastern decor.'], 'Main Dishes': ['Falafel, Shawarma, Kebabs, Moussaka, Baklava.'], 'Working Hours': ['Monday - Saturday: 12:00 PM - 10:00 PM, Sunday: Closed.']}","Cozy and inviting, serving delicious Middle Eastern dishes in a relaxed environment.",51.482216,-0.2134629,https://maps.app.goo.gl/TA838z78R2NPh5XVA,restaurant,2025-02-27T14:08:15.000000Z
414,73,LONDON,United Kingdom,Beirut Knightsbridge,"{'Info': ['Lebanese restaurant located in the heart of Knightsbridge, London.'], 'Restaurant Features': ['Elegant decor with a luxurious, contemporary atmosphere.'], 'Main Dishes': ['Shawarma, Hummus, Grilled Kebabs and Baklava.', 'Mezze (such as tabbouleh, Baba Ghaanoush, and Falafel).'], 'Working Hours': ['Monday - Saturday: 12:00 PM - 11:00 PM, Sunday: Closed.']}",Beirut Knightsbridge offers upscale Lebanese dining with a refined atmosphere and authentic flavors.,51.500228,-0.159164,https://maps.app.goo.gl/is1GVksabFBTh1QVA,restaurant,2025-02-27T13:55:21.000000Z
160,15,Tirana,Albania,Lahi industrial market,"{'Info': [""Tregu industrial 'Lhi' is a commercial market located in the 5 maji area of \u200b\u200bTirana, Albania."", 'It is one of the largest markets in the city, offering a wide range of products at competitive prices.'], 'Main Features': ['Variety of Products: The market offers a wide range of industrial and commercial products.', 'Competitive Prices: Known for offering affordable prices for consumers.'], 'Working Hours': ['Open from 5:00 AM to 2:00 PM.']}",A large commercial market in Tirana offering various products at affordable prices.,41.3406724,19.8270702,https://maps.app.goo.gl/UCYmPapPzJds37tf8,shop,2025-02-27T13:45:06.000000Z
159,15,Tirana,Albania,Gold Fiore florist Tirana,"{'Info': ['Gold Fiore Tirana is a florist specializing in natural flowers, offering a variety of bouquets and arrangements for different occasions.', 'Location: Rruga Dervish Hima, Nr. 4, Nd. 4, Tirana, Albania.'], 'Main Features': ['Product Range: Fresh flower bouquets, personalized arrangements, and gift boxes.', 'Services: Delivery service throughout Tirana.'], 'Working Hours': ['Open daily from 8:00 AM to 9:00 PM.']}",A florist offering a variety of natural flower arrangements and delivery services in Tirana.,41.3251184,19.8017428,https://maps.app.goo.gl/4qt99DbfxgewRYcCA,shop,2025-02-27T13:39:52.000000Z
158,15,Tirana,Albania,Emerald Mall & Residence,"{'Location': ['Rugu 5 water, Tirana, Albania.'], 'Main Features': ['Commercial center, residential apartments, dining options, parking.'], 'Main Shops': ['Fashion Stores: Clothing and accessory shops.', 'Electronics: Mobile phones, gadgets, and electronics stores.', 'Cosmetics: Beauty products and skincare shops.', 'Accessories: Jewelry, watches, and footwear stores.'], 'Working Hours': ['9:00 AM to 9:00 PM daily.']}","A mixed-use development with shopping, dining, and residential spaces in Tirana.",41.3412973,19.8222488,https://maps.app.goo.gl/jTUSQD8UF9phs7Lx5,shop,2025-02-27T13:31:56.000000Z
465,25,PRISTINA,Kosovo,RELOAD SHPK (Shooting range),"{'Location': ['Highway, prishtina.'], 'Key Features': ['Retail Store: Offers a variety of firearms and ammunition for purchase.', 'Shooting Range: Provides facilities for shooting practice.', 'Training Programs: Offers training sessions for individuals interested in learning about firearms safety and handling.'], 'Working Hours': ['Open daily from 9:00 AM to 10:00 PM.']}","A firearms retailer in Shkodër offering guns, ammo, a shooting range, and training programs.",42.5677153,21.1267939,https://maps.app.goo.gl/PZYT9rcPrWUTwMHUA,tourist place,2025-02-27T10:56:32.000000Z
413,17,Shkoder,Albania,Temali Restaurant,"{'Info': ['A traditional restaurant serving authentic Albanian cuisine in a warm and welcoming atmosphere.'], 'Restaurant Features': ['Cozy setting, friendly staff, affordable prices.'], 'Main Dishes': ['Grilled ribs, beef kebabs, Greek salad, mixed grilled meats, traditional stews.'], 'Working Hours': ['Monday-Wednesday & Friday-Sunday: 5:00 AM – 12:00 AM; Thursday: 5:00 AM – 11:00 PM.']}",A traditional spot offering delicious Albanian dishes in a cozy setting with great service.,42.0647285,19.5144019,https://maps.app.goo.gl/8ybGjJ5dFrCGdoTx9,restaurant,2025-02-27T02:06:38.000000Z
412,17,Shkoder,Albania,Genti Breakfast Restaurant,"{'Info': ['A popular breakfast spot known for its delicious traditional dishes and friendly service.'], 'Restaurant Features': ['Cozy atmosphere, attentive staff, affordable prices.'], 'Main Dishes': ['Traditional breakfasts with fresh vegetables, cheese, eggs, donut-like pancakes, fresh-squeezed juices.'], 'Working Hours': ['8:00 AM – 8:00 PM.']}",Renowned for its hearty breakfasts and welcoming service in a cozy setting.,42.0652256,19.5136638,https://maps.app.goo.gl/o5FnvsJw4yvS394SA,restaurant,2025-02-27T01:49:50.000000Z
411,17,Shkoder,Albania,Goje Gaditese,"{'Info': ['A catering service and café offering breakfast and event hosting.'], 'Restaurant Features': ['Cozy atmosphere, artistic décor, breakfast café, catering services.'], 'Main Dishes': ['Brioche, omelet with toast and avocado, specialty coffee, fresh juices, stuffed pastries.'], 'Working Hours': ['Daily from 7:00 AM to 10:00 PM.']}",An artistic café serving delicious breakfast and catering for various events.,42.0668779,19.5177164,https://maps.app.goo.gl/fEynvFecvoaNFW8z5,restaurant,2025-02-27T01:44:19.000000Z
410,17,Shkoder,Albania,Fisi Restaurant - Traditional Food,"{'Info': ['A restaurant focused on serving traditional Albanian cuisine.'], 'Restaurant Features': ['Rustic ambiance, family-friendly, cozy interior.'], 'Main Dishes': ['Fishta lamb, grilled meats, traditional stews, local cheeses.'], 'Working Hours': ['9:00 AM – 10:00 PM.']}","A great spot to enjoy authentic Albanian dishes in a warm, welcoming setting.",42.064756,19.5141311,https://maps.app.goo.gl/i2ciZ67QbXs8YHAN6,restaurant,2025-02-27T01:38:13.000000Z
409,17,Shkoder,Albania,Scutari Garden,"{'Info': ['A garden-themed restaurant offering a variety of dishes in a serene setting.'], 'Restaurant Features': ['Outdoor garden seating, lush greenery, family-friendly atmosphere.'], 'Main Dishes': ['Grilled meats, pizzas, traditional Albanian dishes, salads.'], 'Working Hours': ['10:00 AM – 11:00 PM.']}",A peaceful garden setting perfect for enjoying local and international cuisine.,42.0693749,19.5122547,https://maps.app.goo.gl/4CNSjHkZu8Ad8KjQA,restaurant,2025-02-27T01:34:20.000000Z
408,17,Shkoder,Albania,Tramonto Restaurant,"{'Info': ['An elegant Italian restaurant offering a refined dining experience.'], 'Restaurant Features': ['Stylish décor, wine selection, outdoor terrace with views.'], 'Main Dishes': ['Pasta, pizza, seafood, steaks.'], 'Working Hours': ['12:00 pm - 10:00 pm.']}",A charming spot for Italian cuisine with a beautiful sunset view.,42.0675665,19.4211443,https://maps.app.goo.gl/kNFZSyUDGZjkGWrs8,restaurant,2025-02-27T01:29:23.000000Z
406,17,Shkoder,Albania,Aroma Restorant,"{'Info': ['A popular restaurant serving traditional Albanian dishes.'], 'Restaurant Features': ['Warm atmosphere, indoor and outdoor seating, live music.'], 'Main Dishes': ['Grilled meats, seafood, traditional Albanian stews, salads.'], 'Working Hours': ['10:00 AM – 11:00 PM.']}",Known for its authentic Albanian flavors and welcoming environment.,42.0673039,19.5121203,https://maps.app.goo.gl/7XxoPX4GCBQqU4jM9,restaurant,2025-02-27T01:23:15.000000Z
405,17,Shkoder,Albania,Stolia Coffeehouse & Brunch,"{'Info': ['A cozy café offering coffee, brunch, and light meals.'], 'Restaurant Features': ['Casual ambiance, outdoor seating, coffee bar.'], 'Main Dishes': ['Breakfast bowls, sandwiches, pastries, specialty coffees.'], 'Working Hours': ['8:00 AM – 7:00 PM.']}",A perfect place for brunch with a great selection of coffee and light bites.,42.067296,19.5121203,https://maps.app.goo.gl/sorx8QPihn6yvGpq7,restaurant,2025-02-27T01:18:13.000000Z
404,17,Shkoder,Albania,PURI,"{'Info': ['A contemporary eatery offering a variety of delicious dishes.'], 'Restaurant Features': ['Modern design, comfortable atmosphere, casual dining.'], 'Main Dishes': ['Pizza, pasta, grilled meats, seafood.'], 'Working Hours': ['12:00 pm - 11:00 pm.']}",Trendy spot for Italian and Mediterranean flavors with a relaxed vibe.,42.06929,19.5052401,https://maps.app.goo.gl/hoxKWjbYHao2Ronm6,restaurant,2025-02-27T01:14:38.000000Z
464,83,Kruja,Albania,Gamti Mountain,"{'Info': ['A picturesque mountain located near Krujë, known for its hiking trails and natural beauty.', 'The mountain has been a part of the historical landscape of Krujë, offering a vantage point for defense during various conflicts.'], 'Key Features': ['Scenic hiking routes with views of the surrounding valleys and the Adriatic Sea.', 'Flora and fauna unique to the region.', 'Peaceful environment for nature lovers.'], 'Working Hours': ['Open year-round; best visited during daylight hours.']}","A peaceful mountain offering stunning views, hiking trails, and natural beauty.",41.448247,19.8611654,https://maps.app.goo.gl/ajq7xef37HinoSFy7,tourist place,2025-02-27T01:03:06.000000Z
463,83,Kruja,Albania,Kruja bazaar,"{'Info': ['A historic market located near the Kruja Castle, offering a variety of traditional Albanian products.'], 'Historical Importance': ['Established during the Ottoman era, it was once a major trading hub for local goods and crafts.'], 'Key Features': ['Cobblestone streets with small shops selling souvenirs and crafts.', 'Traditional Albanian textiles, jewelry, and woodwork.', 'Cafés and restaurants offering local dishes.'], 'Working Hours': ['Open daily; shop hours may vary, typically from 09:00 to 18:00.']}",A charming Ottoman-era bazaar offering authentic Albanian crafts and souvenirs.,41.5092777,19.7920197,https://maps.app.goo.gl/hS7UeDndSEJ8JZok7,tourist place,2025-02-27T00:55:51.000000Z
462,83,Kruja,Albania,Sari Salltics,"{'Info': ['A sacred hilltop shrine dedicated to the Sufi saint Sari Salltik, offering panoramic views of Kruja.'], 'Historical Importance': ['The shrine is an important spiritual site for both Muslims and Christians in the region, linked to local religious traditions.'], 'Key Features': ['Peaceful setting with a small mosque and tomb.', 'Panoramic views of Kruja and the surrounding landscape.', 'Pilgrimage site for locals and visitors alike.'], 'Working Hours': ['Open daily, but best visited during daylight hours.']}","A serene shrine offering views and spiritual significance, with historical and cultural importance.",41.5170005,19.7997784,https://maps.app.goo.gl/urt5NofAEEcYPX5y5,tourist place,2025-02-27T00:45:01.000000Z
461,83,Kruja,Albania,Ethnographic Museum of Kruja,"{'Info': ['A museum located in a traditional house, showcasing the cultural and historical heritage of Kruja and Albania.'], 'Historical Importance': ['Housed in a 19th-century Ottoman-era building, it represents the traditional Albanian way of life.'], 'Key Features': ['Exhibits of traditional Albanian costumes, tools, and household items.', 'Authentic displays of rural life from the 18th and 19th centuries.', 'Traditional wooden architecture and furnishings.'], 'Working Hours': ['Typically open daily, 09:00 – 18:00 (hours may vary by season).']}",A cultural museum showcasing the traditional Albanian way of life and Kruja’s history.,41.5065558,19.7910957,https://maps.app.goo.gl/dkrqcVcoXsuW2VYp8,tourist place,2025-02-26T23:59:19.000000Z
460,83,Kruja,Albania,Gjergj Kastrioti National Museum (Skanderbeg Museum),"{'Info': ['A museum dedicated to Albania’s national hero, Skanderbeg, located within Kruja Castle.'], 'Historical Importance': ['Showcases the life and battles of Skanderbeg, who led Albania’s resistance against the Ottoman Empire in the 15th century.'], 'Key Features': ['Exhibits of medieval weapons, armor, and documents.', 'Large murals depicting Skanderbeg’s battles.', 'Stunning views of the surrounding mountains.'], 'Working Hours': ['Typically open daily, 09:00 – 18:00 (hours may vary by season).']}","A historical museum honoring Albania’s greatest hero, Skanderbeg.",41.5075408,19.7914732,https://maps.app.goo.gl/Fa7RgQK2n9pZMGZ7A,tourist place,2025-02-26T23:44:14.000000Z
459,83,Kruja,Albania,Castle of Kruja,"{'Info': ['A historic medieval fortress offering stunning views and home to the Skanderbeg Museum.'], 'Historical Importance': ['A key stronghold of national hero Skanderbeg, who defended Albania from the Ottomans in the 15th century.'], 'Key Features': ['Skanderbeg Museum showcasing Albania’s resistance.', 'Ethnographic Museum with traditional Albanian artifacts.', 'Well-preserved castle walls and scenic viewpoints.'], 'Working Hours': ['Typically open daily, 09:00 – 18:00 (hours may vary by season).']}",A historic fortress and museum symbolizing Albania’s fight for independence.,41.5073294,19.7918298,https://maps.app.goo.gl/q3TEXtnvDYjp74GXA,tourist place,2025-02-26T23:30:53.000000Z
