id,city_id,city_name,country_name,name,description,short_description,latitude,longitude,location,type,created_at
247,71,Pattaya,Thailand,‏Sahara Restaurant (Halal),"{'Information': ['Sahara Restaurant is a well-known Middle Eastern and Mediterranean dining spot in Pattaya, offering a diverse menu of Arabic, Lebanese, and Turkish dishes. With its elegant decor and relaxed atmosphere, it’s a favorite among halal food lovers.'], 'Restaurant Features': ['Specializes in Middle Eastern and Mediterranean cuisine.', 'Elegant and comfortable dining ambiance.', 'Offers a variety of halal-certified dishes.', 'Serves shisha with different flavors.'], 'Main Dishes': ['Baklava & Arabic Coffee.', 'Lamb Mansaf with Yogurt Sauce.', 'Shawarma Wraps with Garlic Sauce.', 'Hummus with Freshly Baked Pita Bread.', 'Mixed Grill Platter with Lamb & Chicken Kebab.'], 'Working Hours': ['Open daily from 12:00 PM to 2:00 AM.']}","A stylish Middle Eastern restaurant in Pattaya serving authentic Arabic, Lebanese, and Turkish dishes in a relaxed setting.",12.9228619,100.8715553,https://maps.app.goo.gl/yffXbHYte394vnXd8,restaurant,2025-02-11T13:38:23.000000Z
246,71,Pattaya,Thailand,Tarka House Indian Restaurant,"{'Information': ['Tarka House Indian Restaurant is a popular spot in Pattaya offering authentic Indian cuisine with rich flavors and traditional recipes. Known for its warm hospitality and vibrant atmosphere, it’s a great choice for lovers of Indian food.'], 'Restaurant Features': ['Specializes in North and South Indian cuisine.', 'Cozy and family-friendly ambiance.', 'Uses fresh, high-quality spices and ingredients.', 'Offers vegetarian and non-vegetarian options.'], 'Main Dishes': ['Butter Chicken with Garlic Naan.', 'Paneer Tikka Masala.', 'Lamb Rogan Josh.', 'Mango Lassi & Gulab Jamun.'], 'Working Hours': ['Open daily from 11:00 AM to 11:00 PM.']}",A cozy Indian restaurant in Pattaya serving authentic North and South Indian dishes with rich flavors and warm hospitality.,12.927614,100.8738356,https://maps.app.goo.gl/r6TAJkdX1rBdLsQB8,restaurant,2025-02-11T13:31:29.000000Z
435,69,Batumi,Georgia,Ramada Plaza by Wyddham Batumi,"{'Location': ['The Ramada Plaza Hotel from Winddam Batumi is located on Chrashava 8th Street, Batumi, Georgia, about 8 kilometers from Batumi International Airport, making it a suitable location for travelers.'], 'Facilities and services:': ['Restaurants and bars: The hotel includes the ""Mana"" restaurant, which serves Georgian and international cuisine, as well as a bar and lounge to serve drinks and snacks.', 'Fitness and Spa Center: The hotel provides a fitness center, an internal swimming pool, and a spa resort with a sauna, allowing guests to relax and health care.', 'Casino: The hotel has a entertainment casino.', 'Additional services: Additional services include 24 -hour room service, free Wi -Fi, and business center.'], 'Types of rooms:': [""Standard rooms with King's bed or twin with views of the city or the sea."", ""Junior wings with King's bed with views of the city or the sea."", ""Executive wings with King's bed with views of the city or the sea.""], 'Near tourist places:': ['Batumi Beach: It is a short walk away, where guests can enjoy the sea and the beautiful walking.', 'Dancing Fountain: It is located about 0.2 miles, and it is a famous attraction in the city.', ""Ali and Nino's statue: One of the prominent cultural features in Batumi."", 'Patumi Vegetable Garden: A perfect place for nature lovers.']}","Ashes, Plaza Batumi, is located near the tourist attractions, and it includes restaurants, a swimming pool, a spa, and rooms equipped with great looks.",41.6396612,41.6142759,https://maps.app.goo.gl/FmChsBr74yVRnKtV6,hotel,2025-02-11T13:15:46.000000Z
245,68,Chiang Mai,Thailand,Takawa Cuisine (Halal),"{'Information': ['Takawa Halal Cuisine is an elegant halal restaurant in Chiang Mai, offering a mix of Thai, Japanese, and international dishes. Known for its high-quality ingredients and refined presentation, it provides a premium dining experience for halal food lovers.'], 'Restaurant Features': ['Specializes in Thai, Japanese, and international halal cuisine.', 'Elegant and modern dining ambiance.', 'Uses high-quality halal-certified ingredients.', 'Family-friendly with a welcoming atmosphere.'], 'Main Dishes': ['Wagyu Beef Sukiyaki (Halal).', 'Massaman Curry with Lamb.', 'Pad Thai with Tiger Prawns.', 'Mango Sticky Rice with Coconut Cream.'], 'Working Hours': ['Open daily from 11:00 AM to 10:00 PM.']}","A premium halal restaurant in Chiang Mai offering Thai, Japanese, and international cuisine in an elegant and modern setting.",18.7650157,98.9902207,https://maps.app.goo.gl/KN2mpV67fDSpwg7DA,restaurant,2025-02-11T13:13:38.000000Z
244,68,Chiang Mai,Thailand,"Freerolls Restaurant, Sports Bar and Beer Garden","{'Information': [""Freerolls is a lively sports bar and restaurant in Chiang Mai, offering a mix of Western comfort food and Thai favorites. With big screens for live sports, a spacious beer garden, and a relaxed atmosphere, it's a great spot for casual dining and social gatherings.""], 'Restaurant Features': ['Wide selection of local and imported beers.', 'Serves a mix of Western and Thai cuisine.', 'Spacious beer garden with a relaxed outdoor setting.', 'Sports bar with multiple screens for live games.'], 'Main Dishes': ['Ice-Cold Craft Beers & Cocktails.', 'Buffalo Chicken Wings with Blue Cheese Dip.', 'Pad Kra Pao (Spicy Thai Basil Stir-Fry).', 'Classic Cheeseburger & Fries.', 'Buffalo Chicken Wings with Blue Cheese Dip.'], 'Working Hours': ['Open daily from 12:00 PM to 12:00 AM.']}",A vibrant sports bar and beer garden in Chiang Mai serving Western and Thai comfort food with live sports and great drinks.,18.7967841,99.0220526,https://maps.app.goo.gl/4s7Zw1184yhs27KH6,restaurant,2025-02-11T13:00:44.000000Z
243,68,Chiang Mai,Thailand,Pizza My Heart,"{'Information': ['cozy and casual pizzeria in Chiang Mai’s trendy Nimman area, known for its handcrafted, wood-fired pizzas made with fresh ingredients. It offers a warm and welcoming atmosphere, perfect for pizza lovers.'], 'Restaurant Features': ['Uses high-quality, fresh ingredients and homemade dough.', 'Offers vegetarian and vegan pizza options.', 'Casual and cozy setting with a friendly vibe.', 'Specializes in wood-fired, handcrafted pizzas.'], 'Main Dishes': ['Tiramisu & Italian Gelato.', 'BBQ Chicken Pizza with Homemade Sauce.', 'Pepperoni & Mozzarella Pizza.', 'Margherita Pizza with Fresh Basil.'], 'Working Hours': ['Open daily from 12:00 PM to 10:00 PM.']}","A cozy pizzeria in Nimman serving wood-fired, handcrafted pizzas with fresh ingredients in a casual and friendly setting.",18.7979556,98.9674807,https://maps.app.goo.gl/uvQ1wm54zgEysr7t5,restaurant,2025-02-11T12:51:23.000000Z
242,68,Chiang Mai,Thailand,Bodhi Terrace,"{'Information': ['Bodhi Terrace is an elegant riverside restaurant in Chiang Mai, offering a refined take on traditional Thai cuisine. With its peaceful setting along the Ping River, it provides a luxurious yet relaxed dining experience, perfect for special occasions or romantic dinners.'], 'Restaurant Features': ['Uses fresh, high-quality local ingredients.', 'Elegant and spacious open-air dining area.', 'Scenic riverside location with a serene ambiance.', 'Specializes in upscale Thai cuisine with modern presentation.'], 'Main Dishes': ['Mango Sticky Rice with Coconut Sorbet.', 'Tom Yum Goong with Fresh Seafood.', 'Crispy Soft-Shell Crab with Tamarind Sauce.', 'Slow-Cooked Beef Massaman Curry.'], 'Working Hours': ['Open daily from 11:30 AM to 10:00 PM.']}",A refined riverside restaurant offering upscale Thai cuisine in a peaceful and elegant setting along the Ping River.,18.7816008,99.0011312,https://maps.app.goo.gl/4gzfhGGGqScV6kUHA,restaurant,2025-02-11T11:47:54.000000Z
241,68,Chiang Mai,Thailand,Choei Cafe & Bistro,"{'Information': ['Choei Cafe & Bistro is a stylish yet cozy café in Chiang Mai, offering a mix of Thai and Western cuisine with a focus on fresh, high-quality ingredients. With its relaxed ambiance and beautifully plated dishes, it’s a great spot for casual dining and coffee lovers.'], 'Restaurant Features': ['Serves a fusion of Thai and Western cuisine.', 'Modern and cozy ambiance with a welcoming atmosphere.', 'Specialty coffee, fresh juices, and homemade desserts.', 'Ideal for brunch, lunch, and relaxed dining.'], 'Main Dishes': ['Thai Iced Coffee & Homemade Cakes.', 'Spaghetti with Spicy Thai Basil Sauce.', 'Grilled Chicken Caesar Salad.', 'Eggs Benedict with Smoked Salmon.'], 'Working Hours': ['Open daily from 9:00 AM to 9:00 PM.']}","A stylish café and bistro serving Thai and Western fusion cuisine with great coffee and a cozy, modern ambiance.",18.779137,98.9970917,https://maps.app.goo.gl/cJJ8475N1TjsGgyU7,restaurant,2025-02-11T11:35:45.000000Z
240,68,Chiang Mai,Thailand,Jarid Thai Food | Fine Wines,"{'Information': ['Jarid is an elegant restaurant offering a refined take on traditional Thai cuisine, paired with a curated selection of fine wines. The restaurant blends authentic flavors with modern presentation in a stylish and sophisticated setting.'], 'Restaurant Features': ['Specializes in upscale Thai cuisine with a modern touch.', 'Extensive selection of fine wines to complement dishes.', 'Elegant and stylish ambiance, ideal for fine dining.', 'Uses high-quality, fresh, and locally sourced ingredients.'], 'Main Dishes': ['Grilled River Prawns with Tamarind Sauce.', 'Slow-Cooked Massaman Beef Curry.', 'Grilled River Prawns with Tamarind Sauce.'], 'Working Hours': ['Open daily from 11:30 AM to 10:00 PM.']}",A refined Thai restaurant offering elegant dishes paired with fine wines in a stylish and sophisticated setting.,18.799104,98.966098,https://maps.app.goo.gl/RKZfh6PBLfE5tc9M7,restaurant,2025-02-11T11:26:51.000000Z
239,68,Chiang Mai,Thailand,JEAB Cafe & Thai Food,"{'Information': ['JEAB Café & Thai Food is a cozy and welcoming eatery in Chiang Mai, serving authentic Thai dishes alongside great coffee and fresh juices. It’s a popular spot for locals and travelers looking for home-style Thai flavors in a relaxed setting.'], 'Restaurant Features': ['Specializes in traditional Thai cuisine with fresh ingredients.', 'Cozy and casual café-style ambiance.', 'Serves freshly brewed coffee, teas, and fruit smoothies.', 'Affordable prices with generous portions.'], 'Main Dishes': ['Homemade Thai Iced Tea & Mango Sticky Rice.', 'Green Curry with Chicken.', 'Tom Kha Gai (Coconut Chicken Soup).', 'Pad Thai with Prawns.'], 'Working Hours': ['Open daily from 8:00 AM to 8:00 PM.']}","A cozy café serving home-style Thai dishes, fresh coffee, and fruit juices in a relaxed and friendly setting.",18.7963565,98.9657457,https://maps.app.goo.gl/CNC1XQmwveAgTVAR7,restaurant,2025-02-11T10:51:07.000000Z
238,68,Chiang Mai,Thailand,Pakorn's Kitchen,"{'Information': ['Pakorn’s Kitchen is a charming, family-run restaurant in Chiang Mai, known for its authentic Thai flavors and warm hospitality. It serves classic Thai dishes made with fresh, locally sourced ingredients in a cozy and welcoming atmosphere.'], 'Restaurant Features': ['Specializes in authentic home-style Thai cuisine.', 'Cozy, family-friendly atmosphere with warm service.', 'Uses fresh, locally sourced ingredients.', 'Affordable prices with generous portions.'], 'Main Dishes': ['Pad Thai with Prawns.', 'Tom Yum Goong (Spicy shrimp soup).', 'Massaman Curry with Chicken.', 'Mango Sticky Rice with Coconut Milk.'], 'Working Hours': ['Open daily from 10:30 AM to 9:00 PM.']}","A cozy, family-run Thai restaurant in Chiang Mai offering authentic home-style dishes with fresh ingredients and warm hospitality.",18.7810602,98.9921183,https://maps.app.goo.gl/LBhW55EbwB3P6hmm9,restaurant,2025-02-11T10:40:20.000000Z
237,68,Chiang Mai,Thailand,Italics Restaurant,"{'Information': ['Italics Restaurant is a stylish Italian eatery in Chiang Mai, known for its modern take on classic Italian cuisine. Using fresh, high-quality ingredients, it offers a mix of traditional flavors with contemporary presentation in a sleek and elegant setting.'], 'Restaurant Features': ['Specializes in modern Italian cuisine with a creative twist.', 'Elegant and contemporary ambiance with a warm atmosphere.', 'Uses fresh, locally sourced, and imported ingredients.', 'Offers a great selection of wines and craft cocktails.'], 'Main Dishes': ['Truffle Mushroom Pizza.', 'Homemade Burrata & Heirloom Tomato Salad.', 'Lobster Fettuccine Alfredo.', 'Classic tyramise & expressing Martini.'], 'Working Hours': ['Open daily from 11:00 AM to 11:00 PM.']}","A modern Italian restaurant in Chiang Mai offering creative, high-quality dishes with a stylish and elegant dining experience.",18.7972633,98.96682,https://maps.app.goo.gl/XrTwRw4h977xFfQq8,restaurant,2025-02-11T10:32:42.000000Z
236,68,Chiang Mai,Thailand,B Samcook Home16,"{'Information': ['B Samcook Home 16 is an intimate fine-dining restaurant in Chiang Mai offering a unique fusion of Thai and international flavors. With a personalized dining experience and creative tasting menus, it’s a hidden gem for food lovers.'], 'Restaurant Features': ['Specializes in Thai fusion cuisine with a creative touch.', 'Cozy, home-style setting with an intimate atmosphere.', 'Personalized service and chef’s tasting menus.', 'Perfect for special occasions and fine dining experiences.'], 'Main Dishes': ['Slow-Cooked Pork Belly with Spiced Curry.', 'Lobster Tom Yum Soup.', 'Grilled Wagyu Beef with Tamarind Reduction.', 'Seared Scallops with Thai Herb Sauce.'], 'Working Hours': ['Open daily from 6:00 PM to 10:00 PM (Reservation recommended).']}",An intimate fine-dining restaurant offering creative Thai fusion cuisine with a personalized and exclusive experience.,18.7765884,98.9913222,https://maps.app.goo.gl/HF5kWzi2V8au2QcA9,restaurant,2025-02-11T10:20:57.000000Z
235,68,Chiang Mai,Thailand,Hummus Chiang Mai (Halal),"{'Information': ['Hummus Chiang Mai is a cozy Middle Eastern restaurant specializing in fresh, homemade hummus, falafel, and other Mediterranean delights. It’s a popular spot for vegetarians and those seeking authentic, healthy meals.'], 'Restaurant Features': ['Specializes in Middle Eastern and Mediterranean cuisine.', 'Cozy and casual setting with a warm atmosphere.', 'Great selection of vegetarian and vegan dishes.', 'Uses fresh, high-quality ingredients.'], 'Main Dishes': ['Classic Hummus with Pita Bread.', 'Shakshuka (Poached eggs in spicy tomato sauce).', 'Grilled Halloumi Salad.', 'Baba Ganoush & Freshly Baked Pita.'], 'Working Hours': ['Open daily from 11:00 AM to 9:00 PM.']}","A cozy Middle Eastern restaurant in Chiang Mai serving fresh hummus, falafel, and Mediterranean dishes in a relaxed setting.",18.7890963,98.990244,https://maps.app.goo.gl/ghA2CFsPhVUcFqqC8,restaurant,2025-02-11T10:12:30.000000Z
234,68,Chiang Mai,Thailand,Baan Buri Café & Restaurant,"{'Information': ['Baan Buri Café & Restaurant is a tranquil spot in Chiang Mai offering a mix of Thai and Western dishes made with fresh, locally sourced ingredients. With its lush greenery and peaceful atmosphere, it’s a great place to relax and enjoy a meal.'], 'Restaurant Features': ['Serves a mix of traditional Thai and Western cuisine.', 'Peaceful garden setting with a cozy and relaxing ambiance.', 'Uses fresh, organic, and locally sourced ingredients.', 'Ideal for breakfast, brunch, and casual dining.'], 'Main Dishes': ['Avocado & Egg Toast.', 'Pad Thai with Prawns.', 'Pumpkin Soup & Fresh Salad.', 'Homemade Cakes & Herbal Teas.', 'Thai Green Curry with Chicken.'], 'Working Hours': ['Open daily from 8:30 AM to 9:00 PM.']}","A peaceful garden café offering Thai and Western dishes with fresh ingredients in a cozy, nature-inspired setting.",18.7885644,98.9804975,https://maps.app.goo.gl/D7CaaTxsVW1oW8g5A,restaurant,2025-02-11T10:05:53.000000Z
233,68,Chiang Mai,Thailand,Cafe de thaan aoan,"{'Information': ['Café de Thaan Aoan is a charming café in Chiang Mai, known for its cozy atmosphere, great coffee, and a mix of Thai and Western comfort food. It’s a perfect spot for breakfast, brunch, or a relaxing coffee break.'], 'Restaurant Features': ['Serves a variety of Thai and Western dishes.', 'Cozy, vintage-style café with a relaxed ambiance.', 'Excellent coffee, tea, and fresh smoothies.', 'Great for breakfast, brunch, and casual dining.'], 'Main Dishes': ['Mango Sticky Rice Pancakes.', 'Homemade Granola with Yogurt.', 'Iced Thai Tea & Cappuccino.'], 'Working Hours': ['Open daily from 8:00 AM to 4:00 PM.']}","A cozy café with vintage charm, offering Thai and Western comfort food, great coffee, and a relaxed atmosphere.",18.785576,98.9858356,https://maps.app.goo.gl/W95sxZxoPPhevZrv9,restaurant,2025-02-11T09:59:00.000000Z
232,68,Chiang Mai,Thailand,Reform Café - Vegan Garden Restaurant,"{'Information': ['Reform Kafé is a peaceful, garden-style vegan restaurant in Chiang Mai, offering a variety of plant-based Thai and international dishes. It is known for its fresh, organic ingredients and flavorful vegan-friendly meals.'], 'Restaurant Features': ['100% vegan and plant-based menu.', 'Relaxing garden setting with a cozy, eco-friendly atmosphere.', 'Uses fresh, organic, and locally sourced ingredients.', 'Great selection of smoothies and fresh juices.'], 'Main Dishes': ['Jackfruit Massaman Curry.', 'Tofu & Mushroom Larb (Spicy Thai salad).', 'Pumpkin Coconut Soup.', 'Banana Pancakes with Coconut Cream.'], 'Working Hours': ['Open daily from 11:00 AM to 9:30 PM.']}","A tranquil vegan restaurant with a lush garden setting, serving delicious plant-based Thai and international dishes.",18.794542,98.9817209,https://maps.app.goo.gl/Mqc5nDNyQQHVpmH67,restaurant,2025-02-11T09:52:46.000000Z
231,68,Chiang Mai,Thailand,Tikky Cafe,"{'Information': ['Tikky Café is a vibrant and popular restaurant known for its authentic Thai food, fresh ingredients, and colorful tropical atmosphere. It offers a relaxed and friendly dining experience, making it a favorite among locals and tourists.'], 'Restaurant Features': ['Specializes in authentic, home-style Thai cuisine.', 'Lush, tropical-themed décor with a laid-back ambiance.', 'Affordable prices with generous portions.', 'Fresh fruit juices and smoothies available.'], 'Main Dishes': ['Pad Thai with Shrimp.', 'Massaman Curry with Beef.', 'Pineapple Fried Rice.', 'Green Curry with Chicken.', 'Mango Sticky Rice & Fresh Smoothies.'], 'Working Hours': ['Open daily from 10:00 AM to 9:00 PM.']}",A lively and colorful Thai restaurant serving authentic dishes in a tropical garden setting with a relaxed vibe.,18.7913896,98.9794132,https://maps.app.goo.gl/hTa3FbXhSuxeFwr39,restaurant,2025-02-11T09:41:57.000000Z
230,66,Tbilisi,Georgia,Tiffany Bar and Terrace Tbilisi,"{'Information:': ['It is a high -end bar and restaurant in the heart of the capital, Tbilisi, offers a distinctive dining experience with a great view of the city.'], 'Restaurant features:': ['Beautiful view: The restaurant has a wide balcony that provides stunning views of the city of Tbilisi.', 'Modern decor: elegant interior design that combines luxury and comfort.', 'A calm atmosphere: provides a quiet place to relax or for private meetings.'], 'Main dishes:': ['Traditional Georgian cuisine: such as Al -Khanakali and the bread.', 'Global cuisine: The menu varies to include dishes from European cuisine.', 'Drinks: A group of various cocktails and luxury drinks.'], 'working hours:': ['From Sunday to Thursday: from 10:00 am to 12:00 midnight', 'Friday and Saturday: from 10:00 am to 2:00 am']}",The restaurant offers an upscale atmosphere and a beautiful view with various foods and drinks,41.701853,44.7972877,https://maps.app.goo.gl/4u3A2LqhSfFhXZm36,restaurant,2025-02-10T19:48:57.000000Z
229,66,Tbilisi,Georgia,Unfound Door Restaurant,"{'Information:': ['It is considered one of the unique restaurants in Tbilisi, as it is characterized by providing an unconventional dining experience that combines global components and the original Georgian flavors in an elegant and luxurious atmosphere'], 'Main Features:': ['Innovative concept: The restaurant is characterized by the concept of food supply in an unconventional way, as it creates a unique experience for every visitor.', 'Fresh ingredients: The restaurant is keen to use fresh and high -quality ingredients in all its dishes.', 'Luxurious decoration: a modern and elegant interior design creates a sophisticated environment for visitors.'], 'Main dishes:': ['Luxury meat dishes: The restaurant offers a variety of fresh and local meat dishes, with various options of preparation.', 'Modern Georgian cuisine: offers a mixture of traditional Georgian dishes that have been modified in a modern style.', 'Distinctive appetizers and drinks: a group of unique appetizers and innovative drinks that complement the dining experience.'], 'Tips for the visit:': ['Check the Special Dishes menu: The restaurant offers seasonal and special dishes, so it is best to see the renewed menu.', 'Preparation: Given high order, it is preferable to reserve in advance for the best experience.']}","""UNFOUND Door"" restaurant offers an innovative dining experience with fresh ingredients and modern Georgian dishes in an elegant atmosphere.",41.7127209,44.7935427,https://maps.app.goo.gl/LT2UZ4QjMy5Ao6oPA,restaurant,2025-02-10T19:40:26.000000Z
289,66,Tbilisi,Georgia,Jumah Mosque,"{'Information:': ['Friday Mosque is a historical mosque located in the heart of the old city of Tbilisi.'], 'Main Features:': ['Architectural design: The mosque is characterized by its luxurious design, which reflects the cultural history of Muslims in the region.', 'Location: It is located in a historical area, allowing visitors to enjoy the spiritual and historical atmosphere.', 'Calm and tranquility: The mosque provides a quiet environment for prayer and meditation.'], 'Main stores:': ['Handicraft stores: In the area around the mosque, many stores that sell Georgian handicrafts can be found.', 'Souvenir stores: There are shops that sell Islamic and Georgian souvenirs, including carpets and statues.'], 'Visit Tips:': ['Respecting religious values: When visiting the mosque, be sure to respect religious customs, especially when praying.', 'Suitable outfit: You should wear decent clothes when entering the mosque.', 'Explore the area: After visiting the mosque, you can wander in the old city and explore other nearby monuments such as Narikala Castle.']}",‪Jumah Mosque‬ in Tbilisi is a historical mosque that combines Islamic and traditional Georgian elements.,41.6872805,44.8074844,https://maps.app.goo.gl/RvJKDq7AoKUqRstc6,tourist place,2025-02-10T19:26:19.000000Z
288,66,Tbilisi,Georgia,‪Old Town Tbilisi‬,"{'Information:': ['The old city of Tbilisi is one of the most prominent tourist destinations in Georgia.'], 'Main Features:': ['Tourist attractions: The old city includes many historical monuments such as sulfur baths, Metekhi Church, and Narikala Castle.', 'Traditional architecture: Old houses with carved wooden windows and sloping surfaces attest to the Georgian architectural style.', 'Unique atmosphere: the traditional and vital atmosphere that makes it an ideal place to explore ancient Georgian life.'], 'Main stores:': ['Handicraft stores: The old city offers many stores that sell Georgian handicrafts such as carpets and statues.', 'Souvenir stores: Summary shops offer gifts and traditional Georgian products.', 'Restaurants and cafes: visitors can enjoy traditional Georgian cuisine in many restaurants and cafes scattered in the region.'], 'Visit Tips:': ['Walk on foot: The old city is an ideal place for exploration on foot, where you can enjoy tight streets and historical monuments.', 'Visiting sulfur baths: Do not miss the opportunity to relax in the famous sulfur baths in the old city.', 'Respect local customs: The old city is full of locals who express Georgian culture, so it is important to respect customs and traditions.']}",The old city of Tbilisi is characterized by its narrow streets and historical monuments such as sulfur baths.,41.6981359,44.7428234,https://maps.app.goo.gl/eGQ5jzK6Xo4ViJoP8,tourist place,2025-02-10T19:15:10.000000Z
287,66,Tbilisi,Georgia,St. George Cathedral of Tbilisi,"{'Information:': ['The St. George Charity is one of the most prominent religious landmarks in Tbilisi.'], 'Main Features:': ['Architectural style: The Cathedral is characterized by its unique design that mixes the traditional Georgian style and religious decorations.', 'History: The Cathedral is an important historical center, and it is a symbol of Georgian culture and faith.', 'Location: It is located on a hill overlooking the city, providing a great view of Tbilisi.'], 'Main stores:': ['Religious souvenirs: There are shops that sell statues and souvenirs linked to the Charity and Religion.', 'Religious Books stores: Book stores related to Christian and Georgian religion.'], 'Visit Tips:': ['A visit in the morning: to enjoy calm and tranquility during prayer.', 'Explore the surrounding areas: Enjoy beautiful views of the city from the Cathedral Hill.', 'Respecting the place: Since the Cathorus is a place for worship, it is better to respect local customs and traditions during the visit.']}",St. George in Tbilisi is a historical religious teacher characterized by its unique design and wonderful view of the city.,41.6904769,44.805847,https://maps.app.goo.gl/Q7JYErvEjuhaoERu5,tourist place,2025-02-10T19:07:54.000000Z
