id,city_id,city_name,country_name,name,description,short_description,latitude,longitude,location,type,created_at
600,94,Khujand,Tajikistan,Kamoli khujandi park,"{'Information:': ['Kamouli Khujandi Park is one of the most prominent public parks in Khajnd, Tajikistan and is located in the heart of the city and is an ideal place to relax and spend fun time with family and friends.'], 'Main Features:': ['Large areas of green spaces', 'Various trees and plants', 'For children dedicated to areas', 'Small lakes or beautiful water pools', 'Places to relax and walk', 'Statues and fountains add beauty to the garden', 'A central site is easy to access'], 'Tips for the visit:': ['Visit the park early in the morning or in the evening to enjoy a quiet atmosphere.', 'Wear comfortable clothes, especially if you are planning to walk or exercise.', 'Take some snacks and drinks to relax in green spaces.', 'Make sure there is a suitable place for children in the garden to play.', 'Enjoy the space of picnics with friends or family.']}",Kamouli Khujandi Park in Khajand provides beautiful green spaces and a calm atmosphere for relaxation.,40.2875684,69.6126883,https://maps.app.goo.gl/eVimbQNFYVdZ7ANw6,tourist place,2025-03-11T04:24:42.000000Z
178,94,Khujand,Tajikistan,Panjshanbe Bazaar,"{'Location:': ['Panjshanbe Bazaar is located in the heart of Khujand, Tajikistan. It is one of the oldest and most famous markets in the city, considered a main destination for local shopping and offering traditional Tajik products.'], 'Main Features:': ['The market is open throughout the week', 'It is characterized by an atmosphere full of vitality and movement', 'It is characterized by the sale of local Tajik products', 'An ideal place to learn about the traditional Tajik culture and food', 'A suitable place to shop at reasonable prices'], 'Products collection:': ['Fresh fruits and vegetables', 'Local spices and herbs', 'Pills and nuts', 'Traditional and Tajiki clothes', 'Manual', 'Home tools and furnishings', 'Light foods and Tajik sweets'], 'working hours:': ['Daily from 8:00 am until 7:00 pm', 'The market is crowded on weekends, and it is preferable to visit the market early in the morning to get the best offers.']}",Panjshanbe Bazaar in Khujand offers traditional Tajik products and is a main shopping destination.,40.2792552,69.630498,https://maps.app.goo.gl/UotVGt4YrGGhsSJ26,shop,2025-03-11T04:17:14.000000Z
529,94,Khujand,Tajikistan,Okay pizza,"{'Information:': ['Okay pizza is a restaurant specializing in the provision of traditional Italian pizza in Khajand, Tajikistan and features a wide range of pizza prepared from fresh and high -quality ingredients as well as other Italian dishes in a comfortable and suitable atmosphere for families.'], 'Restaurant features': ['It offers a traditional Italian pizza', 'Comfortable and warm atmosphere', 'Suitable for families and friends', 'Quick and Woodwind service', 'Reasonable prices', 'Provides external request options'], 'Main dishes:': ['Pizza with various sauces', 'Italian pasta', 'Light salads', 'Italian sweets'], 'working hours:': ['Daily from 11:00 am until 10:00 pm']}",Okay pizza in Khujand offers delicious Italian pizza and other Italian dishes in a comfortable atmosphere.,40.2946939,69.6034631,https://maps.app.goo.gl/DJ4RXFeV5dQkM4Ta8,restaurant,2025-03-11T04:03:42.000000Z
528,94,Khujand,Tajikistan,Albik,"{'Information:': ['Albik Restaurant is one of the famous and famous restaurants in Khujand, Tajikistan and is characterized by providing a variety of fast food, especially fried chicken while maintaining the quality of food and excellent service and is a suitable place for families and young people looking for a fast and delicious dining experience.'], 'Restaurant features:': ['Specialized in fried chicken and fast food', 'Fast and effective service', 'Comfortable and modern family atmosphere', 'Attention', 'Provides the external request service and tank Away', 'High cleaning and attention to food quality'], 'Main dishes:': ['Fried chicken', 'Chicken and meat burger', 'Valley and appetite potatoes', 'Fresh salads'], 'working hours:': ['Daily from 10:00 am until 11:00 pm']}",Albik Restaurant in Khujand  offers fried chicken and fast meals in a comfortable family atmosphere.,40.3001997,69.6356766,https://maps.app.goo.gl/9FePcQDME9KQv4Q37,restaurant,2025-03-11T03:57:09.000000Z
527,94,Khujand,Tajikistan,Mokhii Amon,"{'Information:': ['Mukhay Amon is a famous traditional restaurant in the city of Khajand, Tajikistan and is characterized by the presentation of authentic Tajik dishes in a heritage atmosphere that reflects the local culture.'], 'Restaurant features:': ['Interior design that reflects the Tajik heritage', 'Comfortable sessions suitable for families and groups', 'Quiet music enhances the traditional atmosphere', 'Quick and Woodwind service', 'Suitable prices for everyone'], 'Main dishes:': ['Oshi Balouf (Tajik Blau)', 'Garbecue and wash', 'Traditional Tajik soup', 'Manti and local pies', 'Tajiki Chai and Natural Beverages'], 'working hours:': ['Daily from 9:00 am until 10:00 pm']}",Mokhii Amon Restaurant in Khajand offers traditional tagic dishes in a warm and distinctive heritage atmosphere.,40.2930658,69.6719543,https://maps.app.goo.gl/c7miTSPHRjYHxeFG6,restaurant,2025-03-11T03:49:26.000000Z
526,94,Khujand,Tajikistan,Parlament Restaurant,"{'Information:': ['Parlament Restaurant is one of the most famous restaurants in Khajand, Tajikistan, and is characterized by the presentation of a wide range of traditional Tajik dishes and international cuisine with a luxurious atmosphere that suits official and family meetings.'], 'Restaurant features:': ['Elegant decor and a luxurious atmosphere', 'Suitable for official meetings and parties', 'Comfortable internal sessions and private halls', 'A variety of local and international dishes', 'Soft service and professional staff', 'A car park is available'], 'Main dishes:': ['Oshi Palov', 'Kabab and grilled meat', 'European and Asian cuisine dishes', 'Fresh soups and powers', 'Eastern and international sweets'], 'working hours:': ['Daily from 10:00 am until 11:00 pm']}",Parlament Restaurant in Khujand offers Tajik and international cuisine in an upscale atmosphere and excellent service.,40.2949491,69.6253911,https://maps.app.goo.gl/By5ZtUkFATE5V2rG9,restaurant,2025-03-11T03:40:17.000000Z
525,94,Khujand,Tajikistan,Cafe Nematjon,"{'Information:': ['Café Namatjoun is one of the popular cafes in the city of Khajand, Tajikistan and is characterized by the presentation of fresh coffee and traditional drinks in addition to a group of sweets and snacks in a calm and comfortable atmosphere that suits family sessions or friends ’meetings.'], 'Café features:': ['Warm and friendly atmosphere', 'A suitable place to relax or work', 'Simple decor and comfortable sessions', 'Quick service and friendly crew', 'Attention', 'Provides free internet'], 'Main varieties:': ['Tajik coffee and herbal tea', 'Cold and natural drinks', 'Traditional Tajik sweets', 'Pastry and pies', 'Snacks'], 'working hours:': ['Daily from 8:00 am until 10:00 pm']}",Café Nematjonin Khajand offers Tajik drinks and sweets in a calm and comfortable atmosphere.,40.266938,69.6352362,https://maps.app.goo.gl/d4ZPTxKgcpS8XcHc8,restaurant,2025-03-11T03:32:19.000000Z
524,94,Khujand,Tajikistan,Adibon,"{'Information:': ['Adeebon Restaurant is one of the modern and distinctive restaurants in Khujand, Tajikistan and is characterized by the presentation of a variety of traditional Tajik dishes along with international cuisine with a sophisticated atmosphere and a modern design that suits families and friends.'], 'Restaurant features:': ['Modern and elegant decor', 'A calm and comfortable atmosphere', 'Suitable for families and special occasions', 'Excellent and fast service', 'A varied menu that suits all tastes', 'Internal and external sessions'], 'Main dishes:': ['Blau Tajiki', 'Various kebab and grills', 'Manti and traditional pies', 'Fresh salads', 'European and Asian cuisine dishes', 'Tajik and international sweets'], 'working hours:': ['Daily from 9:00 am until 11:00 pm']}",Adipon Restaurant in Khajand offers Tajik and international dishes in an upscale atmosphere and excellent service.,40.28535,69.6162552,https://maps.app.goo.gl/WcnoiD1XtssiBp1DA,restaurant,2025-03-11T03:24:17.000000Z
523,94,Khujand,Tajikistan,Golden Fish Restaurant,"{'Information:': ['Golden Fish Restaurant is one of the most famous restaurants specializing in serving seafood in Khajand, Tajikistan and is famous for its fresh seafood, especially grilled and fried fish and is characterized by its calm and comfortable atmosphere suitable for families and friends.'], 'Restaurant features:': ['Specialized in sea dishes and fresh fish', 'Comfortable atmosphere and simple decorations in sea colors', 'Internal and external sessions with a beautiful look', 'Suitable for families and groups', 'Women and fast service', 'It provides a variety of food options that suit all tastes'], 'Main dishes:': ['Grilled Fish (Salmon, Forel, Kares)', 'Fried or grilled', 'Marine food soup', 'Fresh salads with sea fruits', 'Rice dishes with fish', 'Tajik sweets and natural juices'], 'working hours:': ['Daily from 10:00 am until 10:00 pm']}",Golden Fish Restaurant in Khujand offers fresh and delicious seafood in a cozy and relaxing atmosphere.,40.2862515,69.6210802,https://maps.app.goo.gl/MqKbFaXsuAcSuFfM8,restaurant,2025-03-11T03:14:52.000000Z
522,94,Khujand,Tajikistan,Ansitu,"{'Information:': ['Anasito Restaurant is one of the high -end restaurants in Khujand, Tajikistan and is characterized by its modern design and elegant decoration, making it a favorite destination for visitors looking for a distinctive dining experience that combines traditional Tajik dishes and international cuisine.'], 'Restaurant features:': ['A sophisticated and calm atmosphere', 'Stylish and modern interior design', 'Suitable for families and private meetings', 'Professional staff and high -quality service', 'A varied list that includes eastern and international cuisine', 'Provides internal and external sessions'], 'Main dishes:': ['Blau Tajiki', 'Various grills (chicken, meat, fish)', 'Fresh soups like Sherba', 'Manti and steam pies', 'Pizza and pasta in the Italian way', 'A collection of health authorities', 'Tajik and international sweets'], 'working hours': ['Daily from 10:00 am until 11:00 pm']}",Anasito Restaurant in Khajand offers Tajik and global cuisine in a sophisticated atmosphere and a distinctive service.,40.2818998,69.6365977,https://maps.app.goo.gl/3LXZSgtCPi71gCgN8,restaurant,2025-03-11T03:07:34.000000Z
521,94,Khujand,Tajikistan,"National Central Complex ""Oshi Palov""","{'Information:': ['The National Central Complex ""Oshi Palov"" is one of the most famous cultural venues and traditional restaurants in Khujand, Tajikistan. It is renowned for serving ""Oshi Palov"" (Tajik Plov), the national dish of the country, in a traditional atmosphere that reflects Tajik culture. The complex combines a restaurant, cultural facilities, and a banquet hall for celebrations.'], 'Advances of the complex:': ['Traditional architectural design that reflects the Tajik culture', 'It provides an authentic experience for the famous ""Oshi Ball"" dish', 'Wide halls for events and parties', 'Art and cultural shows are held on some days', 'Suitable for families and large groups', 'Luxurious atmosphere and professional service', 'A special site in the heart of Khajand'], 'Main dishes:': ['Oshi Balouf (traditional Tajik Blau)', 'Tajik grills of all kinds', 'Drink soup with lamb', 'Manti (steam pies)', 'A wide variety of authorities', 'Traditional Tajik sweets and natural juices'], 'working hours:': ['Daily from 10:00 am until 10:00 pm']}","""Oshi Palov"" restaurant in Khajand offers the Tajik blaw in a distinctive cultural and heritage atmosphere.",40.3029356,69.6237272,https://maps.app.goo.gl/FBjcTu3bxymY9qoi8,restaurant,2025-03-11T02:59:40.000000Z
520,94,Khujand,Tajikistan,"Restaurant ""Forel""","{'Information:': ['Forel Restaurant is one of the most famous restaurants in the city of Khajand, which is characterized by its presentation of fresh fish dishes, especially the chilled salmon (Forel), in a quiet and natural atmosphere.'], 'Restaurant features:': ['Specialized in fish and seafood dishes', 'External sessions with a view of the river and nature', 'A calm atmosphere suitable for families', 'Quick and Woodwind service', 'It provides places designated for children', 'Simple design with a comfortable rustic character'], 'Main dishes:': ['Grilled or fried salmon', 'Traditional fish soup', 'Fish', 'Fresh powers are a variety', 'Meat and chicken dishes for vegetarians who do not prefer fish', 'Fresh Tajik bread'], 'working hours:': ['Daily from 9:00 am until 10:00 pm']}",Forel Restaurant in Khajnd specializes in fresh fish dishes in a quiet and comfortable natural atmosphere.,40.2950903,69.6363355,https://maps.app.goo.gl/P49PaRdkd4t8NZ7AA,restaurant,2025-03-11T02:51:19.000000Z
519,94,Khujand,Tajikistan,Restaurant Visol,"{'Information:': ['The Visol Restaurant is a high -end restaurant in the city of Khajand, which features Tajik and international dishes in a comfortable atmosphere suitable for families and special occasions.'], 'Restaurant features:': ['Stylish design and comfortable sessions.', 'A hall dedicated to events and parties.', 'Quiet music enhances the dining experience.', 'Excellent and fast customer service.', 'Indoor and external seating places.'], 'Main dishes:': ['Traditional Tajiki Blaau', 'Various grills (meat, chicken, fish)', 'Manti (steam stuffed pies)', 'Drink soup with lamb', 'Fresh powers of all kinds', 'Uzbek Kabab', 'Traditional oriental and tagic sweets'], 'working hours:': ['Monday to Sunday: from 10:00 am until 11:00 pm']}",Restoran Visol is a sophisticated restaurant in Khajander offers Tajik and global dishes with a comfortable atmosphere and a distinctive service.,40.4855842,67.6597635,https://maps.app.goo.gl/iWkZE8BHgF3H85Td6,restaurant,2025-03-11T02:43:50.000000Z
518,94,Khujand,Tajikistan,Spring Breeze,"{'Information:': ['""Naseem Al Rabie"" is a famous restaurant and cafe that is characterized by its calm atmosphere and its nature\'s design, which provides a comfortable dining experience that suits families and friends.'], 'Features of the place:': ['Interior decor inspired by spring.', 'An external garden to sit in the trees and flowers.', 'A calm and comfortable atmosphere.', 'Distinctive and fast customer service.', 'Suitable for families and gatherings.'], 'Main dishes:': ['Traditional Tajik cuisine such as Blau and Kabab.', 'Various oriental and international dishes.', 'A group of fresh salads.', 'Cold and hot drinks, including natural juices and Tajik tea.'], 'working hours:': ['Daily from 10:00 am until 11:00 pm.']}",A restaurant serves Tajik cuisine in a quiet natural atmosphere inspired by the spring breeze in Khajand.,40.2974485,69.611156,https://maps.app.goo.gl/BcQCNF3uwNkHN7fp7,restaurant,2025-03-11T02:34:19.000000Z
517,94,Khujand,Tajikistan,Turkish cafe mevlana,"{'Information:': ['Turkish Cafe Mevlana is a famous Turkish cafe and restaurant in Khajand, characterized by its warm atmosphere and decoration inspired by traditional Turkish culture.'], 'Restaurant features:': ['Traditional Turkish atmosphere with comfortable sessions.', 'Suitable for families and individuals.', 'Women and fast service.', 'Internal and external sessions.', 'Submit the original Turkish tea and coffee.'], 'Main dishes:': ['Grilled Turkish kebab.', 'Turkish lentil soup.', 'The pedestrian (Turkish pies).', 'Fresh kofta and bread.', 'Turkish sweets such as baklava and kunafa.', 'Turkish coffee and coal tea.'], 'working hours:': ['Daily from 9:00 am until 11:00 pm.']}",A Turkish cafe offering traditional dishes and special drinks in a warm atmosphere in Khujand.,40.3027759,69.6346467,https://maps.app.goo.gl/qNUk6CV2Y4nExqLRA,restaurant,2025-03-11T02:18:31.000000Z
516,94,Khujand,Tajikistan,Restoran omar khayam,"{'Information:': ['Omar Khayyam Restaurant is a distinctive destination for traditional Tajik cuisine lovers and oriental dishes, characterized by its design inspired by Eastern architecture and a sophisticated environment that suits families and guests.'], 'Restaurant features:': ['Luxurious interior design with oriental touches.', 'Comfortable sessions suitable for families and special events.', 'Live music at some evenings.', 'Professional and friendly customer service.'], 'Main dishes:': ['Traditional Tajiki Plalo.', 'Small kebab of all kinds.', 'Manti (steamed meat pies).', 'Various naval dishes.', 'A group of oriental sweets and traditional green tea.'], 'working hours:': ['Daily from 10:00 am until 11:00 pm.']}",A high -end restaurant serves Tajik and Eastern cuisine in a distinctive traditional atmosphere in the city of Khajand.,40.284427,69.6155518,https://maps.app.goo.gl/c4dXT88zpFffvgLw8,restaurant,2025-03-11T02:11:22.000000Z
515,94,Khujand,Tajikistan,Beliy Dom (White House),"{'Information:': ['Beliy Dom, or ""White House"", is a famous restaurant and entertainment complex in Khajand, characterized by its modern design and various services.'], 'Features of the place:': ['An elegant and elegant atmosphere that suits families and guests.', 'Comfortable internal and external sessions.', 'Special halls for events and parties.', 'An elegant service and a professional staff.'], 'Main dishes:': ['European and Asian food.', 'Traditional Tajik dishes such as Blau and Mante.', 'A wide variety of grills and fish.', 'Eastern and international sweets.'], 'working hours:': ['Daily from 10:00 am until 12:00 midnight.']}","A fine restaurant serves Tajik and international cuisine in an elegant atmosphere in Khajand, Tajikistan.",40.2905261,69.6369776,https://maps.app.goo.gl/zbfT7rKeLULC9Ljm7,restaurant,2025-03-11T02:04:13.000000Z
920,96,Gyumri,Armenia,Aratta Royal Hotel,"{'Location': ['Situated in a central area of Gyumri, close to main attractions, cultural sites, and the city center.'], 'Services & Facilities': ['Free Wi-Fi, restaurant, bar, fitness center, spa, meeting rooms, parking, standard, deluxe, and suite rooms with modern amenities, air-conditioning, and minibars.'], 'Rooms': ['standard, deluxe, and family rooms with air-conditioning, TV, and minibars.'], 'Check-in & Check-out': ['Check-in: From 14:00.', 'Check-out: Until 12:00.'], 'Nearby Attractions': ['Black Fortress.', 'Gyumri’s Central Park.', 'Museum of National Architecture and Urban Life.']}","A luxurious hotel in Gyumri with modern facilities, offering comfort and convenience near the city's top attractions.",40.7863812,43.8386602,https://maps.app.goo.gl/VCNUexQxZYMqTX1x6,hotel,2025-03-11T01:58:57.000000Z
514,94,Khujand,Tajikistan,"""Zaytun"" Restoran Tadzhikskoy Kukhni","{'Information:': ['""Zaytun"" restaurant offers delicious traditional Tajik dishes in a comfortable atmosphere and decoration that reflects the local heritage.'], 'Restaurant features:': ['It serves traditional Tajik cuisine.', 'A calm atmosphere and an interior design inspired by local culture.', 'Suitable for families and gatherings.', 'Women and fast service.', 'Indoor and external seating places.'], 'Main dishes:': ['Tajiki Plalo (rice with meat and carrots).', 'Manti (pies stuffed with steamed meat).', 'Mutal soup.', 'Local authorities and traditional appetizers.', 'Tajik sweets and green tea.'], 'working hours:': ['Daily from 10:00 am until 11:00 pm.']}",A traditional Tajiki restaurant serves delicious local dishes in a calm atmosphere and a decoration that reflects culture.,40.2992733,69.6353052,https://maps.app.goo.gl/iYbHvRF1xisgMCFq6,restaurant,2025-03-11T01:56:41.000000Z
919,96,Gyumri,Armenia,Prime Hotel (Gyumri),"{'Location': ['Located in the center of Gyumri, providing easy access to the city’s main attractions and cultural landmarks.'], 'Services & Facilities': ['Free Wi-Fi, restaurant & bar, meeting rooms, 24-hour reception, airport shuttle, parking.'], 'Rooms': ['standard, deluxe, and family rooms with air-conditioning, TV, and minibars.'], 'Check-in & Check-out': ['Check-in: From 14:00.', 'Check-out: Until 12:00.'], 'Nearby Attractions': ['Black Fortress.', 'Gyumri’s Central Park.', 'Museum of National Architecture and Urban Life.']}","A centrally located hotel in Gyumri, offering modern amenities and easy access to local attractions.",40.7861852,43.8373521,https://maps.app.goo.gl/cYGmFx3A626w2Kjj6,hotel,2025-03-11T01:54:14.000000Z
513,94,Khujand,Tajikistan,Turkish cafe - palace,"{'Information:': ['The Turkish Sarai Café is located in Khujand, Tajikistan, and is known for its presentation of traditional Turkish cuisine and drinks.'], 'Café features:': ['A warm atmosphere and traditional decoration that reflects Turkish culture.', 'Suitable for families and friends.', 'Distinctive customer service.'], 'Main dishes:': ['Turkish Pizza (PIDE).', 'Chicken is a chicken (grilled).', 'A variety of traditional Turkish grills and dishes.'], 'working hours:': ['It opens daily from 10 am until 11 pm.']}","A traditional Turkish café offers delicious dishes and a warm atmosphere in the heart of Khajand, Tajikistan.",40.2987319,69.6136772,https://maps.app.goo.gl/QoEAxfFmsXCiXgfL7,restaurant,2025-03-11T01:48:31.000000Z
599,96,Gyumri,Armenia,Gyumri's Central Park,"{'Information': ['Gyumri’s Central Park is a popular recreational space offering green landscapes, walking paths, and cultural monuments. It serves as a gathering place for locals and visitors alike.'], 'Historical Importance': [""Established during the 19th century, the park has been a key part of Gyumri’s urban life, reflecting the city's architectural and cultural evolution over the years.""], 'Key Features': ['Scenic Green Spaces: Ideal for relaxation and leisure walks.', 'Children’s Playgrounds: Family-friendly environment with play areas.', 'Cultural Monuments: Statues and landmarks representing Gyumri’s history.'], 'Working Hours': ['Open 24/7 as a public space.']}","A relaxing green park in Gyumri featuring walking paths, playgrounds, and cultural monuments.",40.7850911,43.8328931,https://maps.app.goo.gl/LrhtyynT7cwNs6vd8,tourist place,2025-03-11T01:29:34.000000Z
598,96,Gyumri,Armenia,Museum Of Illusions Gyumri,"{'Information': ['The Museum of Illusions in Gyumri offers a fascinating interactive experience with optical illusions, 3D art, and mind-bending exhibits that challenge perception and creativity.'], 'Historical Importance': ['While not a historical site, the museum contributes to Gyumri’s growing cultural and artistic scene, blending entertainment with science and visual art.'], 'Key Features': ['Optical Illusions: Engaging exhibits that trick the eyes and mind.', '3D Art Installations: Interactive artworks for creative photo opportunities.', 'Family-Friendly Experience: Suitable for visitors of all ages.'], 'Working Hours': ['Typically open from morning to evening; check locally for exact timings.']}","An interactive museum in Gyumri featuring optical illusions, 3D art, and mind-bending visual exhibits.",40.7957127,43.8322867,https://maps.app.goo.gl/iuyBnyAvRYhej9hS9,tourist place,2025-03-11T01:18:56.000000Z
597,96,Gyumri,Armenia,The Iron Fountain,"{'Information': ['The Iron Fountain is a historic landmark in Gyumri, known for its intricate ironwork and symbolic significance. It is a popular meeting point and a representation of the city’s artistic craftsmanship.'], 'Historical Importance': ['Built in the 19th century, the fountain is a fine example of Gyumri’s iron craftsmanship, reflecting the city’s industrial and artistic heritage. It has been a central part of local culture for generations.'], 'Key Features': ['Ornate Ironwork: A beautifully crafted fountain made entirely of iron.', 'Historical Landmark: A symbol of Gyumri’s rich artistic and industrial past.', 'Central Location: Located in a public square, making it a popular meeting spot.'], 'Working Hours': ['Open to the public 24/7 as it is a part of the city’s public space.']}","A historic iron fountain in Gyumri, showcasing fine craftsmanship and serving as a cultural landmark.",40.8156432,43.8472473,https://maps.app.goo.gl/AqwDhR8Nede1mDeS9,tourist place,2025-03-11T01:11:12.000000Z
918,94,Khujand,Tajikistan,Khujand Grand Hotel,"{'Location:': ['Khujand Grand Hotel is located in the heart of Khujand, Tajikistan, near Kamoli Khujandi Park and the Opera and Ballet Theater.'], 'Facilities and Services': ['""Omar Khayyam"" restaurant, which offers delicious daily meals in an ""à la carte"" style.', 'Bar.', 'Terrace.', 'Free Wi-Fi.', 'Free parking.', '24-hour front desk', 'Massage services.'], 'Rooms:': ['The hotel consists of 19 comfortable rooms designed with taste, and provides beautiful looks at the Kamouli Khojandi theater and the main square on the one hand, and on the city park on the other side.'], 'Nearby tourist attractions:': ['Bangshansbi Market', 'Jame Mosque', 'Khajnd Castle', 'The Historical Museum of Khajnd']}","Khujand Grand Hotel in Tajikistan is a 4-star establishment offering comfortable rooms, a restaurant, bar, and exceptional services.",40.284403,69.618245,https://maps.app.goo.gl/fGgK5iKNSZfMNfsE9,hotel,2025-03-11T01:06:02.000000Z
