id,city_id,city_name,country_name,name,description,short_description,latitude,longitude,location,type,created_at
1560,73,LONDON,United Kingdom,Hawksmoor Air Street,"{'Location': ['Experience the finest steak dining at 5A Air St, London, W1J 0AD, United Kingdom - a culinary gem in the heart of the city.'], 'Menu Highlights': ['Savor succulent ribeye steak cooked to perfection', 'Try the signature Hawksmoor burger for a juicy delight', 'Delight in flavorful bone marrow with parsley salad'], 'Services & Facilities': ['Enjoy impeccable service from knowledgeable staff', 'Relish an extensive wine list for perfect pairings', 'Experience elegant decor and intimate seating'], 'Nearby Attractions': ['Explore historic Piccadilly Circus for vibrant entertainment', 'Visit Green Park for serene walks amidst lush greenery', ""Discover Regent Street's luxury shopping just around the corner""]}","Carefully sourced & aged steaks. Prime cuts of matured beef, seafood & other British classics served in striking environs.",51.5097064,-0.1362074,https://www.google.com/maps?q=Hawksmoor%20Air%20Street&ftid=0x487604d41e4f9b97:0xfd117ecf2c565e5b,restaurant,2025-08-18T19:20:35.000000Z
1559,73,LONDON,United Kingdom,Happy London,"{'Location': ['Discover culinary delights at Happy London on Coventry St., London. Experience exquisite Modern European cuisine in a trendy setting.'], 'Menu Highlights': ['Must-try: Vegan options', 'Signature dish: Great cocktails', 'Recommended: Small plates'], 'Services & Facilities': ['Wheelchair accessible seating available', 'Bar onsite for great cocktails', ""Free Wi-Fi for guests' convenience""], 'Nearby Attractions': ['Explore Leicester Square for entertainment', 'Visit Trafalgar Square for historic charm', 'Discover Piccadilly Circus for vibrant city life']}","Casual grill & bar with a global menu. International dishes, sushi & cocktails served in a relaxed grill & bar with booth seating.",51.5101534,-0.1324234,https://www.google.com/maps?q=Happy%20London&ftid=0x487605450b184bfb:0xc4f69bdc2f0263db,restaurant,2025-08-18T19:19:14.000000Z
1558,73,LONDON,United Kingdom,Fallow,"{'Location': ['Indulge in modern British cuisine at Fallow on 52 Haymarket, SW1Y 4RP, United Kingdom – a must-visit for food enthusiasts.'], 'Menu Highlights': ['Try the organic dishes and vegan options', 'Savor the small plates and vegetarian choices', ""Don't miss out on the great dessert selection""], 'Services & Facilities': ['Wheelchair accessible seating available', 'Cozy and romantic atmosphere perfect for solo dining or groups', 'Accepts reservations for lunch and dinner'], 'Nearby Attractions': ['Explore Trafalgar Square for iconic landmarks', 'Visit Buckingham Palace for royal history', 'Discover Covent Garden Market for shopping delights']}",Creative fare amid modern decor. Contemporary destination serving innovative cuisine using carefully sourced ingredients.,51.509409999999995,-0.1327837,https://www.google.com/maps?q=Fallow&ftid=0x487604d595786349:0x26d4df293937aa1a,restaurant,2025-08-18T19:17:31.000000Z
1557,73,LONDON,United Kingdom,Bob Bob Ricard Soho,"{'Location': ['Experience luxury dining at its finest on Upper James St, W1F 9DF, United Kingdom.'], 'Menu Highlights': ['Try the Coq au Vin for a classic French dish', 'Savor the Escargots de Bourgogne for a unique appetizer', ""Don't miss the Crème Brûlée for a delightful dessert""], 'Services & Facilities': ['Enjoy impeccable service and elegant ambiance', 'Wheelchair accessible seating available for all guests', 'Extensive wine list and cocktail selection to complement your meal'], 'Nearby Attractions': ['Explore the iconic Carnaby Street nearby', 'Visit the bustling Oxford Street for shopping delights', 'Discover the historic charm of Covent Garden just a short walk away']}",Art deco luxury & a French/British menu. Uniformed staff serve French-inspired & Modern British fare & cocktails in cool art deco surrounds.,51.51237,-0.13733399999999998,https://www.google.com/maps?q=Bob%20Bob%20Ricard%20Soho&ftid=0x487604d4f81d3b37:0x483d43bdcad9b09a,restaurant,2025-08-18T19:15:47.000000Z
1556,73,LONDON,United Kingdom,Benares Mayfair,"{'Location': ['Immerse yourself in culinary luxury at Benares Mayfair, located at 12a Berkeley Square, London, W1J 6BS, United Kingdom. Experience the epitome of fine dining.'], 'Menu Highlights': ['Savor Halal delicacies like Tandoori Lamb Chops', 'Try the flavorful Chicken Tikka Masala', 'Experience traditional Indian desserts like Gulab Jamun'], 'Services & Facilities': ['Enjoy impeccable service and elegant ambiance', 'Wheelchair accessible seating available', 'Extensive wine list and cocktail selection'], 'Nearby Attractions': ['Explore historic Berkeley Square Gardens', 'Visit the iconic Buckingham Palace nearby', 'Discover art at Royal Academy of Arts']}","Refined Modern Indian cuisine. Stylish, upscale Indian-British fusion cuisine, with glass-walled kitchen and chef's table.",51.509846599999996,-0.14507889999999998,https://www.google.com/maps?q=Benares%20Mayfair&ftid=0x4876052bdf642b01:0xe57e84f02b4170f1,restaurant,2025-08-18T19:14:14.000000Z
1555,73,LONDON,United Kingdom,Rules,"{'Location': [""Immerse yourself in the heart of London's Covent Garden at 34-35 Maiden Ln, WC2E 7LB. Discover the charm of British cuisine at Rules.""], 'Menu Highlights': ['Savor traditional Beef Wellington', 'Try the classic Roast Grouse', 'Delight in the decadent Sticky Toffee Pudding'], 'Services & Facilities': ['Enjoy impeccable table service', 'Experience a cozy and romantic atmosphere', 'Wheelchair accessible seating available'], 'Nearby Attractions': ['Explore Covent Garden Market for unique finds', 'Visit Somerset House for art exhibitions', 'Stroll through Leicester Square for entertainment']}","British menu at city's oldest restaurant. Established in 1798, serving classic British food (especially game) in Edwardian surrounds.",51.510833,-0.1231694,https://www.google.com/maps?q=Rules&ftid=0x487604cae7c2496d:0xb6ad06d63e339ce2,restaurant,2025-08-18T19:12:43.000000Z
1554,73,LONDON,United Kingdom,Medlar,"{'Location': [""Discover the culinary gem of Medlar located at 438 King's Rd, London, SW10 0LH, United Kingdom. Treat yourself to a taste of France.""], 'Menu Highlights': ['Savor classic Coq au Vin for a taste of traditional French flavors.', 'Try the decadent Crème Brûlée for a perfect ending to your meal.', 'Experience the richness of Beef Bourguignon cooked to perfection.'], 'Services & Facilities': ['Enjoy impeccable service with wheelchair-accessible seating and entrance.', 'Relish in an extensive wine list and great cocktail selection.', 'Cozy up in the romantic ambiance ideal for solo dining or special occasions.'], 'Nearby Attractions': ['Explore the historic Chelsea Physic Garden nearby for a tranquil escape.', 'Stroll along the Thames Riverwalk for picturesque views and fresh air.', 'Visit Saatchi Gallery to immerse yourself in contemporary art just moments away.']}","Fine French dining with global touches. High-end, Modern French food with global influences, served in an understated dining room.",51.483142,-0.177734,https://www.google.com/maps?q=Medlar&ftid=0x4876057aca191795:0x3bb9043599b607d3,restaurant,2025-08-18T19:11:26.000000Z
1553,73,LONDON,United Kingdom,HIDE,"{'Location': ['Located at 85 Piccadilly, London, W1J 7NB, United Kingdom. Experience culinary excellence in the heart of the city.'], 'Menu Highlights': ['Try their signature cocktails and exquisite wine selection.', ""Don't miss out on their delectable desserts and organic dishes."", 'Savor the great coffee and tea options available.'], 'Services & Facilities': ['Enjoy wheelchair-accessible seating for all guests.', 'Reservations recommended for lunch and dinner to secure your spot.', 'Convenient parking options including free parking lot and paid street parking.'], 'Nearby Attractions': [""Explore Green Park for a leisurely stroll amidst nature's beauty."", 'Visit Buckingham Palace to witness royal grandeur up close.', 'Discover the vibrant energy of Soho with its eclectic mix of shops and entertainment venues.']}","All-day, modern European restaurant. A three floor space in a contemporary setting with elevated morning to late-night dining options.",51.5061931,-0.1444369,https://www.google.com/maps?q=HIDE&ftid=0x4876057bfdc4509f:0xae7716829398dce8,restaurant,2025-08-18T19:10:05.000000Z
1552,73,LONDON,United Kingdom,Berners Tavern,"{'Location': ['Experience the culinary delights of London at Berners Tavern on Berners St., offering a mix of historic charm and trendy elegance.'], 'Menu Highlights': ['Try the traditional Fish and Chips', 'Savor the Beef Wellington', 'Delight in the Sticky Toffee Pudding'], 'Services & Facilities': ['Wheelchair accessible seating', 'Private dining room available', 'Reservations recommended for lunch and dinner'], 'Nearby Attractions': ['Explore Oxford Street for shopping', 'Visit the British Museum for culture', 'Discover Covent Garden for entertainment']}",Upmarket British food in designer hotel. Jason Atherton's upmarket Modern British restaurant in Ian Schrager's London Edition Hotel.,51.5166544,-0.1361045,https://www.google.com/maps?q=Berners%20Tavern&ftid=0x48761b2b657c41e5:0x5593682c9b218977,restaurant,2025-08-18T19:08:56.000000Z
1551,73,LONDON,United Kingdom,Tattu London,"{'Location': ['Experience the culinary journey at The Now Building Rooftop, Outernet, Denmark St, London WC2H 0LA, United Kingdom - an Asian gem in the heart of London!'], 'Menu Highlights': ['Savor signature dishes like dim sum platters, Peking duck rolls, and matcha tiramisu for a fusion of flavors.'], 'Services & Facilities': ['Enjoy wheelchair-accessible seating, cozy ambiance, and top-notch service. Make reservations for a hassle-free dining experience.'], 'Nearby Attractions': ['Explore Covent Garden Market for shopping delights.', 'Visit Leicester Square for entertainment vibes.', 'Discover the British Museum for cultural immersion.']}","Modern Chinese fare in stylish quarters. Chic, spacious restaurant turning out sophisticated, contemporary takes on Cantonese classics.",51.515384999999995,-0.1295445,https://www.google.com/maps?q=Tattu%20London&ftid=0x48761b1ce27dd71d:0x560f057dcac2108a,restaurant,2025-08-18T19:07:49.000000Z
1550,73,LONDON,United Kingdom,Scully,"{'Location': [""Indulge in exquisite fine dining at Scully located at 4 St James's Market, London. Discover culinary delights in a chic setting.""], 'Menu Highlights': ['Try the flavorful vegan options like Spiced Aubergine or the aromatic Coffee Cured Salmon for a unique dining experience.', 'Savor the delicious Small Plates such as Lamb Ribs or indulge in the rich Chocolate & Miso dessert for a sweet ending.', 'Explore the diverse wine list featuring rare selections to complement your meal perfectly.'], 'Services & Facilities': ['Enjoy wheelchair accessible seating and entrance for all guests.', 'Reserve your table hassle-free with their easy online booking system.', 'Experience cozy and romantic ambiance perfect for intimate dinners or group gatherings.'], 'Nearby Attractions': ['After dining at Scully, take a stroll to Buckingham Palace for royal history immersion.', 'Visit Piccadilly Circus nearby for vibrant nightlife and entertainment options post-dinner.', ""Explore Trafalgar Square's iconic landmarks just minutes away from this culinary gem.""]}","Stylish option for seasonal small plates. Hip, wood-hued eatery serving artfully plated seasonal flavors from Australia to India & Ireland.",51.508665,-0.1330131,https://www.google.com/maps?q=Scully&ftid=0x487604d15cac84af:0x5e1284e7a3e3e42b,restaurant,2025-08-18T19:06:41.000000Z
1549,73,LONDON,United Kingdom,The Restaurant at St Martins Lane London,"{'Location': [""45 St Martin's Ln, London, WC2N 4HX, United Kingdom - Experience a taste of France in the vibrant city center of London.""], 'Menu Highlights': ['Savor classic French dishes like Coq au Vin and Ratatouille', 'Try the decadent Crème Brûlée for dessert', 'Explore an extensive wine list featuring fine French selections'], 'Services & Facilities': ['Wheelchair accessible seating available', 'Bar onsite for great cocktails and wines', 'Romantic atmosphere perfect for special occasions'], 'Nearby Attractions': ['Visit Trafalgar Square for iconic landmarks', ""Explore Covent Garden's bustling markets and street performers"", 'Discover the historic charm of Leicester Square']}","Indulge in exquisite French cuisine at The Restaurant at St Martins Lane London, offering a cozy, upscale dining experience in the heart of London.",51.5104696,-0.12658239999999998,https://www.google.com/maps?q=The%20Restaurant%20at%20St%20Martins%20Lane%20London&ftid=0x487605392096364b:0xb17575f51fcade5b,restaurant,2025-08-18T19:05:25.000000Z
1548,73,LONDON,United Kingdom,The Ritz Restaurant,"{'Location': ['Immerse yourself in the opulence of 150 Piccadilly, London, W1J 9BR, United Kingdom - a gastronomic haven awaits.'], 'Menu Highlights': ['Savor Halal delicacies like Lamb Tagine', 'Try the Vegan Mushroom Risotto for a plant-based delight', 'Experience luxury with Lobster Thermidor', 'Indulge in the classic Beef Wellington'], 'Services & Facilities': ['Enjoy live music performances during dinner', 'Wheelchair accessible entrance and seating available', 'Private dining room for intimate gatherings', ""Free Wi-Fi for guests' convenience""], 'Nearby Attractions': [""Explore Buckingham Palace's grandeur nearby"", 'Stroll through Hyde Park for a serene escape', 'Discover historic landmarks like Big Ben and Westminster Abbey']}",British fine dining in baroque opulence. High-end British–French dining in baroque-style  gilded salon with ceiling frescoes and chandeliers.,51.506921299999995,-0.14197369999999998,https://www.google.com/maps?q=The%20Ritz%20Restaurant&ftid=0x48760529d30fc857:0xd0c0725a24b3c96e,restaurant,2025-08-18T19:03:53.000000Z
1547,73,LONDON,United Kingdom,Rabbit British Bistro,"{'Location': [""Discover the culinary delights of modern British cuisine at Rabbit British Bistro on King's Rd, London. Join us for a delightful dining experience!""], 'Menu Highlights': [""Try the Vegan Shepherd's Pie"", 'Savor the Beef Wellington', ""Don't miss the Sticky Toffee Pudding""], 'Services & Facilities': ['Cozy ambiance perfect for romantic dinners', 'Wheelchair accessible seating available', 'Great wine list to complement your meal'], 'Nearby Attractions': ['Explore Chelsea Physic Garden for a tranquil escape', 'Visit Saatchi Gallery for contemporary art exhibitions', 'Stroll along Thames River for scenic views']}",Seasonal British food in rustic environs. Sustainable ingredients and wines from the family farm in Sussex are served in a bucolic space.,51.488703199999996,-0.1660769,https://www.google.com/maps?q=Rabbit%20British%20Bistro&ftid=0x4876056b61d9c35d:0xb5ba2d57ef1e61b1,restaurant,2025-08-18T19:02:22.000000Z
1546,73,LONDON,United Kingdom,Holborn Dining Room,"{'Location': [""Immerse yourself in the heart of London's culinary scene at 252 High Holborn Rosewood, WC1V 7EN.""], 'Menu Highlights': ['Try the traditional Fish and Chips for a classic taste of Britain.', 'Savor the Beef Wellington, a signature dish with tender beef wrapped in flaky pastry.', 'Experience the Eton Mess dessert, a delightful mix of meringue, cream, and fresh berries.'], 'Services & Facilities': ['Enjoy wheelchair-accessible seating and restroom facilities for all guests.', 'Reserve your table easily with their online booking system for a hassle-free dining experience.', 'Experience an intimate meal with cozy and romantic ambiance perfect for solo diners or groups.'], 'Nearby Attractions': ['Explore the historic British Museum nearby after your meal for cultural enrichment.', 'Stroll through Covent Garden to discover street performers and boutique shops just minutes away.', ""Visit Lincoln's Inn Fields, one of London's largest public squares, ideal for a leisurely post-dinner walk.""]}","Hotel's ornate brasserie-style eatery. Rosewood Hotel's elegant, chandelier-decked space and courtyard for a traditional British menu.",51.517648699999995,-0.11791499999999999,https://www.google.com/maps?q=Holborn%20Dining%20Room&ftid=0x48761b35813eef8b:0xb2a415e29b095b15,restaurant,2025-08-18T19:01:01.000000Z
1545,73,LONDON,United Kingdom,St. John,"{'Location': [""Experience the heart of London's gastronomy at St. John on 26 St John St, EC1M 4AY.""], 'Menu Highlights': ['Savor traditional British dishes like Roast Bone Marrow and Eccles Cake with Lancashire Cheese.', 'Try their signature Blood Cake or Roast Middlewhite Pork for an authentic taste experience.'], 'Services & Facilities': ['Enjoy a cozy and upscale atmosphere perfect for solo dining or group gatherings.', 'Wheelchair accessible seating available, with great beer, cocktails, coffee, and wine selections.', 'Reservations recommended for lunch and dinner. Accepts credit cards and offers free Wi-Fi.'], 'Nearby Attractions': ['Explore the historic Barbican Centre nearby for cultural experiences.', ""Visit the iconic St. Paul's Cathedral just a short walk away from St. John."", ""Discover Smithfield Market for a glimpse into London's vibrant food scene.""]}",Trailblazing whole animal cooking. Whitewashed ex-smokehouse where Fergus Henderson pioneered the resurgent interest in offal dishes.,51.5204534,-0.10143039999999999,https://www.google.com/maps?q=St.%20John&ftid=0x48761b5161b93317:0x86773f8e76f37d7,restaurant,2025-08-18T18:59:03.000000Z
1544,73,LONDON,United Kingdom,Mount St. Restaurant,"{'Location': ['Experience culinary excellence at First Floor, 41-43 Mount St, London W1K 2RX, United Kingdom - a must-visit for food enthusiasts!'], 'Menu Highlights': ['Try the Vegan options', 'Savor the Great tea selection', ""Don't miss the Small plates""], 'Services & Facilities': ['Wheelchair accessible seating', 'Private dining room available', 'Free Wi-Fi for guests'], 'Nearby Attractions': ['Explore nearby Hyde Park for a relaxing stroll', 'Visit Buckingham Palace for royal history', ""Discover Mayfair's art galleries and boutiques""]}","Indulge in modern British cuisine at Mount St. Restaurant, offering a cozy, historic, and upscale atmosphere with great wine and dessert selections.",51.5097059,-0.15158839999999998,https://www.google.com/maps?q=Mount%20St.%20Restaurant&ftid=0x487605e5d35fc577:0x7a51ed922282266d,restaurant,2025-08-18T18:58:06.000000Z
1543,73,LONDON,United Kingdom,Riviera,"{'Location': [""Experience the culinary delights of Riviera at 23 St James's St, London. Visit for an unforgettable dining experience!""], 'Menu Highlights': ['Savor exquisite dishes like Coq au Vin, Ratatouille Provencal, and Crème Brûlée at Riviera.'], 'Services & Facilities': ['Enjoy wheelchair-accessible seating, great wine selection, and gender-neutral restrooms at Riviera.'], 'Nearby Attractions': ['Explore Buckingham Palace for royal history', ""Stroll through Hyde Park for nature's beauty"", 'Discover the vibrant Covent Garden Market']}","Indulge in modern French cuisine at Riviera, a top-rated restaurant in London with a cozy, romantic, and upscale atmosphere.",51.5066352,-0.1391577,https://www.google.com/maps?q=Riviera&ftid=0x487605487b4c8021:0x51eade6c50d248be,restaurant,2025-08-18T18:56:49.000000Z
1542,73,LONDON,United Kingdom,Dinner by Heston Blumenthal,"{'Location': [""Immerse yourself in the culinary delights of British cuisine at this iconic restaurant located in the heart of London's upscale Knightsbridge district.""], 'Menu Highlights': ['Try the renowned Meat Fruit, a unique dish resembling a mandarin orange but filled with chicken liver parfait.', 'Savor the savory Powdered Duck Breast or the historic Spiced Pigeon for an unforgettable dining experience.'], 'Services & Facilities': ['Enjoy impeccable service and elegant ambiance perfect for special occasions or intimate dinners.', 'Wheelchair accessible seating ensures inclusivity, while diverse wine and cocktail selections elevate your dining experience.'], 'Nearby Attractions': [""Explore Hyde Park's lush greenery or visit The Victoria and Albert Museum for cultural enrichment."", 'Discover Harrods department store nearby or take a leisurely stroll through Kensington Gardens post-meal.']}","British culinary history-inspired dining. Elegant, contemporary dining room in opulent hotel, for a menu inspired by British culinary history.",51.502161,-0.159964,https://www.google.com/maps?q=Dinner%20by%20Heston%20Blumenthal&ftid=0x4876053998f43547:0x60f3fd42f231a0fa,restaurant,2025-08-18T18:56:11.000000Z
641,68,Chiang Mai,Thailand,ChiangMai Heart เชียงใหม่ฮาร์ท,"{'Top Stores': ['Discover trendy fashion at Robinson Chiangmai Airport', 'Find unique sports gear at Heart Sport', 'Indulge in local cuisine at Lonely Hearts Café'], 'Top Restaurants & Cafes': ['Savor delicious meals at Beats Cafe and Bar', 'Enjoy a cozy meal at Baan Mae Café & Restaurant', 'Try specialty drinks at Lonely Hearts Café'], 'Opening Hours': ['ChiangMai Heart is open daily with varying hours. Check individual store schedules for specific times.'], 'Location': ['ChiangMai Heart เชียงใหม่ฮาร์ท']}","Experience a vibrant shopping haven at ChiangMai Heart, offering diverse stores and delightful dining options for an unforgettable retail adventure.",18.790032,98.9951256,https://www.google.com/maps?q=ChiangMai%20Heart%20%E0%B9%80%E0%B8%8A%E0%B8%B5%E0%B8%A2%E0%B8%87%E0%B9%83%E0%B8%AB%E0%B8%A1%E0%B9%88%E0%B8%AE%E0%B8%B2%E0%B8%A3%E0%B9%8C%E0%B8%97&ftid=0x30da3aa372990727:0xffef637af7324ae1,shop,2025-08-18T18:42:03.000000Z
640,68,Chiang Mai,Thailand,Chiang Mai Premium Outlet,"{'Location': ['Explore the shopping paradise of Chiang Mai, Thailand, for unique finds and memorable experiences.'], 'Top Stores': ['Discover trendy fashion at Central Chiangmai', 'Find quality goods at MAYA Lifestyle Shopping Center', 'Shop for family fun at 50FLY!® Family Entertainment Center'], 'Top Restaurants & Cafes': ['Indulge in Thai delicacies at Baan Mae Café & Restaurant', 'Savor global flavors at Fusion One', 'Enjoy a cozy meal at The happy frog'], 'Opening Hours': ['Chiang Mai Premium Outlet opens daily from 10 AM to 7 PM, providing ample time for your retail therapy.'], 'Nearby Attractions': ['Visit Wat Phra Singh Temple for cultural immersion', ""Explore Doi Suthep-Pui National Park's natural beauty"", ""Dine at Nimmanhaemin Road's eclectic eateries""]}","Experience a diverse shopping journey at Chiang Mai Premium Outlet, offering a mix of local and international brands in a vibrant setting.",18.7000079,98.93088999999999,https://www.google.com/maps?q=Chiang%20Mai%20Premium%20Outlet&ftid=0x30da3151ede4a5e9:0x1064c74154e2e3ea,shop,2025-08-18T18:40:22.000000Z
639,68,Chiang Mai,Thailand,Pavilion Night Bazaar Chiang Mai,"{'Location': ['Explore the bustling retail paradise in Chiang Mai, Thailand, where Pavilion Night Bazaar awaits to fulfill your shopping desires.'], 'Top Stores': ['Discover unique finds at Come On Cafe & Restaurant', 'Indulge in fresh delights at Garden to Table Chiangmai', 'Find cozy charm at Cat House Chiangmai'], 'Top Restaurants & Cafes': ['Savor local flavors at Baan Mae Café & Restaurant', 'Enjoy a laid-back meal at Garden to Table Chiangmai', 'Experience comfort food at Cat House Chiangmai'], 'Opening Hours': ['Unwind from 8 AM to 11 PM every day for an unforgettable shopping and dining experience.']}","Busy night market with food stalls. Large outdoor night market with stalls selling Asian street food, plus handicrafts.",18.7836277,99.0004256,https://www.google.com/maps?q=Pavilion%20Night%20Bazaar%20Chiang%20Mai&ftid=0x30da3aa649ac33e9:0xe92ddd5b343c3be1,shop,2025-08-18T18:36:47.000000Z
638,68,Chiang Mai,Thailand,Nim City Community Mall,"{'Location': [""Discover the heart of Chiang Mai's shopping scene at Nim City Community Mall in Thailand.""], 'Top Stores': ['Explore unique finds at One Nimman', 'Discover cannabis products at The Spot Cannabis Dispensary', 'Shop for trendy items at Nim City Community Mall'], 'Top Restaurants & Cafes': ['Indulge in artisanal coffee at Pai Yan Yai Coffee', 'Savor fusion cuisine at Manifreshto Cafe & Restaurant', 'Enjoy a cozy ambiance at The Barisotel by The Baristro'], 'Opening Hours': ['Open from 8 AM to 10 PM daily, providing ample time for shopping and dining experiences.'], 'Nearby Attractions': ['Visit Wat Phra Singh Temple for cultural immersion', 'Explore Chiang Mai Night Bazaar for local crafts and souvenirs', ""Relax at Huay Kaew Waterfall amidst nature's beauty""]}","Busy hub for retail, dining & groceries. Bustling plaza offering a selection of retail stores, global restaurants, services & a supermarket.",18.771524199999998,98.9762586,https://www.google.com/maps?q=Nim%20City%20Community%20Mall&ftid=0x30da307b17795397:0x7a494398ce639c57,shop,2025-08-18T18:35:29.000000Z
637,68,Chiang Mai,Thailand,Chiang Mai 89 Plaza,"{'Top Stores': ['Discover unique finds at เชียงใหม่เทเลช็อป สาขา 89 พลาซ่า', 'Shop for quality goods at Tops (Market) 89 พลาซ่า', 'Indulge in vegan delights at Alchemy Vegan'], 'Top Restaurants & Cafes': ['Savor artisanal coffee at The Ironwood', 'Enjoy plant-based treats at Caramellow Cafe', 'Taste international cuisine at Baan Mae Café & Restaurant'], 'Opening Hours': ['Chiang Mai 89 Plaza is open 24 hours daily, providing round-the-clock shopping convenience.'], 'Location': ['Chiang Mai 89 Plaza']}","Experience diverse shopping at Chiang Mai 89 Plaza with top stores and eateries, offering a vibrant mix of products and flavors.",18.751996899999998,99.0087324,https://www.google.com/maps?q=Chiang%20Mai%2089%20Plaza&ftid=0x30da3018cc5a2ecd:0x673169aa7a77984d,shop,2025-08-18T18:33:27.000000Z
