id,city_id,city_name,country_name,name,description,short_description,latitude,longitude,location,type,created_at
107,69,Batumi,Georgia,Carrefour,"{'Information:': ['Carrefour is a global retail store located in Batumi and is considered one of the largest supermarket chains in the world.'], 'Main Features:': ['It offers a wide range of products including foodstuffs, home appliances, clothes, and library tools.', 'It provides various options for local and international products.', 'Easy access to parking spaces and multiple facilities.'], 'Main stores:': ['Foods section (vegetables, meat, dairy products).', 'The electronics and home appliances section.', 'Divide and fashion section.'], 'Visit Tips:': ['Avoid visiting hours to avoid crowding.', 'Check the special offers and discounts offered by the store.', 'Plan to visit the food section where you can find local and fresh products.']}",Carrefour in Batumi is a retail store that offers a wide range of products at reasonable prices.,41.6375663,41.6095766,https://maps.app.goo.gl/RGnX7PUS3FK3VGmGA,shop,2025-02-14T17:21:43.000000Z
106,69,Batumi,Georgia,Black Sea Mall,"{'Information:': ['It is a distinguished commercial center in Batumi, characterized by many shops, restaurants, and recreational activities.'], 'Main features:': ['It contains global commercial stores.', 'It includes an entertainment area for children.', 'It includes cinema and other entertainment facilities.', 'Places to eat and cafes.'], 'Main stores:': ['International fashion stores.', 'Home supplies and electronic devices.', 'Shoes and bags stores.'], 'Tips for the visit:': ['It is preferable to visit the mall in the evening to enjoy the entertainment facilities.', 'It is recommended to book in advance in the cinema to avoid overcrowding.', 'The mall provides parking places easily, but it is preferable to reach early on holidays.']}","It is a commercial center in Batumi that includes shops, restaurants, entertainment areas, and cinema.",41.6375468,41.6173282,https://maps.app.goo.gl/Z5mxB6QfQKaff2Ux6,shop,2025-02-14T17:11:55.000000Z
105,69,Batumi,Georgia,Grand Mall,"{'Information:': ['It is a modern commercial center located in the heart of the city of Batumi and is considered a distinctive shopping destination for both tourists and residents. The mall provides a comprehensive and comfortable shopping experience, and includes a wide range of stores, restaurants, and entertainment, which makes it suitable for all ages.'], 'Main Features:': ['Wide shopping spaces: The mall includes many shops that offer the best local and international brands.', ""Entertainment facilities: It contains a modern cinema hall to display the latest films, as well as a children's game."", 'Restaurants and cafes: There is a variety of restaurants in the mall that offer Georgian and international foods, as well as cafes for rest and enjoy a warm drink.', 'Customer Service: The mall provides services such as free parking lots and free Wi -Fi, making the shopping experience more comfortable.'], 'Main stores:': [""Clothes: Men and women's clothes and fashion stores, including famous brands."", 'Electronics: Service for the sale of electronic devices such as smartphones, computers, and other modern devices.', 'Home tools: stores offer various home products such as furniture, electrical appliances, and decoration.'], 'Visit Tips:': ['Suitable times for the visit: It is preferable to visit the mall in the morning or on the week to avoid the large congestion on weekends.', 'Visit restaurants: After shopping, you can go to one of the restaurants available for the experience of local or international foods.', ""Entertainment activities: If you are accompanied by the family, be sure to visit the children's game and the cinema hall."", ""Shopping in offers: Don't miss the opportunity to buy products during periods of discounts and seasonal offers.""]}","It is a modern commercial center in Batumi, which includes shops, restaurants, cinema, and entertainment facilities.",41.6353844,41.6050746,https://maps.app.goo.gl/bZ9KhKvLqRj85neT9,shop,2025-02-14T16:58:21.000000Z
104,69,Batumi,Georgia,Hopa bazar,"{'Information:': ['Hopa Bazar is a local market in the Turkish city of Hoba near the border with Georgia and is a famous destination for the local population and visitors to shop and buy traditional products.'], 'Main Features:': ['It includes a wide range of local and international commodities.', 'It offers various products such as fresh foods, spices, clothes, and antiques.', 'A vital and popular place that attracts visitors daily.', 'Provides a comfortable shopping experience and affordable prices.'], 'Main stores:': ['Fresh food stores and local products.', 'Shops selling clothes and fashion.', 'Kiosks to sell handicrafts and souvenirs.'], 'Visit Tips:': ['It is recommended to visit the market in the morning to get the best offers.', 'Bring cash money as some stalls may not accept cards.', 'The local food experience available on the market.', 'Maintaining the value of negotiation when buying to get the best prices.']}","Hopa Bazar is a local market in Huba that offers fresh products, clothes, and handicrafts at affordable prices.",41.6236842,41.6180224,https://maps.app.goo.gl/VVjf5jTLfHPoFfyB8,shop,2025-02-14T16:45:36.000000Z
103,69,Batumi,Georgia,Batumi Plaza,"{'Information:': ['Location: It is located in the center of Batumi, Georgia.', 'Type: Multi -use commercial and office center.', 'Activities: Includes offices, restaurants, and retail stores.'], 'Main Features:': ['Modern and modern design.', 'Central site is close to the main city landmarks.', 'Entertainment areas and comfortable services such as cafes and restaurants.'], 'Main stores:': ['Local and international fashion stores.', 'Electronics stores and accessories.', 'Restaurants and cafes offer various cuisine.'], 'Visit Tips:': ['It is preferable to visit it in the afternoon or evening to enjoy a comfortable atmosphere.', 'Enjoy shopping in various stores or a break in cafes inside the center.', 'Make sure to visit the top floor for great views of the city.']}","It is a modern commercial center in the city center, which includes stores, restaurants, and entertainment facilities.",41.6467417,41.6408797,https://maps.app.goo.gl/7jB1XWJhUSusW6e6A,shop,2025-02-14T16:29:05.000000Z
102,69,Batumi,Georgia,Metro City Forum AVM,"{'Information:': ['City Form is a modern commercial center located in Batumi, Georgia and includes a variety of shops and restaurants in addition to entertainment facilities.'], 'Main Features:': ['Modern design and wide spaces.', 'Multiple options of restaurants and cafes.', ""Children's entertainment areas."", 'Large parking.', 'Commercial stores include the most famous local and international brands.'], 'Main stores:': ['Global and local clothing stores.', 'Electronics and devices stores.', 'Shoes and accessories stores.', 'Beauty stores and personal care.', 'Games and gift stores.'], 'Visit Tips:': ['It is preferable to visit the center in the morning hours to avoid crowding.', 'Make sure to allocate time to enjoy various restaurants and cafes.', ""Do not miss a visit to the children's entertainment if you are with a family.""]}","Metro City Forum AVM is a modern shopping center in Batumi with retail stores, restaurants, and entertainment facilities.",41.627861,41.5992617,https://maps.app.goo.gl/ZyxMmD8cdNRZafEu7,shop,2025-02-14T16:06:13.000000Z
274,69,Batumi,Georgia,Sun Restaurant,"{'Information:': ['Shams Restaurant is an oriental restaurant in Batumi that offers a variety of Arabic and eastern dishes, and it features a warm atmosphere and a distinctive service.'], 'Restaurant features:': ['Comfortable family atmosphere', 'Internal and external sessions', 'Quick and Woodwind service', 'Fresh food prepared daily'], 'Main dishes:': ['The problem grills', 'Mande', 'Kabsa', 'Arab appetizers such as chickpeas and tabbouleh'], 'working hours:': ['Daily from 10:00 am until 11:00 pm.']}",Sun Restaurant in Batumi offers delicious oriental dishes in a comfortable and suitable atmosphere for families.,41.6551488,41.6319853,https://maps.app.goo.gl/8ZVGR93F98KoVDkw9,restaurant,2025-02-14T15:36:43.000000Z
273,69,Batumi,Georgia,Shawarma King,"{'Information:': ['A restaurant in serving shawarma with distinctive flavors with fresh ingredients, is one of the most famous shawarma restaurants in Batumi.'], 'Restaurant features:': ['Quick service and comfortable atmosphere', 'Internal and external sessions', 'Suitable for families and individuals', 'Suitable prices and high quality'], 'Main dishes:': ['Chicken and meat shawarma', 'Various shawarma sandwiches', 'Shawarma dishes with rice or potatoes', 'Fresh drinks and juices'], 'working hours:': ['It opens daily from 10:00 am to 12:00 midnight.']}","Restaurant specializing in shawarma with distinctive flavors, offers delicious shawarma sandwiches and dishes in a comfortable atmosphere.",41.6438164,41.6301819,https://maps.app.goo.gl/Nr4AWB73ozXPPbtCA,restaurant,2025-02-14T15:18:03.000000Z
272,69,Batumi,Georgia,Baraka,"{'Information:': ['Baraka Restaurant is a distinctive destination for eastern and international cuisine lovers, and is characterized by its warm atmosphere and excellent service.'], 'Restaurant features:': ['Comfortable internal and external sessions', 'Perfect family atmosphere', 'Delivery and food delivery service', 'Fresh ingredients prepared dishes'], 'Main dishes:': ['Various grills (meat, chicken, fish)', 'Traditional oriental and Arabic food', 'Various salads and appetizers', 'Eastern and international sweets'], 'working hours:': ['It opens daily from 10:00 am until 11:00 pm.']}",Baraka Restaurant offers oriental and international dishes in a comfortable atmosphere with distinctive service and internal and external sessions.,41.6443039,41.63273,https://maps.app.goo.gl/QrdAwUgrW91f927BA,restaurant,2025-02-14T15:06:36.000000Z
271,69,Batumi,Georgia,Grand Grill,"{'Information:': ['Grand Grill Restaurant in Batumi specializes in serving the Turkish -style grilled food, and it features a warm atmosphere and excellent service.'], 'Restaurant features:': ['Comfortable family atmosphere', 'Internal and external sessions', 'Quick and friendly service', 'A varied list that suits all tastes'], 'Main dishes:': ['The problem grills', 'Kabbab of all kinds', 'Grilled chicken', 'Grilled fish', 'Traditional Turkish appetizers'], 'working hours': ['It works daily from 11:00 am until 11:00 pm.']}",Grand Grill Restaurant offers delicious Turkish grills in a comfortable atmosphere with a distinctive service.,41.640802,41.610937,https://maps.app.goo.gl/xiTYaTnwoG1qXeF96,restaurant,2025-02-14T14:57:46.000000Z
270,69,Batumi,Georgia,Istanbul Restaurant,"{'Information:': ['Istanbul Restaurant in Batumi offers delicious and famous Turkish dishes with original preparation techniques from Istanbul.'], 'Restaurant features:': ['Interior design inspired by the traditional Turkish character', 'Excellent and friendly service', 'A calm and ideal atmosphere for groups and families', 'Fresh and authentic dishes', 'A suitable place to enjoy a variety of Turkish cuisine'], 'Main dishes:': ['Turkish kebab', 'Charma meat and chicken', 'Turkish pies, ""Manti""', 'Turkish Molokhia', 'Turkish candy ""Baklava"" and ""Konafa""'], 'working hours:': ['It opens daily from 12:00 pm until 11:00 pm.']}",Istanbul Restaurant in Batumi offers authentic Turkish dishes in a traditional and comfortable atmosphere.,41.6491571,41.6406996,https://maps.app.goo.gl/z9x2Ct8oFkxB7ncN9,restaurant,2025-02-14T14:49:59.000000Z
269,69,Batumi,Georgia,Izmiri Restaurant,"{'Information:': ['Izmir Restaurant is located in Batumi and is considered one of the most famous Turkish restaurants in the city, as it serves traditional Turkish cuisine with a modern touch.'], 'Restaurant features:': ['A warm and elegant atmosphere inspired by the Turkish style', 'Using fresh and high -quality ingredients', 'A professional staff offers excellent service', 'A suitable place for families and friends', 'A comfortable interior design adds to the dining experience'], 'Main dishes:': ['Turkish kebab', 'Grilled lamb', 'Turkish soup ""lentils""', 'Izmir Kofta', 'Turkish dessert ""bacillus"" and ""Kunafa""'], 'working hours:': ['It opens daily from 12:00 pm until 11:00 pm.']}",Izmir Restaurant in Batumi offers traditional Turkish cuisine in a warm and comfortable atmosphere.,41.5853715,41.5892001,https://maps.app.goo.gl/WqVqAjCe4mNBe3F79,restaurant,2025-02-13T20:26:52.000000Z
268,69,Batumi,Georgia,Black Sea - Fish Restaurant in Batumi,"{'Information:': ['The Black Sea Fish Restaurant is located in Batumi, and offers a variety of fresh seafoods prepared with traditional methods.'], 'Restaurant features:': ['Wonderful view of the Black Sea', 'A calm and comfortable atmosphere is perfect for eating', 'Use fresh fish from the local sea', 'Excellent service and family and warm atmosphere'], 'Main dishes:': ['Grilled fish like salmon and mackerel', 'Shrimp and crabs', 'Georgian fish soup', 'Fresh oyster dishes', 'Georgian sweets such as ""Corroshi""'], 'working hours:': ['It opens daily from 12:00 pm until 10:00 pm.']}",Black Sea Restaurant in Batumi serves fresh marine dishes in a quiet atmosphere with a great sea view.,41.6498642,41.661321,https://maps.app.goo.gl/AEtfu5vDbxkBK5AE7,restaurant,2025-02-13T19:46:29.000000Z
267,69,Batumi,Georgia,Deniz Turkish Restaurant,"{'Information:': ['The Turkish Deniz Turkish Meat Restaurant is located in Batumi, and it specializes in serving grilled and prepared Turkish meat dishes in a traditional way.'], 'Restaurant features:': ['Interior design combines authentic and comfortable Turkish airspace', 'Use fresh and high -quality ingredients', 'A calm and ideal atmosphere for luxury meals'], 'Main dishes:': ['Grilled Turkish kebab', 'Grilled lamb', 'Shish kebab', 'Turkey stop it', 'Turkish sweets such as ""Baklava"" and ""Kunafa""'], 'working hours:': ['It opens daily from 12:00 pm until 11:00 pm.']}",The Turkish Deniz Restaurant in Batumi offers grilled Turkish meat dishes in a traditional and comfortable atmosphere.,41.6066477,41.538345,https://maps.app.goo.gl/HPxXLLstW2oWqEzi9,restaurant,2025-02-13T19:36:30.000000Z
266,69,Batumi,Georgia,Restaurant Karabak,"{'Information:': ['Carapak Restaurant is located in Batumi, and offers a distinctive dining experience that combines Turkish and Georgian cuisine in a wonderful environment.'], 'Restaurant features:': ['Modern decor reflects a warm and upscale atmosphere', 'High quality food focus on natural flavors', 'Excellent service and comfortable atmosphere for groups and families'], 'Main dishes:': ['Turkish kebab', 'Georgian shawarma', 'Fresh seafood', 'Grilled meat dishes', 'Sweets such as ""Kunafa"" and ""Baklava""'], 'working hours:': ['It opens daily from 12:00 pm until 10:00 pm.']}",Karabak Restaurant in Batumi offers Turkish and Georgian cuisine in a comfortable and elegant atmosphere.,41.6444055,41.6329938,https://maps.app.goo.gl/kRcHTxrc2EeGY4mb7,restaurant,2025-02-13T19:24:21.000000Z
265,69,Batumi,Georgia,Mecca Georgian Restaurant,"{'Information:': ['The Georgian Makkah Restaurant is located in Batumi, and offers a range of traditional Georgian dishes in an elegant and comfortable environment.'], 'Restaurant features:': ['Interior design inspired by traditional Georgian style', 'Family and warm atmosphere', 'Excellent service and distinctive dishes that are specially used using local ingredients'], 'Main dishes:': ['Al -Khasabouri of all kinds', 'Shish kebab Georgian', 'Traditional Georgian soup ""Khashi""', 'Rice dishes with meat', 'Georgian sweets such as ""Corroshi""'], 'working hours:': ['It opens daily from 12:00 pm until 11:00 pm.']}",The Georgian Mecca Restaurant in Batumi offers traditional Georgian cuisine in a comfortable and elegant atmosphere.,41.6188081,41.5841831,https://maps.app.goo.gl/Fi8Z8RtMFJcDpxuq7,restaurant,2025-02-13T19:08:18.000000Z
264,69,Batumi,Georgia,Spice Garden Restaurant Batumi,"{'Information:': ['The Spice Garden Restaurant is located in Batumi and is considered a distinctive destination for food lovers that combines Georgian and international cuisine in a quiet and elegant atmosphere.'], 'Restaurant features:': ['Distinguished decor that reflects a warm and comfortable character', 'A nice garden atmosphere makes the dining experience more fun', 'High quality service and introduction from a professional staff'], 'Main dishes:': ['Traditional Georgian soup ""Khasaburi""', 'Fresh seafood', 'Various Georgian barbecue dishes', 'Innovative plants', 'Georgian sweets such as ""Corroshi""'], 'working hours:': ['It opens daily from 12:00 pm until 11:00 pm.']}",Spice Garden Restaurant in Batumi offers Georgian and international dishes in a warm and comfortable atmosphere.,41.6381924,41.6063896,https://maps.app.goo.gl/2Xbx1Kec5z85zvKT9,restaurant,2025-02-13T18:54:36.000000Z
324,69,Batumi,Georgia,Chacha Tower,"{'Information:': ['Chacha Tower is a modern tower located in the city of Batumi, Georgia, and is one of the prominent tourist attractions.'], 'Historical importance:': ['The tower is a symbol of modern Georgian culture and its name dates back to the traditional ""Chatha"" drink, which is part of the cultural heritage in Georgia.'], 'The most prominent landmarks:': ['A long tower with a modern design with effects of Georgian culture', 'The tower includes an elevator that allows visitors to enjoy a panoramic view of the city of Batumi', 'A statue made of glass at the top of the tower symbolizes Georgian culture'], 'working hours:': ['It opens daily from 10:00 am until 8:00 pm.']}",The Chacha Tower in Batumi features a modern design and provides great panoramic views of the city.,41.6528177,41.6401223,https://maps.app.goo.gl/VCXMMxLwkfW9nBsH7,tourist place,2025-02-13T18:15:07.000000Z
323,69,Batumi,Georgia,Batumi City Zoo,"{'Information:': ['The Batumi Zoo is one of the important entertainment features in the city, and it includes a variety of rare wild animals.'], 'Historical importance:': ['The Batumi Zoo was established in the fifties, and it is an important center for the protection of endangered species and the education of visitors on wildlife.'], 'The most prominent landmarks:': ['Various animals such as lions, tigers and bears', 'Regions dedicated to wild animals and rare birds', 'Educational events for children and visitors'], 'working hours:': ['It opens daily from 10:00 am until 5:00 pm.']}",A diverse zoo in Batumi offering an educational and fun experience with animals from around the world.,41.6468274,41.6176684,https://maps.app.goo.gl/Uz8yAJj3eG7g6j746,tourist place,2025-02-13T18:03:49.000000Z
322,69,Batumi,Georgia,Batumi Nobel Brothers Technological Museum,"{'Information:': ['The Nobel Museum of Technology Brotherhood in Batumi is a museum that displays the history of technology and innovations carried out by the Nobel brothers who were pioneers in the field of industry and technological development.'], 'Historical importance:': ['The museum is a symbol of the history of technological creativity in the region, and the Nobel brothers who have had a great role in the development of many industries, including the oil industry and technological inventions are honored.'], 'The most prominent landmarks:': ['Exhibitions that display the technological equipment used by the Nobel brothers', 'Historical photos and documents tell their story and achievements', 'An exhibition that displays the innovations of the two brothers in the field of chemical and oil industries'], 'working hours:': ['It opens daily from 10:00 am until 6:00 pm, except for Monday.']}",The Nobel Museum of Technology Brothers displays the achievements of the Nobel brothers in technology and industry.,41.661657,41.677856,https://maps.app.goo.gl/fuBnNP5bRtCiNukeA,tourist place,2025-02-13T17:50:48.000000Z
321,69,Batumi,Georgia,Adjara Art Museum,"{'Information:': ['The Adjara Arts Museum is one of the most prominent art museums in Batumi, Georgia, and includes a wide range of paintings, sculptures and Georgian and international artworks.'], 'Historical importance:': ['The museum was established to preserve the Georgian artistic heritage and display works by local and international artists, making it an important cultural center in the region.'], 'The most prominent landmarks:': ['Paints of famous Georgian artists', 'European and Russian artworks', 'Temporary exhibitions of contemporary artists', 'Technical workshops and cultural activities'], 'working hours:': ['It opens daily from 10:00 am until 6:00 pm, with the exception of Monday.']}","The Adjara Arts Museum displays Georgian and international paintings and sculptures, and is an important cultural center in Batumi.",41.6485297,41.6339527,https://maps.app.goo.gl/ys18Z66KAUvRyPsL6,tourist place,2025-02-13T17:31:42.000000Z
320,69,Batumi,Georgia,Aqua Park batumi,"{'Information:': ['Aqua Partomi is an entertainment water park suitable for families, which includes many enjoyable pools and water slides for all ages.'], 'Historical importance:': ['It is one of the first water parks in Georgia, as it has contributed to promoting summer tourism in Batumi since its inception.'], 'The most prominent landmarks:': ['Water slides of different sizes and levels', 'Swimming pools for adults and children', 'Relaxed areas', 'Restaurants and cafes inside the park'], 'working hours:': ['It opens daily during the summer season from 10:00 am to 7:00 pm.']}","Aqua Patumi is an enjoyable water park that includes slides and swimming pools for all ages, making it an ideal summer entertainment destination.",41.6346199,41.6028192,https://maps.app.goo.gl/KsauJ1wSHbB1S2Mf8,tourist place,2025-02-13T17:12:57.000000Z
101,69,Batumi,Georgia,Batumi Mall,"{'Information:': ['Batumi Mall is one of the largest shopping centers in Batumi, Georgia, and provides an integrated shopping experience that combines international and local stores, as well as various options of restaurants and entertainment facilities.'], 'Historical importance:': ['Batumi Mall is considered one of the modern landmarks in the city, as it has contributed to strengthening the shopping and tourism sector in the region, to become a major destination for visitors and locals.'], 'The most prominent landmarks:': ['Shops for international and local brands', 'Hyper Market to meet daily shopping needs', 'Modern cinemas', ""Children's games area"", 'Restaurants and cafes offer various foods'], 'working hours:': ['Daily from 10:00 am until 10:00 pm.']}","Batumi Mall is a modern shopping destination that includes international stores, restaurants, and cinema, making it a major center for entertainment and shopping.",41.6433492,41.6171577,https://maps.app.goo.gl/XLzyAkTiEpDZvfer6,shop,2025-02-13T16:53:27.000000Z
319,69,Batumi,Georgia,Miracle Park,"{'Location': ['Miracle Park in Batumi, Georgia, is a distinctive tourist destination that combines modern architectural landmarks and scenic landscapes.', 'The park is located on the waterfront of the city of Batumi, providing great views of the Black Sea.'], 'Historical importance:': ['The miracle garden is a cultural and entertainment center in Batumi, as it hosts various events and festivals, such as concerts and cultural festivals.'], 'The most prominent landmarks:': ['Alphabet Tower: a 130 -meter tower, represents the Georgian alphabet, and is a symbol of the cultural identity of the city.', 'Status of Love: A moving statue tells a love story between a young man and a girl, moving towards each other every 10 minutes, creating a unique romantic scene.', 'Ferris Wheel: a rotating wheel that provides panoramic views of the city and the sea, and is one of the most prominent features of entertainment in the garden.', 'Clock Tower (CHACHA TOWER): a 25 -meter high tower, known as the distribution of the traditional Georgian ""Chatha"" drink for free every evening at 7:00.'], 'working hours:': ['The garden is open to visitors 24 hours, allowing to enjoy its beauty at any time of the day.']}",Patumi miracle garden includes distinctive features such as the alphabet and Ferris wheel with great looks.,41.6562872,41.6373158,https://maps.app.goo.gl/XnAEpZq6XcMMmJnE7,tourist place,2025-02-13T16:09:17.000000Z
318,69,Batumi,Georgia,6 May Park,"{'Location': ['The May 6 Park in Batumi is one of the oldest public parks in Georgia, founded in 1881, and is an ideal destination for relaxation and entertainment.', 'The park is located in the heart of the city of Batumi, near the Black Sea, providing visitors with picturesque looks on the coast.'], 'Historical importance:': [""The park was founded in 1881, and contributed to the city's development as a tourist and entertainment destination.""], 'The most prominent landmarks:': ['Artificial lake: It is a center for water activities, where visitors can rent pedal boats to roam in the lake.', 'Zoo: includes a variety of animals and birds, making it an ideal place for families and children.', ""Games area: It contains children's entertainment, including water games and stadiums."", 'Green spaces: they feature various trees and plants, providing a calm environment for relaxation and enjoying nature.'], 'working hours:': ['The garden is open to visitors 24 hours, allowing visitors to enjoy it at any time of the day.']}","The May 6 Park in Batumi is characterized by green spaces, an industrial lake and a children's animal garden.",41.6480022,41.6259785,https://maps.app.goo.gl/8kUNYSRxjsMxk4p99,tourist place,2025-02-13T15:00:42.000000Z
