id,city_id,city_name,country_name,name,description,short_description,latitude,longitude,location,type,created_at
968,129,Bodrum,Turkey,Herodotus Statue,"{'Location': ['Herodotus Statue is in Bodrum, Turkey and is a must-visit spot for history enthusiasts and art lovers alike. The statue stands as a symbol of ancient heritage and cultural significance.'], 'Activities and Facilities': ['Exploring the rich history and artistry of the statue.', ""Enjoying the panoramic views of Bodrum from the statue's location."", 'Taking memorable photos with the iconic Herodotus Statue.'], 'Opening Hours and Entry Fees': ['Open 24 hours daily.'], 'Nearby Areas': ['Close to Bodrum Museum Of Underwater Archaeology', 'Near Mausoleum at Halicarnassus', 'Short distance to Bodrum Castle.']}","The Herodotus Statue in Bodrum honors the ancient Greek historian Herodotus, who was born in the city (formerly known as Halicarnassus). Located near the marina or city center, the statue is a symbolic tribute to the “Father of History” and a popular photo spot for visitors exploring Bodrum’s rich cultural heritage.",37.0356715,27.432138799999997,https://www.google.com/maps?q=Herodotus%20Statue&ftid=0x14be6d376f1b8191:0x9fa523f846c3530c,tourist place,2025-07-02T18:53:41.000000Z
967,129,Bodrum,Turkey,Zeki Muren Arts Museum,"{'Location': ['Zeki Muren Arts Museum is in Bodrum, Turkey and is a must-visit destination for art enthusiasts and history lovers alike.'], 'Activities and Facilities': ['Explore the rich history and cultural heritage of the museum.', 'Admire the stunning art collections on display.', 'Learn about the life and legacy of Zeki Muren, a prominent Turkish singer and artist.'], 'Opening Hours and Entry Fees': ['Open daily from 8:30 AM to 7:45 PM', 'Free entry for all visitors.'], 'Nearby Areas': ['Located near Bodrum Museum Of Underwater Archaeology.', 'Surrounded by charming cafes and restaurants offering delicious Turkish cuisine.']}",Museum of Zeki Müren's art & costumes. This museum is located in the former home of artist Zeki Müren & displays his paintings & costumes.,37.030262,27.4396953,https://www.google.com/maps?q=Zeki%20Muren%20Arts%20Museum&ftid=0x14be6c6e9e230b05:0xdb766920cf23f27,tourist place,2025-07-02T18:49:47.000000Z
966,129,Bodrum,Turkey,Bodrum Castle,"{'Location': ['Bodrum Castle is in Bodrum, Turkey and is a must-visit historical site with a rating of 4.5.'], 'Activities and Facilities': ['Explore the Bodrum Museum Of Underwater Archaeology and Mausoleum at Halicarnassus for a dive into ancient history. Enjoy live performances at Bodrum Castle and take in the stunning views from Myndos Gate. Visit Zeki Muren Arts Museum and the historic Bodrum House for a cultural experience.'], 'Opening Hours and Entry Fees': ['Open daily from 8:30 AM to 5:00 PM, Bodrum Castle offers visitors a chance to immerse themselves in history and enjoy live performances. Entry fees may apply for certain exhibitions.'], 'Nearby Areas': ['Close to Bodrum Castle, you can explore attractions like Bodrum Museum Of Underwater Archaeology and Mausoleum at Halicarnassus. The area also boasts restaurants and cafes serving delicious seafood dishes.']}","Castle with underwater archeology museum. Oceanfront castle built in the early 1400s, now housing a large museum on underwater archeology.",37.0317978,27.4291652,https://www.google.com/maps?q=Bodrum%20Castle&ftid=0x14be6c4234600e63:0x2bd4f1f586d41c71,tourist place,2025-07-02T18:45:46.000000Z
965,129,Bodrum,Turkey,Mausoleum at Halicarnassus,"{'Location': ['Mausoleum at Halicarnassus is in Bodrum, Türkiye, and is a must-visit historical site with a rating of 4.2, offering a glimpse into the royal era of the country.'], 'Activities and Facilities': ['Explore the rich history of the Mausoleum at Halicarnassus.', 'Enjoy the stunning views of the surrounding area.', 'Visit nearby attractions like Bodrum Museum Of Underwater Archaeology and Bodrum Castle.'], 'Opening Hours and Entry Fees': ['Open daily from 8:30 AM to 5:00 PM', 'Closed on Mondays.', 'Free entry for all visitors.'], 'Nearby Areas': ['Close to the mausoleum, you can find the Bodrum Museum Of Underwater Archaeology and Bodrum Castle, offering a perfect blend of history and culture for visitors to explore.']}",Mausoleum ruins from circa 350 B.C.. Archaeological site with the ruins of the huge tomb of Mausolus dating from around 350 B.C..,37.037887399999995,27.4241164,https://www.google.com/maps?q=Mausoleum%20at%20Halicarnassus&ftid=0x14be6c4712970997:0x5ea4619a942df9d1,tourist place,2025-07-02T18:39:34.000000Z
964,129,Bodrum,Turkey,Bodrum Museum Of Underwater Archaeology,"{'Location': ['Bodrum Museum Of Underwater Archaeology is in Bodrum, Turkey, a captivating destination for history enthusiasts and curious travelers alike.'], 'Activities and Facilities': ['Explore the fascinating underwater archaeology exhibitions.', 'Discover ancient artifacts and shipwrecks.', 'Enjoy stunning views of the sea from the museum.'], 'Opening Hours and Entry Fees': ['Open daily from 9:00 AM to 9:30 PM'], 'Nearby Areas': ['Nearby areas include Mausoleum at Halicarnassus, Bodrum Castle, and Zeki Muren Arts Museum offering additional historical and cultural experiences.']}",Shipwreck artifacts & a glass collection. Museum in Bodrum Castle featuring artifacts from ancient shipwrecks & a large collection of glass.,37.031712999999996,27.429032499999998,https://www.google.com/maps?q=Bodrum%20Museum%20Of%20Underwater%20Archaeology&ftid=0x14be6c419795d4a9:0xc5d456bcd5364d44,tourist place,2025-07-02T18:36:30.000000Z
1236,132,Tashkent,Uzbekistan,Hyatt Regency Tashkent,"{'Location': ['Hyatt Regency Tashkent is located in Tashkent, Uzbekistan, a luxurious accommodation option in the heart of the city, offering a perfect blend of comfort and sophistication.'], 'Services & Facilities': ['Free Wi-Fi', 'Spa services', 'Fitness center'], 'Rooms': ['Comfortable and well-equipped rooms.', 'Air conditioning in all rooms.', 'Cozy bedding for a restful sleep.'], 'Nearby Attractions': ['Chorsu Bazaar', 'Amir Timur Museum', 'Tashkent Tower']}","Upmarket hotel with a spa & a pool. Refined rooms & suites in an upscale hotel offering dining, plus bars, a spa & an indoor pool.",41.316350899999996,69.27802199999999,https://www.google.com/maps?q=Hyatt%20Regency%20Tashkent&ftid=0x38ae8b302631a383:0x324fb78013c57369,hotel,2025-07-02T18:23:43.000000Z
963,130,Fethiye,Turkey,Sultans Aqua City,"{'Location': ['Sultans Aqua City is located in the Foça neighborhood along Mustafa Kemal Boulevard in Fethiye, Muğla, Turkey, making it easily accessible for both locals and tourists seeking aquatic recreation.'], 'Activities and Facilities': ['Enjoy a variety of water-based activities in the aquatic center.', 'Facilities include wheelchair accessible entrances, restrooms, and seating areas.', 'Advance ticket purchase is recommended for a smooth visit.', 'Payments can be made via debit cards and NFC mobile payments.'], 'Opening Hours and Entry Fees': ['Open daily from 9:30 AM to 5:30 PM.', 'Entry fees are affordable, with options for food and refreshments available on-site.'], 'Nearby Areas': ['Nearby attractions include the Ancient City of Telmessos, Amyntas Rock Tombs, and Calis Beach Bird Sanctuary, all within a short distance in Fethiye.', 'Visitors can also explore Fethiye Port and Fethiye Municipality Gulistan Park for more leisure options.']}","Sultans is a great way to enjoy a few hours of fun on the slides, as long as your expectation isn't that you expect to arrive at some massive, expensive, all ...",36.6592556,29.113270699999998,https://www.google.com/maps?q=Sultans%20Aqua%20City&ftid=0x14c04393012920a3:0x18047648a5af3b5b,tourist place,2025-07-02T11:31:07.000000Z
