id,city_id,city_name,country_name,name,description,short_description,latitude,longitude,location,type,created_at
29,16,Durres,Albania,Hills and Horses Park (Kodra e Kuajve),"{'Location and History:': ['Kodra e Kuajve is a park located in the city of Durrës, Albania, and is one of the most prominent natural spots in the region. The park is known for its breathtaking landscapes, combining lush hills, green spaces, and fresh air. It provides an ideal environment for outdoor activities such as horseback riding and nature walks, making it a beloved destination for both local and international visitors.'], 'Activities and Experience:': ['Horseback Riding: Horseback riding is the main activity in the park, offering visitors the chance to enjoy a ride through the hills and surrounding green spaces.', 'Nature and Walking: Visitors can enjoy walking along natural trails and take in the beautiful views of the area.', 'Relaxation: The park is an ideal place for relaxation, offering a peaceful environment away from the hustle and bustle of the city.'], 'Why Visit?': ['Interaction with Nature: If you love nature and outdoor activities, Kodra e Kuajve Park provides an ideal setting for relaxation and exploring the hills and green lands.', 'Diverse Activities: While horseback riding is popular here, the park also offers many opportunities to enjoy nature, whether through walking or relaxing outdoors.', ""Location: Kodra e Kuajve is located just a short distance from downtown Durrës, making it an easy place to reach while combining nature's beauty and recreational activities.""]}",An ideal place to relax and get away from the stress of daily life.,41.276718,19.523884,https://maps.app.goo.gl/S7s3PheB7836EuDT7,tourist place,2024-12-16T14:41:53.000000Z
28,16,Durres,Albania,Al-Fatih Mosque in Idris,"{'Location and History': [""The Fatih Mosque is one of the prominent religious landmarks in the city of Durrës, Albania. It is located in the city center, near the commercial and historical areas, and is considered one of the oldest mosques in the region. The mosque was built in the 15th century during the rule of the Ottoman Empire and is believed to have been established following the city's conquest by the Ottomans in 1501. It is attributed to the Ottoman Sultan Mehmed the Conqueror, who conquered Constantinople and had a significant impact on the expansion of the Ottoman Empire.""], 'Architectural Design': ['Ottoman Style: The mosque is characterized by traditional Ottoman architecture, featuring a towering minaret and a large dome surrounded by intricate architectural details. The mosque offers an atmosphere of tranquility and spirituality due to its simple yet majestic design.', 'Ornamentation and Details: The mosque is adorned with exquisite Islamic decorations on the walls and columns, reflecting Islamic art traditions that enhance the beauty of the place.'], 'Activities and Visit': ['Religious Visit: Worshippers and visitors can attend prayers at the mosque, especially on Fridays.', 'Exploring Surrounding Landmarks: The mosque is located near other attractions such as the Roman amphitheater and the Durres Castle, making it a part of a comprehensive sightseeing tour in the city.'], 'Why Visit?': ['Cultural and Spiritual Experience: If you are interested in Islamic history or want to visit an important religious landmark, the Fatih Mosque in Durres is an ideal place for that.', 'Architecture: The mosque offers a unique experience for those interested in traditional architecture and Islamic art.', 'If you decide to visit, you can simply contact us and get a customized package!']}",A unique experience for those interested in traditional architecture and Islamic art.,41.3069815,19.4460619,https://maps.app.goo.gl/kJA2NduNtpm3eapG6,tourist place,2024-12-16T14:32:19.000000Z
27,16,Durres,Albania,Durres Beach,"{'Location and Importance:': ['Durrës Beach is one of the most famous beaches in Albania, located in the coastal city of Durrës overlooking the Adriatic Sea. This beach is a favorite destination for both local and international tourists due to its clean waters and golden sands stretching along the coast.'], 'Beach Features:': ['Soft sands and blue waters: The beach is characterized by its soft sands and clear turquoise waters, making it an ideal destination for relaxation and swimming.', 'Tourist facilities: The beach features many hotels, restaurants, and cafes offering a complete tourist experience, making it suitable for both families and young people.', 'Water activities: Visitors can enjoy a wide range of water activities such as boating, surfing, and water skiing.'], 'Activities and Events:': ['Swimming and relaxation: Durrës Beach is the perfect place to relax under the sun or enjoy swimming in the Adriatic Sea.', 'Water sports: In addition to swimming, visitors can engage in many fun water sports such as snorkeling and surfing', 'Promenade stroll: The promenade along the beach offers an ideal environment for walking and enjoying the beautiful sea views.'], 'Activities in the Surrounding Area:': ['Visiting tourist attractions: Visitors can explore nearby historical landmarks such as the Roman Amphitheater of Durrës and the Durrës Castle.', 'Shopping and resorts: The area has many local markets where souvenirs and handmade crafts can be purchased, along with parks that offer enjoyable times for everyone.'], 'Why Visit It?': ['Ideal place for relaxation: Durrës Beach is an ideal choice for those looking to escape the pressures of daily life and enjoy a peaceful day on the beach.', 'Variety of activities: The beach offers a mix of activities suitable for all ages, from swimming to various water sports.', 'Proximity to historical landmarks: Its close proximity to other tourist attractions in the city makes visiting Durrës Beach a complete travel experience.', 'The beach is open year-round, with activities varying depending on the season.', 'Due to its relative closeness to the capital, the beach is located in the city of Durrës, about 33 km west of the capital, Tirana.']}",Clean water and golden sand that stretches along the coast.,41.287701,19.491968,https://maps.app.goo.gl/A9ge1i4zdY7oMNcR9,tourist place,2024-12-16T13:51:13.000000Z
26,16,Durres,Albania,Durres Roman Amphitheater,"{'Location and Importance:': [""The Durrës Amphitheater is located in the city of Durrës, Albania, and is one of the largest and most important Roman archaeological landmarks in the country. This amphitheater is one of the prominent sites reflecting the city's rich history during the Roman era. It dates back to the 2nd century AD and was built during the Roman Empire's rule.""], 'History:': ['Foundation: The amphitheater was built between 100-200 AD during the Roman rule over the city, which was considered an important center in the empire.', 'Function: The amphitheater was originally used to host theatrical performances, gladiatorial combat, and as a platform for athletic games. Due to its large size, it was considered one of the largest amphitheaters in the region.', ""Modern Discovery: It was discovered in the early 20th century when archaeologists began excavating, revealing detailed insights into the city's history and its relations with the Roman Empire.""], 'Landmarks and Activities:': ['The Amphitheater Itself: The amphitheater is notable for its ability to accommodate around 20,000 spectators. Visitors can explore the amphitheater and enjoy viewing its impressive architectural design, including the circularly arranged seats and the tunnels that were used for the entry of gladiators.', 'Surrounding Ruins: Around the amphitheater, there are other ruins related to the Roman era, such as some ancient buildings and columns.', 'The Museum: The nearby museum can be visited, which contains many artifacts discovered in the area that document the rich history of Durrës.'], 'Why Visit?': [""Historical Heritage: Visiting this amphitheater gives you the opportunity to learn about a significant part of the city's Roman history, making it a living visit to the past."", 'Wonderful Views: In addition to its historical value, the amphitheater offers stunning views of the surrounding city and the Adriatic Sea.', 'Cultural Activities: The amphitheater is an ideal location for cultural events such as theatrical performances or musical concerts, which are occasionally held.'], 'Conclusion': ['In conclusion, if you need to visit it or any other tourist attraction in Albania and beyond, you can contact us and inquire through our app.']}",An ideal location for cultural events,41.312217,19.445039,https://maps.app.goo.gl/iUVV1ZH9rrPAaS6P7,tourist place,2024-12-16T13:22:27.000000Z
25,16,Durres,Albania,Durres Castle,"{'Location and Importance:': [""The Durrës Castle is located in the city of Durrës, Albania, and is one of the oldest and most important historical landmarks in the city. This castle is famous for its strong walls and towers, which were built during the medieval period. Its history dates back to the Venetian era, and it was part of the city's defense system against both maritime and land attacks.""], 'History:': ['Establishment: The castle dates back to the 15th century when the Venetians controlled the region. It is considered one of the most famous historical landmarks in the city of Durrës.', 'Expansion and Fortifications: Initially, the castle consisted of simple surrounding walls, but during the Venetian era, these walls were reinforced to provide better protection against attacks.'], 'Landmarks and Activities:': [""Old Walls: Visitors can walk within the castle's walls, which retain many of their original features."", 'Museum: Inside the castle, there are some exhibits highlighting the history of the city and the region during the medieval period.', ""Venetian Tower: The tower in the castle is one of the most prominent elements of Venetian fortifications, and it's a popular attraction for visitors. From the top of the tower, visitors can enjoy spectacular views of the city and the Adriatic Sea.""], 'Why Visit?': ['Breathtaking Views: From the tower and walls, you can enjoy stunning views of the city of Durrës and the Adriatic Sea.', ""Historical Experience: A visit to the castle is an opportunity to immerse yourself in the city's rich history and learn about the Venetians' role in Albania's history."", 'Tourist Activities: The castle offers an ideal environment for walking around and taking historical photos.']}",An ideal environment for walking around and taking historical photos,41.3096979,19.4468827,https://maps.app.goo.gl/6dBKuc9w8pz9PEKv9,tourist place,2024-12-16T13:05:50.000000Z
7,16,Durres,Albania,HUQI Park and Restaurant,"{'Introduction': ['HUQI Park and Restaurant is an ideal destination that combines natural beauty and traditional cuisine, attracting visitors seeking a unique experience that blends tranquility with enjoyable activities.'], 'Location and Atmosphere:': ['It is located in a green area next to a small lake, surrounded by terraced hills and vineyards, with charming views of the Adriatic Sea.', 'The park offers a serene and natural atmosphere, perfect for relaxation or enjoying quality time with family and friends.'], 'Menu:': ['Lakror pies, traditional Albanian pies stuffed with vegetables.', 'Handmade local cheese.', 'Grilled chicken prepared in the traditional way.', 'The food is served with locally produced wine from the farm.'], 'Activities and Services:': ['Farm tours: Explore vast agricultural lands covering about 15 hectares.', 'Water sports: Experience fishing in the lake or boat rides.', 'Walking and meditation: Enjoy peaceful walks in the surrounding hills or around the lake.'], 'Why Visit HUQI?': ['Food: A fresh and authentic flavor experience.', ""Natural surroundings: A peaceful environment away from the city's hustle and bustle."", 'Recreational activities: A mix of relaxation and adventure.'], 'Contact Information:': [""Feel free to contact us if you're planning to visit Albania; we offer great travel plans. Get in touch with us and inquire!""]}",A quiet environment away from the hustle and bustle of the city,41.41043,19.610237,https://maps.app.goo.gl/TiDEcDM1nT6PVU7Y7,restaurant,2024-12-16T12:25:09.000000Z
24,25,PRISTINA,Kosovo,Marachi Park and Walk,"{'Marashi Park and Walkway ': ['Marashi Park and Walkway, known on the map as Restaurant Marashi, is located in the picturesque city of Prizren, Kosovo. This park is an ideal destination for those seeking to enjoy stunning natural beauty and savor a delicious meal in a serene setting.'], 'Highlights of the Park and Walkway:': ['Natural Atmosphere: The park is surrounded by breathtaking landscapes of mountains and small rivers, offering a perfect escape from the hustle and bustle of everyday life.', 'Marashi Restaurant: The restaurant serves a variety of local and international dishes, making it a standout spot for dining while visiting the park.', 'Peaceful Walkway: The walkway stretches through nature, providing visitors with an excellent opportunity for a relaxing stroll or shaded seating.'], 'Activities to Enjoy:': ['Walking and soaking in the scenic views.', 'Tasting delicious dishes at Marashi Restaurant.', 'Capturing memorable photos at this unique location.'], 'Tips for Visiting:': ['Visit in the morning or during sunset hours for a tranquil experience.', 'Wear comfortable clothing and shoes, especially if planning for a long walk.', 'Reserve a table in advance if dining at the restaurant during weekends.']}",An ideal destination for those who want to enjoy the charming nature and have a delicious meal in a peaceful atmosphere.,42.2115508,20.7451599,https://maps.app.goo.gl/s2rB4HidxirErcv1A,tourist place,2024-12-15T21:30:38.000000Z
23,15,Tirana,Albania,Petrella Castle,"{'Location': ['The Petrela Castle is located about 15 km south of Tirana, in a quiet mountainous area near the Viosa River. It is one of the most important tourist landmarks in Albania and is a significant destination for history enthusiasts and adventure seekers.'], 'General Description': ['Petrela Castle is a historical fortress dating back to the medieval era, built on a high rocky hill, providing it with a fantastic strategic location that allows it to overlook the surrounding area. The castle is known for its sturdy walls and imposing towers that surround the site. It is considered one of the most prominent castles that reflects the military defense history of Albania.'], 'History': ['The castle dates back to the medieval era and was used as a major defensive site against invaders. It is believed that the castle was initially part of the Byzantine Empire, then later became a stronghold during the Ottoman era. The location of the castle is of significant historical importance, having played a prominent role in local and regional wars.'], 'Tourist Attractions within the Castle': ['Towers and Defensive Walls: Visitors can explore the tall towers and impregnable walls that have stood for centuries, offering a glimpse into the military defenses of the time.', 'Ottoman Mosque: Inside the castle, there is a small mosque built during the Ottoman period, which is considered one of the important historical landmarks.', 'Panoramic Views: From the castle, visitors can enjoy breathtaking panoramic views of the surrounding areas, including the Tirana mountains and lush valleys.'], 'Importance of the Castle': ['Historically: Petrela Castle is one of the oldest historical landmarks in Albania, representing the local struggle against invaders throughout the ages.', 'Culturally: The castle is an important cultural site, attracting tourists interested in Albanian and Ottoman history.'], 'Best Time to Visit': ['It is preferred to visit the castle in spring or autumn, when the temperatures are moderate and the weather is suitable for exploration.']}",A unique opportunity to explore part of Albania's history,41.2552168,19.8543547,https://maps.app.goo.gl/hGtr9Uk3kPXYmhj47,tourist place,2024-12-15T21:04:59.000000Z
22,15,Tirana,Albania,National History Museum,"{'Location': ['The National History Museum is located in the heart of the capital, Tirana, on the main square in the city center, and is considered one of the most prominent cultural landmarks in Albania.'], 'General Description': [""The National History Museum in Tirana is the largest museum in Albania, containing a rich collection of exhibits that highlight the country's history across the ages. The museum was founded in 1981 and includes over 60,000 artifacts ranging from ancient to modern times.""], 'Main Exhibits': ['Mural Paintings: This artwork is one of the most prominent exhibits in the museum, reflecting the history and culture of the ancient Illyrian people who inhabited the region.', 'Military Artifacts: The museum includes many military artifacts that tell the story of the various wars Albania has witnessed throughout history.', 'Daily Life: The museum displays tools, clothing, and furniture that reflect daily life in Albania during different historical periods.', 'Ottoman Period: The museum contains a collection of exhibits highlighting the impact of the Ottoman Empire on Albania, including weapons and manuscripts.', ""Modern Era: The museum also includes exhibits related to Albania's 20th-century history, including the communist regimes and the democratic reforms the country underwent.""], 'Museum Significance': [""Culturally and Historically: The National History Museum in Tirana is a key resource for understanding the development of Albania throughout the ages, offering visitors a comprehensive experience of the country's history."", 'Educationally: The museum plays a vital role in providing valuable information about Albanian culture, making it an ideal destination for students and those interested in historical studies.'], 'Architectural Structure': ['The museum is distinguished by its grand architectural structure, which reflects the history of the country. Its front facade is adorned with a large mural called ""The Power of the People,"" which illustrates the development of Albania from ancient times to the modern era.'], 'Conclusion': [""The National History Museum in Tirana is an unmissable cultural experience for anyone looking to explore Albania's rich and diverse history. With its extensive collections and unique exhibits, this museum is one of the city's must-visit landmarks.""]}",An unmissable cultural experience for anyone who wants to explore,41.3289266,19.8173076,https://maps.app.goo.gl/kW1J5SmGqF45YGW58,tourist place,2024-12-15T20:12:15.000000Z
21,15,Tirana,Albania,Farka Park and Lake,"{'Location': ['Farka Lake is located in the eastern suburbs of Tirana, about 9 kilometers from the city center. It is surrounded by green hills and fresh air, making it an ideal destination to escape the hustle and bustle of the city.'], 'General Description': ['Farka Lake is a charming natural area featuring vast stretches of calm waters and surrounding green gardens. The area is known for its peaceful atmosphere, attracting families and groups seeking moments of relaxation amidst nature.'], 'Tourist Activities': ['Picnics and Walking: The open spaces around the lake are a great place for picnics and walks with family or friends, where one can enjoy nature and relax.', 'Cycling: The area is suitable for cycling due to the paved trails around the lake, offering stunning views.', 'Water Sports: Visitors can enjoy kayaking or small boat rides in the lake, adding a fun element to the visit.', 'Photography: The lake is an ideal place for photography enthusiasts, especially at sunset, when the colors of the beautiful nature reflect on the water.'], 'Facilities and Services': ['There are nearby restaurants and cafes offering traditional Albanian dishes and delicious beverages.', 'There are designated play areas for children, making it an ideal destination for families.', 'Carefully designed parking spaces and walking trails.'], 'Importance of Farka Lake': ['Environmentally: The lake contributes to improving air quality in the area and serves as a refuge for wildlife and birds.', 'Socially: The lake is a unique place for social activities and family gatherings, providing a distinctive atmosphere of relaxation and connection.'], 'Best Time to Visit': ['The best time to visit Lake Farka is during spring and summer, when the weather is perfect for enjoying outdoor activities and the stunning nature.'], 'In Conclusion': [""Lake Farka is considered a hidden gem near Tirana. Whether you're looking for relaxation, sports activities, or just a place to connect with nature, this park and lake offer a unique, unforgettable experience. Don't forget that we are here to help. If you wish to go there, just contact us, and we will provide a tour guide and other services and offers.""]}",A hidden gem close to Tirana,41.3153061,19.8640752,https://maps.app.goo.gl/EXe59nxfhJnW3Qcy5,tourist place,2024-12-15T19:58:38.000000Z
20,15,Tirana,Albania,Lake Bovilla Reservoir,"{'Introduction': ['One of the best places to visit to escape the hustle and bustle of the city, offering stunning natural views with crystal-clear blue waters meeting the surrounding mountains. The lake provides a serene environment for relaxation and is also a popular destination for hiking and kayaking enthusiasts.'], 'Location': ['Lake Bovilla is located approximately 20 km from Tirana, the capital of Albania. The lake is part of a series of artificial reservoirs created on the Ishëm River and is surrounded by breathtaking natural landscapes.'], 'Tourist Activities:': ['Lake Bovilla is located approximately 20 km from Tirana, the capital of Albania. The lake is part of a series of artificial reservoirs created on the Ishëm River and is surrounded by breathtaking natural landscapes.', 'Kayaking: The lake is an ideal destination for activities such as kayaking, where visitors can rent boats and enjoy the clear waters.', 'Photography: The lake and its surroundings are a fantastic spot for photography enthusiasts, especially with the natural scenery that includes mountains and green landscapes.'], 'The Importance of the Lake': [""Environmentally: Lake Bovilla is an important source of drinking water for the Tirana area and is part of the country's water reservoir network."", ""Climatically: The lake contributes to improving the local climate, creating an ideal environment for the region's plants and animals.""], 'Best Time to Visit:': ['The best time to visit Lake Bovilla is during the spring and summer seasons when temperatures are moderate, making outdoor activities like hiking and kayaking enjoyable.'], 'The End': ['Lake Bovilla is a remarkable destination that visitors must explore in Albania. It offers a fantastic blend of natural beauty and exciting tourist activities, making it an ideal spot for adventurers and relaxation seekers alike.']}",Here are the natural beauties and exciting tourist activities,41.4361716,19.8942326,https://maps.app.goo.gl/uSYGkgxhexqz9hYn7,tourist place,2024-12-15T19:42:54.000000Z
19,15,Tirana,Albania,War Shelter II - BUNK'ART 2,"{'Introduction:': [""BUNK'ART 2 is another part of the series of bunkers built in Albania during the communist regime led by Enver Hoxha. Like BUNK'ART 1, this site is also a fortified shelter designed for protection in case of nuclear attacks or any external threats. However, BUNK'ART 2 differs in that it is located in a different location from BUNK'ART 1 and offers a different perspective on Albanian history.""], 'Location:': [""BUNK'ART 2 is located in the center of the capital, Tirana, specifically in the Kalivo area, near the old town area.""], 'History and Importance:': [""BUNK'ART 2 was originally intended to be the headquarters of the government, and was used by prominent figures in the regime. Although Albania did not face any significant nuclear threats, the regime decided to build these shelters to enhance security preparedness."", ""Today, BUNK'ART 2 serves as a cultural museum that displays its military history, as well as exhibits that address the political violations that occurred during the communist era.""], 'Exhibits and Experience:': [""Military Experience: BUNK'ART 2 offers visitors a unique experience that introduces them to the challenges faced by Albanians during the communist regime. The exhibits include military uniforms, weapons, documents, and photos that document that era."", 'Art and Culture: The museum also features art exhibits that reflect Albanian culture in the post-communist era, providing a mix of military and cultural history.', ""Interactive Experience: Visitors can explore the shelter's rooms and learn how it was used through interactive screens and videos that document daily life during that period.""], ""Why Visit BUNK'ART 2?"": [""Learn about Albania's History: This place offers a unique opportunity to learn how Albania adapted to military and political challenges under the communist regime."", ""A One-of-a-Kind Experience: BUNK'ART 2 is not only a historical site but also an interactive experience that attracts visitors interested in the Cold War and military history."", 'Strategic Location: Located in a strategic area in Tirana, it is easily accessible to tourists during their tours of the capital.'], 'Conclusion:': [""A visit to BUNK'ART 2 offers a rich opportunity to discover Albania's military and cultural history, enhancing your understanding of an important period in the country's past. If you are interested in contemporary history, a visit to this unique museum in Tirana is a must.""]}",Uncover Albania's military and cultural history,41.3269893,19.8196392,https://maps.app.goo.gl/L9sQB2aikEz2YEUUA,tourist place,2024-12-15T19:25:39.000000Z
