id,city_id,city_name,country_name,name,description,short_description,latitude,longitude,location,type,created_at
145,31,Cairo,Egypt,Prince Muhammad Ali Palace,"{'information': ['The Prince Mohammed Ali Palace is located in the Manial area of Cairo and is one of the most prominent historical palaces in Egypt. It was built between 1901 and 1929 by the order of Prince Mohammed Ali Tewfik, who had a passion for Islamic arts and architecture.', 'The palace combines various architectural styles, most notably Islamic, with touches of Ottoman, Moroccan, Persian, and European elements. It stands as an artistic masterpiece that merges grandeur with precision in design.', ""The Prince Mohammed Ali Palace stands as a testament to an important era in modern Egyptian history, reflecting the artistic and cultural taste of Prince Mohammed Ali. Today, it is one of Cairo's most important tourist attractions, drawing visitors from all over the world.""], 'Location': ['Prince Mohamed Ali Palace is located in El-Manial area in Cairo, Egypt. It enjoys a strategic location on Rhoda Island, offering stunning views and proximity to many other tourist attractions in the capital.'], 'Palace Contents:': ['The Saraya: The main building with ornate reception rooms and a collection of artworks and manuscripts.', 'The Palace Mosque: Known for its unique Islamic design and intricate geometric decorations.', 'The Clock Tower: A distinctive tower showcasing Islamic architectural craftsmanship.', ""The Museum: Houses the prince's personal belongings, including weapons, carpets, and jewelry."", 'The Gardens: Expansive gardens beautifully landscaped, featuring rare plants and fountains.']}","A historical architectural masterpiece in Manial that combines Islamic style and international arts, surrounded by charming gardens.",30.0287574,31.2273132,https://maps.app.goo.gl/oGKd8pfNS2jfhFxA9,tourist place,2025-01-09T14:42:59.000000Z
144,31,Cairo,Egypt,Muhammad Ali Mosque,"{'information': ['The Muhammad Ali Mosque, also known as the Alabaster Mosque, is located within the Citadel of Salah al-Din in Cairo. It was commissioned by Muhammad Ali Pasha, the founder of the Alawiyya dynasty in Egypt, in memory of his son Tusun Pasha, who passed away at a young age. Construction began in 1830 and was completed in 1848.', ""The mosque is an architectural masterpiece inspired by the Sultan Ahmed Mosque (Blue Mosque) in Istanbul. It features a large central dome about 52 meters high, surrounded by smaller domes. Its two elegant minarets rise prominently, adding to the mosque's majestic appearance."", 'Inside, the mosque is adorned with alabaster marble walls, giving it the name ""Alabaster Mosque."" The main prayer hall boasts stunning Islamic decorations and magnificent chandeliers that illuminate the space beautifully.', ""The mosque is one of Cairo’s most important tourist attractions, drawing visitors from around the globe to admire its Islamic architecture and explore Egypt's history during Muhammad Ali Pasha's era.""], 'Location': ['The mosque is situated within the Citadel of Salah al-Din, a historic site that offers panoramic views of Cairo.']}","A nineteenth-century Ottoman architectural masterpiece inside the Saladin Citadel, highlighting fine Islamic art.",30.0287061,31.2573357,https://maps.app.goo.gl/iRyrAio56ASKvquc6,tourist place,2025-01-09T14:05:55.000000Z
54,31,Cairo,Egypt,Mall of Egypt,"{'Information': ['Mall of Arabia is located in 6th of October City, Cairo. It is one of the significant malls in Cairo, featuring numerous international stores, restaurants, and cafes, in addition to entertainment centers. The mall also boasts a beautiful dancing fountain that has captivated tourists and visitors alike.', 'The mall also features a variety of international cafes and restaurants, making it an ideal place to spend enjoyable time with your family and friends. Additionally, it offers numerous entertainment venues and advanced cinema halls where you can have a delightful day.', 'Mall of Egypt features Ski Egypt, a unique destination offering a special experience where you can play in the snow, ski, and enjoy many activities with friends or family.'], 'Shops': ['American Eagle', 'Emporio Armani', 'Aeropostale', 'Tommy Hilfiger', 'Timberland'], 'Restaurants and cafes': [""Butcher's Burger"", 'Country Hills', 'Labash', 'Mokai', 'La Poire Café', 'Starbucks'], 'Mall working hours': ['From Saturday to Wednesday: 10:00 AM to 11:00 PM On Thursday and Friday: 10:00 AM to 12:00 Midnight']}","Mall of Egypt is a distinguished entertainment and marketing destination that includes the most famous brands, restaurants, and family entertainment venues.",29.9726551,31.0126441,https://maps.app.goo.gl/XcriYkmCfCFZS23q8,shop,2025-01-08T21:47:03.000000Z
53,31,Cairo,Egypt,Genena Mall,"{'About': ['Genena Mall, located in Nasr City, is one of Cairo’s top malls. Opened in 1999, it consists of five floors and features over 300 stores offering gifts, clothing, and accessories. The mall also includes large restaurants, an ice-skating rink, six cinemas, and much more, making it a prime destination for shopping and entertainment.'], 'Top Stores:': ['Black Line', 'Dakur', 'Cottonil', 'Tango'], 'Top Restaurants & Cafes:': ['Sbarro', 'Wasaya', ""McDonald's""], 'Opening Hours:': ['Daily from 11:00 AM to 12:00 Midnight']}",Genena Mall...an integrated shopping and entertainment experience in Nasr City.,30.060953,31.3321901,https://maps.app.goo.gl/4JGHmyYZLJzM7Wm2A,shop,2025-01-08T21:36:56.000000Z
52,31,Cairo,Egypt,Sun City Mall,"{'About Sun City Mall': ['Sun City Mall, located in Sheraton, is a massive and unique shopping complex designed in the shape of a ship. It consists of 9 floors, housing around 300 stores, alongside international restaurants, cafes, modern cinemas, and entertainment areas for families and kids. It’s a top destination for shopping and entertainment in Cairo.'], 'Top Stores:': ['Clarks', 'Monsoon', 'Adidas', 'White House', 'Mothercare'], 'Top Restaurants & Cafes:': [""McDonald's"", 'Buffalo Burger', 'Pottery Café', 'Einstein Café'], 'Opening Hours:': ['Daily from 10:00 AM to 12:00 Midnight']}",Sun City.. a shopping and entertainment destination with a unique design.,30.1035608,31.387174,https://maps.app.goo.gl/ttTYec2MtNfacksp9,shop,2025-01-08T21:19:49.000000Z
51,31,Cairo,Egypt,Mall of Arabia,"{'Information': ['Mall of Arabia is located in 6th of October City, Cairo. It is one of the significant malls in Cairo, featuring numerous international stores, restaurants, and cafes, in addition to entertainment centers. The mall also boasts a beautiful dancing fountain that has captivated tourists and visitors alike.', 'Mall of Arabia is a perfect spot for spending quality time with family, whether shopping, dining, or enjoying entertainment. It offers a wide range of options to suit all tastes and ages. Its only drawback is its distance from downtown Cairo, but it is definitely worth a visit.'], 'Shops': ['Stradivarius Store', 'Centrepoint', 'Skechers', 'IKEA', 'Swarovski'], 'Restaurants and cafes': ['Kilo Kebab', 'Ayadina', 'Babu Smokehouse', 'Starbucks', 'Carbon', 'Costa Coffee'], 'Mall working hours': ['Sunday to Thursday from 9:00 am to 10:00 pm Friday and Saturday from 9:00 am to 11:00 pm']}","Mall of Arabia is an integrated shopping and entertainment destination in 6th of October, featuring international stores, restaurants, and a dancing fountain.",30.0065859,30.9753955,https://maps.app.goo.gl/f3ifmGpEkZN9CgY68,shop,2025-01-08T21:08:56.000000Z
50,31,Cairo,Egypt,City Center Almaza Mall,"{'Information': ['When talking about Cairo malls, we must mention City Centre Almaza, one of the most beautiful malls in Cairo. It features over 260 retail stores, in addition to restaurants, cafes, and various entertainment options suitable for all ages.', 'The name ""Almaza,"" meaning ""jewel,"" reflects a rich history and the philosophy behind the planning and design of Heliopolis. The mall offers its visitors free Wi-Fi services and a customer service center to assist and answer any questions you may have.'], 'Shops': ['LC Waikiki', 'Armani Exchange', 'Aeropostale'], 'Restaurants and cafes': ['Country Hills', 'Mori Sushi', 'Tamara', ""Papa John's"", 'Fifth Street Coffee', 'Emporio Armani Caffè', 'Coffee Berry'], 'Mall working hours': ['From Saturday to Tuesday, from 10:00 AM to 11:00 PM. From Wednesday to Friday, from 10:00 AM to 12:00 midnight']}",City Center Almaza Mall is a luxury shopping and entertainment destination with more than 260 stores and a variety of restaurants and cafes.,30.0807204,31.3649881,https://maps.app.goo.gl/rEKPd667yfStrf4e7,shop,2025-01-08T20:28:16.000000Z
49,31,Cairo,Egypt,City Stars Mall,"{'Information': [""City Stars Mall is one of the largest and most beautiful malls in Cairo. Located in Nasr City, Cairo, it is a luxury shopping and entertainment destination, featuring over 600 retail stores, 3 hotels, more than 3 cinemas, a conference center, an ice skating rink, and a children's play area."", ""City Stars Mall is an important destination for tourists and visitors, offering a fun experience for shopping, dining, and entertainment with children, thanks to its many options and the mall's beautiful design that makes you want to visit even if you're not in the mood to shop.""], 'important shops': ['defacto', 'carina', ""Levi's"", 'Zara', 'Lacoste', 'Concrete', 'Clarks', 'Minior'], 'restaurants and cafés': ['Ayadina Restaurant', 'Abou Shakra Restaurant', 'Bosporus Restaurant', 'Cortigiano Restaurant', ""Dunkin' Donuts"", 'Paul', 'Costa Coffee'], 'Mall working hours': ['From Saturday to Wednesday: 10:00 AM to 11:00 PM. On Thursdays and Fridays: 10:00 AM to 12:00 midnight.']}","City Stars Mall is an upscale shopping and entertainment destination that includes more than 600 shops, various restaurants, and distinctive cinemas.",30.0721132,31.3418531,https://maps.app.goo.gl/4egqPFfBV6CXMqtJ7,shop,2025-01-07T17:14:07.000000Z
48,31,Cairo,Egypt,Cairo Festival Mall,"{'Information': ['Cairo Festival Mall is one of the most important and beautiful malls in Cairo, known for its unique and beautiful design. Located in the Fifth Settlement area in Cairo, it features a large number of international retail stores and entertainment venues where both adults and children can enjoy. The mall also houses numerous global restaurants offering a variety of exquisite international dishes.', 'It is also distinguished by its open dining area overlooking beautiful dancing fountains, accompanied by soft music, offering a truly unique and enjoyable experience. Additionally, there are many global cafés where you can relax with friends and enjoy the ambiance while watching the dancing fountains.', 'Cairo Festival Mall houses over 300 retail stores, as well as a cinema, an amusement park, a water play area, a hotel, and a conference center.'], 'important shops': ['Lacoste', 'H&M', 'Samsonite', 'Swarovski', 'Sephora', 'Virgin Megastore'], 'restaurants and cafés': ['KFC', ""McDonald's"", ""Hardee's"", ""Chili's"", 'Paul', 'Costa Coffee', 'Caribou Coffee', 'Starbucks'], 'Mall working hours': ['Every day of the week from 10:00 AM to 11:00 PM.']}","Cairo Festival Mall is a distinctive shopping and entertainment destination, offering international brands, dining options, and unique experiences.",30.0288408,31.4050112,https://maps.app.goo.gl/NMrN87qvbYy1nPSQ6,shop,2025-01-07T16:42:07.000000Z
56,30,Alexandria,Egypt,Byblos Restaurant,"{'About Byblos Restaurant': ['Byblos Restaurant is located within the renowned Four Seasons Hotel in Alexandria and is considered one of the finest and most luxurious dining destinations in the city. With its elegant design and serene ambiance, the restaurant offers an unparalleled experience featuring delicious Lebanese, Middle Eastern, and European cuisines. It’s the perfect spot for families and friends seeking an extraordinary dining experience.'], 'Menu Highlights': ['Byblos Restaurant is famous for its special dishes, including:', 'Kofta in pottery', 'Shakriya with lamb', 'Byblos chicken', 'Salmon tagine', 'Grilled boneless chicken'], 'Location & Accessibility': ['Situated inside the Four Seasons Hotel, Byblos is easily accessible and offers excellent facilities, making it a suitable choice for individuals and families alike. The top-notch service further elevates the dining experience.'], 'Opening Hours': ['Open daily from 2:00 PM to 12:00 AM.']}",Byblos: Elegant ambiance and unique Lebanese dishes.,31.2452636,29.9668781,https://maps.app.goo.gl/zUa3vd5id9itP41j7,restaurant,2025-01-07T13:51:14.000000Z
58,31,Cairo,Egypt,Meat Mott Restaurant,"{'Information': ['Meat Mout offers a unique dining experience for meat lovers, featuring a variety of dishes with the finest cuts of grilled meats prepared in innovative styles.', 'The restaurant features a lively, modern atmosphere with quick and friendly service to ensure a comfortable dining experience.'], 'Menu': ['The menu includes delicious dishes such as steaks, kebabs, burgers, alongside tasty sides and appetizers.'], 'Location and Branches': ['Meat Mout is located in a prime spot within the city, easily accessible for an enjoyable dining experience.']}",Meat Mute Restaurant offers a unique experience for meat lovers with grilled dishes prepared in innovative ways in a modern atmosphere.,30.043099,30.9507776,https://maps.app.goo.gl/L5deC49RMxsukfao9,restaurant,2025-01-07T13:49:24.000000Z
57,30,Alexandria,Egypt,Sea Gull Restaurant,"{'About Sea Gull Restaurant': [""Sea Gull Restaurant is located on El-Max Beach with a stunning view of the Mediterranean Sea, making it one of Alexandria's top seafood restaurants."", 'The restaurant is known for its beautiful design and tranquil seating areas, offering a unique dining experience perfect for families and friends.', ""It also features an outdoor area with children's play facilities and seating for adults.""], 'Menu Highlights': ['The restaurant serves a variety of delicious seafood dishes, including:', 'Seafood Fatta', 'Fried Fish Fillet', 'Singari Fish'], 'Location and Accessibility': ['Situated on El-Max Beach, the restaurant combines great food with a scenic seaside view.'], 'Opening Hours': ['Open daily from 12:00 PM to 1:00 AM.']}",Sea Gull Restaurant: Delicious seafood with a stunning view.,31.1447784,29.834024,https://maps.app.goo.gl/tRhsnjxQrVcgPfZHA,restaurant,2025-01-07T13:43:11.000000Z
59,30,Alexandria,Egypt,Délices Restaurant,"{'About Delices Restaurant': ['Delices Restaurant is one of the oldest and finest restaurants in Alexandria, established in 1922 and still managed by the same family.', 'The restaurant is distinguished by its antique design, maintained by its owners, making it a popular destination for tourists and locals to enjoy meals and great ambiance.'], 'Menu Highlights': ['The restaurant offers a variety of renowned international dishes, such as:', 'Lemon Chicken', 'French Curry Chicken', 'Greek Grilled Chicken', 'Greek-Style Lamb Shank', 'Soutzoukakia', 'Deluxe Filet Mignon'], 'Location and Accessibility': ['Delices Restaurant is located next to Trianon Restaurant in the heart of Alexandria, ensuring easy access for visitors.'], 'Opening Hours': ['Open daily from 8:00 AM to 12:00 midnight.']}",Delice Restaurant...an ancient atmosphere and distinctive international dishes.,31.200107,29.8995529,https://maps.app.goo.gl/mvuMtG5LbN1vGmy89,restaurant,2025-01-07T13:34:20.000000Z
143,30,Alexandria,Egypt,Montaza Palace,"{'About Montaza Palace': ['Montaza Palace is one of the most important landmarks in Alexandria, known for its rich history dating back to the royal era in Egypt.', 'The palace is distinguished by its unique location overlooking the Mediterranean Sea, offering natural beauty and special charm.', 'The palace is surrounded by vast gardens filled with rare trees and plants, making it a perfect destination for leisure and enjoying nature.'], 'Activities and Facilities': ['Visitors can enjoy guided tours inside the palace to explore its unique architectural design and royal artifacts.', 'The palace gardens feature wide open spaces for picnics, with seating areas and playgrounds for children.', 'Walking or jogging in the dedicated paths within the gardens is highly enjoyable.', 'The palace offers stunning views of the sea, making it an ideal spot for photography.'], 'Location and Accessibility': ['Montaza Palace is located in the Montaza district of Alexandria and is easily accessible via public or private transportation.', 'Parking facilities and comfortable amenities are available, accommodating visitors of all ages.'], 'Opening Hours and Entry Fees': ['The palace is open daily from 9:00 AM to 5:00 PM.', 'Ticket prices vary depending on the category, with special discounts for students and children.'], 'Nearby Areas': ['Close to the palace are several tourist attractions, such as Antoniades Gardens and Montaza Beach.', 'The area surrounding the palace hosts a variety of restaurants and cafes offering delicious seafood.']}",Montazah Palace...royal beauty and gardens overlooking the sea.,31.2884642,30.0159916,https://maps.app.goo.gl/WrAm3R8Aof5nVXm3A,tourist place,2025-01-07T13:17:07.000000Z
55,31,Cairo,Egypt,Hajouja Restaurant,"{'About Hajouga Restaurant': ['Hajouga Restaurant offers a unique dining experience for lovers of traditional Egyptian cuisine, blending authentic flavors with modern quality.', 'The restaurant stands out with its warm, traditional ambiance inspired by Egyptian culture, complemented by an interior design reflecting the spirit of heritage. The staff is well-trained to provide quick and professional service.'], 'Menu': [""Hajouga's menu features a selection of famous Egyptian dishes, including koshari, molokhia, pies, and casseroles, along with grilled dishes and special appetizers.""], 'Location and Accessibility': ['Hajouga Restaurant is located in a convenient area, offering easy access, parking spaces, and indoor and outdoor seating suitable for individuals and families.'], 'Branches': ['Downtown: Talaat Harb Street, near Tahrir Square.', 'Nasr City: Abbas Al Akkad Street, next to City Stars Mall.', 'Mohandessin: Arab League Street, opposite the Shooting Club.', 'Maadi: 9th Street, next to Maadi Metro Station.', 'Fifth Settlement: North Teseen Street, inside Mall 5A.'], 'Contact Information': ['Hotline: 890-567-1234', 'Website: www.hagogarestaurant.com']}","Hajouja Restaurant serves traditional Egyptian dishes with authentic flavors and a warm, popular atmosphere.",30.0808269,31.3813469,https://maps.app.goo.gl/cqkT3u51yTjiDL7u8,restaurant,2025-01-07T12:53:34.000000Z
54,31,Cairo,Egypt,Kababji Palace Restaurant,"{'Information': ['Qasr El-Kababgy is a famous Egyptian restaurant specializing in grilled dishes and authentic Oriental cuisine. The restaurant is renowned for the quality of its ingredients, as it uses fresh meat and poultry from its own farms, ensuring high-quality dishes.'], 'Branches:': ['New Cairo (Fifth Settlement): North Teseen Street, inside Mall 258, next to Jumia Egypt.', 'Sheikh Zayed: Sheikh Zayed Entrance 4, Boulevard Mall, Tourist Walkway, Dahshour Link Road.', 'North Coast: Alexandria-Matrouh Road, opposite Marina Gate 5.'], 'Contact Numbers:': ['Hotline: 15959', 'For inquiries and hall reservations: 01007444378', 'Complaints and suggestions: 01212120700'], 'Working Hours:': ['The restaurant operates daily from 9 AM to 2 AM.'], 'Additional Information:': ['Qasr El-Kababgy offers a wide variety of traditional Egyptian dishes, including kebabs, kofta, casseroles, and assorted appetizers. Known for its luxurious ambiance and exceptional service, the restaurant is a favorite destination for lovers of Oriental cuisine in Egypt.']}",Kababgy Palace Restaurant offers authentic Egyptian grilled meats with fresh ingredients and a luxurious atmosphere suitable for all occasions.,30.0302043,31.4587117,https://maps.app.goo.gl/cT9ssG9chAbrvjzv8,restaurant,2025-01-06T18:31:03.000000Z
49,32,Sharm El Sheikh,Egypt,Rixos Premium Seagate Hotel,"{'Information': ['Rixos Premium Seagate is located in Nabq Bay in Sharm El Sheikh, Egypt, and is an exclusive adult-only resort (18+). The resort is ideally situated on the Red Sea and offers an all-inclusive experience with a variety of facilities and services.'], 'Location and Nearby Attractions:': ['Location: The resort is located in Nabq Bay, just 9 kilometers from Sharm El Sheikh International Airport, making it easy to access.', 'Nearby Attractions: The resort is about 18 kilometers from Naama Bay and 25 kilometers from the Old Market in Sharm El Sheikh.'], 'Rooms and Facilities:': ['Rooms and Suites: The resort features 660 elegantly decorated luxury rooms with stunning views of the sea or gardens.', 'Restaurants and Bars: The resort has one main restaurant, along with seven à la carte restaurants offering a wide variety of international cuisines, and nine bars serving various beverages.', 'Entertainment Facilities:  The resort offers seven swimming pools, spa and wellness facilities, and a variety of entertainment activities.'], 'Additional Services:': ['Activities: The resort provides water sports facilities, including diving and windsurfing, as well as various entertainment activities.', 'Wi-Fi Service: Free Wi-Fi is available throughout the hotel.']}","Rixos Premium Seagate Resort, a luxury adults-only beach resort in Nabq Bay with comprehensive services and upscale facilities.",28.0381922,34.4287376,https://maps.app.goo.gl/MGmW5Yc3KtoHXhUQ7,hotel,2025-01-06T13:12:14.000000Z
48,36,Dahab,Egypt,Dahab Bay Hotel,"{'Information': ['Dahab Bay Hotel is located in Dahab, Egypt, and is an ideal destination for travelers seeking comfortable and distinctive accommodations.'], 'Location and Nearby Attractions:': ['Location: The hotel boasts a beachfront location, offering breathtaking views of the Red Sea.', 'Nearby Attractions: The hotel is a short distance from the famous diving site ""Blue Hole,"" making it perfect for diving and marine activities enthusiasts.'], 'Rooms and Facilities:': ['Rooms: The rooms at Dahab Bay Hotel feature simple and comfortable decor, air conditioning, satellite TV, and private bathrooms.', 'Facilities: The hotel offers an outdoor pool, garden, private beach area, and a restaurant serving a variety of local and international dishes.'], 'Additional Services:': ['Activities: The hotel provides water sports facilities for an additional fee, allowing guests to enjoy various marine activities.', 'Wi-Fi Service: Free Wi-Fi is available throughout the hotel.']}",Dahab Bay: A distinctive beach destination with stunning views of the Red Sea and its proximity to the famous “Blue Hole” diving site.,28.5188454,34.5087967,https://maps.app.goo.gl/zw2vVp1c9xFJytTd9,hotel,2025-01-06T12:27:02.000000Z
47,36,Dahab,Egypt,Retac Konya Resort Dahab,"{'Information': ['Retac Qunay Dahab Resort & Spa is located in central Sinai, overlooking the Gulf of Aqaba. The resort features 5 swimming pools and an artificial beachfront lagoon. All rooms include a private balcony or terrace, along with flat-screen TVs with satellite channels.'], 'Location and Nearby Attractions:': ['Location: The resort is approximately 4.7 km from Dahab city center.', 'Nearby Attractions: It is located near Dahab Lagoon, offering guests the opportunity to enjoy beach activities and water sports.'], 'Rooms and Facilities:': ['Rooms: The rooms are designed with modern decor in warm earthy tones. They feature large windows, white bed linens, luxurious beds, comfortable sofas in seating areas, and tea/coffee-making facilities. Bathrooms come equipped with premium toiletries.', 'Facilities: The resort provides various amenities, including a fitness center, beachfront massage services, and recreational activities for children.'], 'Additional Services:': ['Activities: The resort offers diving, windsurfing, and snorkeling activities.', 'Dining: The resort features a selection of international cuisines across 4 restaurants, with cocktails and snacks available at Sails Restaurant & Bar.']}","Retac Konya Dahab: An exceptional destination that combines tranquility and luxury, with stunning views and wonderful marine activities.",28.4696922,34.4764876,https://maps.app.goo.gl/iP2FWc7NkSHk6RQX6,hotel,2025-01-06T12:09:02.000000Z
46,36,Dahab,Egypt,Jaz Dahabeya Hotel,"{'Information': ['Jaz Dahabeya Hotel is located in Dahab, Egypt, and is one of the most luxurious hotels in the area, offering stunning views of the Red Sea and the Sinai Mountains.'], 'Location and Nearby Attractions:': ['Location: The hotel is about 3 km from Dahab city center and a 10-minute drive from Abu Gallum National Reserve.', 'Nearby Attractions: It is close to Dahab Bay, allowing guests to enjoy beach activities and water sports.'], 'Rooms and Facilities:': ['Rooms: The rooms feature elegant designs, air conditioning, satellite TV, and balconies overlooking the pool area or gardens.', ""Facilities: The hotel includes a lagoon-style pool, a well-equipped gym, a spa offering massage treatments and sauna, and a children's playground.""], 'Additional Services:': ['Activities: The hotel offers activities such as windsurfing, snorkeling, and diving at an additional cost.', ""Dining: Le Palmier restaurant serves Mediterranean and international cuisines, while regional specialties can be enjoyed on Sea Pearl's terrace.""]}","Jaz Dahabeya: A luxury resort on the Red Sea that offers a peaceful atmosphere, water activities, and exceptional services.",28.4798744,34.4879971,https://maps.app.goo.gl/6xxQDxGfeEKYpoty7,hotel,2025-01-06T11:51:10.000000Z
