id,city_id,city_name,country_name,name,description,short_description,latitude,longitude,location,type,created_at
155,25,PRISTINA,Kosovo,Chop Sandwich Club,"{'Location': ['Chop Sandwich Club is a popular eatery in Pristina, Kosovo'], 'Operating Hours': ['Monday to Friday: 10:30 AM – 6:30 PM', 'Saturday: 11:30 AM – 5:30 PM', 'Closed on Sundays'], 'Main Dishes': ['Pesto Chicken Sandwich: Chicken, pesto, homemade ranch, mozzarella cheese, arugula, basil leaves, cherry tomatoes, and chili peppers.', 'Hoboken—Crunchiest Crunch®: Crunchy chicken, homemade coleslaw, ranch, pickles, cherry tomatoes, and chili peppers.', 'Chef Sandwich: Chicken, smoked beef, four house sauces (BBQ, Ranch, Reggie & Cabron), mozzarella cheese, arugula, and cherry tomatoes.']}","Chop Sandwich Club offers gourmet sandwiches with fresh ingredients, unique flavors, and a cozy atmosphere in Pristina.",42.6629526,21.1588864,https://maps.app.goo.gl/j8bavkfidR3R6X4v5,restaurant,2025-02-02T19:21:08.000000Z
154,25,PRISTINA,Kosovo,Dielli Grill,"{'Location': ['Situated in the heart of Pristina, Dielli Grill is easily accessible to both locals and visitors.'], 'Facilities & Services': ['Amenities: Offers free Wi-Fi and comfortable seating arrangements.', 'Ambiance: Features a cozy and inviting atmosphere, suitable for various dining occasions.', 'Services: Provides dine-in, takeaway, and delivery options.'], 'Main Dishes': ['Cuisine: Serves a variety of dishes, including traditional Albanian cuisine, barbecue, and fast food options.', 'Vegetarian Options: Offers vegetarian-friendly dishes to cater to diverse dietary preferences.'], 'Operating Hours': ['Open daily from 6:30 AM to 8:00 PM.']}","Dielli Grill offers a diverse menu in a cozy setting, making it a popular choice for both locals and tourists in Pristina.",42.64597,21.158908,https://maps.app.goo.gl/9aWKY1gix4gEQqXt9,restaurant,2025-02-02T19:08:27.000000Z
150,25,PRISTINA,Kosovo,Burger King,"{'Locations': ['Albi Mall: Located within the Albi Mall shopping center, this was the first Burger King outlet in Pristina.', 'City Center: Another branch is situated near Mother Teresa Square, providing easy access for those in the downtown area.'], 'Operating Hours': ['Burger King restaurants in Pristina typically operate from 10:00 AM to 12:00 AM. Please note that orders placed after midnight are accepted only within Pristina.'], 'Services': ['Dine-In and Takeaway: Enjoy your meal in the restaurant or opt for takeaway.', 'Delivery: Delivery services are available, with specific terms for late-night orders.', 'Mobile App: Burger King Kosovo offers a mobile app for convenient ordering and exclusive deals.']}",Burger King in Pristina serves flame-grilled burgers with fast service and a casual dining experience.,42.4371111,20.4119834,https://maps.app.goo.gl/KUDLknQU7N9PYcNL7,restaurant,2025-02-02T18:12:54.000000Z
71,25,PRISTINA,Kosovo,Meridian Express Supermarket,"{'Location': ['Conveniently located in central Pristina, making it easily accessible for locals and visitors.'], 'Facilities & Services': ['Products: Wide range of groceries, fresh produce, dairy products, snacks, beverages, household items, and personal care products.', 'Additional Services: Some locations offer delivery services, self-checkout options, and customer loyalty programs.', 'Payment Methods: Accepts various payment methods, including cards and cash.']}",Meridian Express Supermarket is a convenient shopping destination offering everything from fresh food to everyday essentials.,42.6677177,21.1662145,https://maps.app.goo.gl/UcB7rczbk2VdU4tJ6,shop,2025-02-02T14:45:09.000000Z
146,27,Peja,Kosovo,Pizza gryka,"{'Location': ['Located in the city of Peja, Pizza Gryka provides a great dining spot for locals and visitors looking for tasty, freshly prepared pizzas.'], 'Facilities & Services': ['Services: Dine-in, takeaway, and delivery options', 'Ambiance: Cozy and friendly atmosphere with modern decor', 'Amenities: Casual seating, free Wi-Fi'], 'Main Dishes': ['Signature Pizzas – A wide variety of pizzas including Margherita, Pepperoni, and Vegetariana', 'Custom Pizzas – Choose your own toppings for a personalized pizza experience', 'Side dishes – Garlic bread, fries, and salads', 'Beverages – Soft drinks, fresh juices, and a selection of beers']}","A local favorite in Peja, Pizza Gryka is known for its fresh, delicious pizzas and cozy atmosphere, ideal for a casual meal.",42.6603224,20.2705234,https://maps.app.goo.gl/6brqsvCdMM9ubs2n7,restaurant,2025-02-02T14:17:56.000000Z
145,24,Prizren,Kosovo,KFC,"{'Location': ['Located in the heart of Prizren, the restaurant provides easy access for locals and visitors alike, serving the famous KFC menu.'], 'Facilities & Services:': ['Amenities: Free Wi-Fi, drive-thru service', 'Services: Friendly staff, dine-in and takeaway options', 'Ambiance: Casual dining with modern fast-food seating'], 'Main Dishes': ['Chicken Sandwiches & Wraps – Variety of sandwiches with chicken fillets', 'Signature Fried Chicken – Crispy fried chicken pieces, original recipe, or extra crispy', 'Sides – Fries, coleslaw, mashed potatoes, and gravy', 'Beverages – Soft drinks and desserts']}","A fast-food haven in Prizren, KFC offers quick, tasty meals with their signature fried chicken and classic sides. Perfect for a fast, satisfying meal on the go.",42.2118668,20.7215284,https://maps.app.goo.gl/cmEPDEXKs9AAwrPn6,restaurant,2025-02-02T13:57:31.000000Z
