id,city_id,city_name,country_name,name,description,short_description,latitude,longitude,location,type,created_at
197,64,Bangkok,Thailand,Wat Arun,"{'Information': ['Watt Arun, known as the Dawn Temple, is one of the most famous landmarks of Bangkok, located on the West Bank of the Zhao Figia River.'], 'Historical importance': ['Dating back to the Ayutthaya period, Wat Arun was originally known as Wat Makok before being renamed. It was later restored and expanded during the reign of King Rama II and King Rama III. The temple is dedicated to Aruna, the Hindu god of dawn.'], 'The most prominent landmarks': ['Central Tower (Brang): The main tower in the temple is the iconic characteristic, and it reaches 70 meters and is decorated with colored and marine seashells.', 'The surrounding temples: The complex includes smaller temples, towers and statues representing aspects of Thai culture and history.', 'Decorative patterns and walls: inside the temple, visitors can see detailed inscriptions and topics related to Thai myths and Buddhist education.'], 'Best Time to Visit': ['Working hours: The temple opens daily from 8:00 am until 5:30 pm.', 'Entry fees: There are small entry fees for visitors.']}","Watt Arun is a famous dawn temple in Bangkok, known as a decorative central tower and its beauty at dawn and sunset.",13.7438704,100.4835731,https://maps.app.goo.gl/nUKwo7k6FYLxPNL39,tourist place,2025-02-03T13:55:46.000000Z
196,64,Bangkok,Thailand,The Grand Palace,"{'Information': [""The Grand Palace is one of Bangkok's most iconic landmarks and a symbol of the nation's rich history and culture"", 'This sprawling complex was once the official residence of the Kings of Siam, and it has served as the administrative center of Thai government for over 150 years.'], 'Historical Significance': ['Constructed in 1782 by King Rama I, the Grand Palace was the seat of the Thai king and the administrative center of the government until 1925. It is located on the banks of the Chao Phraya River and has been a symbol of Thailand’s monarchy and its governance.'], 'The most prominent landmarks': ['Watt Fra Caio (Emerald Buddhist Temple): This temple, which is located within the Grand Palace complex, includes the escaping emerald Buddha, which is considered the most valuable religious princess.', 'External Court: The region where royal offices and government buildings are located.', ""The Internal Court: Once it is booked to the King's family, the Interior Court now includes many important structures, including the residence of the king and temples.""], 'working hours': ['The Grand Palace is open daily from 8:30 am until 3:30 pm']}",The Grand Palace in Bangkok is a wonderful historical landmark that includes the temple of Buddha Al -Zomardi and ownership buildings.,13.7498558,100.4868129,https://maps.app.goo.gl/tnhezNALCh19Ve8c8,tourist place,2025-02-03T13:43:36.000000Z
300,24,Prizren,Kosovo,Monarch Hotel,"{'Location': [""Monarch Hotel is located in the heart of Prizren, offering a central location with easy access to the city's major attractions and landmarks.""], 'Facilities & Services': ['On-site restaurant serving a variety of local and international dishes.', 'Free Wi-Fi available throughout the property.', 'Bar/lounge area for guests to relax and unwind.', 'Free private parking for guests traveling by car.'], 'Rooms': ['Modern, air-conditioned rooms with elegant décor and contemporary furnishings.', 'Each room features a flat-screen TV, minibar, and a private bathroom.', 'Some rooms offer balconies with views of the surrounding area.'], 'Nearby Attractions': ['Kalaja Fortress of Prizren – A historic fortress with panoramic views of the city.', 'The Albanian League of Prizren Museum – A museum that highlights the cultural history of the region.', 'Mahmet Pasha Hamam – An Ottoman-style bathhouse offering a glimpse into the past.']}","Monarch Hotel in Prizren offers modern rooms, free Wi-Fi, dining, and easy access to attractions.",42.2100638,20.7370792,https://maps.app.goo.gl/EyC5wrkQxTFd7QXY6,hotel,2025-02-03T12:52:11.000000Z
299,24,Prizren,Kosovo,L'Hotelpz,"{'Location': [""L'Hotelpz is located in Prizren, just 300 meters from Sinan Pasha Mosque. The hotel offers easy access to local attractions and is also 900 meters from Kalaja Fortress.""], 'Facilities & Services': ['The hotel is allergy-free, ensuring a comfortable stay for sensitive guests.', 'Bar for guests to enjoy drinks and relax.', 'Free Wi-Fi available throughout the hotel.', '24-hour front desk for assistance at any time.', 'Free private parking for guests.'], 'Rooms': ['Rooms come with air conditioning, flat-screen TV, and private bathrooms with free toiletries.', 'Some rooms feature balconies for outdoor relaxation.', 'Each room includes bed linens, towels, and a work desk for convenience.']}","L'Hotelpz in Prizren features comfortable rooms, free Wi-Fi, parking, and is near key landmarks.",42.2079193,20.7363448,https://maps.app.goo.gl/B6DbRRf7qfbhmR2W9,hotel,2025-02-03T12:35:28.000000Z
298,24,Prizren,Kosovo,Zani Boutique Hotel,"{'Location': ['Zani Boutique Hotel is located in Prizren, offering a cozy and stylish atmosphere with easy access to local attractions.'], 'Facilities & Services': ['On-site restaurant serving local and international dishes.', 'Free Wi-Fi throughout the property.', '24-hour front desk for assistance at all times.', 'Bar and lounge area for relaxation and drinks.'], 'Rooms': ['Modern, air-conditioned rooms with elegant décor.', 'Each room is equipped with a flat-screen TV, minibar, and private bathroom.', 'Some rooms include balconies with views of the city or surrounding area.'], 'Nearby Attractions': ['Kalaja Fortress of Prizren – A historic landmark with panoramic views.', ""The Albanian League of Prizren Museum – A museum that showcases the region's history."", 'Mahmet Pasha Hamam – A beautiful Ottoman-era bathhouse.']}","Zani Boutique Hotel in Prizren offers stylish rooms, free Wi-Fi, dining, and easy access to attractions.",42.2104146,20.7338865,https://maps.app.goo.gl/eFwJTXHr2zUWmqzr5,hotel,2025-02-03T12:28:34.000000Z
297,24,Prizren,Kosovo,Biond Hotel,"{'Location': ['Biond Hotel is located in Prizren, just 300 meters from Sinan Pasha Mosque, offering scenic city views and a central location.'], 'Facilities & Services': ['Airport shuttle service available for an additional fee.', 'Terrace in select rooms for a relaxing stay.', 'Free Wi-Fi available throughout the hotel.'], 'Rooms': ['Each room is equipped with a flat-screen TV and air conditioning.', 'Private bathrooms include free toiletries and a shower.', 'Some rooms feature a terrace with city views.', 'All rooms come with bed linens, towels, and an electric kettle.'], 'Nearby Attractions': ['Kalaja Fortress of Prizren – A historical site with breathtaking views.', 'The Albanian League of Prizren Museum – A key cultural and historical attraction.', 'Mahmet Pasha Hamam – A preserved Ottoman-era bathhouse.']}","Biond Hotel in Prizren offers modern rooms, free Wi-Fi, and city views near major attractions.",42.2095439,20.7350639,https://maps.app.goo.gl/SnP5radqC9ichGR38,hotel,2025-02-03T12:22:09.000000Z
296,24,Prizren,Kosovo,Hotel Tiffany,"{'Location': ['Hotel Tiffany is located in Prizren, just 200 meters from Sinan Pasha Mosque, offering a central location with beautiful city views.'], 'Facilities & Services': ['On-site restaurant and bar serving delicious meals and drinks.', 'Free Wi-Fi available throughout the hotel.', '24-hour reception with multilingual staff (English & Turkish).', 'Terrace with scenic city views.'], 'Rooms': ['Each room features a flat-screen TV with cable channels and a safe deposit box.', 'Private bathrooms come with bed linens, towels, and toiletries.', 'Air-conditioned rooms with a modern design.'], 'Nearby Attractions': ['Kalaja Fortress of Prizren – A historical fortress with panoramic views.', 'The Albanian League of Prizren Museum – A cultural and historical site.', 'Mahmet Pasha Hamam-an ottoman-ke bathhouse.']}","Hotel Tiffany in Prizren offers modern rooms, free Wi-Fi, dining, and stunning views near top landmarks.",42.2078788,20.7370301,https://maps.app.goo.gl/1YXtwTkJsGudEuq37,hotel,2025-02-03T12:15:25.000000Z
295,25,PRISTINA,Kosovo,Vetus Hotel,"{'Location': ['Vetus Hotel is located in Pristina, just 300 meters from the Emin Gjiku Ethnographic Museum. The hotel offers convenient access to key landmarks and attractions in the city, making it an ideal choice for travelers looking to explore the capital of Kosovo.'], 'Facilities & Services': ['Free private parking for guests.', 'A garden, terrace, and restaurant for relaxation and dining.', '24-hour front desk for assistance at any time.', 'Room service and an on-site bar for added convenience.'], 'Rooms': ['Each room is equipped with a wardrobe and a flat-screen TV.', 'Private bathrooms include free toiletries and a shower.', 'Some rooms feature city views.', 'All rooms come with air conditioning and a work desk for comfort and convenience.']}","Vetus Hotel in Pristina offers modern rooms, free Wi-Fi, dining, and easy access to top attractions.",42.668301,21.1612338,https://maps.app.goo.gl/eyFUWw1TwR8Tpf7T7,hotel,2025-02-03T11:56:01.000000Z
294,25,PRISTINA,Kosovo,Uniluxury Hotel,"{'Location': ['Location: Situated approximately a 9-minute walk from the Newborn Monument, the hotel provides easy access to several notable attractions', 'Mother Teresa Cathedral – about 0.8 kilometers away', 'Fatih Mosque (King Mosque) - Approximately 1.1 kilometers Away'], 'Facilities & Services': ['Amenities: Complimentary Wi-Fi and free private parking for guests.', 'Services: 24-hour front desk assistance, daily housekeeping, and luggage storage.'], 'Rooms': ['The hotel offers well-appointed rooms equipped with modern conveniences to ensure a comfortable stay.']}","Uniluxury Hotel Prishtina offers a blend of modern amenities and a prime location, making it a suitable choice for both business and leisure travelers visiting Pristina.",42.6628724,21.1513932,https://maps.app.goo.gl/wxqmeb6DR4GfyBpS7,hotel,2025-02-03T11:39:32.000000Z
293,25,PRISTINA,Kosovo,Hotel Nartel,"{'Location': [""Situated in the Kalabria neighborhood, Hotel Nartel offers convenient access to Pristina's city center and government buildings, which are about a 10-minute walk away.""], 'Facilities & Services': ['Amenities: Free Wi-Fi, air conditioning, flat-screen TVs, minibars, and a fitness center.', 'Services: 24-hour front desk, room service, laundry service, and concierge assistance.', 'Additional Features: On-site restaurant serving local and international cuisine, a lounge bar, and private parking.'], 'Rooms': ['The hotel offers modern rooms equipped with comfortable bedding, work desks, and private bathrooms with complimentary toiletries. Some rooms also feature seating areas for added comfort.']}","Hotel Nartel provides a blend of modern amenities and convenient location, making it an ideal choice for both business and leisure travelers visiting Pristina.",42.6486275,21.1450774,https://maps.app.goo.gl/fAV1pCNv2BR4LoHM6,hotel,2025-02-02T23:10:38.000000Z
292,25,PRISTINA,Kosovo,Hotel Callisto,"{'Location': ['The hotel is situated in Pristina, providing convenient access to local attractions and city landmarks.'], 'Facilities & Services': ['Amenities: Free Wi-Fi, air conditioning, flat-screen TVs, and minibars in rooms.', 'Services: 24-hour front desk, airport shuttle service, and daily housekeeping.', 'Additional Features: On-site parking and non-smoking rooms.'], 'Rooms': ['Guest rooms are equipped with modern furnishings, including comfortable bedding, work desks, and private bathrooms with complimentary toiletries.']}","Hotel Callisto provides a comfortable and convenient stay for visitors to Pristina, with modern amenities and a central location ideal for exploring the city.",42.6550444,21.1670031,https://maps.app.goo.gl/KeinWVSY7QGruCwC6,hotel,2025-02-02T23:02:20.000000Z
291,25,PRISTINA,Kosovo,Dodona Aprohotel in Prishtina,"{'Location': [""Located in Pristina, providing easy access to the city's key landmarks, including Mother Teresa Square and Newborn Monument.""], 'Services': ['24-hour reception to assist with any guest needs at any time.', 'Airport transfers (additional charges may apply).', 'Free Wi-Fi in all areas, allowing guests to stay connected.', 'Housekeeping to ensure rooms are clean and well-maintained during your stay.'], 'Amenities': ['Air conditioning for comfort throughout the year.', 'Flat-screen TVs with access to various channels.', 'Kitchenettes in rooms for guests to prepare their own meals if preferred.']}","A well-equipped hotel offering spacious accommodations and modern amenities, perfect for both short-term and long-term stays in Pristina.",42.6620171,21.1642514,https://maps.app.goo.gl/YiqmLFoRkMHaMC2N6,hotel,2025-02-02T22:55:45.000000Z
290,25,PRISTINA,Kosovo,Amico Hotel,"{'Location': ['Situated near the city center of Pristina, the hotel offers easy access to major landmarks such as Mother Teresa Square, the National Library of Kosovo, and Newborn Monument. It is well-connected to public transportation.'], 'Facilities & Services': ['Amenities: Free Wi-Fi, air conditioning, minibar, flat-screen TV, and parking.', 'Services: 24-hour reception, room service, and daily housekeeping.', 'Additional Features: A restaurant serving local and international cuisine, as well as a café.'], 'Rooms': ['Accommodation: The rooms are elegantly furnished, featuring comfortable bedding, workstations, and en-suite bathrooms equipped with essential toiletries.', 'Suites: Special suites are available for guests seeking more space and additional luxury.']}","A welcoming hotel offering modern comforts and a central location in Pristina, perfect for travelers looking for a comfortable and convenient stay.",42.6606414,21.1616565,https://maps.app.goo.gl/VmqTbKxEf31TRB2z9,hotel,2025-02-02T22:48:48.000000Z
289,25,PRISTINA,Kosovo,Hotel Europa,"{'Location': ['Situated in the center of Pristina, the hotel provides easy access to key attractions such as Mother Teresa Square, Newborn Monument, and cultural landmarks. The hotel is close to government offices and business hubs.'], 'Facilities & Services': ['Amenities: Free Wi-Fi, air conditioning, flat-screen TVs, minibar, and a fitness center.', 'Services: 24-hour reception, room service, laundry service, and concierge assistance.', 'Additional Features: Bar, restaurant, and private parking are available.'], 'Rooms': ['Accommodation: Rooms are equipped with modern furniture, a comfortable bed, work desk, and a private bathroom with high-quality toiletries.', 'Suites: Larger rooms and suites are available for guests seeking more space and additional comfort.']}","A comfortable, well-located hotel providing excellent amenities and services, ideal for both short and long stays in Pristina.",42.6514524,21.1257668,https://maps.app.goo.gl/WkrMJYZ5CN8yN9nUA,hotel,2025-02-02T22:41:53.000000Z
288,25,PRISTINA,Kosovo,Hotel Era,"{'Location': ['Situated in the heart of Pristina, this hotel provides easy access to popular landmarks such as the Newborn Monument and Mother Teresa Square, making it a great base for exploring the city.'], 'Facilities & Services': ['Amenities: Free Wi-Fi, air conditioning, flat-screen TVs, and a well-equipped fitness center.', 'Services: 24-hour front desk, room service, laundry service, and concierge services.', 'Additional Features: Private parking, bar, and a comfortable lounge area.'], 'Rooms': ['Accommodation: Rooms are modern with contemporary furniture, comfortable bedding, and workspaces. Some rooms also include a seating area.', 'Suites: Larger suites available with a separate living area, offering more space and additional amenities.']}","A stylish and comfortable hotel offering great services and a central location, ideal for both business and leisure visits in Pristina.",42.6215409,21.1466907,https://maps.app.goo.gl/zi4gUWeXr9gL3rEj7,hotel,2025-02-02T22:34:23.000000Z
287,25,PRISTINA,Kosovo,Boulevard Exclusive,"{'Location': ['Situated in Pristina, this hotel offers easy access to the Newborn Monument, Mother Teresa Square, and other cultural landmarks within a short drive.'], 'Facilities & Services': ['Amenities: Free Wi-Fi, air conditioning, flat-screen TVs, and a fully equipped gym.', 'Services: 24-hour front desk, room service, and concierge services.', 'Additional Features: Private parking, terrace, and a modern lobby.'], 'Rooms': ['Accommodation: The hotel offers spacious rooms with contemporary decor, comfortable bedding, and workstations for business travelers.', 'Suites: Some rooms come with a seating area and a balcony with city views.']}","An exclusive hotel offering luxury and comfort in the heart of Pristina, perfect for both business and leisure travelers looking for a sophisticated stay.",42.6621661,21.1574159,https://maps.app.goo.gl/rfdM2Yg4ZQRitu1j8,hotel,2025-02-02T22:21:47.000000Z
286,25,PRISTINA,Kosovo,Urban Cozy Retreat Apartments,"{'Location': ['Located in the heart of Pristina, this apartment offers easy access to major attractions such as Newborn Monument, Mother Teresa Square, and National Library of Kosovo.'], 'Facilities & Services': ['Amenities: Free Wi-Fi, air conditioning, fully equipped kitchen, and comfortable living space.', 'Services: Self-check-in, private entrance, and 24/7 support available.', 'Additional Features: Cozy living area with a balcony for relaxation, modern bathroom facilities.'], 'Rooms': ['Accommodation: The apartment features a bedroom, a spacious living room with a flat-screen TV, and a kitchen with all necessary appliances.', 'Family-Friendly: Ideal for solo travelers, couples, or small families.']}","A cozy apartment offering modern amenities, located near the main cultural attractions of Pristina, providing a comfortable and convenient stay.",42.6628167,21.1606616,https://maps.app.goo.gl/6CBR2vkfYgjDkQa1A,hotel,2025-02-02T22:08:36.000000Z
163,25,PRISTINA,Kosovo,SONDER,"{'Location': ['Situated in the heart of Pristina, SONDER is a modern and stylish restaurant offering a diverse range of dishes.'], 'Facilities & Services': ['Amenities: Free Wi-Fi, air conditioning, outdoor seating.', 'Services: 24/7 service, reservations available, event hosting.', 'Additional Features: Contemporary interior, cozy ambiance, ideal for both intimate dinners and group gatherings.'], 'Main Dishes': ['Grilled Lamb Chops – Tender, perfectly seasoned lamb chops served with vegetables and potatoes.', 'Fresh Fish Fillets – A selection of fresh fish fillets, pan-seared and served with a side of risotto or greens.', 'Pasta Primavera – A blend of pasta, seasonal vegetables, and a light creamy sauce.', 'Vegetarian Lasagna – Layers of pasta, seasonal vegetables, and cheese baked to perfection.']}","A modern, fusion restaurant offering a relaxed atmosphere, with a diverse menu perfect for food enthusiasts.",42.6550372,21.1634204,https://maps.app.goo.gl/oTyhXe7X1hXqAKjY6,restaurant,2025-02-02T21:13:14.000000Z
162,24,Prizren,Kosovo,Best Ocakbaşı,"{'Location': ['Best Ocakbaşı Restaurant is Situated in Prizren, Kosovo.'], 'Services': ['Authentic Ocakbaşı Grill Experience: Enjoy watching the chefs prepare your food in the traditional Ocakbaşı style, with an open grill where meats are cooked to perfection.', 'Indoor and Outdoor Seating: The restaurant offers comfortable indoor seating, as well as outdoor dining, ideal for a warm evening.', 'Family-Friendly: The atmosphere is welcoming for families, with a variety of options suitable for children.']}",Best Ocakbaşı offers authentic Turkish barbecue with grilled meats and traditional dishes in Prizren.,42.2102172,20.7389625,https://maps.app.goo.gl/eaYWo8qDibwYB8pTA,restaurant,2025-02-02T21:01:37.000000Z
161,25,PRISTINA,Kosovo,Bagolina,"{'Location': ['is located in the heart of Pristina, Kosovo.'], 'Services': ['Dine-in & Takeout: Offers a cozy dining experience and takeaway options for customers on the go.', 'Outdoor Seating: Enjoy your meals in an open-air environment during the warmer months.', 'Free Wi-Fi: Stay connected while enjoying your meal.'], 'Main Dishes': ['Grilled meats such as lamb, chicken, and beef', 'Fresh salads, grilled vegetables, and vegetarian pitas', 'Pizza, pasta, and Mediterranean-inspired dishes', 'Local wines, raki, and fresh juices']}","Bagolina Restaurant in Pristina offers a delightful selection of traditional and international dishes in a welcoming atmosphere, making it an ideal spot for family meals, gatherings, or casual dining.",42.6581202,20.8604843,https://maps.app.goo.gl/62ZmQZ9gpQA9hkMA6,restaurant,2025-02-02T20:48:07.000000Z
160,27,Peja,Kosovo,King's,"{'Location': [""King's Restaurant is located in Peja, Kosovo.""], 'Main Dishes': ['Grilled meats (lamb, chicken, and beef)', 'Fish and seafood platters', 'Grilled vegetables, salads, and stuffed peppers', 'Traditional cakes and desserts', 'Soft drinks and fresh juices'], 'Services': ['Dine-in & Takeout: The restaurant offers an in-house dining experience with options for takeout.', 'Family-Friendly: Spacious and family-friendly, perfect for group gatherings and special events.', 'Parking: Convenient parking available for customers.', 'Wi-Fi: Free Wi-Fi is available for customers to stay connected.']}","King's Restaurant in Peja offers a diverse selection of traditional Kosovar and regional dishes in a modern and cozy environment, perfect for family meals or gatherings.",42.6591806,20.282881,https://maps.app.goo.gl/E6qucff9HARpjs6XA,restaurant,2025-02-02T20:30:53.000000Z
159,24,Prizren,Kosovo,Konaku,"{'Location': ['Konaku Restaurant is located on 16 Marin Barleti, in the heart of Prizren, Kosovo. It offers a warm and inviting atmosphere for both locals and tourists looking to explore authentic Kosovar cuisine.'], 'Services': ['Dine-in & Takeout: The restaurant offers a comfortable dining experience and the option for takeout.', 'Group and Family-Friendly: Ideal for gatherings and special occasions, with a cozy, spacious setting for families and groups.', 'Wi-Fi: Free Wi-Fi is available for customers.'], 'Main Dishes': ['Kosovar stews, include ""step"" (bean stew)', 'Grilled meats (lamb, chicken, and beef)', 'Traditional Kosovar cakes and pastries', 'Grilled vegetables and salads']}","Konaku Restaurant offers a delightful mix of traditional Kosovar cuisine in a comfortable setting, making it a great spot to enjoy local flavors while in Prizren.",42.2089421,20.7367558,https://maps.app.goo.gl/mqXKjfpzDKmPwPmu7,restaurant,2025-02-02T20:17:26.000000Z
158,25,PRISTINA,Kosovo,Matcha Coffee and Eatery,"{'Location': ['is situated in Pristina, Kosovo.'], 'Services': ['Dine-in & Takeout: Customers can either dine in or take their orders to go.', 'Cozy Atmosphere: A modern, comfortable space perfect for working, studying, or relaxing with friends.', 'Delivery: Offers delivery service for those who prefer to enjoy their food at home.'], 'Menu': ['Specialty Coffees (including iced options)', 'Matcha Lattes', 'Freshly baked croissants, cakes, and cookies', 'Vegan and gluten-free options available', 'Fresh juices, smoothies, and teas'], 'Operating Hours': [""Matcha Coffee and Eatery operates during standard cafe hours, typically from early morning until late evening. It's best to check directly for the most accurate timings.""]}","A trendy spot in Pristina offering specialty coffee, matcha-based drinks, and healthy, fresh food options.",42.6646501,21.1571218,https://maps.app.goo.gl/MHbqoLEYRhSCvgRBA,restaurant,2025-02-02T19:57:46.000000Z
157,27,Peja,Kosovo,KFC PEJA DT,"{'Location': ['Situated in the heart of Peja, KFC Peja DT is easily accessible to both locals and visitors.'], 'Services': ['Dine-in and Takeout: Customers can choose to dine inside the restaurant or opt for takeout.', 'Delivery: KFC Peja offers delivery services.', 'Amenities: The restaurant provides free Wi-Fi and is wheelchair accessible.'], 'Main Dishes ': ['Cheeseburger Box: Includes a cheeseburger, hot wings, bites, fries, and a drink.', 'Buckets & Pieces: Offers various combinations of hot wings, crispy strips, and drumsticks.', 'Beverages & Desserts: A selection of soft drinks, milkshakes, and desserts like sundaes and Kream Balls.', 'Snacks : Includes items like chicken salad, fries, and various sauces.'], 'Main Dishes': ['Cheeseburger Box: Includes a cheeseburger, hot wings, bites, fries, and a drink.', 'Buckets & Pieces: Offers various combinations of hot wings, crispy strips, and drumsticks.', 'Beverages & Desserts: A selection of soft drinks, milkshakes, and desserts like sundaes and Kream Balls.', 'Snacks : Includes items like chicken salad, fries, and various sauces.']}",KFC Peja DT offers a convenient and enjoyable dining experience for those craving classic fried chicken and other fast-food favorites in Peja.,42.6544425,20.3064155,https://maps.app.goo.gl/NszezfZYzEoTN9wV7,restaurant,2025-02-02T19:47:24.000000Z
156,24,Prizren,Kosovo,Elif Burger,"{'Location': ['Elif Burger is situated in the heart of Prizren, offering a great spot for burger lovers to enjoy high-quality fast food.'], 'Facilities & Services': ['Dine-in & Takeaway: Customers can enjoy their meals in a cozy setting or opt for takeaway.', 'Delivery Service: Available for those who prefer to enjoy their food at home.', 'Casual Atmosphere: The restaurant provides a relaxed and modern environment, ideal for friends and families.'], 'Main Dishes': ['Classic beef burgers', 'Vegetarian options', 'Chicken burgers', 'A variety of sides such as fries and onion rings']}","Elif Burger in Prizren serves delicious burgers and sides in a casual and friendly atmosphere, perfect for a quick bite.",42.2200219,20.7312567,https://maps.app.goo.gl/o944xXMogdbC8EdQ9,restaurant,2025-02-02T19:30:15.000000Z
