id,city_id,city_name,country_name,name,description,short_description,latitude,longitude,location,type,created_at
1137,142,Fortress,Brazil,Lençóis Maranhenses National Park,"{'Location': ['Explore the breathtaking Parque Nacional dos Lençóis Maranhenses in MA, Brazil - a must-visit for nature lovers and adventure seekers.'], 'Activities and Facilities': ['Embark on exhilarating hikes through the unique landscape.', 'Enjoy picnics surrounded by the beauty of sand dunes and lagoons', 'Convenient onsite services available for a seamless experience'], 'Opening Hours and Entry Fees': ['Operating hours vary; check specific sites within the park for details on accessibility, amenities, and any entry fees.'], 'Nearby Areas': ['Visit Fortaleza dos Reis Magos for historical insights', 'Indulge in local cuisine at nearby restaurants', ""Explore Escadaria Selarón's vibrant mosaic staircase""]}","Expanse of dunes, salt marsh & lagoons. Extensive, protected coastal area of sand dunes & salt marsh with numerous ponds & lagoons.",-2.5282195,-43.026021,https://www.google.com/maps?q=Parque%20Nacional%20dos%20Len%C3%A7%C3%B3is%20Maranhenses&ftid=0x7f19ee15e39be5f:0x2d2895d0d57e9beb,tourist place,2025-07-20T09:54:45.000000Z
1136,142,Fortress,Brazil,Fortaleza de Nuestra Señora de la Asunción,"{'Location': ['Explore the iconic Fortress of Our Lady of the Assumption in Fortaleza, Brazil.'], 'Activities and Facilities': ['Immerse in rich history through guided tours.', 'Enjoy panoramic views from the fortress walls.', 'Capture stunning photos of the surrounding landscape.'], 'Opening Hours and Entry Fees': ['Open Mon 9 AM - 11:30 AM, Closed other days. Free entry for an enriching experience.'], 'Nearby Areas': ['Visit Christ the Redeemer for breathtaking views', 'Dine at local restaurants like Boteco Praia or Coco Bambu Meireles', ""Explore Escadaria Selarón's vibrant mosaic staircase""]}","Discover the historic Fortress of Our Lady of the Assumption, a cultural treasure in Fortaleza, Brazil.",-3.722755,-38.524704,https://www.google.com/maps?q=Fortress%20of%20Our%20Lady%20of%20the%20Assumption&ftid=0x7c7484c9030605b:0x22f9706428647b81,tourist place,2025-07-20T09:50:11.000000Z
1135,142,Fortress,Brazil,Christ the Redeemer,"{'Location': ['Experience the awe-inspiring Christ the Redeemer in Rio de Janeiro, Brazil.'], 'Activities and Facilities': ['Enjoy panoramic views from the top', 'Learn about its history and significance', 'Installations accessible to all visitors.'], 'Opening Hours and Entry Fees': ['Open daily from 8 AM to 7 PM', 'Tickets: It is recommended to purchase in advance for a smooth experience.'], 'Nearby Areas': ['Explore Tijuca National Park for nature lovers.', 'Indulge in local cuisine at nearby restaurants.', 'Visit Escadaria Selarón for vibrant street art']}","Iconic statue of Christ located on top of a mountain. The giant statue is 30 meters tall and can be reached by a train, providing panoramic views of the city.",-22.951916,-43.210487199999996,https://www.google.com/maps?q=Christ%20the%20Redeemer&ftid=0x997fd5984aa13f:0x9dc984d7019502de,tourist place,2025-07-20T09:45:45.000000Z
1134,142,Fortress,Brazil,Selarón Steps,"{'Location': ['Experience the artistic wonder of Rio de Janeiro, Brazil at Escadaria Selarón.'], 'Activities and Facilities': ['Admire the intricate tile work.', 'Capture stunning photos', 'Immerse yourself in local artistry'], 'Opening Hours and Entry Fees': ['Open 24 hours with free admission for all visitors.'], 'Nearby Areas': ['Explore Christ the Redeemer for breathtaking views', 'Enjoy Brazilian food at a restaurant nearby.', 'Visit Fortaleza dos Reis Magos for historical insights']}",Iconic stairway covered with mosaic tile. Landmark public stairway adorned by artist Jorge Selarón with colorful & hand-painted tiles.,-22.915292299999997,-43.1792036,https://www.google.com/maps?q=Escadaria%20Selar%C3%B3n&ftid=0x997f7b55fe685d:0x76011e047b252c35,tourist place,2025-07-20T09:41:12.000000Z
1133,142,Fortress,Brazil,Fortress of the Three Wise Men,"{'Location': ['Discover Fortaleza dos Reis Magos in Natal, Brazil - a must-visit for history buffs and nature lovers.'], 'Activities and Facilities': ['Admire panoramic ocean vistas from the fortress.', 'Enjoy guided tours showcasing its rich heritage.', 'Accessible amenities like restrooms for convenience'], 'Opening Hours and Entry Fees': ['Open daily except Mondays from 8 AM to 4 PM. Free entry for all visitors.'], 'Nearby Areas': ['Visit Escadaria Selarón for colorful steps nearby', 'Indulge in local cuisine at Praça General Tiburcio', 'Explore the beauty of Praia da Barra do Ceará'], 'A proximidade das áreas': ['Visit Escadaria Selarón for colorful steps nearby', 'Enjoy the local cuisine at Praça General Tiburcio.', 'Discover the beauty of Barra do Ceará Beach']}","Enduring military fortress built in 1598. 16th-century military fortification with cannons, a limestone embankment & chapel.",-5.756437699999999,-35.1949475,https://www.google.com/maps?q=Fortaleza%20dos%20Reis%20Magos&ftid=0x7b30094f2794c13:0xd9cc6b7158796083,tourist place,2025-07-20T09:39:19.000000Z
1132,141,Salvador,Brazil,Joventino Silva City Park,"{'Location': ['Explore the lively Joventino Silva City Park in Salvador, Brazil - a sanctuary of nature and entertainment suitable for visitors of all ages.'], 'Activities and Facilities': ['Enjoy picnics amidst scenic landscapes.', 'Embark on peaceful walks through the park.', 'Let kids play on slides and swings.'], 'Opening Hours and Entry Fees': ['Open daily from early morning until late evening with free entry. Check website for special events or closures.'], 'Nearby Areas': ['Visit Centro Histórico de Salvador da Bahia for historical charm', 'Indulge in local cuisine at Praia da Gamboa', 'Explore Morro do Cristo for panoramic views']}","Lush park with sports & amphitheater. This large park with lush vegetation features trails, sports fields, playgrounds & an amphitheater.",-12.9964227,-38.4736252,https://www.google.com/maps?q=Joventino%20Silva%20City%20Park&ftid=0x7161b445bc60139:0xd1e42d49ee1f2c49,tourist place,2025-07-20T09:16:08.000000Z
1131,141,Salvador,Brazil,Dike of Tororó,"{'Location': ['Discover the cultural oasis of Salvador, Brazil'], 'Activities and Facilities': ['Admire intricate sculptures around the lake.', 'Enjoy a leisurely walk in a tranquil setting', 'Accessible entrance and parking for convenience'], 'Opening Hours and Entry Fees': ['Check the website for current hours and any entry fees.'], 'Nearby Areas': ['Explore Centro Histórico de Salvador da Bahia for historical charm', 'Indulge in local cuisine at Mercado Modelo', 'Visit Elevador Lacerda for panoramic city views'], 'A proximidad.': ['Explore the Historic Center of Salvador da Bahia for historical charm.', 'Enjoy local dishes at Mercado Modelo.', 'Visit Elevador Lacerda for panoramic city views']}","Immerse yourself in Salvador's rich culture at Dike do Tororó, a serene spot with stunning sculptures and a peaceful lake.",-12.983912799999999,-38.5043398,https://www.google.com/maps?q=Dike%20do%20Toror%C3%B3&ftid=0x71605171bf4f09d:0x771ce6be799493a4,tourist place,2025-07-20T09:12:06.000000Z
1130,141,Salvador,Brazil,Mariquita Rock,"{'Location': ['Immerse yourself in the vibrant Rio Vermelho district of Salvador, Brazil.'], 'Activities and Facilities': ['Explore historical significance', 'Enjoy panoramic city views', 'Discover the local culture'], 'Opening Hours and Entry Fees': ['The operating hours of Pedra da Mariquita vary; visitors can typically enjoy its beauty for free.'], 'Nearby Areas': ['Visit Centro Histórico de Salvador da Bahia for more history', 'Indulge in local cuisine at a Casa do Rio Vermelho', 'Relax at Praia da Gamboa for beach vibes']}","Explore the historic Pedra da Mariquita in Salvador, Brazil, which provides cultural insights and breathtaking views of the city.",-13.0149861,-38.4894412,https://www.google.com/maps?q=Pedra%20da%20Mariquita&ftid=0x71603005a7aa887:0x43d9c054240ec3d5,tourist place,2025-07-20T09:09:07.000000Z
1129,141,Salvador,Brazil,"""Pé do Caboclo"" - Monument to the Second of July","{'Location': [""Discover the heart of Salvador, Brazil's Centro district""], 'Activities and Facilities': ['Explore historical significance', 'Enjoy accessible entrance and parking', 'Kid-friendly environment'], 'Opening Hours and Entry Fees': ['Operating hours vary; entry is free.'], 'Nearby Areas': ['Visit Centro Histórico de Salvador da Bahia for cultural insights', '""Dining at restaurants known for their calm atmosphere and excellent service.""', 'Relax at Praia da Gamboa for scenic views']}","Immerse yourself in the history of Bahia at 'Pé do Caboclo' - Monumento ao Dois de Julho, a symbol of independence with wheelchair accessibility and kid-friendly features.",-12.989078699999999,-38.5213969,https://www.google.com/maps?q=%22P%C3%A9%20do%20Caboclo%22%20-%20Monumento%20ao%20Dois%20de%20Julho&ftid=0x716048f1bc409c9:0xada2004e7ac91250,tourist place,2025-07-20T08:56:07.000000Z
1128,141,Salvador,Brazil,São Marcelo Fort,"{'Location': ['Immerse yourself in the history of Salvador - BA, Brazil at São Marcelo Fort'], 'Activities and Facilities': [""Discover the fort's architecture and historical exhibits."", 'Enjoy panoramic views of the city and ocean', 'Participate in guided tours to learn about its significance.'], 'Opening Hours and Entry Fees': ['Plan ahead as tickets should be booked in advance for an enriching experience. Check official website for current pricing.'], 'Nearby Areas': ['Visit Centro Histórico de Salvador da Bahia for more historical insights', 'Indulge in local cuisine at nearby restaurants like Mercado Modelo', 'Relax at Praia da Gamboa after exploring the fort']}","17th-century, circular stone sea fort. Circular, stone sea fort & former prison dating from the 17th century, built on a reef.",-12.9699659,-38.5178462,https://www.google.com/maps?q=S%C3%A3o%20Marcelo%20Fort&ftid=0x71604e568d522fd:0x4daee43fd556e2ef,tourist place,2025-07-20T08:46:46.000000Z
1127,141,Salvador,Brazil,Jardim Botânico de Salvador | Floresta dos Oitis,"{'Location': ['Discover the enchanting Salvador Botanical Garden and Oitis Forest in São Marcos, Salvador, Brazil – a must-visit for nature lovers.'], 'Activities and Facilities': ['Enjoy picnics amidst vibrant flora.', 'Embark on scenic hikes through the forest.', 'Kid-friendly trails for family adventures'], 'Opening Hours and Entry Fees': ['Open Tuesday to Saturday from 8 AM to 5 PM; closed Sunday and Monday. Free entry for a day of outdoor fun.'], 'Nearby Areas': ['Visit the Historic Center of Salvador da Bahia for historical charm.', 'Enjoy the local cuisine at Praia da Gamboa.', 'Relax at Morro do Cristo with panoramic views']}","Discover the abundant Salvador Botanical Garden and Oitis Forest, where you can enjoy picnics, hiking, and family-friendly activities in a peaceful natural environment.",-12.9291682,-38.4346616,https://www.google.com/maps?q=Salvador%20Botanical%20Garden%20%7C%20Oitis%20Forest&ftid=0x716108f77b46d6b:0x5ebe9dc0807e5e7f,tourist place,2025-07-20T08:41:59.000000Z
1126,141,Salvador,Brazil,Catedral de Salvador,"{'Location': ['Discover the Cathedral of Salvador in Salvador, Brazil – a must-visit for its historical and architectural beauty.'], 'Activities and Facilities': ['Admire stunning architecture and religious art inside', 'Learn about local history and culture through guided tours.', 'Experience spiritual tranquility in this sacred place'], 'Opening Hours and Entry Fees': ['Open Monday to Friday from 9 AM to 12 PM and 1 PM to 4:30 PM. Free admission for all visitors.'], 'Nearby Areas': ['Explore the Historic Center of Salvador da Bahia for more historical insights.', 'Enjoy local dishes at Mercado Modelo.', 'Relax at Gamboa Beach after a day of sightseeing.']}",Ornate 17th-century Mannerist church. This Mannerist-style cathedral built in the 17th century features baroque altars & paintings.,-12.972785199999999,-38.510355,https://www.google.com/maps?q=Cathedral%20of%20Salvador&ftid=0x71604e61a2398b9:0x872d93113ca84885,tourist place,2025-07-20T08:38:13.000000Z
1125,141,Salvador,Brazil,July 2nd Square,"{'Location': ['Discover the heart of Salvador, Brazil, at Largo Dois de Julho, a vibrant tourist attraction.'], 'Activities and Facilities': ['Explore the Historic Center of Salvador da Bahia for historical insights.', 'Enjoy panoramic views from Morro do Cristo.', 'Visit the Nautical Museum of Bahia - Farol da Barra for maritime heritage.'], 'Opening Hours and Entry Fees': ['Varies per site; some free entry while others have nominal fees. Check individual schedules.'], 'Nearby Areas': [""Admire Cathedral of Salvador's architecture nearby."", 'Savor local cuisine at Mercado Modelo.', 'Relax at Praia da Gamboa for beach vibes.']}","Immerse yourself in Salvador's rich history at Largo Dois de Julho, surrounded by iconic landmarks and cultural sites.",-12.9821674,-38.516616899999995,https://www.google.com/maps?q=Largo%20Dois%20de%20Julho&ftid=0x71605001ee9c7df:0xab19f20508e02fda,tourist place,2025-07-20T08:31:26.000000Z
1124,141,Salvador,Brazil,Palácio Rio Branco,"{'Location': [""Immerse yourself in the heart of Salvador's Centro district at Praça Tomé de Souza, a must-visit landmark in Brazil.""], 'Activities and Facilities': ['Discover Brazilian history through guided tours of the palace.', 'Admire stunning architecture and intricate details', 'Enjoy wheelchair-accessible amenities for all visitors.'], 'Opening Hours and Entry Fees': ['Open Tuesday to Friday from 10 AM to 5 PM; recommended to book tickets in advance for a seamless experience.'], 'Nearby Areas': ['Visit the iconic Elevador Lacerda for panoramic views', 'Indulge in local cuisine at nearby restaurants like Mercado Modelo', 'Stroll through Largo Terreiro de Jesus for a taste of local culture'], 'Areas nearby': ['Visit the iconic Elevador Lacerda for panoramic views.', 'Enjoy local cuisine at nearby restaurants such as Mercado Modelo.', 'Take a walk through Largo Terreiro de Jesus to experience the local culture.']}","Historic government building with a museum. Rebuilt after a 1912 bombing, this neoclassical palace and government building has a museum and offers tours.",-12.9748039,-38.5130014,https://www.google.com/maps?q=Rio%20Branco%20Palace&ftid=0x71604ef1c86e595:0x79800f40a58f19be,tourist place,2025-07-20T08:26:13.000000Z
1123,141,Salvador,Brazil,Monument to the City of Salvador - Bahia,"{'Location': ['Immerse yourself in the vibrant city of Salvador, Brazil, where history and culture blend harmoniously.'], 'Activities and Facilities': ['Explore historical sites like Historic Center of Salvador da Bahia.', 'Enjoy panoramic views from Morro do Cristo', 'Visit the Nautical Museum of Bahia for maritime history.'], 'Opening Hours and Entry Fees': ['Open 24/7 with free entry, offering accessibility for all visitors to enjoy.'], 'Nearby Areas': ['Stroll through Largo Terreiro de Jesus for local charm', 'Indulge in Bahian cuisine at nearby Mercado Modelo', 'Relax at Praia da Gamboa for seaside tranquility']}","Massive sculpture and a historic landmark. Erected in 1970, this 16-meter high fiberglass and metal sculpture by Mario Cravo is a city landmark.",-12.9740031,-38.514317299999995,https://www.google.com/maps?q=Monumento%20%C3%A0%20Cidade%20de%20Salvador%20-%20BA&ftid=0x71604efa1be6bb5:0x610de0e546a200c5,tourist place,2025-07-20T08:21:08.000000Z
1122,141,Salvador,Brazil,Largo Terreiro de Jesus,"{'Location': ['Discover the heart of Salvador, Brazil, at Largo Terreiro de Jesus - a must-visit historical plaza in Pelourinho.'], 'Activities and Facilities': ['Explore the Historic Center of Salvador da Bahia for rich heritage insights.', 'Enjoy panoramic views from Morro do Cristo overlooking the city.', 'Visit the Nautical Museum of Bahia - Farol da Barra for maritime history.'], 'Opening Hours and Entry Fees': ['Largo Terreiro de Jesus is open 24 hours daily with free entry for all visitors.'], 'Nearby Areas': ['Admire the Cathedral of Salvador nearby for stunning architecture.', 'Savor local flavors at Mercado Modelo offering traditional cuisine options.', 'Relax at Praia da Gamboa beach after exploring the historic sites.']}","Immerse in Salvador's history at Largo Terreiro de Jesus, a vibrant plaza with cultural significance and architectural charm.",-12.9731092,-38.5099144,https://www.google.com/maps?q=Largo%20Terreiro%20de%20Jesus&ftid=0x71604ea25b695c9:0x6691d1c6544cfe0f,tourist place,2025-07-20T08:16:28.000000Z
1121,141,Salvador,Brazil,Model Market,"{'Location': ['Discover Mercado Modelo in Salvador, Brazil – a must-visit for authentic souvenirs and cultural experiences.'], 'Activities and Facilities': ['Explore artisan stalls showcasing Afro-Brazilian art.', 'Enjoy Bahian delicacies such as acarajé and cocada.', 'Enjoy live music performances creating a lively atmosphere'], 'Opening Hours and Entry Fees': ['Open daily from 9 AM to 6 PM with free entry for all visitors.'], 'Nearby Areas': ['Visit the Historic Center of Salvador da Bahia for historical charm.', 'Enjoy delicious seafood dishes at Gamboa Beach.', 'Admire panoramic views from Morro do Cristo']}","This market is famous for its wide selection of arts and crafts. It includes over 250 shops offering various arts, crafts, souvenirs, as well as restaurants.",-12.9730385,-38.513920899999995,https://www.google.com/maps?q=Mercado%20Modelo&ftid=0x71604efa5d0086f:0xb760dfc13018f1dd,tourist place,2025-07-20T08:07:49.000000Z
1120,141,Salvador,Brazil,Foundation Marker of the City of Salvador,"{'Location': ['Explore the iconic Barra district in Salvador, Brazil, where history and beauty converge.'], 'Activities and Facilities': ['Immerse yourself in local history at the Historic Center of Salvador da Bahia.', 'Enjoy panoramic views from Morro do Cristo overlooking the city.', 'Visit the Nautical Museum of Bahia - Farol da Barra for maritime treasures and stunning lighthouse views.'], 'Opening Hours and Entry Fees': ['Open 24 hours daily with free admission for all visitors.'], 'Nearby Areas': ['Walk along Praia da Gamboa for a relaxing beach experience.', 'Indulge in local cuisine at Mercado Modelo offering traditional dishes and crafts.', 'Experience the vibrant Largo Terreiro de Jesus square for live music and cultural performances.']}","Discover the historic Foundation Stone of the City of Salvador, a symbol of Brazil's rich cultural heritage.",-13.002076599999999,-38.5329432,https://www.google.com/maps?q=Marco%20de%20Funda%C3%A7%C3%A3o%20da%20Cidade%20do%20Salvador&ftid=0x7160386baa0bc55:0x8c490ae1b5de1576,tourist place,2025-07-20T08:00:54.000000Z
1119,141,Salvador,Brazil,Christ Hill,"{'Location': ['Explore the Morro do Cristo in Salvador, Brazil, which is a serene hilltop with a perfect view of the ocean, ideal for peaceful contemplation.'], 'Activities and Facilities': ['Enjoy 24-hour access to this scenic viewpoint.', 'Free parking is available for your convenience.', 'Ideal for families with kids'], 'Opening Hours and Entry Fees': ['Open daily 24 hours with free admission'], 'Nearby Areas': ['Explore the Historic Center of Salvador da Bahia for historical charm.', 'Enjoy local cuisine at Praia da Gamboa.', 'Visit the Nautical Museum of Bahia - Farol da Barra for maritime history.']}","Seaside park with a statue of Jesus. Grass-covered hill by the ocean with a significant sculpture of Jesus Christ, offering expansive views.",-13.0107871,-38.5238882,https://www.google.com/maps?q=Morro%20do%20Cristo&ftid=0x7160377057c4a63:0xbc5c9e01e02c80a4,tourist place,2025-07-20T07:57:07.000000Z
1118,141,Salvador,Brazil,Nautical Museum of Bahia - Barra Lighthouse,"{'Location': [""Discover the allure of Salvador, Brazil's vibrant coastal city.""], 'Activities and Facilities': ['Explore nautical artifacts and exhibits', 'Enjoy panoramic views from Farol da Barra.', 'Discover LGBTQ+ friendly places'], 'Opening Hours and Entry Fees': ['Open daily from 9 AM to 6 PM', 'Entry fees: Vérifiez le site web pour plus de détails'], 'Nearby Areas': ['Visit the Historic Center of Salvador da Bahia for historical charm.', 'Enjoy local dishes at the nearby Praia da Gamboa.', 'Experience the beauty of Morro do Cristo.']}",Historic lighthouse known for its views. Scenic views draw visitors to this lighthouse originally built at Santo António Fort in the 1690s.,-13.0101987,-38.532916799999995,https://www.google.com/maps?q=Museu%20N%C3%A1utico%20da%20Bahia%20-%20Farol%20da%20Barra&ftid=0x716038285844f45:0x123db8b55534402e,tourist place,2025-07-20T07:36:49.000000Z
1117,141,Salvador,Brazil,Lacerda Elevator,"{'Location': [""Experience Salvador's charm at Praça Tomé de Souza, Centro, BA, Brazil – a must-visit historic site.""], 'Activities and Facilities': ['Enjoy breathtaking city vistas from the elevator', 'Explore nearby historical landmarks like Historic Center of Salvador, Bahia.', 'Accessible entrance and parking facilities for convenience'], 'Opening Hours and Entry Fees': ['The elevator is open every day from 7 AM to 9:30 PM, and there are different payment methods to choose from.'], 'Nearby Areas': ['Visit Morro do Cristo for stunning views', 'Indulge in local cuisine at Mercado Modelo', 'Discover history at Museu Náutico da Bahia - Farol da Barra']}","Iconic long-running elevator with views. Historic art deco elevator with scenic views, connecting the upper & lower parts of Salvador.",-12.9744251,-38.5130321,https://www.google.com/maps?q=Elevador%20Lacerda&ftid=0x71604efa5d0086f:0x725930e371c16778,tourist place,2025-07-20T07:32:15.000000Z
1116,141,Salvador,Brazil,Mermaid's Hole,"{'Location': [""Immerse yourself in the magic of Salvador, Brazil's Buraco da Sereia, where nature meets history for an unforgettable experience.""], 'Activities and Facilities': ['Explore the mystical cave formations', 'Enjoy panoramic views of the ocean.', 'Learn about local folklore and legends'], 'Opening Hours and Entry Fees': ['Open 24 hours with free entry for all visitors to enjoy at their leisure.'], 'Nearby Areas': ['Visit Centro Histórico de Salvador da Bahia for historical charm', 'Indulge in local cuisine at Praia da Gamboa', ""Experience Morro do Cristo's breathtaking vistas""]}","Discover the enchanting Buraco da Sereia, a must-visit in Salvador, Brazil, known for its natural beauty and cultural significance.",-13.0114574,-38.532887599999995,https://www.google.com/maps?q=Buraco%20da%20Sereia&ftid=0x71603d68226173b:0x61c178169efcec0f,tourist place,2025-07-20T07:28:12.000000Z
1115,141,Salvador,Brazil,Christ the Redeemer Hill,"{'Location': ['Discover the vibrant Rio Vermelho district in Salvador, Brazil.'], 'Activities and Facilities': ['Explore the charming house filled with history and cultural artifacts.', 'Participate in guided tours to discover the life of Jorge Amado and Zélia Gattai.', 'Enjoy a peaceful garden setting for reflection and relaxation.'], 'Opening Hours and Entry Fees': ['Open from 9 AM to 5 PM on select days. Check website for ticket prices.'], 'Nearby Areas': ['Visit Centro Histórico de Salvador da Bahia for more historical insights.', 'Indulge in local cuisine at nearby Praia da Gamboa.', 'Experience panoramic views from Morro do Cristo.']}",Museum home of authors Amado & Gattai. Former home of writers Jorge Amado & Zélia Gattai featuring exhibits related to their lives & work.,-13.0077372,-38.4897432,https://www.google.com/maps?q=a%20Casa%20do%20Rio%20Vermelho&ftid=0x7160355d216ddb9:0x59ed2bd0266964c,tourist place,2025-07-20T07:13:14.000000Z
1114,141,Salvador,Brazil,Gamboa Beach,"{'Location': ['Experience the enchanting Praia da Gamboa in Salvador, Brazil - a must-visit tourist attraction by the sea.'], 'Activities and Facilities': ['Enjoy sunbathing on golden sands', 'Swim in crystal-clear waters', 'Explore nearby historical landmarks'], 'Opening Hours and Entry Fees': ['Praia da Gamboa is open 24/7 with free entry for all visitors.'], 'Nearby Areas': ['Visit Centro Histórico de Salvador da Bahia', 'Try local cuisine at traditional restaurants', 'Admire Morro do Cristo']}","Discover the beauty of Praia da Gamboa, a 24-hour beach paradise in Salvador, Brazil.",-12.9831217,-38.5207939,https://www.google.com/maps?q=Praia%20da%20Gamboa&ftid=0x7160581364e3691:0x606eda4fe1fe3a3c,tourist place,2025-07-20T07:03:08.000000Z
1113,141,Salvador,Brazil,Historic Center of Salvador da Bahia,"{'Location': [""Immerse yourself in the heart of Salvador, Brazil's rich history and cultural diversity.""], 'Activities and Facilities': ['Discover iconic landmarks like Elevador Lacerda for panoramic views.', 'Visit the Nautical Museum of Bahia at Farol da Barra for insights into maritime history.', 'Enjoy shopping at Mercado Modelo for local crafts and souvenirs.'], 'Opening Hours and Entry Fees': ['Varies by attraction. Check individual sites for details.'], 'Nearby Areas': [""Admire the Cathedral of Salvador's architectural beauty nearby."", 'Savor authentic Bahian cuisine at local eateries around Largo Terreiro de Jesus.', 'Relax on Praia da Gamboa beach after exploring historical sites.']}","Discover the historic charm of Salvador da Bahia's Historic Center, a UNESCO World Heritage Site with a lively culture and breathtaking architecture.",-12.9730636,-38.509954,https://www.google.com/maps?q=Centro%20Hist%C3%B3rico%20de%20Salvador%20da%20Bahia&ftid=0x71605c4bccc0bc5:0x18482380686aac7d,tourist place,2025-07-20T06:53:55.000000Z
