id,city_id,city_name,country_name,name,description,short_description,latitude,longitude,location,type,created_at
260,65,Phuket,Thailand,Thavorn Phuket Museum,"{'Information': [""Thavorn Phuket Museum is located in the heart of Phuket Town, close to the Old Town area. It offers visitors a glimpse into the island's rich history, particularly its tin mining era and cultural development.""], 'Main Features': ['Extensive Artifact Collection: The museum houses over 1,000 artifacts, including mining tools, old movie projectors from Phuket’s first cinema, and items from the 1940s such as clothing, jewelry, toys, and coins.', ""Historical Exhibits: Displays highlight Phuket's transformation from a tin mining hub to its early development stages, providing insights into the island's cultural and economic evolution.""], 'Visiting Tips': ['Operating Hours: The museum is open daily from 9:00 AM to 4:00 PM.', 'Admission Fee: An entrance fee of 30 Baht is charged.', ""Location: Situated on Rassada Road, it's easily accessible for those exploring Phuket Town."", 'Photography: Visitors are encouraged to take photos of the exhibits and the vintage ambiance.']}","Thavorn Phuket Museum showcases Phuket’s history with artifacts from the tin mining era, early cinema, and local culture.",7.8829238,98.3875574,https://maps.app.goo.gl/edPm8RPBjXbmJ76LA,tourist place,2025-02-07T12:48:22.000000Z
259,65,Phuket,Thailand,Dolphins Bay Phuket,"{'Information': [""Dolphins Bay Phuket is the island's only dolphinarium, offering entertaining shows featuring dolphins and fur seals. The facility is designed to international standards, ensuring a comfortable environment for the animals.""], 'Main Features': ['Dolphin and Seal Shows: Enjoy performances where dolphins and seals showcase their intelligence and agility through various tricks and acrobatics.', 'Interactive Experiences: Opportunities to take photos with the dolphins and seals, swim with dolphins, and participate in the ""Young Trainer"" program to learn about caring for these marine animals.'], 'working hours': ['Show Times: Performances are held daily at 11:00 AM, 2:00 PM, and 5:00 PM, except on Mondays when the facility is closed.', ""Arrival: It's recommended to arrive at least 20 minutes before the show starts to secure good seats and avoid any last-minute rush."", 'Tickets: Various seating options are available, including VVIP, VIP, Deluxe, and Regular seats, each priced differently. Booking tickets in advance is advisable, especially during peak tourist seasons.', 'Additional Activities: If interested in swimming with dolphins or taking photos, inquire about availability and any additional costs upon arrival.']}","Dolphins Bay Phuket offers engaging shows and interactive experiences with dolphins and seals, making it a must-visit attraction for families and marine life enthusiasts.",7.8422947,98.3542738,https://maps.app.goo.gl/TR1ETtxw2gjSMntV6,tourist place,2025-02-07T12:39:59.000000Z
258,65,Phuket,Thailand,hanuman world,"{'Information': ['Hanuman World is an adventure park in Phuket offering thrilling zipline experiences through the lush rainforest. It combines adrenaline-pumping activities with stunning natural scenery, inspired by the legendary monkey god Hanuman from Thai mythology.'], 'Main Features': ['Ziplining: Multiple zipline courses with varying lengths and heights.', 'Skywalk: A treetop walkway with panoramic jungle views.', 'Roller Zipline: A high-speed zipline that combines ziplining with a rollercoaster experience.', 'Eco-Friendly Design: Built with minimal impact on the surrounding rainforest.'], 'working hours': ['daily from 8:00 AM to 6:00 PM.']}","Hanuman World offers thrilling zipline rides, a skywalk, and jungle adventures in Phuket’s lush rainforest.",7.8764274,98.348562,https://maps.app.goo.gl/Kvx4JEcq3BdsFsLPA,tourist place,2025-02-07T12:31:40.000000Z
382,66,Tbilisi,Georgia,BG Palace Hotel,"{'Location': ['BG Palace Hotel is a 4 -star hotel located in Tbilisi, Georgia.'], 'Facilities and services:': ['Free Wi -Fi service', 'A restaurant that serves local and international dishes', 'Gym', 'room service', '24 hours reception service', 'Facilities for meetings and events', 'Washing and ironing service'], 'Rooms:': ['Single and double rooms', 'Family rooms', 'TV rooms, air conditioner, and free Wi -Fi service'], 'Near tourist places:': ['Freedom Square', 'Metmasinanda Church', 'Mistammanda Mountain', 'Tbilisi National Museum']}",The BG Palace Hotel in Tbilisi provides comfortable accommodation with distinguished services and perfect location near the tourist attractions.,41.7278455,44.7382144,https://maps.app.goo.gl/HNjiNMYmtY3KSTpE7,hotel,2025-02-06T22:18:40.000000Z
381,66,Tbilisi,Georgia,Hotel Splendid Tbilisi,"{'Location': ['The Siblinid Tbilisi Hotel is a 4 -star hotel located in the heart of Tbilisi, Georgia and is characterized by its central location, which is easy to reach the main tourist attractions such as the Freedom Square and the Metmasinanda Church.'], 'Facilities and services:': ['Free Wi -Fi service', 'A restaurant offers a variety of meals', 'Fitness Center', 'Washing and ironing services', 'A 24 -hour reception', 'room service'], 'Rooms:': ['Single and double rooms', 'Family rooms', 'All rooms are equipped with a TV, air conditioner, and comfortable facilities'], 'Near tourist places:': ['Freedom Square', 'Metmasinanda Church', 'Tbilisi National Museum', 'Mistammanda Mountain']}","The 4 -star Siblinide Hotel is located in the city center, offers comfortable rooms and distinguished services near tourist attractions.",41.7320615,44.7663407,https://maps.app.goo.gl/kL24pBQYiKbCaa8EA,hotel,2025-02-06T22:04:46.000000Z
380,66,Tbilisi,Georgia,Hotel Verisima,"{'Location': ['Ferresima Hotel is a 3 -star hotel located in the heart of Tbilisi, Georgia, and is one of the distinctive options for travelers looking for comfortable stay and integrated facilities.', 'The hotel is about 0.6 km from the famous Rostafelli Street, and 0.9 km from Samia Park.'], 'Facilities and services:': ['Free Wi -Fi: Available throughout the hotel.', 'Free parking: available for guests.', '24 hours a reception office: to meet the needs of guests at any time.', 'Room Cleaning Service: It is done once in every residence.'], 'Rooms:': ['All rooms are equipped with: air conditioning and flat -screen TV with satellite channels, minibar, a private bathroom with a shower, free bath supplies and views of the city.'], 'Near tourist places:': ['Freedom Square: 0.5 km away.', 'Opera and ballet theater in Tbilisi: 1.5 km.', 'Peace Bridge: 2 km away.']}",Ferissima 3 -star hotel in Tbilisi provides comfortable rooms and distinguished services near tourist attractions.,41.7069679,44.7821837,https://maps.app.goo.gl/bfA4jsULFiY9p6MV6,hotel,2025-02-06T21:43:21.000000Z
379,66,Tbilisi,Georgia,Hotel King Tom,"{'Location': ['Address: Tsinanuri Street 83, downtown Tbilisi, Tbilisi, Georgia, 0114.', ""The hotel is about 17 minutes' drive from Tbilisi International Airport."", ""It is located 2.7 km from St. George's Cathedral, 3.5 km from the National Plant Plant in Georgia.""], 'Facilities and services:': ['Free Wi -Fi: Available throughout the hotel.', 'Free parking: available for guests.', '24 hours a reception office: to meet the needs of guests at any time.', 'Seasony external pool: to relax and enjoy Georgian weather.', 'Restaurant and Bar: offers a variety of food and drinks.', ""Facilities: The hotel includes a children's play area.""], 'Rooms:': ['All rooms are equipped with: air conditioning and flat -screen TV with satellite channels, minibar, a private bathroom with a shower, free bath supplies and views of the city or mountains.'], 'Near tourist places:': [""St. George's Cathedral: 2.7 km away."", ""Georgia's National Plant Plant: 3.5 km."", 'Freedom Square: Located 4.5 km.']}",King Tom in Tbilisi offers comfortable stay with air -conditioned rooms and various facilities such as a pool and restaurant.,41.6775032,44.8105107,https://maps.app.goo.gl/FecokGV9PSURPcpi9,hotel,2025-02-06T21:26:11.000000Z
378,66,Tbilisi,Georgia,Terra Bridge,"{'Location': ['Address: Odysseis Street 16, Tbilisi, Georgia.', ""The hotel is about 2.2 km from Freedom Square, which provides easy access to the city's main tourist attractions.""], 'Facilities and services:': ['Free Wi -Fi: Available throughout the hotel.', 'Free parking: available to guests.', '24 hours a reception office: to meet the needs of guests at any time.', 'Wide terrace: offers panoramic views of the city.', 'Garden: to relax and enjoy the calm atmosphere.'], 'Rooms:': ['All rooms are equipped with: air conditioning.'], 'Near tourist places:': ['The Cathedral of the Holy Trinity (Samba): It is short of a short distance.', 'Peace Bridge: About 1.5 km.', 'Naricala Castle: It is approximately 2 km away.']}","Terra Bridge is a boutique hotel in Tbilisi with comfortable facilities, equipped rooms, and various services.",40.3383097,17.9552712,https://maps.app.goo.gl/SfPn8JRRnXVSmg1F7,hotel,2025-02-06T21:09:01.000000Z
377,66,Tbilisi,Georgia,Luxmani Hotel & Spa,"{'Location': ['It is located in Tbilisi, Georgia, in a quiet area and close to the main landmarks, making it suitable for tourists and businessmen.'], 'Facilities and services:': ['An integrated spa with massage sessions and sauna', 'An internal swimming pool', 'A restaurant that offers local and international meals', 'Fitness Center', 'Free Wi -Fi and parking lots'], 'Rooms:': ['Modern rooms with luxurious furniture', 'Wonderful views of the city', 'Air conditioning and flat -screen TV', 'Private bathrooms equipped with luxurious bathtub'], 'Near tourist places:': ['Freedom Square', 'Naricala Castle', 'Peace Bridge', 'Sulfur Tbilisi bathrooms']}","Luxemani Hotel and Spa provides luxury accommodation with an integrated spa, an inner pool, and modern rooms with great looks in Tbilisi.",41.7329481,44.8271524,https://maps.app.goo.gl/e5RQCZN8TJ6VuV7X9,hotel,2025-02-06T20:53:53.000000Z
376,66,Tbilisi,Georgia,34 Silver Rooms,"{'Location': ['It is located in Tbilisi, near the famous tourist attractions, and provides easy access to the city center and public transport.'], 'Facilities and services:': ['Free Wi -Fi', 'room service', 'A 24 -hour front desk', 'Car parking available'], 'Rooms:': ['Stylish and comfortable rooms', 'Air conditioning', 'TV with a flat screen', 'Private bathrooms equipped'], 'Near tourist places:': ['Freedom Square', 'Naricala Castle', 'Peace Bridge', 'Sulfur baths']}","A modern hotel in Tbilisi provides comfortable stay with distinguished services, near the most important tourist attractions.",41.6947583,44.8014579,https://maps.app.goo.gl/S3b84n9WD7tWmN9MA,hotel,2025-02-06T20:39:57.000000Z
374,66,Tbilisi,Georgia,Lisi Hills Hotel,"{'Location': ['Address: 300 Araghavili Street, Tbilisi, 0103, Georgia.', 'The hotel is located near Lake Lizy, providing guests with picturesque looks on the lake and the surrounding mountains.'], 'Facilities and services:': ['Free Wi -Fi: Available throughout the hotel.', 'Free parking: available for guests.', '24 hours a reception office: to meet the needs of guests at any time.', 'Restaurant and Bar: offers a variety of food and drinks.', 'Airport transfer service: available for an additional fee.'], 'Rooms:': ['All rooms are equipped with: air conditioning.'], 'Near tourist places:': ['Lake Lake: 500 meters away.', ""Georgia's National Plant Garden: 7 km."", 'Freedom Square: It is 8 km away.']}",The Lizi Hills Hotel in Tbilisi provides comfortable stay with picturesque views of Lake Lese and Mountains.,41.7377399,44.7498604,https://maps.app.goo.gl/rEc22Xi1gqQDaDgx6,hotel,2025-02-06T19:13:00.000000Z
373,66,Tbilisi,Georgia,Sota Metekhi Hotel,"{'Location': ['Address: Metchy 20 Street, Tbilisi, 0103, Georgia.', 'The hotel is located in the historical area of \u200b\u200bAflabari, which allows easy access to major tourist attractions such as the Cathedral of Sion and Al Salam Bridge.'], 'Facilities and services:': ['Free Wi -Fi: Available throughout the hotel.', '24 hours a reception office: to meet the needs of guests at any time.', 'Parking: available for guests.'], 'Rooms:': ['All rooms are equipped with: air conditioning.'], 'Near tourist places:': ['Sioni Cathedral: 400 meters away.', 'Peace Bridge: 1.5 km.', ""Georgia's National Plant Garden: 1.8 km away.""]}",Sota Metchy Hotel in Tbilisi provides comfortable accommodation near tourist attractions with excellent services.,41.6899586,44.8134009,https://maps.app.goo.gl/mVbvYzmFYH2qkbQ99,hotel,2025-02-06T18:58:37.000000Z
372,66,Tbilisi,Georgia,Hotel Highgarden,"{'Location': ['Address: 300 Araghavili Street, Tbilisi, 0103, Georgia.', 'The hotel is about 2.3 km from the famous sulfur baths in Tbilisi, allowing easy access to the main tourist attractions.'], 'Facilities and services:': ['Free Wi -Fi: Available throughout the hotel.', '24 hours a reception office: to meet the needs of guests at any time.', 'Parking: available for guests.'], 'Rooms:': ['All rooms are equipped with: air conditioning.'], 'Near tourist places:': ['Sulfur baths: 2.3 km away.', 'Peace Bridge: 2.5 km.', 'The Cathedral of the Holy Trinity (Samba): It is located 3.5 km.']}",Hijarden Tbilisi provides comfortable stay with excellent services and a location close to tourist attractions.,41.6909166,44.8299909,https://maps.app.goo.gl/wRqcVkkb1MxN9VdX6,hotel,2025-02-06T17:35:50.000000Z
257,65,Phuket,Thailand,Phuket thai hua museum,"{'Information': ['Phuket Thai Hua Museum is housed in a beautifully preserved Sino-Portuguese building in Old Phuket Town. The museum showcases the cultural and historical heritage of Phuket, particularly the influence of Chinese immigrants on the island’s development.'], 'Main features': [""Cultural Exhibits: Displays about Phuket's history, Chinese immigration, and the island’s role in the tin mining industry."", 'Architectural Beauty: The museum is set in a charming, well-preserved colonial-style building with beautiful tiled floors and intricate wooden details.', 'Interactive Displays: Features exhibits that tell the stories of early Chinese settlers and their impact on Phuket’s society and economy.', 'Temporary Exhibitions: Regularly hosts temporary exhibitions related to Thai culture and history.'], 'Visiting Tips': ['Plan a 1-2 hour visit to fully explore the exhibits and learn about Phuket’s rich history.', 'Visit the museum’s shop for unique souvenirs related to Phuket’s history.']}","Phuket Thai Hua Museum showcases the island’s history, focusing on Chinese immigrants and Phuket’s cultural heritage.",7.885102,98.3842118,https://maps.app.goo.gl/PVSXVPfv3pq5d1sQA,tourist place,2025-02-06T17:32:47.000000Z
256,65,Phuket,Thailand,Patong Beach Bangla Walking Street,"{'Information': [""Bangla Walking Street is the lively heart of Patong Beach, known for its vibrant nightlife, entertainment, and bustling atmosphere. It’s one of Phuket's most famous streets, filled with bars, clubs, restaurants, and shops.""], 'Main features': ['Nightlife Hub: A hotspot for nightclubs, go-go bars, and pubs offering entertainment till late at night.', 'Shops and Stalls: Street vendors selling souvenirs, clothing, and accessories.', 'Live Music & Shows: Live performances and cabaret shows are common in the area.', 'Culinary Scene: A range of dining options from local Thai food to international cuisines.'], 'Visiting Tips': ['Evening Visits are ideal, as the street becomes especially lively at night.', 'Stay cautious of your belongings, as the area can be crowded.']}","Bangla Walking Street in Patong is a vibrant nightlife hub with bars, shops, live music, and street food.",7.8935193,98.2941506,https://maps.app.goo.gl/CjVBJ5QdEZ2NizZk9,tourist place,2025-02-06T17:25:26.000000Z
255,65,Phuket,Thailand,Ancient buildings in Sino-European style,"{'Information': ['The Sino-European architectural style, commonly seen in Old Phuket Town, is a blend of traditional Chinese and European (mainly Portuguese) influences. These buildings reflect the island’s colonial past, particularly from the 19th and early 20th centuries.'], 'Main features': ['Facade Designs: Colorful, ornate facades with intricate details, combining Chinese elements (like tiled roofs and window shutters) with European touches (like arches and columns).', 'Shophouses: Traditional two- or three-story buildings with a shop on the ground floor and living spaces above.', 'Cultural Influence: The style is a result of the mingling of Chinese immigrants with European settlers, particularly during Phuket’s tin mining boom.', 'Preservation: Many of these buildings have been carefully preserved and converted into cafes, shops, and museums.'], 'Visiting Tips': ['Explore Old Phuket Town by foot to fully appreciate the architecture and hidden details.', 'Best visited in the morning or evening to avoid midday heat and enjoy photography.', 'Don’t miss Thalang Road, which has the most prominent examples of Sino-European buildings.', 'Many of these buildings are now used for businesses, so feel free to step inside to experience their charm.']}","The Sino-European style in Phuket features colorful, ornate buildings blending Chinese and European architectural elements.",7.8864287,98.3849278,https://maps.app.goo.gl/aBkvEA1NcnxypPar5,tourist place,2025-02-06T17:14:19.000000Z
371,66,Tbilisi,Georgia,Citrus Hotel,"{'Location': ['Address: April 9th, Tbilisi, 0102, Georgia.', ""The hotel is 10 minutes' walk from Freedom Square, allowing easy access to major tourist attractions such as the Opera and Ballet Theater in Tbilisi.""], 'Facilities and services:': ['Free Wi -Fi: Available throughout the hotel.', 'Parking: available for guests.', '24 hours a reception office: to meet the needs of guests at any time.', 'Restaurant and Bar: offers a variety of food and drinks.', 'Airport transfer service: available for an additional fee.'], 'Rooms:': ['All rooms are equipped with: air conditioning.'], 'Near tourist places:': ['Freedom Square: 10 minutes walk.', 'Opera and ballet theater in Tbilisi: 700 meters.', ""Georgia's National Plant Garden: 2 km away.""]}",Citros Hotel in Tbilisi provides comfortable accommodation and distinctive facilities with a central site close to the tourist attractions.,41.6958551,44.7941141,https://maps.app.goo.gl/WxmLacazvJgapBwy6,hotel,2025-02-06T17:03:36.000000Z
254,65,Phuket,Thailand,Karon Beach,"{'Information': ['Karon Beach is one of Phuket’s most popular beaches, offering a beautiful stretch of golden sand and clear blue waters. It’s known for its relaxed atmosphere, making it perfect for families, swimmers, and sunbathers.'], 'Main features': ['Long Beach: A 3-kilometer stretch of soft sand, perfect for walking and sunbathing.', 'Clear Waters: Great for swimming, though the waves can be strong during the high season.', 'Nightlife: Nearby restaurants, bars, and shops make it easy to enjoy the beach day and night.', 'Water Sports: Opportunities for water activities like jet skiing, parasailing, and snorkeling.'], 'Visiting Tips': ['Morning or evening visits are best for avoiding the crowds and the midday heat.', 'Check the weather before swimming as waves can be strong during certain months.', 'There are plenty of restaurants near the beach for meals after a swim.']}","Karon Beach is a long, beautiful beach with clear waters, ideal for swimming, sunbathing, and water sports.",7.8440095,98.2816063,https://maps.app.goo.gl/ac2yGGqde3x4FRNQ8,tourist place,2025-02-06T17:02:21.000000Z
253,65,Phuket,Thailand,Freedom Beach,"{'Information': [""Freedom Beach is a secluded and pristine beach located in the southern part of Phuket, known for its crystal-clear waters, white sand, and tranquil atmosphere. It's an ideal spot for relaxation away from the crowds.""], 'Main features': ['Seclusion: A quiet, less crowded beach compared to others in Phuket.', 'Clear Waters: Perfect for swimming, snorkeling, and sunbathing.', 'Natural Beauty: Surrounded by lush greenery and dramatic cliffs.', 'Accessibility: Only accessible by boat or via a steep path, maintaining its peaceful atmosphere.'], 'Visiting Tips': ['It’s ideal to visit in the morning or late afternoon to enjoy the beach in peace.', 'Bring your own snacks and drinks, as facilities are limited.']}","Phuket Freedom Beach is a secluded, serene beach with clear waters, white sand, and stunning natural scenery.",7.8752612,98.2732479,https://maps.app.goo.gl/gLGqiqQjXPY5nhmL6,tourist place,2025-02-06T16:55:03.000000Z
370,66,Tbilisi,Georgia,Rasta Maidan Hotel,"{'Location': ['Address: Samirbro Street 5, Tbilisi, 0105, Georgia.', ""The hotel is 10 minutes' walk from the city center, allowing easy access to the main tourist attractions such as the Cathedral of the Holy Trinity and Narikala Castle.""], 'Facilities and services:': ['Free Wi -Fi: Available throughout the hotel.', 'Free parking: available for guests.', '24 hours a reception office: to meet the needs of guests at any time.', 'Restaurant and Bar: offers a variety of food and drinks.'], 'Rooms:': ['All rooms are equipped with: air conditioning.'], 'Near tourist places:': ['The Cathedral of the Holy Trinity (Samba): 1.9 km away.', 'Naricala Castle: It is 1.5 km away.', 'Peace Bridge: 1.2 km.']}",Rasta Midan Hotel in Tbilisi offers a comfortable stay on a central site with distinguished services near tourist attractions.,41.6895145,44.8063445,https://maps.app.goo.gl/w2cT4piixCYKDMcXA,hotel,2025-02-06T16:50:41.000000Z
252,65,Phuket,Thailand,Phuket Aquarium,"{'Information': ['Phuket Aquarium, located in Cape Panwa, showcases a variety of marine life found around Phuket and Thailand. It offers an educational experience with its impressive range of sea creatures and aquatic displays.'], 'Main features': ['Marine Exhibits: Features both freshwater and saltwater species, including fish, coral, and sharks.', 'Walkthrough Tunnel: A tunnel where visitors can walk through and see marine life swimming around them.', 'Educational Displays: Information on marine conservation and the local ecosystem.', 'Outdoor Area: A small outdoor section where you can see larger sea creatures and marine life in open tanks.'], 'Visiting Tips': [""It's advisable to check for any schedule changes before visiting, especially on holidays or special events.""]}","Phuket Aquarium offers marine life exhibits, a walkthrough tunnel, and educational displays about local sea creatures.",7.8035088,98.4053324,https://maps.app.goo.gl/fEmgV8SjGfRwbryy9,tourist place,2025-02-06T16:46:30.000000Z
251,65,Phuket,Thailand,Tiger Kingdom - Phuket,"{'Information': ['Tiger Kingdom is a popular wildlife attraction in Phuket, where visitors can get up close with tigers, lions, and other exotic animals, offering a unique and interactive experience.'], 'Main features': ['Tiger Encounters: Visitors can safely interact with tigers of different ages, including cubs and adults.', 'Other Animals: The park also features lions, leopards, and exotic birds.', 'Photo Opportunities: Professional photographers are available to capture your moments with the animals.', 'Animal Shows: Occasionally, the park hosts live shows and demonstrations.'], 'Visiting Tips': ['Be respectful of the animals and follow all safety instructions provided by the staff.', 'Book tickets in advance during peak seasons to avoid long waiting times.', 'Arrive early to avoid crowds and enjoy a quieter experience.']}","Tiger Kingdom allows close interaction with tigers and other exotic animals, offering a unique wildlife experience.",7.9070435,98.3274366,https://maps.app.goo.gl/HQ3FUrFWsYLLsnoM8,tourist place,2025-02-06T16:40:10.000000Z
250,65,Phuket,Thailand,Splash Jungle Water Park,"{'Information': ['Splash Jungle Water Park is a family-friendly water park in Mai Khao, Phuket, featuring a variety of thrilling slides, wave pools, and lazy rivers for a fun day out.'], 'Main features': ['Water Slides: A range of slides for all ages, from high-speed thrill rides to more relaxing options.', 'Wave Pool: A large pool with artificial waves for fun swimming.', 'Lazy River: A relaxing, slow-moving river perfect for drifting along.', 'Kids Area: Shallow pools and smaller slides designed for younger children.'], 'Visiting Tips': ['Early morning or late afternoon visits are ideal to avoid crowds and heat.'], 'Working hours': ['It works from 10:00 am to 5:30 pm daily.']}","Splash Jungle Water Park offers thrilling slides, wave pools, and lazy rivers for a fun family experience.",8.1175731,98.3037456,https://maps.app.goo.gl/DGU8L7YbB97pZRV56,tourist place,2025-02-06T16:33:19.000000Z
369,66,Tbilisi,Georgia,Atrium Boutique Hotel,"{'Location': ['Address: Eileen Akhzeldani Khifi Street, Tbilisi, 0102, Georgia.', 'The hotel is located in the historical area of \u200b\u200bAflabari, which allows easy access to major tourist attractions such as the Cathedral of Sion and Al Salam Bridge.'], 'Facilities and services:': ['Free Wi -Fi: Available throughout the hotel.', '24 hours a reception office: to meet the needs of guests at any time.', 'Parking: available for guests.'], 'Rooms:': ['All rooms are equipped with: air conditioning.'], 'Near tourist places:': ['Sioni Cathedral: 400 meters away.', 'Peace Bridge: 1.5 km.', ""Georgia's National Plant Garden: 1.8 km away.""]}",The Atrom Boutique Hotel in Tbilisi offers a comfortable stay near the main tourist attractions.,41.6986917,44.8077071,https://maps.app.goo.gl/Vh2p4ffKsrGe8Wwx5,hotel,2025-02-06T16:32:20.000000Z
