id,city_id,city_name,country_name,name,description,short_description,latitude,longitude,location,type,created_at
156,22,Gjirokastra,Albania,Gjirokastra Bazaar,"{'Info': ['A historic Ottoman-style bazaar filled with traditional crafts, souvenirs, and local goods.', 'Dating back to the 17th century, it was a key trade center during the Ottoman era.'], 'Key Features': ['Cobblestone streets with old stone buildings.', 'Handcrafted souvenirs, textiles, and antiques.', 'Local cafés and traditional Albanian restaurants.'], 'Working Hours': ['Open daily; shop hours may vary.']}","A charming Ottoman-era bazaar offering local crafts, souvenirs, and traditional food.",40.0741716,20.1360197,https://maps.app.goo.gl/LZykiVgzNwMpmSvB7,shop,2025-02-26T21:32:23.000000Z
457,22,Gjirokastra,Albania,Cold War Museum,"{'Info': ['An underground bunker-turned-museum showcasing Albania’s Cold War history.', 'Built during Enver Hoxha’s communist regime to protect officials from nuclear attacks.'], 'Key Features': ['80+ rooms including offices, dormitories, and interrogation rooms.', 'Cold War propaganda exhibits.', 'Authentic military equipment and documents.'], 'Working Hours': ['Usually open daily; hours may vary by season.']}",A hidden underground bunker revealing Albania’s Cold War secrets.,47.1015311,2.7720643,https://maps.app.goo.gl/EieVeC7HXfEcr7AL7,tourist place,2025-02-26T13:09:35.000000Z
456,22,Gjirokastra,Albania,Skenduli House,"{'Info': ['A well-preserved Ottoman-era house showcasing traditional Albanian architecture.', 'Built in the 18th century, it reflects the lifestyle of wealthy families in Ottoman Gjirokastër.'], 'Key Features': ['Original wooden carvings and stone walls.', 'Secret storage rooms and defensive elements.', 'Traditional furnishings and decorations.'], 'Working Hours': ['Usually open daily; hours may vary by season.']}",A stunning Ottoman-era house with intricate details and rich history.,40.0753563,20.1329326,https://maps.app.goo.gl/nfjNcppt3i8AzE5M7,tourist place,2025-02-26T13:00:05.000000Z
403,82,Plav,Montenegro,Caffe & Restuarant Timm,"{'Info': ['A stylish café and restaurant in Plav, serving a mix of local and international cuisine.'], 'Restaurant Features': ['Indoor & outdoor seating, cozy ambiance, lake view, free Wi-Fi, family-friendly.'], 'Main Dishes': ['Grilled meats, fresh fish, pasta, salads, homemade desserts.'], 'Working Hours': ['Typically open daily; exact hours may vary.']}",Modern café-restaurant offering delicious meals with scenic views of Plav Lake.,42.5979059,19.9378571,https://maps.app.goo.gl/pkNoZVitA8ty7pmMA,restaurant,2025-02-26T12:33:24.000000Z
402,76,Gudauri,Georgia,Taj Mahal food,"{'Information:': ['Taj Mahal Food Restaurant offers an authentic Indian dining experience with a variety of spices rich in spices and unique flavors in a warm atmosphere suitable for families and groups.'], 'Restaurant features:': ['It offers authentic Indian dishes rich in traditional flavors and spices', 'Warm atmosphere and excellent service suitable for families and groups', 'It provides vegetable options and halal foods that suit different tastes', 'The dishes are prepared with fresh and high -quality ingredients', 'A special location in Judauri, suitable for tourists and lovers of Indian food'], 'Main dishes:': ['Chicken / meat - meat - spiced rice with delicious Indian spices', 'Tandori chicken - spoiled and grilled chicken in the traditional tandoor oven', 'Masala Panir - Indian cheese cubes cooked with tomato sauce and cream', 'Curry Al -Lahmas (Dal Tadka) - Indian lentil soup with a distinctive flavor', 'Nan and Nan garlic bread - fresh Indian bread served with various dishes'], 'working hours:': ['Daily: 11:00 AM - 11:00 pm']}",Taj Mahal Food Restaurant offers authentic Indian dishes with rich spices and a warm atmosphere suitable for families and Indian food lovers.,42.4658648,44.4774895,https://maps.app.goo.gl/pV2xEC3D85Zy6MsSA,restaurant,2025-02-26T00:55:27.000000Z
401,76,Gudauri,Georgia,Bismillah Indian and Arabic Halal Restaurant,"{'Information:': ['In the name of God, it is an ideal choice for halal food lovers, as it offers authentic Arabic and Indian dishes with distinctive flavors with a warm atmosphere suitable for families and travelers.'], 'Restaurant features:': ['It offers authentic Indian and Arabic dishes with 100% halal components', 'Warm atmosphere and friendly service suitable for families and travelers', 'It provides vegetable options and various spices that suit all tastes', 'Carefully prepared fresh dishes according to traditional recipes', 'A comfortable location in Judauri, suitable for Muslim tourists and travelers'], 'Main dishes:': ['Chicken / meat - meat - spiced rice with rich Indian spices', 'Tika Masala - cooked chicken pieces with hot cream sauce', 'Grilled kebab - spilled and grilled meat on coal with an authentic Arab flavor', 'Mansaf mutton - a traditional Jordanian dish served with rice and milk', 'Fresh nan bread - serve hot with different curry dishes'], 'working hours:': ['Daily: 11:00 AM - 11:00 pm']}","Bismillah Restaurant, it serves Indian and Arab cuisine halal in a warm atmosphere, with authentic flavors that suit all tastes.",42.470772,44.4778527,https://maps.app.goo.gl/YtLwk4HoyRyb284J7,restaurant,2025-02-26T00:44:24.000000Z
400,82,Plav,Montenegro,Caffe 'misch' - Plav,"{'Info': ['A cozy café in Plav, offering coffee, desserts, and a relaxed atmosphere.'], 'Restaurant Features': ['Indoor & outdoor seating, lake view, free Wi-Fi, casual ambiance.'], 'Main Dishes': ['Coffee, tea, fresh pastries, cakes, light snacks.', 'pizza,burger,stake.'], 'Working Hours': ['Typically open daily; exact hours may vary.']}","Charming café with great coffee, desserts, and scenic views in Plav.",42.5994609,19.93477,https://maps.app.goo.gl/FXNumKGPim7a5XwZ9,restaurant,2025-02-26T00:40:31.000000Z
399,76,Gudauri,Georgia,Ereto Restaurant,"{'Information:': ['Erto Restaurant is characterized by its wonderful location in the heart of Godauri and offers a unique dining experience that combines traditional Georgian dishes with international cuisine with a warm atmosphere and a great view of the mountains.'], 'Restaurant features:': ['A special location in the heart of Godauri with a great view of the mountains', 'Warm and comfortable atmosphere is perfect for ski and nature lovers', 'A varied menu that combines Georgian and international dishes', 'A friendly service and a welcome atmosphere that suits families and groups', 'Stylish and external internal sessions to enjoy pure air'], 'Main dishes:': ['Jenkali - Georgian pies stuffed with meat or cheese', 'Khashabori Adjari - Georgi bread stuffed with cheese and eggs', 'Various Georgian grills - beef, chicken, and grilled sheep on charcoal', ""Georgi's hot soup - perfect for cold atmosphere"", 'Pasta and international food - various options that suit all tastes'], 'working hours:': ['Daily: 10:00 AM - 10:00 pm']}",Erito Restaurant offers Georgian and international cuisine in a warm atmosphere with a picturesque view of the Judauri Mountains.,42.4628171,44.4768328,https://maps.app.goo.gl/prM9rEotZMF3fU8ZA,restaurant,2025-02-26T00:36:41.000000Z
398,82,Plav,Montenegro,Restaurant ABAS,"{'Info': ['Located in Plav, offering local and international cuisine with scenic lake views.'], 'Restaurant Features': ['Indoor & outdoor seating, lake view, family-friendly, vegetarian options, free parking.'], 'Main Dishes': ['Grilled fish, cevapi, lamb dishes, fresh salads, homemade pastries.'], 'Working Hours': ['Typically open daily; exact hours may vary.']}",Cozy restaurant with traditional dishes and beautiful views of Plav Lake.,42.6052549,19.932011,https://maps.app.goo.gl/kGTLBHCamxqzpvpd7,restaurant,2025-02-26T00:30:37.000000Z
397,76,Gudauri,Georgia,Restaurant Glintwine,"{'Information:': ['A warm restaurant characterized by its charming mountainous atmosphere, and is famous for serving hot wine (Glintwine) and traditional Georgian cuisine, making it an ideal place to relax after skiing.'], 'Restaurant features:': ['A warm and comfortable atmosphere with a wonderful view of the Caucasus Mountains', 'It is famous for the introduction of the perfect hot wine for the cold atmosphere', 'A menu that includes traditional Georgian dishes and international food', 'A friendly service and the perfect atmosphere for relaxation after skiing', 'Comfortable interior sessions with classic wooden decor'], 'Main dishes:': ['Jenkali - Georgian pies stuffed with meat or cheese', 'Khasaburi - Georgi bread stuffed with melted cheese', 'Grilled meat on charcoal - soft and grilled meat with distinctive spices', 'Ranger soup - warm and delicious Georgian soup', 'Georgian appetizer assortment - salads and appetizers with traditional flavors'], 'working hours:': ['Daily: 11:00 AM - 11:00 pm']}",Restaurant Glintwine offers traditional Georgian dishes and hot wine in a warm atmosphere with a stunning view of the Caucasus Mountains.,42.4706444,44.4897264,https://maps.app.goo.gl/Jv4HcAvxynW6xE1g6,restaurant,2025-02-26T00:29:59.000000Z
396,76,Gudauri,Georgia,Kudebi Restaurant,"{'Information:': ['A special restaurant on the top of Mount Kodibi provides a unique dining experience with picturesque looks on the Caucasus Mountains and offers Georgian and international dishes that suit all tastes.'], 'Restaurant features:': ['A special location on the top of Mount Kodibi with great panoramic looks', 'A warm and comfortable atmosphere that suits ski and nature lovers', 'A varied menu that includes Georgian and international dishes', 'Internal and external sessions to enjoy the picturesque view', 'Women and fast service'], 'Main dishes:': ['Jenkali - Georgian pies stuffed with meat or cheese', 'Khasaburi - Georgi bread stuffed with melted cheese', 'Grilled meat on charcoal - pieces of marinated meat with mastery', ""Georgi's hot soup - perfect for cold atmosphere"", 'Fresh powers - fresh local components with rich flavors'], 'working hours:': ['Daily: 10:00 AM - 6:00 pm (may vary depending on the weather)']}","Kudebi Restaurant offers traditional Georgian dishes with a picturesque view of the Caucasus Mountains, ideal for ski and nature lovers.",42.4633935,44.478469,https://maps.app.goo.gl/Rv6qkXNb6LdZ2Jx96,restaurant,2025-02-26T00:17:36.000000Z
744,82,Plav,Montenegro,Holiday cottages & food Plav,"{'Location': ['2.7km from blue light, 12km from the curse National Park.'], 'Services & Facilities': ['Free WiFi, free private parking, restaurant, airport transfers, bicycle & car rental.'], 'Rooms': ['1-bedroom holiday home with a terrace, mountain views, kitchen, TV, and private bathroom.'], 'Nearby Attractions': ['Plav Lake', 'The curse of National Park']}","Cozy holiday home with scenic views, on-site dining, and transport services.",42.615446,19.9308985,https://maps.app.goo.gl/72Fu8yp42TAkh7dP9,hotel,2025-02-26T00:17:22.000000Z
395,76,Gudauri,Georgia,Hee haw gastro-bar gudauri,"{'Information:': ['A distinctive bar and restaurant with its modern atmosphere and an innovative menu, offers various drinks and delicious dishes in a comfortable environment that suits relaxation after skiing.'], 'Bar features:': ['A modern and comfortable atmosphere with elegant decor', 'An innovative menu that combines international and local cuisine', 'Various drinks, alcoholic and alcoholic', 'Live music and enjoyable social atmosphere', 'Internal and external sessions with a great look'], 'Main dishes:': ['Grilled steak with special sauce - soft and grilled meat perfectly', 'Burger is the distinctive hack - a delicious burger with fresh ingredients and unique sauce', 'Homemade Pizza - fresh ingredients and rich flavors', ""Georgian -Jenkali's appetizer collection, Khashaburi bread, and traditional powers"", 'Homemade sweets - hot cakes and chocolate are perfect for cold atmosphere'], 'working hours:': ['Sunday to Thursday: 12:00 pm - 12:00 midnight', 'Friday and Saturday: 12:00 pm - 2:00 am']}","Hee Haw Gastro-bar offers a modern atmosphere, various drinks, innovative dishes, perfect for relaxation after skiing.",42.4679667,44.4913691,https://maps.app.goo.gl/vJvG2BUzBnc9R4xQ9,restaurant,2025-02-26T00:10:46.000000Z
743,82,Plav,Montenegro,Ema Apartments,"{'Location': ['700m from blue light, 9.4km from the curse National Park.'], 'Services & Facilities': ['Free WiFi, free private parking, sun terrace, garden, airport shuttle (paid).'], 'Rooms': ['Some units have private entrances, wardrobes, dressing rooms, kitchens, and flat-screen TVs.'], 'Nearby Attractions': ['Plav Lake', 'The curse of National Park']}","Scenic apartments with mountain, river, and lake views near Plav Lake.",42.596939,19.9343344,https://maps.app.goo.gl/hZRj9u3NL67suW546,hotel,2025-02-26T00:05:56.000000Z
