id,city_id,city_name,country_name,name,description,short_description,latitude,longitude,location,type,created_at
1356,14,Ras Al Khaimah,United Arab Emirates,National Museum of Ras Al Khaimah,"{'Location': ['Discover the National Museum in Ras Al Khaimah, UAE - a cultural gem in the heart of Old Town.'], 'Activities and Facilities': ['Engage with live performances and explore artifacts', 'Accessible amenities for all visitors', 'Kid-friendly activities and discounts available'], 'Opening Hours and Entry Fees': ['Open daily except Mondays from 8 AM to 6 PM. Check website for ticket prices.'], 'Nearby Areas': ['Visit Dhayah Fort for historical insights', 'Enjoy picnics at Saqr Park', 'Explore Al Jazeera Al Hamra Heritage Village']}","Mountain with a famous zip line. Towering mountain featuring sweeping views, camping, wadis & a popular 2.8km-long zip line.",25.794551799999997,55.9450795,https://www.google.com/maps?q=National%20Museum%20of%20Ras%20Al%20Khaimah&ftid=0x3ef6715227b249e9:0x899643d2de4e40fc,tourist place,2025-08-13T08:00:45.000000Z
1355,14,Ras Al Khaimah,United Arab Emirates,Jebel Jais,"{'Location': ['Explore Jebel Jais in Ras Al Khaimah, UAE for adrenaline-pumping activities amidst breathtaking natural beauty.'], 'Activities and Facilities': [""Experience the world's longest zipline at Jais Flight."", 'Enjoy desert safaris with picturesque landscapes.', 'Visit historical sites like Dhayah Fort for a cultural journey.'], 'Opening Hours and Entry Fees': ['Various attractions have different operating hours; check individual websites for details on entry fees.'], 'Nearby Areas': ['Discover the National Museum of Ras Al Khaimah for history buffs.', 'Indulge in local cuisine at traditional restaurants nearby.', 'Explore the scenic beauty of Wadi Naqab for a peaceful retreat.']}","Mountain with a famous zip line. Towering mountain featuring sweeping views, camping, wadis & a popular 2.8km-long zip line.",25.9436748,56.1424297,https://www.google.com/maps?q=Jebel%20Jais&ftid=0x3ef6633e40f1aff7:0x4ad5c210abe1de21,tourist place,2025-08-13T07:59:13.000000Z
1345,14,Ras Al Khaimah,United Arab Emirates,NAJM AL BAHAR – Best Seafood Restaurant in Ras Al Khaimah,"{'Location': ['Experience seaside dining at its best on Sheikh Rashid Bin Saeed Al Maktoum Rd, Ras Al Khaimah.'], 'Menu Highlights': ['Must-try: Freshly caught seafood dishes like grilled fish and prawn curry.', 'Savor traditional Emirati flavors with specialties such as hammour machboos and fried calamari.', 'Explore unique fusion creations like lobster biryani for a culinary adventure by the sea.'], 'Services & Facilities': ['Enjoy outdoor seating with stunning views of the coast.', 'Convenient options include no-contact delivery, takeout, and dine-in services.', 'Wheelchair accessible entrance and parking make dining here inclusive for all guests.'], 'Nearby Attractions': ['Discover local gems like Al Hamra Beach for a relaxing day by the water.', ""Explore historical sites such as Dhayah Fort to immerse yourself in Ras Al Khaimah's heritage."", 'Unwind at Iceland Water Park or Jebel Jais for thrilling adventures near NAJM AL BAHAR.']}","Indulge in diverse flavors at PACHAMULAKU RESTAURANT, rated 4.6, offering a cozy atmosphere and great tea selection.",25.742115199999997,55.9361379,https://www.google.com/maps?q=NAJM%20AL%20BAHAR%20%E2%80%93%20Best%20Seafood%20Restaurant%20in%20Ras%20Al%20Khaimah&ftid=0x3ef677f0bfa405c7:0x6ad9388c1dc77f0d,restaurant,2025-08-13T07:55:15.000000Z
1344,14,Ras Al Khaimah,United Arab Emirates,PACHAMULAKU RESTAURANT,"{'Location': ['Discover PACHAMULAKU RESTAURANT at 94 Al Jazaah Rd, Al Nakheel - Ras Al Khaimah, UAE – a culinary gem worth exploring!'], 'Menu Highlights': ['Try the Halal food', 'Savor the Vegan options', ""Don't miss the Great dessert"", 'Explore Small plates'], 'Services & Facilities': ['Enjoy Outdoor seating', 'Wheelchair accessible entrance', 'Free Wi-Fi available', 'Accepts reservations for convenience'], 'Nearby Attractions': ['Visit National Museum of Ras Al Khaimah for history buffs', 'Explore Iceland Water Park for family fun', 'Dine at Socials Tourist Restaurant for more culinary delights']}",Estacoza seafood restaurant offers a delightful dining experience with fresh seafood dishes in Ras Al Khaimah.,25.795838,55.969431,https://www.google.com/maps?q=PACHAMULAKU%20RESTAURANT&ftid=0x3ef6778533a53e0d:0x513709024f123327,restaurant,2025-08-13T07:52:41.000000Z
1343,14,Ras Al Khaimah,United Arab Emirates,Estacoza seafood restaurant,"{'Location': ['Indulge in the finest seafood cuisine at Estacoza, located in the vibrant Al Nakheel district of Ras Al Khaimah, UAE.'], 'Menu Highlights': ['Savor the signature seafood platter', 'Try the grilled lobster tail', ""Don't miss out on the shrimp scampi pasta""], 'Services & Facilities': ['Enjoy outdoor seating with sea views', 'Wheelchair accessible entrance and restroom', 'Accepts reservations for a hassle-free experience'], 'Nearby Attractions': ['Explore Al Hamra Mall for shopping delights', 'Visit Iceland Water Park for family fun', 'Discover Jebel Jais mountain for breathtaking views']}","Enjoy the finest seafood dishes at Istakoza Restaurant, located in the vibrant Nakheel area of Ras Al Khaimah, UAE.",25.7920615,55.968554,https://www.google.com/maps?q=Estacoza%20seafood%20restaurant&ftid=0x3ef6776c23409113:0x25d9e8063572601b,restaurant,2025-08-13T07:50:41.000000Z
1342,14,Ras Al Khaimah,United Arab Emirates,ALHATEE RESTAURANT,"{'Location': ['Indulge in flavorful dishes at ALHATEE RESTAURANT located in the vibrant Old Market of Ras Al Khaimah, UAE.'], 'Menu Highlights': ['Try their Halal food options', 'Savor their Vegan and Vegetarian dishes', ""Don't miss out on their Great dessert selection""], 'Services & Facilities': ['Wheelchair accessible entrance and seating available', 'Enjoy free Wi-Fi while dining', 'Accepts reservations for convenience'], 'Nearby Attractions': ['Explore the historic Dhayah Fort nearby', 'Discover local culture at National Museum of Ras Al Khaimah', 'Relax at Corniche Beach with stunning views']}","Indulge in traditional Emirati flavors at Madfoon Al Sadda, a top-rated restaurant in Ras Al Khaimah with a cozy and upscale atmosphere.",25.7998983,55.949787,https://www.google.com/maps?q=ALHATEE%20RESTAURANT&ftid=0x3ef6714f751285db:0x97e1c1dd7184839e,restaurant,2025-08-13T07:47:51.000000Z
1341,14,Ras Al Khaimah,United Arab Emirates,Madfoon Al Sadda - Ras Al Khaimah,"{'Location': ['Experience the taste of authentic Emirati cuisine near Emirates Market on Sheikh Mohamed Bin Salem Rd in Ras Al Khaimah.'], 'Menu Highlights': ['Try the succulent Chappli Kabaaab', 'Savor the aromatic Halal dishes', ""Don't miss out on the organic options""], 'Services & Facilities': ['Wheelchair accessible entrance and seating', 'Great tea selection and dessert offerings', 'Accepts reservations for a hassle-free dining experience'], 'Nearby Attractions': ['Explore National Museum of Ras Al Khaimah for local history', 'Visit Jebel Jais for breathtaking mountain views', 'Discover Iceland Water Park for family fun']}","Indulge in a culinary journey at Chopstx Ras Al Khaimah, offering diverse menu highlights and cozy atmosphere.",25.757095699999997,55.9134439,https://www.google.com/maps?q=Madfoon%20Al%20Sadda%20-%20Ras%20Al%20Khaimah%20%D9%85%D8%AF%D9%81%D9%88%D9%86%20%D8%A7%D9%84%D8%B3%D8%AF%D9%87%20-%20%D8%B1%D8%A3%D8%B3%20%D8%A7%D9%84%D8%AE%D9%8A%D9%85%D9%87&ftid=0x3ef674409d9f1b65:0x33ffba4ca6a09ca6,restaurant,2025-08-13T07:46:33.000000Z
1340,14,Ras Al Khaimah,United Arab Emirates,Chopstx Ras Al Khaimah,"{'Location': ['Discover the flavors of PVRW+29M, Al Dhait - Al Dhait South - Ras Al Khaimah, United Arab Emirates. Visit for a delightful dining experience!'], 'Menu Highlights': ['Savor Halal food', 'Try Quick bites', 'Explore Small plates', 'Enjoy Vegetarian options'], 'Services & Facilities': ['Wheelchair accessible entrance and seating', 'Free Wi-Fi available', 'Accepts reservations for convenience'], 'Nearby Attractions': ['Explore Jebel Jais mountain for stunning views', 'Visit National Museum of Ras Al Khaimah for cultural insights', 'Dine at Socials Tourist Restaurant for more culinary delights']}","Lexington Grill & Bar offers a cozy, upscale dining experience with great coffee and dessert selections. Ideal for solo dining or group gatherings.",25.740178999999998,55.8958374,https://www.google.com/maps?q=Chopstx%20Ras%20Al%20Khaimah&ftid=0x3ef60b6a7d6faa8f:0xba643d1966d0c094,restaurant,2025-08-13T07:44:31.000000Z
1339,14,Ras Al Khaimah,United Arab Emirates,Lexington Grill & Bar,"{'Location': ['Indulge in exquisite grill cuisine at Lexington Grill & Bar on Vienna St, Al Jazeera Al Hamra-Qaryat Al Hamra, Ras Al Khaimah.'], 'Menu Highlights': ['Savor the Halal food options', 'Try the late-night dishes', 'Enjoy the small plates selection'], 'Services & Facilities': ['Wheelchair accessible entrance and seating', 'Private dining room available', 'Accepts reservations for convenience'], 'Nearby Attractions': ['Explore Al Hamra Beach for a relaxing day out', 'Visit Iceland Water Park for family fun', 'Discover the historical Dhayah Fort nearby']}","Indulge in flavorful dishes at Al Medyaf Restaurant - Rak - Branch# 1, offering a cozy ambiance and diverse menu options.",25.68478,55.7726167,https://www.google.com/maps?q=Lexington%20Grill%20%26%20Bar&ftid=0x3ef60a3bf4812e97:0xa9e90cde3e0cf4d2,restaurant,2025-08-13T07:41:41.000000Z
1338,14,Ras Al Khaimah,United Arab Emirates,Al Medyaf Restaurant - Rak - Branch# 1,"{'Location': ['Experience the culinary delights of Old Town - The Old Market in Ras Al Khaimah, UAE, near Manar Mall and National Museum of Ras Al Khaimah.'], 'Menu Highlights': ['Savor the Halal food', 'Try the Late-night food', 'Enjoy the Small plates', 'Explore Vegetarian options'], 'Services & Facilities': ['Wheelchair accessible entrance and seating', 'Free Wi-Fi available', 'Accepts reservations for convenience'], 'Nearby Attractions': ['Visit Dhayah Fort for historical charm', 'Explore Iceland Water Park for family fun', 'Discover Jebel Jais for breathtaking views']}","Indulge in authentic Lebanese cuisine at Orient Restaurant, a cozy spot known for great coffee, desserts, and tea selection.",25.7971838,55.949840699999996,https://www.google.com/maps?q=Al%20Medyaf%20Restaurant%20-%20Rak%20-%20Branch%23%201&ftid=0x3ef6714e8ac0384f:0x7023dbe76bd4a12d,restaurant,2025-08-13T07:39:29.000000Z
1337,14,Ras Al Khaimah,United Arab Emirates,Orient Restaurant,"{'Location': ['Experience the flavors of Lebanon at Orient Restaurant on Al Maareedh St in Ras Al-Khaimah.'], 'Menu Highlights': ['Must-try: Halal dishes like Shawarma and Kibbeh', 'Savor traditional Lebanese Mezze platters', 'Enjoy Baklava and Kunafa for dessert'], 'Services & Facilities': ['Outdoor seating available for a relaxing dining experience', 'Wheelchair accessible entrance and restroom for convenience', 'Accepts reservations to secure your table'], 'Nearby Attractions': ['Explore the historic Dhayah Fort nearby', 'Stroll along Corniche Al Qawasim for scenic views', 'Discover local gems at Ras Al Khaimah Old Souq']}","Experience authentic Indian cuisine at Nells Restaurant in Ras Al-Khaimah, rated 4.0 for its exceptional service and diverse menu.",25.818879799999998,55.961148599999994,https://www.google.com/maps?q=Orient%20Restaurant&ftid=0x3ef67173d9d8b047:0x32bd1c56c8014ab,restaurant,2025-08-13T07:37:25.000000Z
1336,14,Ras Al Khaimah,United Arab Emirates,Nells Restaurant Ras Al-Khaimah,"{'Location': ['Indulge in flavorful Indian dishes at Nells Restaurant on Al Montaser Road, Al Nakheel - Ras Al Khaimah, UAE.'], 'Menu Highlights': ['Savor aromatic biryanis', 'Try the spicy chapli kebabs', 'Enjoy traditional Indian desserts'], 'Services & Facilities': ['Wheelchair accessible entrance and seating', 'Outdoor dining available', 'Great tea selection and dessert options'], 'Nearby Attractions': ['Explore the historic Dhayah Fort', 'Relax at Marjan Island Beach', 'Visit the scenic Jebel Jais mountain range']}","Indulge in flavorful biryani at TOPI VAPPA BIRIYANI RAS AL KHAIMAH, rated 4.7, offering a delightful dining experience.",25.7965856,55.972468899999996,https://www.google.com/maps?q=Nells%20Restaurant%20Ras%20Al-Khaimah&ftid=0x3ef6770205645245:0x721c327b59d9c99d,restaurant,2025-08-13T07:33:55.000000Z
1335,14,Ras Al Khaimah,United Arab Emirates,TOPI VAPPA BIRIYANI RAS AL KHAIMAH,"{'Location': ['Discover the aromatic flavors of Oman Road, opp. Rak Bank, Al Nakheel - Ras Al Khaimah, United Arab Emirates at TOPI VAPPA BIRIYANI RAS AL KHAIMAH.'], 'Menu Highlights': ['Savor authentic biryani', 'Try the flavorful halal dishes', 'Enjoy quick bites and small plates'], 'Services & Facilities': ['Wheelchair accessible entrance and seating', 'No-contact delivery and takeout options available', 'Cozy and casual atmosphere for solo diners'], 'Nearby Attractions': ['Explore Al Hamra Mall for shopping delights', 'Visit Jazirat Al Hamra Heritage Village for cultural insights', 'Indulge in seafood at Najm Al Bahar – Best Seafood Restaurant']}","Lebanese House Restaurant offers a cozy ambiance and diverse menu, known for great coffee, desserts, and tea selection.",25.7923738,55.9721349,https://www.google.com/maps?q=TOPI%20VAPPA%20BIRIYANI%20RAS%20AL%20KHAIMAH&ftid=0x3ef677b2b7601c51:0x7b79cfdcef882893,restaurant,2025-08-13T07:32:28.000000Z
1334,14,Ras Al Khaimah,United Arab Emirates,Lebanese House Restaurant,"{'Location': ['Indulge in authentic Lebanese flavors at Lebanese House Restaurant in Al Nakheel - Ras Al Khaimah, UAE.'], 'Menu Highlights': ['Must-try: Halal dishes, vegan & vegetarian options', 'Signature: Organic plates, salad bar delights'], 'Services & Facilities': ['Enjoy wheelchair accessibility and free Wi-Fi', 'Relish casual yet trendy atmosphere with high chairs for kids'], 'Nearby Attractions': ['Explore the historic Dhayah Fort nearby', 'Discover local charm at Ras Al Khaimah Old Souq', 'Savor seafood delights at Najm Al Bahar – Best Seafood Restaurant']}","Indulge in a culinary journey at Lumee Restaurant Ar Rams, offering a cozy and upscale atmosphere with great tea selection and Halal food.",25.796376499999997,55.9723635,https://www.google.com/maps?q=Lebanese%20House%20Restaurant&ftid=0x3ef676d32be2c9b1:0xe2799b9c81016ad6,restaurant,2025-08-13T07:30:13.000000Z
1333,14,Ras Al Khaimah,United Arab Emirates,Lumee restaurant Ar Rams,"{'Location': ['Discover Lumee Restaurant Ar Rams at V257+FVX, Julfar - Ras Al Khaimah, UAE. Experience exquisite dining in the heart of the city.'], 'Menu Highlights': ['Savor delicious Halal dishes', 'Try their signature teas', 'Enjoy late-night bites', 'Explore organic options'], 'Services & Facilities': ['Wheelchair accessible entrance, parking, restroom, and seating', 'Private dining room available', 'Accepts reservations for a hassle-free experience'], 'Nearby Attractions': ['Visit Al Qawasim Corniche for scenic views', 'Explore National Museum of Ras Al Khaimah for cultural insights', 'Dine at Socials Tourist Restaurant for more culinary delights']}","Indulge in a culinary journey at Saffar Restaurant مطعم سفر, offering diverse menu highlights and cozy atmosphere for solo dining.",25.8586536,56.0147434,https://www.google.com/maps?q=Lumee%20restaurant%20Ar%20Rams&ftid=0x3ef671c70ef27d67:0x91551c8b5368ec8b,restaurant,2025-08-13T07:27:26.000000Z
1332,14,Ras Al Khaimah,United Arab Emirates,Saffar Restaurant,"{'Location': ['Experience exquisite dining at InterContinental Ras Al Khaimah Resort & Spa, Mina Al Arab - Ras Al Khaimah, UAE. Visit now!'], 'Menu Highlights': ['Try the Halal food', 'Savor the Vegan options', 'Explore the Small plates', 'Enjoy the Late-night food'], 'Services & Facilities': ['Wheelchair accessible entrance and seating', 'Free Wi-Fi available', 'Accepts reservations for convenience'], 'Nearby Attractions': ['Visit National Museum of Ras Al Khaimah for history buffs', ""Explore Jebel Jais - UAE's highest mountain peak"", 'Relax at Al Hamra Beach for a serene experience']}","Indulge in a cozy, romantic dining experience at Ramsa Lounge مقهى رمسة, offering great coffee, desserts, and a trendy atmosphere.",25.7261116,55.8466166,https://www.google.com/maps?q=Saffar%20Restaurant%20%D9%85%D8%B7%D8%B9%D9%85%20%D8%B3%D9%81%D8%B1&ftid=0x3ef675f88e77a459:0xe067b200ad764093,restaurant,2025-08-13T07:24:15.000000Z
1331,14,Ras Al Khaimah,United Arab Emirates,Ramsa Lounge,"{'Location': ['Experience the charm of Ramsa Lounge مقهى رمسة at InterContinental Ras Al Khaimah Resort & Spa. Visit for a delightful culinary journey.'], 'Menu Highlights': ['Savor Halal food', 'Try their late-night offerings', 'Enjoy quick bites and small plates'], 'Services & Facilities': ['Wheelchair accessible entrance and seating', 'Accepts reservations for convenience', 'Free Wi-Fi available for guests'], 'Nearby Attractions': ['Explore Al Hamra Mall for shopping delights', 'Visit Iceland Water Park for family fun', 'Discover the beauty of Jazirat Al Hamra historic village']}","Indulge in authentic Chappli Kabaaab at AlFalah, a top-rated restaurant in Ras Al Khaimah.",25.7261401,55.846992799999995,https://www.google.com/maps?q=Ramsa%20Lounge%20%D9%85%D9%82%D9%87%D9%89%20%D8%B1%D9%85%D8%B3%D8%A9&ftid=0x3ef6755f65ae14c5:0x8eaa7e2ca99fa65d,restaurant,2025-08-13T07:21:55.000000Z
1330,14,Ras Al Khaimah,United Arab Emirates,AlFalah Chappli Kabaaab Ras AlKhaimah,"{'Location': ['Discover the flavors of AlFalah on Al Rams Rd, Julfar - Ras Al Khaimah, UAE. Visit for a culinary journey'], 'Menu Highlights': ['Must-try: Chappli Kabaaab', 'Savor: Halal dishes and tea selection'], 'Services & Facilities': ['Enjoy: Outdoor seating and no-contact delivery', 'Accessible: Wheelchair-friendly amenities'], 'Nearby Attractions': ['Explore: Jebel Jais mountain for breathtaking views', 'Visit: National Museum of Ras Al Khaimah for cultural insights', 'Dine at: Socials Tourist Restaurant for more local cuisine']}","Indulge in authentic Turkish cuisine at MADO Restaurant, rated 4.7, offering a cozy and trendy atmosphere with great coffee and dessert.",25.855272,56.019947599999995,https://www.google.com/maps?q=AlFalah%20Chappli%20Kabaaab%20Ras%20AlKhaimah&ftid=0x3ef671709e69d0d9:0x2fc5c966acd691a7,restaurant,2025-08-13T07:19:50.000000Z
1329,14,Ras Al Khaimah,United Arab Emirates,MADO Restaurant,"{'Location': ['Experience the flavors of Turkey at MADO Restaurant, located in Dafan Al Nakheel, Ras Al Khaimah, UAE.'], 'Menu Highlights': ['Try their Halal food options', 'Savor the late-night offerings', 'Explore the vegetarian and vegan dishes'], 'Services & Facilities': ['Enjoy outdoor seating', 'Convenient delivery and takeout services available', 'Wheelchair accessible for all guests'], 'Nearby Attractions': ['Visit Dhayah Fort for historical insights', 'Explore Jazirat Al Hamra for a glimpse into the past', 'Discover Iceland Water Park for family fun']}","Experience authentic Indian cuisine at India Palace Restaurant in RAK Mall, Ras Al Khaimah. Enjoy a blend of flavors and aromas.",25.782404,55.964791999999996,https://www.google.com/maps?q=MADO%20Restaurant&ftid=0x3ef6773da2b6a7af:0x4aaab881d1b63f8f,restaurant,2025-08-13T07:15:10.000000Z
1328,14,Ras Al Khaimah,United Arab Emirates,India Palace Restaurant,"{'Location': ['Indulge in flavorful dishes at Food Court, 2nd Floor, RAK Mall, Khuzam Rd, Al Qurum - Ras Al Khaimah'], 'Menu Highlights': ['Try the aromatic Biryani', 'Savor the spicy Chicken Tikka Masala', 'Delight in the creamy Butter Chicken', 'Enjoy the crispy Samosas'], 'Services & Facilities': ['Wheelchair accessible entrance and seating', 'Variety of vegetarian and vegan options available', 'Cozy and upscale atmosphere for a relaxing dining experience'], 'Nearby Attractions': ['Explore Jebel Jais for stunning mountain views', 'Visit Al Hamra Beach for a relaxing day by the sea.', 'Discover the historic Dhayah Fort']}","Indulge in fresh seafood at Emirates Sea Restaurant Ras Al Khaimah, known for its cozy atmosphere and great tea selection.",25.7722066,55.959495999999994,https://www.google.com/maps?q=India%20Palace%20Restaurant&ftid=0x3ef676eaa2ff7ae9:0x46f0f0580dd26dfc,restaurant,2025-08-13T07:12:52.000000Z
1327,14,Ras Al Khaimah,United Arab Emirates,Socials Tourist Restaurant,"{'Location': ['Experience seaside dining on Al Thaqafah Street, offering a tranquil escape in Ras Al Khaimah.'], 'Menu Highlights': ['Savor the Halal seafood dishes', 'Try the organic salads', 'Enjoy late-night bites'], 'Services & Facilities': ['Wheelchair accessible entrance and seating', 'Free Wi-Fi available', 'Accepts reservations for a hassle-free experience'], 'Nearby Attractions': ['Explore the historic Dhayah Fort', 'Relax at Marjan Island Beach', 'Discover local flavors at Socials Tourist Restaurant']}","Indulge in Czech cuisine at Socials Tourist Restaurant, offering great coffee, desserts, and a cozy atmosphere for solo dining.",25.7468064,55.9066331,https://www.google.com/maps?q=Emirates%20Sea%20Restaurant%20Ras%20Al%20Khaimah&ftid=0x3ef67445cd5cf2bf:0xe48b245c070156a9,restaurant,2025-08-13T07:09:43.000000Z
1326,14,Ras Al Khaimah,United Arab Emirates,Socials Tourist Restaurant,"{'Location': ['Discover the flavors of Czech cuisine at Al Mareed Street, Ras Al Khaimah. Visit for a taste of Prague in the UAE!'], 'Menu Highlights': ['Try traditional Czech dishes like goulash and schnitzel', 'Savor homemade pastries and cakes', 'Explore a variety of teas from around the world'], 'Services & Facilities': ['Enjoy outdoor seating with live music', 'Wheelchair accessible entrance and parking available', 'Reservations accepted for a hassle-free experience'], 'Nearby Attractions': ['Explore the historic Dhayah Fort for panoramic views', 'Stroll along Corniche Al Qawasim for seaside relaxation', 'Visit Iceland Water Park for family-friendly fun']}","Indulge in Czech cuisine at Socials Tourist Restaurant, offering great coffee, desserts, and a cozy atmosphere for solo dining.",25.813959699999998,55.9595208,https://www.google.com/maps?q=Socials%20Tourist%20Restaurant&ftid=0x3ef6713eec320c5f:0xcd3d24d680e16d2f,restaurant,2025-08-13T07:07:37.000000Z
508,14,Ras Al Khaimah,United Arab Emirates,The Lagoon,"{'Location': ['Explore the bustling shopping paradise of Ras Al Khaimah, UAE, at The Lagoon.'], 'Top Stores': ['Discover unique finds at RAK Mall', 'Indulge in luxury brands at Manar Mall', 'Shop for bargains at Al Hamra Mall'], 'Top Restaurants & Cafes': ['Savor Halal delicacies at Karma Kafé Rak by Buddha - Bar', 'Enjoy a cozy meal at Cyclist Restaurant and Cafe', 'Relish international flavors at Ramsa Lounge'], 'Opening Hours': ['Experience round-the-clock shopping bliss with The Lagoon open 24 hours daily.']}","Experience a vibrant shopping haven at Manar Mall Promenade, offering diverse stores and delightful dining options in Ras Al Khaimah.",25.7146644,55.836639399999996,https://www.google.com/maps?q=The%20Lagoon&ftid=0x3ef60ad745f538fb:0x438f2e47e3c6027b,shop,2025-08-12T14:45:49.000000Z
507,14,Ras Al Khaimah,United Arab Emirates,Manar Mall Promenade,"{'Top Stores': ['Discover exquisite jewelry at Jawhara Jewellery - Manar Mall - Branch 1', 'Shop the latest trends at Zara', 'Find unique items at 7md Store Manar Mall حمد ستور المنار مول'], 'Top Restaurants & Cafes': ['Indulge in Halal steaks at The Turkish House Restaurant', 'Enjoy a cozy meal at For Four Restaurant & Cafe', 'Savor delicious dishes at Elite cafe & restaurant'], 'Opening Hours': ['Manar Mall Promenade is open from 10 AM to 10 PM every day, with extended hours on weekends for your convenience.'], 'Nearby Attractions': ['Visit the historic Dhayah Fort for panoramic views of Ras Al Khaimah', 'Explore the natural beauty of Jebel Jais, home to thrilling ziplines and hiking trails', 'Relax by the beach at Al Hamra Village or take a desert safari for an adventurous experience'], 'Location': ['Al Waha Center offers a vibrant shopping experience with diverse stores and delightful dining options in Ras Al Khaimah.']}",Al Waha Center offers a vibrant shopping experience with diverse stores and delightful dining options in Ras Al Khaimah.,25.7842797,55.964678,https://www.google.com/maps?q=Manar%20Mall%20Promenade&ftid=0x3ef6777bcc60ad7f:0xcdc5b4c16857861d,shop,2025-08-12T14:43:44.000000Z
506,14,Ras Al Khaimah,United Arab Emirates,Al Waha Center,"{'Top Stores': ['Discover trendy finds at Al Hamra Mall', 'Indulge in luxury scents at Al Kindi Perfumes LLC', 'Explore cycling gear at Cyclist Restaurant and Cafe'], 'Top Restaurants & Cafes': ['Savor delicious meals at For Four Restaurant & Cafe', 'Enjoy aromatic coffee at Cafe Du Roi COFFEE & RESTO', 'Experience eclectic flavors at Cyclist Restaurant and Cafe'], 'Opening Hours': ['Open daily from 10 AM to 1 AM, providing ample time for shopping and dining enjoyment.'], 'Nearby Attractions': ['Visit the historic Dhayah Fort for cultural insights', 'Relax at the tranquil Corniche Beach for scenic views', 'Explore local cuisine at authentic eateries like Karma Kafé Rak by Buddha - Bar'], 'Location': ['Discover a diverse shopping experience at Value Bag General Trading LLC. with arcade games and free parking, offering a unique retail adventure.']}","Discover a diverse shopping experience at Value Bag General Trading LLC. with arcade games and free parking, offering a unique retail adventure.",25.790958099999997,55.9393197,https://www.google.com/maps?q=Al%20Waha%20Center&ftid=0x3ef671544fc5858b:0x30af135fc40b5d0,shop,2025-08-12T14:41:16.000000Z
