id,city_id,city_name,country_name,name,description,short_description,latitude,longitude,location,type,created_at
41,17,Shkoder,Albania,Theth Albanian Mountains,"{'Introduction:': ['The Theth region in the Albanian Alps is one of the most breathtaking natural and tourist destinations in Albania. Known for its rugged mountain terrain, pristine environment, and charming waterfalls, Theth offers visitors a unique experience amidst towering peaks and lush valleys. It is located in northern Albania and is part of the Albanian Alps National Park.'], 'Location:': ['Theth is situated in northern Albania, within the Albanian Alps, specifically in the picturesque Theth Valley. Travelers typically start their journey from the city of Shkodër and follow the mountainous roads leading to this scenic destination.'], 'Top Attractions in Theth:': ['Albanian Alps National Park: A protected natural area offering lush landscapes and towering peaks, perfect for nature lovers and adventurers.', 'Grunas Waterfall: Located near Theth village, this stunning waterfall is one of Albania’s most beautiful natural wonders, known for its height and cascading waters.', 'Valbona Pass Hike: A famous mountain trail connecting Theth to Valbona Valley. It is one of the best hiking trails in Europe for adventure enthusiasts.', 'Theth Lock-in Tower: A historic defensive tower, known locally as ""Kulla,"" which was used as a place of refuge and conflict resolution in ancient times.', 'Theth Church: A small historic church surrounded by majestic natural landscapes, symbolizing the cultural and religious heritage of the region.'], 'Activities to Do:': ['Hiking and Trekking: Theth is renowned for its amazing hiking trails, ideal for trekking enthusiasts and mountain climbers.', 'Camping in Nature: Visitors can enjoy camping in the serene natural setting and experience the fresh mountain air at night.', 'Exploring Waterfalls and Caves: Visit the stunning Grunas Waterfall or explore the Blue Eye Cave nearby.', 'Photography: The Albanian Alps provide perfect backdrops for photography, thanks to the scenic landscapes and natural diversity.'], 'Significance of Theth:': ['Ecotourism: Theth promotes sustainable and environmental tourism, offering a peaceful retreat away from city life.', 'Cultural Heritage: The area is rich in Albanian traditions and cultural history.', 'Adventure Destination: A prime location for mountain sports, trekking, and exploration.']}",It is an attraction for lovers of mountain and natural sports such as hiking,42.4052854,19.7673868,https://maps.app.goo.gl/EwXK8KbkVdVNR6Gx5,tourist place,2024-12-17T20:06:44.000000Z
40,17,Shkoder,Albania,Blue Eye Kaprre,"{'Introduction:': ['The Blue Eye (Blue Eye Kaprre) is one of Albania’s most famous natural landmarks, located near the town of Përmet in the southwestern part of the country. This spot attracts numerous visitors due to its unique beauty and the crystal-clear blue waters that make it look like a giant natural eye.'], 'Location:': ['The Blue Eye is located near the village of Kaprre, just a short distance from the town of Përmet, in a stunning mountainous region. It is easily accessible via rural roads and offers breathtaking views of the surrounding landscapes.'], 'Description of the Blue Eye:': ['The Blue Eye is a natural spring with deep, vibrant blue waters that are said to flow from deep underground. The surrounding pool forms a mesmerizing sight, with clear and pure waters that captivate visitors.'], 'Activities to Enjoy:': ['Photography: The area provides excellent opportunities for photography, thanks to the breathtaking landscapes and turquoise waters.', 'Hiking: There are several scenic trails around the Blue Eye for visitors to enjoy the natural surroundings.', 'Swimming: The cool and pure waters attract swimmers who enjoy exploring natural landmarks.'], 'Significance of the Site:': ['Natural Environment: The Blue Eye is part of a unique ecosystem, making it an important destination for nature lovers.', 'Ecotourism: It is a perfect spot for ecotourism, allowing visitors to experience the natural beauty and cultural heritage of the region.'], 'How to Reach:': ['The Blue Eye can be reached by public or private transportation from the town of Përmet, and visitors will need to walk a short distance along mountain roads to reach the site. It is best to visit during the spring or summer to fully enjoy the natural beauty.']}","A natural spring with deep, blue water",42.3134308,19.7790719,https://maps.app.goo.gl/qpiYwnBWAt1zpWDLA,tourist place,2024-12-17T19:55:15.000000Z
3,17,Shkoder,Albania,Qendra Tregtare Shopping Centres,"{'Introduction:': ['Qendra Tregtare is one of the main shopping destinations in Shkodër, Albania. It combines shopping, entertainment, and dining to create a complete experience for locals and visitors alike.'], 'Location and Services:': ['Strategically located in Shkodër, making it easily accessible on foot or by car.'], 'Shops and Stores:': ['The Qendra Tregtare shopping centers feature a variety of stores offering:', 'International and local clothing brands.', 'Accessories and bags.', 'Electronics and home appliances.', 'Cosmetics and perfumes.'], 'Restaurants and Cafés:': ['Several restaurants and cafés offer both local and international cuisine, providing an excellent opportunity for dining while shopping.'], 'Entertainment Facilities:': ['Play areas for children.', 'Modern cinemas showcasing international films.', 'Relaxing lounge areas for families.'], 'Features:': ['Comprehensive Shopping Experience: All shopping and entertainment needs in one place.', 'Comfortable Environment: Modern, air-conditioned, and clean spaces.', 'Ongoing Events: Regular events, exhibitions, and family activities are held on-site.'], 'How to Reach:': ['Qendra Tregtare is easily accessible via public transportation or private vehicles, with available parking facilities.']}","A major shopping destination in Shkodra, Albania",42.0690288,19.5108178,https://maps.app.goo.gl/J3uEvoxaQtvUyeuz5,shop,2024-12-17T12:52:10.000000Z
5,17,Shkoder,Albania,HYSAJ Cottages and Restaurant,"{'Location and Background:': ['HYSAJ Cottages and Restaurant is located in a serene and picturesque area of Albania, making it an ideal destination for nature lovers and those seeking relaxation. The location combines rustic charm with modern comfort, perfect for families and friends alike.'], 'Key Features:': ['1. Wooden Cottages:', 'Beautifully designed rustic cabins offering privacy and comfort.', 'Fully equipped with essentials such as cozy beds, clean bathrooms, and air conditioning.', 'Stunning views of the surrounding nature.', '2. Traditional Restaurant:', 'Serves a variety of traditional Albanian dishes with a modern twist.', 'Fresh ingredients sourced locally ensure authentic flavors.', 'Popular dishes include assorted grilled meats, traditional soups, and homemade pies.', '3. Natural Surroundings:', 'Surrounded by breathtaking landscapes of green valleys and mountains.', 'Perfect for hiking and enjoying fresh air.', '4. Available Activities:', 'Nature walks and hikes.', 'Cycling along scenic trails.', 'Family barbecues and picnics.', '5. Family-Friendly Atmosphere:', 'Peaceful environment with excellent services tailored for families.', 'Ideal for vacations with friends or romantic getaways.'], 'How to Reach:': ['HYSAJ is easily accessible by car, with free parking provided for guests.']}",An ideal place for holidays with friends or as a romantic getaway.,42.1569831,19.4448615,https://maps.app.goo.gl/iM8pZyRqstFcUqzh7,hotel,2024-12-17T12:41:21.000000Z
25,32,Sharm El Sheikh,Egypt,Grand Sharm Hotel,"{'Location and Background': ['Grand Sharm Hotel is located in the heart of Sharm El Sheikh, near Naama Bay, tourist markets, and fine dining restaurants. The hotel boasts a strategic location with easy access to Red Sea beaches and marine activities.'], 'Services': ['A large swimming pool equipped with loungers and umbrellas.', 'A full-service spa offering massages, sauna, and jacuzzi.', 'A fine dining restaurant serving international and local dishes.', '24/7 room service to meet all guest needs.', 'Free Wi-Fi throughout the hotel.'], 'Rooms and Amenities': ['Luxurious rooms and suites with views of the sea or pool.', 'Flat-screen TV, air conditioning, and minibar.', 'Private bathrooms with complimentary toiletries.'], 'Activities and Entertainment': ['Snorkeling and diving activities to explore stunning coral reefs.', 'Tour packages to natural reserves and local landmarks.', 'Daily entertainment programs including live music and events.'], 'Business Facilities': ['Meeting and conference rooms equipped with the latest technology.', 'Printing and fax services for business travelers.'], 'Stay Policies': ['Check-in at 2 PM, check-out at 12 PM.', 'Children are welcome, and family-friendly services are available.']}",Enjoy a premium stay in Sharm El Sheikh,27.8668275,34.3124184,https://maps.app.goo.gl/137SvWBJYFE7XE2f6,hotel,2024-12-17T12:25:32.000000Z
26,32,Sharm El Sheikh,Egypt,Sunrise Resort,"{'Location and Background': ['Sunrise Resort is situated right on the beach, offering breathtaking panoramic views.'], 'Services': ['Private beach, spa, sports courts, and various dining options.']}",Perfect spot for a luxurious Red Sea holiday,27.9424248,34.3784125,https://maps.app.goo.gl/Mw3G6meCTmfasCVK8,hotel,2024-12-17T12:25:32.000000Z
27,24,Prizren,Kosovo,Theranda Hotel,"{'Theranda Hotel ': ['Theranda Hotel in Kosovo is a charming and professional establishment located in the heart of the city. Its proximity to major attractions makes it an excellent choice for both business and leisure travelers.'], 'Hotel Features:': ['Comfortable and Well-Equipped Rooms: Rooms are furnished with modern amenities, including air conditioning, flat-screen TVs, and free Wi-Fi.', 'Exceptional Restaurant: The on-site restaurant offers a wide selection of local and international dishes in a cozy atmosphere.', 'Additional Facilities and Services: Includes 24-hour room service, a reception desk, and airport shuttle services.', 'Strategic Location: Close to shopping areas, restaurants, and business centers.'], 'Tips for Your Stay:': ['Book early to secure the best rates.', 'Inquire about nearby tourist activities for an enjoyable experience.']}",One of the distinctive hotels that combines a warm atmosphere and professional services.,42.2099151,20.7412538,https://maps.app.goo.gl/jk8KcCxhc1d2SNcH7,hotel,2024-12-17T12:25:32.000000Z
30,16,Durres,Albania,Tropical Resort,"{'The First': ['Tropikal Resort, located along the beautiful coastline of Durrës, Albania, is a luxurious and serene destination that offers an ideal escape for those seeking relaxation and leisure. The resort offers a variety of activities and accommodations, making it a popular choice for both local and international tourists.'], 'Key Features:': ['Beachfront Location: The resort is located along the pristine beaches of Durrës, offering guests breathtaking sea views and direct beach access.', 'Accommodations: The resort features comfortable and fully-equipped rooms, ideal for couples, families, or large groups. The rooms are designed to provide a peaceful atmosphere ensuring a relaxing stay.', 'Pools and Spa: The resort boasts several outdoor pools and a luxurious spa where guests can unwind with soothing treatments.', 'Restaurants: Tropikal Resort features a variety of restaurants offering both local and international dishes, providing guests with the opportunity to indulge in fresh Mediterranean cuisine.', 'Entertainment and Activities: The resort offers a wide range of activities, from water sports on the beach to guided tours of nearby attractions. It also hosts entertainment shows and cultural events.', 'Ideal for Events: Tropikal Resort is an excellent venue for weddings, conferences, and other special events, thanks to its modern facilities and incredible atmosphere.'], 'Why Visit Tropikal Resort?': [""Tropikal Resort stands out for its perfect blend of relaxation, adventure, and luxury. Whether you're looking to relax on the beach, explore local culture, or enjoy various activities, Tropikal Resort offers everything you need for an unforgettable experience.""]}","The resort is an ideal venue for weddings, conferences, and special events",41.2905785,19.5085317,https://maps.app.goo.gl/UK8gf641W7rYgvvp8,hotel,2024-12-17T12:25:32.000000Z
31,32,Sharm El Sheikh,Egypt,Baron Palms Resort Sharm El Sheikh,"{'Location and Background': ['Baron Palms Resort Sharm is located in Ras Nasrani Bay, offering stunning views of the Red Sea and vibrant coral reefs.'], 'Services': ['Private beach with white sand and turquoise waters.', 'Multiple swimming pools, including two heated pools.', 'Luxury spa offering signature relaxation and massage treatments.', 'Diverse restaurants serving dishes from various international cuisines.', 'Water activities like diving and snorkeling to explore coral reefs.'], 'Rooms and Amenities': ['Elegant rooms and suites with balconies overlooking the sea or gardens.', 'Flat-screen TVs and minibars in all rooms.', 'Luxurious bathrooms equipped with rain showers and premium toiletries.'], 'Activities and Entertainment': ['Daily entertainment programs featuring live music performances.', 'Water sports and beach activities.', 'Fully equipped gym for fitness enthusiasts.'], 'Business Facilities': ['Meeting and conference rooms equipped with the latest technology.', 'Specialized services for organizing conferences and events.'], 'Stay Policies': ['Check-in at 3 PM and check-out at 12 PM.', 'Ideal for couples and those seeking a romantic and serene experience.']}",A luxury resort offering a unique stay experience.,27.9745041,34.4196118,https://maps.app.goo.gl/PWmUEigWYGKqrJ6t8,hotel,2024-12-17T12:25:32.000000Z
39,17,Shkoder,Albania,park Lake Shkodra,"{'Location and Background:': ['Lake Shkodër, also known as Lake Skadar, is located in northwestern Albania near the city of Shkodër. It is the largest lake in the Balkan Peninsula, stretching across the border between Albania and Montenegro. The lake is renowned for its natural beauty and ecological diversity.'], 'Key Features:': ['Stunning Scenery: The lake is surrounded by green hills and mountains, making it a perfect spot for photography enthusiasts.', 'Rich Wildlife: It is home to hundreds of bird and fish species, including rare pelicans.', 'Tourist Activities: Visitors can enjoy boat rides, fishing, and hiking around the lake.', 'Historic Sites: The lake’s shores are dotted with small villages and historical landmarks.'], 'Tourist Activities:': ['Boat trips to explore the lake’s scenic beauty.', 'Birdwatching, especially during migration seasons.', 'Swimming or engaging in water sports.', 'Visiting small villages like Vërbas and Shiroka to experience local culture.'], 'How to Reach:': ['The lake is easily accessible by car or bus from Shkodër, making it one of Albania’s prominent tourist destinations.']}",An ideal place to enjoy boat trips and fishing,42.059994,19.475208,https://maps.app.goo.gl/sC8Hip2UnKycVkgj6,tourist place,2024-12-17T12:14:31.000000Z
38,17,Shkoder,Albania,Kompleksi Dea Park,"{'Location and Background:': ['Kompleksi Dea Park is situated in a peaceful and scenic area in Shkodër, making it a favorite destination for families and friends looking for a unique spot to enjoy nature and premium services.'], 'Key Features:': ['Green Spaces: The park is surrounded by beautiful gardens and lush lawns, perfect for strolling and relaxation.', 'Restaurants and Cafés: It offers restaurants that serve delicious Albanian and international cuisine.', ""Children's Play Area: A safe and well-equipped playground makes it ideal for families with kids."", 'Events: The venue hosts various events, including weddings, birthdays, and cultural celebrations.'], 'Activities:': ['Walking and relaxing in the natural gardens.', 'Enjoying a delicious meal in elegant restaurants.', 'Spending quality time with family and friends in a peaceful environment.', 'Taking memorable photos with scenic backdrops.'], 'How to Reach:': ['Kompleksi Dea is easily accessible by car from the center of Shkodër and is located close to other tourist attractions.']}",A quiet and beautiful area in Durres,42.0084153,19.6057985,https://maps.app.goo.gl/7GSqQ9yqbiiPNcNc9,tourist place,2024-12-17T07:59:31.000000Z
37,17,Shkoder,Albania,Lake Secutari,"{'Location and Background:': ['Lake Skadar (also known as Lake Shkodra) is located in northwestern Albania near the city of Shkodra. It is the largest lake in the Balkan Peninsula, stretching between Albania and Montenegro. The lake is a stunning tourist destination known for its scenic landscapes and rich biodiversity.'], 'Natural Features:': [""Large Area: The lake's size ranges from 370 to 530 square kilometers, depending on the season."", 'Biodiversity: It is home to various migratory birds, including the Dalmatian pelican and cormorants.', 'Freshwater Source: Fed by small rivers and natural springs, the lake is rich in fish resources.'], 'Tourist Activities:': ['Boat Trips: Explore the lake and enjoy the breathtaking surrounding landscapes.', 'Bird Watching: A perfect spot for bird enthusiasts due to its diverse birdlife.', 'Fishing: The lake is known for species like carp and eel.', 'Hiking and Walking: Trails around the lake provide a peaceful and refreshing experience.'], 'Cultural and Environmental Importance:': ['The lake is a globally significant natural reserve, recognized for its environmental value.', 'Surrounding villages reflect the traditional lifestyle of the local population.'], 'How to Reach:': ['Lake Skadar is located about 20 kilometers from Shkodra and can be accessed by car or organized tours.']}",A calm and refreshing experience,42.190424,19.284467,https://maps.app.goo.gl/icNevAAHBXmxNRqVA,tourist place,2024-12-17T07:49:36.000000Z
35,17,Shkoder,Albania,Museum of Witness and Memory,"{'Location and History:': ['The Site of Witness and Memory is located in the city of Shkodër in northern Albania. It was officially opened in 2014 and serves as a memorial to the victims of Albania’s communist regime, which ruled from 1945 to 1991. The building previously housed the headquarters of the Sigurimi, the communist secret police, where many political dissidents were imprisoned and tortured.'], 'Contents and Exhibits:': ['Documentary Exhibits: The museum features photos, documents, and personal testimonies that shed light on the lives of individuals persecuted during the communist era.', 'Original Prison Cells: Visitors can see the actual cells where political prisoners were held, preserved as they were to reflect the harsh realities of the past.', ""Tools of Torture: The museum displays tools used for interrogation and torture, offering a sobering perspective on the regime's brutal practices."", 'Documentary Films: Audio-visual documentaries and interviews provide personal accounts of people who lived through this oppressive period.'], 'Historical Importance:': ['The museum plays a crucial role in preserving Albania’s collective memory and educating future generations about the injustices of the communist regime. It stands as a powerful reminder of the importance of freedom, justice, and human rights.'], 'Things to Do:': ['Guided Tours: Take guided tours to gain in-depth knowledge about the exhibits and historical significance of the site.', 'Reflection: The museum offers moments for reflection on past struggles and the value of liberty.', 'Photography: Visitors can take photos to document and remember their visit.'], 'Location and Accessibility:': ['The Site of Witness and Memory is located in the center of Shkodër, easily accessible by foot from the city center or via local transportation.']}",A museum that plays a major role in preserving the collective memory of the Albanian people,42.06491,19.516883,https://maps.app.goo.gl/HrKWq2b9SA5ER6vaA,tourist place,2024-12-17T07:33:11.000000Z
34,17,Shkoder,Albania,Messi Bridge,"{'Location and History:': ['The Mesi Bridge is located about 5 kilometers from the city of Shkodër in northern Albania. It was constructed in the 18th century, specifically between 1770 and 1778, during the Ottoman era. The bridge was commissioned by the local ruler Kara Mahmud Bushati as part of a vital trade route connecting Shkodër with other northern regions.'], 'Architecture:': ['The bridge spans approximately 108 meters in length and 3.4 meters in width, featuring 13 stone arches of varying sizes. Its architectural design reflects the expertise of Ottoman craftsmen, showcasing their ability to build resilient and aesthetically pleasing structures. The bridge crosses the Kir River, whose clear waters enhance the natural beauty of the site.'], 'Historical Significance:': ['The Mesi Bridge was part of a trade network that played a key role in the economic life of the region. It facilitated the movement of goods and people, contributing to the prosperity of Shkodër and surrounding areas. Today, it stands as a symbol of Ottoman architectural heritage.'], 'Tourist Activities:': ['Photography: The bridge is a perfect spot for photographers, offering picturesque views of the river and surrounding mountains.', 'Walking and Hiking: Visitors can stroll along the bridge and enjoy its historical charm.', 'Nature Exploration: The surrounding landscape, with its green fields and mountain backdrops, is ideal for nature lovers and picnics.'], 'How to Get There:': ['The Mesi Bridge is easily accessible from Shkodër by car or bicycle, and the route leading to it offers a pleasant experience for visitors.']}",The bridge is full of mountains and green fields,42.114514,19.574915,https://maps.app.goo.gl/VkEX9Z5RwwMXUKJr8,tourist place,2024-12-17T07:25:06.000000Z
33,17,Shkoder,Albania,Rozafa Castle,"{'fIRST': [""Rozafa Castle, perched on a rocky hill 130 meters above sea level near the city of Shkodër in northwest Albania, is one of the country's oldest and most significant historical landmarks. The castle overlooks the confluence of the Drin and Buna rivers, offering a strategic location with breathtaking panoramic views.""], 'History and Legend:': ['Founded during Roman times, the castle evolved through the Middle Ages, shaped by Byzantine, Venetian, and Ottoman influences. It is famously linked to the ""Legend of Rozafa,"" a story of a woman who was sacrificed to ensure the castle\'s walls would stand strong.'], 'Key Features of the Castle:': ['Defensive Walls: Impressive fortifications that showcase its military importance.', 'Panoramic Views: Stunning vistas of the city and surrounding rivers.', ""Old Church and Mosque: Reflecting the region's religious and historical diversity.""], 'Activities:': ['Walking tours to explore the ruins.', 'Capturing beautiful photos of the landscape and history.', 'Enjoying scenic views, especially at sunset.']}",One of the most prominent tourist attractions in Shkodra - Albania,42.0464387,19.4936166,https://maps.app.goo.gl/qapexJ3w54BaYsH6A,tourist place,2024-12-17T07:17:40.000000Z
32,17,Shkoder,Albania,Marubi National Museum of Photography,"{'First': [""Located in Shkodër, Albania, the Marubi National Museum of Photography is one of the country's most significant cultural landmarks. It houses a stunning collection of photographs that chronicle over 150 years of Albanian history and culture. The museum's foundation is linked to the Marubi family, pioneers of photography in Albania.""], 'Highlights of the Museum:': ['Historical Collection: The museum holds over 500,000 photographs documenting various eras of Albanian history.', 'Rare Artworks: Features vintage photographs taken with traditional 19th-century cameras.', 'Cultural Value: Offers a glimpse into the life of Albanian society in the past, including social and cultural events.', 'Location: The museum is housed in a beautiful Ottoman-era building, combining architectural elegance with historical depth.'], 'Why Visit the Museum?': ['The museum provides an extraordinary opportunity to explore Albania’s history through the lens of the Marubi family, making it an unmissable destination for art and photography enthusiasts.']}",An exceptional opportunity to learn about the history of Albania through the lens of the Marubi family,42.068551,19.515658,https://maps.app.goo.gl/GyyRxrKYn6AEHyZz9,tourist place,2024-12-17T07:07:44.000000Z
31,16,Durres,Albania,Golemi Beach,"{'The First': ['Golemi Beach is one of the most beautiful tourist destinations in Albania, located in the Durrës area, one of the country’s most famous coastal regions. The beach is known for its crystal-clear waters and soft golden sand, making it a popular spot for travelers from all over the world. Compared to other beaches, it is renowned for its peaceful atmosphere, and the surrounding natural views add to its charm.'], 'Key Features of Golemi Beach:': ['Location: The beach is located just a short distance from the city of Durrës, making it easily accessible from various parts of Albania.', 'Clear Waters: The beach has clear and pure waters, making it perfect for swimming and water activities.', 'Recreational Activities: Visitors can enjoy various water sports such as surfing, water skiing, and diving.', 'Scenic Views: The surrounding area offers stunning natural views, including mountains that frame the beach.', 'Facilities: Golemi Beach is equipped with restaurants and cafes offering fresh seafood and places to stay.'], 'Why Visit Golemi Beach?': ['Golemi Beach offers the ideal setting for relaxation and enjoying the Mediterranean vibes in a tranquil atmosphere, away from the crowds.']}",An ideal place to relax and enjoy,41.2491054,19.5267448,https://maps.app.goo.gl/265LhjmEbkiEnEs6A,tourist place,2024-12-16T15:16:27.000000Z
